,id,label,template,placeholders,num_objects,verb_class_name,noun_class_name,start_frame,stop_frame
5322,109912,moving pencil up,Moving [something] up,['pencil'],1,Picking [something] up,pencil,1,48
12007,27890,lifting pencil up completely without letting it drop down,Lifting [something] up completely without letting it drop down,['pencil'],1,Picking [something] up,pencil,1,31
10400,205718,taking pencil out of plate,Taking [something] out of [something],"['pencil', 'plate']",2,Picking [something] up,pencil,1,35
2262,190083,moving color pencils up,Moving [something] up,['color pencils'],1,Picking [something] up,pencil,1,27
9243,121809,moving color pencils up,Moving [something] up,['color pencils'],1,Picking [something] up,pencil,1,26
10106,160613,picking plastic bottle up,Picking [something] up,['plastic bottle'],1,Picking [something] up,bottle,1,43
12633,128551,taking bottle out of cup board,Taking [something] out of [something],"['bottle', 'cup board']",2,Picking [something] up,bottle,1,40
9998,24593,taking bottle,Taking [one of many similar things on the table],['bottle'],1,Picking [something] up,bottle,1,40
4147,44734,taking bottle from rack,Taking [something] from [somewhere],"['bottle', 'rack']",2,Picking [something] up,bottle,1,35
5395,96621,taking bottle from ground,Taking [something] from [somewhere],"['bottle', 'ground']",2,Picking [something] up,bottle,1,28
8137,196354,lifting pen up completely without letting it drop down,Lifting [something] up completely without letting it drop down,['pen'],1,Picking [something] up,pen,1,36
13496,46492,taking pen out of glass,Taking [something] out of [something],"['pen', 'glass']",2,Picking [something] up,pen,1,38
2769,62059,taking pen,Taking [one of many similar things on the table],['pen'],1,Picking [something] up,pen,1,37
10348,22877,taking pen out of drawer,Taking [something] out of [something],"['pen', 'drawer']",2,Picking [something] up,pen,1,42
2267,150990,taking a pen,Taking [one of many similar things on the table],['a pen'],1,Picking [something] up,pen,1,62
13222,174560,taking a book from the shelf,Taking [something] from [somewhere],"['a book', 'the shelf']",2,Picking [something] up,book,1,68
4909,108147,lifting a book with a mobile phone on it,Lifting [something] with [something] on it,"['a book', 'a mobile phone']",2,Picking [something] up,book,1,58
1951,55197,lifting book with sunglasses on it,Lifting [something] with [something] on it,"['book', 'sunglasses']",2,Picking [something] up,book,1,61
2868,88309,lifting book with mp3 player on it,Lifting [something] with [something] on it,"['book', 'mp3 player']",2,Picking [something] up,book,1,56
5940,40966,lifting book with sticking tape on it,Lifting [something] with [something] on it,"['book', 'sticking tape']",2,Picking [something] up,book,1,39
9331,32085,lifting box with tube on it,Lifting [something] with [something] on it,"['box', 'tube']",2,Picking [something] up,box,1,49
10536,106133,lifting box with head bomb box on it,Lifting [something] with [something] on it,"['box', 'head bomb box']",2,Picking [something] up,box,1,45
10798,58718,moving box up,Moving [something] up,['box'],1,Picking [something] up,box,1,45
7624,198145,lifting a box up completely without letting it drop down,Lifting [something] up completely without letting it drop down,['a box'],1,Picking [something] up,box,1,42
8737,206815,lifting a box with a hair tie on it,Lifting [something] with [something] on it,"['a box', 'a hair tie']",2,Picking [something] up,box,1,40
1651,21742,putting color pencils on a surface,Putting [something] on a surface,['color pencils'],1,Putting [something],pencil,1,29
13127,167767,putting a pencil next to a cord,Putting [something] next to [something],"['a pencil', 'a cord']",2,Putting [something],pencil,1,73
2817,159726,putting color pencils on a surface,Putting [something] on a surface,['color pencils'],1,Putting [something],pencil,1,27
13545,124854,putting a pencil on a flat surface without letting it roll,Putting [something] on a flat surface without letting it roll,['a pencil'],1,Putting [something],pencil,1,57
1469,146541,putting color pencils on a surface,Putting [something] on a surface,['color pencils'],1,Putting [something],pencil,1,47
1898,50782,putting bottle onto knife,Putting [something] onto [something],"['bottle', 'knife']",2,Putting [something],bottle,1,54
11867,175502,putting bottle on a surface,Putting [something] on a surface,['bottle'],1,Putting [something],bottle,1,34
5449,67127,putting bottle,Putting [something similar to other things that are already on the table],['bottle'],1,Putting [something],bottle,1,49
10523,71541,putting bottle on a flat surface without letting it roll,Putting [something] on a flat surface without letting it roll,['bottle'],1,Putting [something],bottle,1,63
14117,172411,putting bottle on a surface,Putting [something] on a surface,['bottle'],1,Putting [something],bottle,1,60
10819,111475,"putting pen that can't roll onto a slanted surface, so it stays where it is","Putting [something] that can't roll onto a slanted surface, so it stays where it is",['pen'],1,Putting [something],pen,1,55
12907,32685,putting a pen behind a book,Putting [something] behind [something],"['a pen', 'a book']",2,Putting [something],pen,1,33
8433,4312,putting pen behind tape measure,Putting [something] behind [something],"['pen', 'tape measure']",2,Putting [something],pen,1,47
1205,50326,putting pen on a flat surface without letting it roll,Putting [something] on a flat surface without letting it roll,['pen'],1,Putting [something],pen,1,40
10742,135234,putting pen on a surface,Putting [something] on a surface,['pen'],1,Putting [something],pen,1,41
9205,200446,"putting book, cable and cutter on the table","Putting [something], [something] and [something] on the table","['book', 'cable', 'cutter']",3,Putting [something],book,1,46
6242,220075,putting book on a surface,Putting [something] on a surface,['book'],1,Putting [something],book,1,41
12457,186273,putting a book on a surface,Putting [something] on a surface,['a book'],1,Putting [something],book,1,29
12485,14870,putting a book on a surface,Putting [something] on a surface,['a book'],1,Putting [something],book,1,33
12650,21229,putting book and mug on the table,Putting [something] and [something] on the table,"['book', 'mug']",2,Putting [something],book,1,49
13628,178990,putting box on a surface,Putting [something] on a surface,['box'],1,Putting [something],box,1,45
5282,52985,"putting a box, a stapler and a hole punch on the table","Putting [something], [something] and [something] on the table","['a box', 'a stapler', 'a hole punch']",3,Putting [something],box,1,69
1475,202957,putting box on a surface,Putting [something] on a surface,['box'],1,Putting [something],box,1,50
5503,72723,putting box onto shelf,Putting [something] onto [something],"['box', 'shelf']",2,Putting [something],box,1,50
9835,126886,putting box next to phone,Putting [something] next to [something],"['box', 'phone']",2,Putting [something],box,1,36
10566,184558,throwing color pencils,Throwing [something],['color pencils'],1,Dropping [something],pencil,1,27
1139,213086,throwing color pencils,Throwing [something],['color pencils'],1,Dropping [something],pencil,1,49
13292,70680,throwing a pencil onto a surface,Throwing [something] onto a surface,['a pencil'],1,Dropping [something],pencil,1,33
3331,58470,throwing color pencils,Throwing [something],['color pencils'],1,Dropping [something],pencil,1,29
2150,101495,throwing color pencils,Throwing [something],['color pencils'],1,Dropping [something],pencil,1,39
10837,29227,throwing water bottle,Throwing [something],['water bottle'],1,Dropping [something],bottle,1,61
4852,16517,plastic bottle falling like a rock,[Something] falling like a rock,['plastic bottle'],1,Dropping [something],bottle,1,32
14234,106124,throwing bottle in the air and letting it fall,Throwing [something] in the air and letting it fall,['bottle'],1,Dropping [something],bottle,1,30
11155,35288,throwing bottle,Throwing [something],['bottle'],1,Dropping [something],bottle,1,26
14782,120938,throwing bottle onto a surface,Throwing [something] onto a surface,['bottle'],1,Dropping [something],bottle,1,34
12924,109873,pen falling like a rock,[Something] falling like a rock,['pen'],1,Dropping [something],pen,1,15
2300,167258,pen falling like a rock,[Something] falling like a rock,['pen'],1,Dropping [something],pen,1,50
14373,172583,throwing pen in the air and letting it fall,Throwing [something] in the air and letting it fall,['pen'],1,Dropping [something],pen,1,44
12963,143893,a pen falling like a rock,[Something] falling like a rock,['a pen'],1,Dropping [something],pen,1,15
3069,123825,throwing pen in the air and letting it fall,Throwing [something] in the air and letting it fall,['pen'],1,Dropping [something],pen,1,21
14168,116497,throwing a book,Throwing [something],['a book'],1,Dropping [something],book,1,38
1863,67593,throwing book,Throwing [something],['book'],1,Dropping [something],book,1,37
4636,80198,throwing book in the air and letting it fall,Throwing [something] in the air and letting it fall,['book'],1,Dropping [something],book,1,42
3619,105932,book falling like a rock,[Something] falling like a rock,['book'],1,Dropping [something],book,1,22
13376,25805,throwing book onto a surface,Throwing [something] onto a surface,['book'],1,Dropping [something],book,1,39
5270,44422,a box falling like a rock,[Something] falling like a rock,['a box'],1,Dropping [something],box,1,30
6215,66723,throwing the box,Throwing [something],['the box'],1,Dropping [something],box,1,60
9770,165166,throwing box in the air and letting it fall,Throwing [something] in the air and letting it fall,['box'],1,Dropping [something],box,1,48
3048,106439,box falling like a rock,[Something] falling like a rock,['box'],1,Dropping [something],box,1,47
4210,83405,throwing box in the air and letting it fall,Throwing [something] in the air and letting it fall,['box'],1,Dropping [something],box,1,48
8629,169947,pushing pencil from left to right,Pushing [something] from left to right,['pencil'],1,Moving [something] from left to right,pencil,1,60
9874,13669,pushing color pencils from left to right,Pushing [something] from left to right,['color pencils'],1,Moving [something] from left to right,pencil,1,27
9496,47270,pushing color pencils from left to right,Pushing [something] from left to right,['color pencils'],1,Moving [something] from left to right,pencil,1,27
6244,32448,pushing color pencils from left to right,Pushing [something] from left to right,['color pencils'],1,Moving [something] from left to right,pencil,1,28
7992,204448,pushing color pencils from left to right,Pushing [something] from left to right,['color pencils'],1,Moving [something] from left to right,pencil,1,40
12095,9575,pushing water bottle from left to right,Pushing [something] from left to right,['water bottle'],1,Moving [something] from left to right,bottle,1,33
10856,43982,pushing bottle from left to right,Pushing [something] from left to right,['bottle'],1,Moving [something] from left to right,bottle,1,37
7836,155832,pushing bottle from left to right,Pushing [something] from left to right,['bottle'],1,Moving [something] from left to right,bottle,1,25
4112,67298,pushing bottle from left to right,Pushing [something] from left to right,['bottle'],1,Moving [something] from left to right,bottle,1,25
10213,160400,pulling plastic bottle from left to right,Pulling [something] from left to right,['plastic bottle'],1,Moving [something] from left to right,bottle,1,60
8240,111369,pushing pen from left to right,Pushing [something] from left to right,['pen'],1,Moving [something] from left to right,pen,1,47
9519,93205,pushing pen from left to right,Pushing [something] from left to right,['pen'],1,Moving [something] from left to right,pen,1,38
8450,28552,pushing pen from left to right,Pushing [something] from left to right,['pen'],1,Moving [something] from left to right,pen,1,37
6647,6238,pulling pen from left to right,Pulling [something] from left to right,['pen'],1,Moving [something] from left to right,pen,1,37
9832,106457,pulling a pen from left to right,Pulling [something] from left to right,['a pen'],1,Moving [something] from left to right,pen,1,58
5419,202829,pushing book from left to right,Pushing [something] from left to right,['book'],1,Moving [something] from left to right,book,1,30
4887,20879,pushing book from left to right,Pushing [something] from left to right,['book'],1,Moving [something] from left to right,book,1,50
8074,2692,pushing book from left to right,Pushing [something] from left to right,['book'],1,Moving [something] from left to right,book,1,30
11170,163229,pushing book from left to right,Pushing [something] from left to right,['book'],1,Moving [something] from left to right,book,1,27
8307,177720,pulling a book from left to right,Pulling [something] from left to right,['a book'],1,Moving [something] from left to right,book,1,53
8239,111500,pushing box from left to right,Pushing [something] from left to right,['box'],1,Moving [something] from left to right,box,1,24
5886,192509,pushing box from left to right,Pushing [something] from left to right,['box'],1,Moving [something] from left to right,box,1,41
2844,37892,pushing box from left to right,Pushing [something] from left to right,['box'],1,Moving [something] from left to right,box,1,52
10784,129080,pushing box from left to right,Pushing [something] from left to right,['box'],1,Moving [something] from left to right,box,1,52
13864,85527,pushing box from left to right,Pushing [something] from left to right,['box'],1,Moving [something] from left to right,box,1,31
4885,105873,pushing color pencils from right to left,Pushing [something] from right to left,['color pencils'],1,Moving [something] from right to left,pencil,1,33
14449,71054,pushing pencil from right to left,Pushing [something] from right to left,['pencil'],1,Moving [something] from right to left,pencil,1,45
2876,99617,pulling pencil from right to left,Pulling [something] from right to left,['pencil'],1,Moving [something] from right to left,pencil,1,35
8311,204796,pushing color pencils from right to left,Pushing [something] from right to left,['color pencils'],1,Moving [something] from right to left,pencil,1,28
8721,180029,pushing color pencils from right to left,Pushing [something] from right to left,['color pencils'],1,Moving [something] from right to left,pencil,1,33
12818,217385,pulling a bottle from right to left,Pulling [something] from right to left,['a bottle'],1,Moving [something] from right to left,bottle,1,38
12029,201303,pushing bottle from right to left,Pushing [something] from right to left,['bottle'],1,Moving [something] from right to left,bottle,1,43
9094,6938,pushing a bottle from right to left,Pushing [something] from right to left,['a bottle'],1,Moving [something] from right to left,bottle,1,38
4735,182380,pushing bottle from right to left,Pushing [something] from right to left,['bottle'],1,Moving [something] from right to left,bottle,1,34
11736,94042,pushing bottle from right to left,Pushing [something] from right to left,['bottle'],1,Moving [something] from right to left,bottle,1,32
10612,22943,pulling pen from right to left,Pulling [something] from right to left,['pen'],1,Moving [something] from right to left,pen,1,31
6116,126801,pulling pen from right to left,Pulling [something] from right to left,['pen'],1,Moving [something] from right to left,pen,1,26
8327,132238,pushing a pen from right to left,Pushing [something] from right to left,['a pen'],1,Moving [something] from right to left,pen,1,47
5567,39233,pulling a pen from right to left,Pulling [something] from right to left,['a pen'],1,Moving [something] from right to left,pen,1,29
11296,86881,pushing pen from right to left,Pushing [something] from right to left,['pen'],1,Moving [something] from right to left,pen,1,43
11457,147449,pushing book from right to left,Pushing [something] from right to left,['book'],1,Moving [something] from right to left,book,1,35
1844,50048,pushing book from right to left,Pushing [something] from right to left,['book'],1,Moving [something] from right to left,book,1,32
5316,35095,pushing book from right to left,Pushing [something] from right to left,['book'],1,Moving [something] from right to left,book,1,42
11411,196405,pushing book from right to left,Pushing [something] from right to left,['book'],1,Moving [something] from right to left,book,1,47
4379,109881,pushing book from right to left,Pushing [something] from right to left,['book'],1,Moving [something] from right to left,book,1,33
5105,21874,pulling box from right to left,Pulling [something] from right to left,['box'],1,Moving [something] from right to left,box,1,51
5157,119786,pulling box from right to left,Pulling [something] from right to left,['box'],1,Moving [something] from right to left,box,1,48
2311,36168,pushing box from right to left,Pushing [something] from right to left,['box'],1,Moving [something] from right to left,box,1,35
6073,5280,pulling a box from right to left,Pulling [something] from right to left,['a box'],1,Moving [something] from right to left,box,1,43
12284,177338,pushing box from right to left,Pushing [something] from right to left,['box'],1,Moving [something] from right to left,box,1,48
