,id,label,template,placeholders,num_objects,verb_class_name,noun_class_name,start_frame,stop_frame
7075,161193,lifting pencil up completely without letting it drop down,Lifting [something] up completely without letting it drop down,['pencil'],1,Picking [something] up,pencil,1,29
2147,51979,taking pencil,Taking [one of many similar things on the table],['pencil'],1,Picking [something] up,pencil,1,50
2873,2045,taking pencil out of tray,Taking [something] out of [something],"['pencil', 'tray']",2,Picking [something] up,pencil,1,27
2521,151442,moving color pencils up,Moving [something] up,['color pencils'],1,Picking [something] up,pencil,1,37
294,186498,moving color pencils up,Moving [something] up,['color pencils'],1,Picking [something] up,pencil,1,27
3644,141067,moving color pencils up,Moving [something] up,['color pencils'],1,Picking [something] up,pencil,1,27
2220,124012,moving color pencils up,Moving [something] up,['color pencils'],1,Picking [something] up,pencil,1,27
13225,158336,taking color pencil,Taking [one of many similar things on the table],['color pencil'],1,Picking [something] up,pencil,1,64
7639,77311,moving color pencils up,Moving [something] up,['color pencils'],1,Picking [something] up,pencil,1,29
1929,196440,lifting pencil up completely without letting it drop down,Lifting [something] up completely without letting it drop down,['pencil'],1,Picking [something] up,pencil,1,29
13929,171169,moving bottle up,Moving [something] up,['bottle'],1,Picking [something] up,bottle,1,44
5242,191632,picking plastic bottle up,Picking [something] up,['plastic bottle'],1,Picking [something] up,bottle,1,49
12432,53214,taking bottles,Taking [one of many similar things on the table],['bottles'],1,Picking [something] up,bottle,1,43
13437,207085,picking a bottle up,Picking [something] up,['a bottle'],1,Picking [something] up,bottle,1,37
14357,30588,picking water bottle up,Picking [something] up,['water bottle'],1,Picking [something] up,bottle,1,44
592,110322,taking bottle from bucket,Taking [something] from [somewhere],"['bottle', 'bucket']",2,Picking [something] up,bottle,1,30
9259,176235,taking a water bottle from a paper towel,Taking [something] from [somewhere],"['a water bottle', 'a paper towel']",2,Picking [something] up,bottle,1,60
9812,92739,picking bottle up,Picking [something] up,['bottle'],1,Picking [something] up,bottle,1,45
1112,49245,taking bottles,Taking [one of many similar things on the table],['bottles'],1,Picking [something] up,bottle,1,41
12308,189206,moving bottle up,Moving [something] up,['bottle'],1,Picking [something] up,bottle,1,39
14758,100101,moving pen up,Moving [something] up,['pen'],1,Picking [something] up,pen,1,39
819,148843,taking pen,Taking [one of many similar things on the table],['pen'],1,Picking [something] up,pen,1,31
13963,105994,taking a pen,Taking [one of many similar things on the table],['a pen'],1,Picking [something] up,pen,1,50
1374,190532,taking pen from table,Taking [something] from [somewhere],"['pen', 'table']",2,Picking [something] up,pen,1,32
4922,54115,taking a pen out of pencil-case,Taking [something] out of [something],"['a pen', 'pencil-case']",2,Picking [something] up,pen,1,56
14551,15390,taking a pen,Taking [one of many similar things on the table],['a pen'],1,Picking [something] up,pen,1,49
8021,212564,picking pen up,Picking [something] up,['pen'],1,Picking [something] up,pen,1,25
11027,57042,lifting pen up completely without letting it drop down,Lifting [something] up completely without letting it drop down,['pen'],1,Picking [something] up,pen,1,51
2551,93972,taking pen out of trash can,Taking [something] out of [something],"['pen', 'trash can']",2,Picking [something] up,pen,1,20
6278,54852,taking pen,Taking [one of many similar things on the table],['pen'],1,Picking [something] up,pen,1,40
13260,196240,moving book up,Moving [something] up,['book'],1,Picking [something] up,book,1,20
14726,87609,lifting book with tape on it,Lifting [something] with [something] on it,"['book', 'tape']",2,Picking [something] up,book,1,55
2052,158241,lifting book with eraser on it,Lifting [something] with [something] on it,"['book', 'eraser']",2,Picking [something] up,book,1,65
2508,177051,lifting book with train on it,Lifting [something] with [something] on it,"['book', 'train']",2,Picking [something] up,book,1,66
9595,164891,lifting book with cellphone on it,Lifting [something] with [something] on it,"['book', 'cellphone']",2,Picking [something] up,book,1,54
229,108457,moving book up,Moving [something] up,['book'],1,Picking [something] up,book,1,21
12248,56238,taking a book,Taking [one of many similar things on the table],['a book'],1,Picking [something] up,book,1,28
13549,118955,lifting a book with a measuring tape on it,Lifting [something] with [something] on it,"['a book', 'a measuring tape']",2,Picking [something] up,book,1,39
9906,178670,lifting book up completely without letting it drop down,Lifting [something] up completely without letting it drop down,['book'],1,Picking [something] up,book,1,25
10866,4599,taking book,Taking [one of many similar things on the table],['book'],1,Picking [something] up,book,1,33
5911,152032,lifting box with hands on it,Lifting [something] with [something] on it,"['box', 'hands']",2,Picking [something] up,box,1,20
14769,66570,picking box up,Picking [something] up,['box'],1,Picking [something] up,box,1,36
5977,2613,moving a box up,Moving [something] up,['a box'],1,Picking [something] up,box,1,30
2984,146011,taking box from rack,Taking [something] from [somewhere],"['box', 'rack']",2,Picking [something] up,box,1,45
6181,211758,moving box up,Moving [something] up,['box'],1,Picking [something] up,box,1,61
7027,112919,picking a box up,Picking [something] up,['a box'],1,Picking [something] up,box,1,34
800,206318,lifting box with watch on it,Lifting [something] with [something] on it,"['box', 'watch']",2,Picking [something] up,box,1,54
8737,206815,lifting a box with a hair tie on it,Lifting [something] with [something] on it,"['a box', 'a hair tie']",2,Picking [something] up,box,1,40
3726,161038,taking box out of drawer,Taking [something] out of [something],"['box', 'drawer']",2,Picking [something] up,box,1,31
8363,140696,lifting a box with a paper bag on it,Lifting [something] with [something] on it,"['a box', 'a paper bag']",2,Picking [something] up,box,1,57
1259,62828,moving adapter up,Moving [something] up,['adapter'],1,Picking [something] up,charger,1,33
6597,31896,moving charger up,Moving [something] up,['charger'],1,Picking [something] up,charger,1,50
14456,108814,moving charger up,Moving [something] up,['charger'],1,Picking [something] up,charger,1,27
6795,168067,taking charger out of drawer,Taking [something] out of [something],"['charger', 'drawer']",2,Picking [something] up,charger,1,46
5221,128401,moving charger up,Moving [something] up,['charger'],1,Picking [something] up,charger,1,29
7480,9581,moving adapter up,Moving [something] up,['adapter'],1,Picking [something] up,charger,1,33
8602,172223,moving adapter up,Moving [something] up,['adapter'],1,Picking [something] up,charger,1,33
8390,191858,taking charger from ladder,Taking [something] from [somewhere],"['charger', 'ladder']",2,Picking [something] up,charger,1,53
2174,134323,taking a charger out of a backpack,Taking [something] out of [something],"['a charger', 'a backpack']",2,Picking [something] up,charger,1,42
11983,42495,picking charger up,Picking [something] up,['charger'],1,Picking [something] up,charger,1,60
13947,59719,taking brush from purse,Taking [something] from [somewhere],"['brush', 'purse']",2,Picking [something] up,brush,1,43
6178,87839,taking brush out of plastic glass,Taking [something] out of [something],"['brush', 'plastic glass']",2,Picking [something] up,brush,1,51
12058,74145,moving brush up,Moving [something] up,['brush'],1,Picking [something] up,brush,1,39
5104,71342,moving brush up,Moving [something] up,['brush'],1,Picking [something] up,brush,1,58
5027,188658,taking brush out of cloth bag,Taking [something] out of [something],"['brush', 'cloth bag']",2,Picking [something] up,brush,1,58
14315,109268,lifting brush with paper on it,Lifting [something] with [something] on it,"['brush', 'paper']",2,Picking [something] up,brush,1,50
11899,74264,taking brush out of case,Taking [something] out of [something],"['brush', 'case']",2,Picking [something] up,brush,1,32
11562,37782,moving brush up,Moving [something] up,['brush'],1,Picking [something] up,brush,1,26
1093,23656,taking brush,Taking [one of many similar things on the table],['brush'],1,Picking [something] up,brush,1,49
7094,59978,moving brush up,Moving [something] up,['brush'],1,Picking [something] up,brush,1,61
2232,113069,putting color pencils on a surface,Putting [something] on a surface,['color pencils'],1,Putting [something],pencil,1,28
1167,4706,putting color pencils on a surface,Putting [something] on a surface,['color pencils'],1,Putting [something],pencil,1,39
7509,144799,putting pencil on a surface,Putting [something] on a surface,['pencil'],1,Putting [something],pencil,1,60
5594,131674,putting color pencils on a surface,Putting [something] on a surface,['color pencils'],1,Putting [something],pencil,1,38
4808,189911,putting pencil on a flat surface without letting it roll,Putting [something] on a flat surface without letting it roll,['pencil'],1,Putting [something],pencil,1,43
7419,14950,putting a pencil behind a book,Putting [something] behind [something],"['a pencil', 'a book']",2,Putting [something],pencil,1,67
14716,173702,putting pencil,Putting [something similar to other things that are already on the table],['pencil'],1,Putting [something],pencil,1,29
441,133286,putting pencil and eraser on the table,Putting [something] and [something] on the table,"['pencil', 'eraser']",2,Putting [something],pencil,1,65
6527,43104,putting a pencil on a surface,Putting [something] on a surface,['a pencil'],1,Putting [something],pencil,1,63
3832,91597,putting color pencils on a surface,Putting [something] on a surface,['color pencils'],1,Putting [something],pencil,1,27
6604,20080,putting bottle and spidol on the table,Putting [something] and [something] on the table,"['bottle', 'spidol']",2,Putting [something],bottle,1,44
335,148589,putting a water bottle and a pig bank on the table,Putting [something] and [something] on the table,"['a water bottle', 'a pig bank']",2,Putting [something],bottle,1,53
2159,77795,putting a bottle on a surface,Putting [something] on a surface,['a bottle'],1,Putting [something],bottle,1,55
4687,122680,putting bottle on a surface,Putting [something] on a surface,['bottle'],1,Putting [something],bottle,1,28
9889,137834,putting bottle next to tube,Putting [something] next to [something],"['bottle', 'tube']",2,Putting [something],bottle,1,53
9887,130263,putting a bottle next to a jar,Putting [something] next to [something],"['a bottle', 'a jar']",2,Putting [something],bottle,1,33
7995,158992,putting water bottle and mortein mosquito killer packet on the table,Putting [something] and [something] on the table,"['water bottle', 'mortein mosquito killer packet']",2,Putting [something],bottle,1,50
10579,152552,"putting bottle, cutex and pack on the table","Putting [something], [something] and [something] on the table","['bottle', 'cutex', 'pack']",3,Putting [something],bottle,1,60
8135,133466,putting a water bottle on a surface,Putting [something] on a surface,['a water bottle'],1,Putting [something],bottle,1,39
12041,152346,putting bottle next to sunglasses,Putting [something] next to [something],"['bottle', 'sunglasses']",2,Putting [something],bottle,1,36
12587,80554,putting pen and pen cap on the table,Putting [something] and [something] on the table,"['pen', 'pen cap']",2,Putting [something],pen,1,39
9819,204466,putting a pen on a flat surface without letting it roll,Putting [something] on a flat surface without letting it roll,['a pen'],1,Putting [something],pen,1,49
11617,123815,putting pen on a surface,Putting [something] on a surface,['pen'],1,Putting [something],pen,1,35
5717,46810,putting pen on a surface,Putting [something] on a surface,['pen'],1,Putting [something],pen,1,36
5976,213645,putting pen next to mug,Putting [something] next to [something],"['pen', 'mug']",2,Putting [something],pen,1,46
8703,206103,putting pen on a surface,Putting [something] on a surface,['pen'],1,Putting [something],pen,1,44
4267,72863,putting pen on a surface,Putting [something] on a surface,['pen'],1,Putting [something],pen,1,56
6042,215469,putting pen on a surface,Putting [something] on a surface,['pen'],1,Putting [something],pen,1,34
5742,140706,putting pen on a surface,Putting [something] on a surface,['pen'],1,Putting [something],pen,1,42
837,105665,putting pen on a surface,Putting [something] on a surface,['pen'],1,Putting [something],pen,1,42
726,75537,putting book,Putting [something similar to other things that are already on the table],['book'],1,Putting [something],book,1,37
12249,210402,"putting book, condenser and scissor on the table","Putting [something], [something] and [something] on the table","['book', 'condenser', 'scissor']",3,Putting [something],book,1,47
2539,29167,putting book,Putting [something similar to other things that are already on the table],['book'],1,Putting [something],book,1,31
14673,98322,"putting a book, a candle and a lighter on the table","Putting [something], [something] and [something] on the table","['a book', 'a candle', 'a lighter']",3,Putting [something],book,1,49
124,108208,putting book behind bag,Putting [something] behind [something],"['book', 'bag']",2,Putting [something],book,1,58
5550,217203,"putting a book, a calculator and a remote on the table","Putting [something], [something] and [something] on the table","['a book', 'a calculator', 'a remote']",3,Putting [something],book,1,48
12695,118828,putting book and key on the table,Putting [something] and [something] on the table,"['book', 'key']",2,Putting [something],book,1,49
10541,212034,putting book next to basket,Putting [something] next to [something],"['book', 'basket']",2,Putting [something],book,1,64
3524,52620,putting book behind cup,Putting [something] behind [something],"['book', 'cup']",2,Putting [something],book,1,43
13874,116330,putting book next to bag,Putting [something] next to [something],"['book', 'bag']",2,Putting [something],book,1,45
14104,64267,putting book onto can,Putting [something] onto [something],"['book', 'can']",2,Putting [something],book,1,54
13494,78820,"putting box, handphone and pen on the table","Putting [something], [something] and [something] on the table","['box', 'handphone', 'pen']",3,Putting [something],box,1,65
342,35608,putting box and cable on the table,Putting [something] and [something] on the table,"['box', 'cable']",2,Putting [something],box,1,35
9087,87801,putting box behind box,Putting [something] behind [something],"['box', 'box']",2,Putting [something],box,1,30
3318,7916,putting box onto box,Putting [something] onto [something],"['box', 'box']",2,Putting [something],box,1,34
4148,85833,putting a box on a surface,Putting [something] on a surface,['a box'],1,Putting [something],box,1,68
1380,96064,putting box behind battery,Putting [something] behind [something],"['box', 'battery']",2,Putting [something],box,1,47
11165,168379,putting box and bottle on the table,Putting [something] and [something] on the table,"['box', 'bottle']",2,Putting [something],box,1,37
11747,137413,"putting box, hair band and a screw on the table","Putting [something], [something] and [something] on the table","['box', 'hair band', 'a screw']",3,Putting [something],box,1,50
8937,42512,"putting box, tube and phone on the table","Putting [something], [something] and [something] on the table","['box', 'tube', 'phone']",3,Putting [something],box,1,60
2734,92985,putting box on a surface,Putting [something] on a surface,['box'],1,Putting [something],box,1,53
1475,202957,putting box on a surface,Putting [something] on a surface,['box'],1,Putting [something],box,1,50
2770,81346,putting battery behind can,Putting [something] behind [something],"['battery', 'can']",2,Putting [something],battery,1,52
2329,188542,putting a battery on a surface,Putting [something] on a surface,['a battery'],1,Putting [something],battery,1,66
12986,23577,putting battery behind keys,Putting [something] behind [something],"['battery', 'keys']",2,Putting [something],battery,1,46
10589,76553,putting battery onto wooden box,Putting [something] onto [something],"['battery', 'wooden box']",2,Putting [something],battery,1,57
6468,137736,putting battery on a surface,Putting [something] on a surface,['battery'],1,Putting [something],battery,1,62
9398,133211,putting battery next to shoe,Putting [something] next to [something],"['battery', 'shoe']",2,Putting [something],battery,1,39
7244,156923,putting battery onto compact disk,Putting [something] onto [something],"['battery', 'compact disk']",2,Putting [something],battery,1,45
7011,69482,putting battery and candy on the table,Putting [something] and [something] on the table,"['battery', 'candy']",2,Putting [something],battery,1,54
3315,115478,putting battery next to portable speaker,Putting [something] next to [something],"['battery', 'portable speaker']",2,Putting [something],battery,1,38
12123,144939,putting battery next to keys,Putting [something] next to [something],"['battery', 'keys']",2,Putting [something],battery,1,53
14390,205521,putting battery onto rubix cube,Putting [something] onto [something],"['battery', 'rubix cube']",2,Putting [something],battery,1,41
2074,84471,putting glasses on a surface,Putting [something] on a surface,['glasses'],1,Putting [something],glasses,1,33
8045,119626,putting glasses on a surface,Putting [something] on a surface,['glasses'],1,Putting [something],glasses,1,33
4347,41183,putting glasses,Putting [something similar to other things that are already on the table],['glasses'],1,Putting [something],glasses,1,55
13957,188301,"putting glasses, marker and gift card on the table","Putting [something], [something] and [something] on the table","['glasses', 'marker', 'gift card']",3,Putting [something],glasses,1,58
14568,200991,putting glasses,Putting [something similar to other things that are already on the table],['glasses'],1,Putting [something],glasses,1,68
6322,56821,putting glasses on a surface,Putting [something] on a surface,['glasses'],1,Putting [something],glasses,1,52
14290,58136,putting glasses next to a watch,Putting [something] next to [something],"['glasses', 'a watch']",2,Putting [something],glasses,1,60
12322,41767,putting a glasses on a surface,Putting [something] on a surface,['a glasses'],1,Putting [something],glasses,1,53
4303,219240,putting a glasses on a surface,Putting [something] on a surface,['a glasses'],1,Putting [something],glasses,1,29
5694,137343,putting glasses onto dog leash,Putting [something] onto [something],"['glasses', 'dog leash']",2,Putting [something],glasses,1,40
4016,10592,putting glasses on a surface,Putting [something] on a surface,['glasses'],1,Putting [something],glasses,1,41
79,195331,throwing color pencils,Throwing [something],['color pencils'],1,Dropping [something],pencil,1,39
6069,40777,throwing color pencils,Throwing [something],['color pencils'],1,Dropping [something],pencil,1,26
5348,165731,throwing color pencils,Throwing [something],['color pencils'],1,Dropping [something],pencil,1,28
7000,162145,throwing color pencils,Throwing [something],['color pencils'],1,Dropping [something],pencil,1,28
5071,156789,throwing color pencils,Throwing [something],['color pencils'],1,Dropping [something],pencil,1,28
12350,217879,throwing color pencils,Throwing [something],['color pencils'],1,Dropping [something],pencil,1,36
7225,166147,throwing color pencil,Throwing [something],['color pencil'],1,Dropping [something],pencil,1,26
12674,197372,throwing color pencils,Throwing [something],['color pencils'],1,Dropping [something],pencil,1,30
9121,205892,throwing color pencils,Throwing [something],['color pencils'],1,Dropping [something],pencil,1,28
802,24691,throwing color pencils,Throwing [something],['color pencils'],1,Dropping [something],pencil,1,35
624,110639,throwing color pencils,Throwing [something],['color pencils'],1,Dropping [something],pencil,1,27
13284,117335,bottle falling like a rock,[Something] falling like a rock,['bottle'],1,Dropping [something],bottle,1,32
14094,206965,bottle falling like a rock,[Something] falling like a rock,['bottle'],1,Dropping [something],bottle,1,35
2249,87160,throwing bottle,Throwing [something],['bottle'],1,Dropping [something],bottle,1,26
3825,80395,throwing a water bottle,Throwing [something],['a water bottle'],1,Dropping [something],bottle,1,63
8903,116190,plastic bottle falling like a rock,[Something] falling like a rock,['plastic bottle'],1,Dropping [something],bottle,1,49
894,147405,bottle falling like a rock,[Something] falling like a rock,['bottle'],1,Dropping [something],bottle,1,42
14234,106124,throwing bottle in the air and letting it fall,Throwing [something] in the air and letting it fall,['bottle'],1,Dropping [something],bottle,1,30
7797,91236,bottle falling like a rock,[Something] falling like a rock,['bottle'],1,Dropping [something],bottle,1,44
5578,185693,throwing plastic bottle onto a surface,Throwing [something] onto a surface,['plastic bottle'],1,Dropping [something],bottle,1,60
8594,102046,plastic bottle falling like a rock,[Something] falling like a rock,['plastic bottle'],1,Dropping [something],bottle,1,32
11159,49069,throwing bottle,Throwing [something],['bottle'],1,Dropping [something],bottle,1,30
2990,89470,throwing pen,Throwing [something],['pen'],1,Dropping [something],pen,1,62
13633,214964,throwing a pen in the air and letting it fall,Throwing [something] in the air and letting it fall,['a pen'],1,Dropping [something],pen,1,50
9111,44122,throwing pen onto a surface,Throwing [something] onto a surface,['pen'],1,Dropping [something],pen,1,62
1562,159989,pen falling like a rock,[Something] falling like a rock,['pen'],1,Dropping [something],pen,1,35
7816,63712,throwing a pen onto a surface,Throwing [something] onto a surface,['a pen'],1,Dropping [something],pen,1,37
93,130122,throwing pen onto a surface,Throwing [something] onto a surface,['pen'],1,Dropping [something],pen,1,33
13937,138877,throwing pen,Throwing [something],['pen'],1,Dropping [something],pen,1,50
7811,151156,pen falling like a rock,[Something] falling like a rock,['pen'],1,Dropping [something],pen,1,58
14240,141707,throwing a pen onto a surface,Throwing [something] onto a surface,['a pen'],1,Dropping [something],pen,1,39
7058,216013,throwing pen in the air and letting it fall,Throwing [something] in the air and letting it fall,['pen'],1,Dropping [something],pen,1,69
4054,202565,pen falling like a rock,[Something] falling like a rock,['pen'],1,Dropping [something],pen,1,34
4539,14597,a book falling like a rock,[Something] falling like a rock,['a book'],1,Dropping [something],book,1,44
1591,6163,book falling like a rock,[Something] falling like a rock,['book'],1,Dropping [something],book,1,37
13073,97052,book falling like a rock,[Something] falling like a rock,['book'],1,Dropping [something],book,1,47
14168,116497,throwing a book,Throwing [something],['a book'],1,Dropping [something],book,1,38
7943,131299,throwing book,Throwing [something],['book'],1,Dropping [something],book,1,26
6834,206238,throwing book,Throwing [something],['book'],1,Dropping [something],book,1,36
8700,66950,throwing book,Throwing [something],['book'],1,Dropping [something],book,1,26
1225,174866,a book falling like a rock,[Something] falling like a rock,['a book'],1,Dropping [something],book,1,50
547,91896,throwing book,Throwing [something],['book'],1,Dropping [something],book,1,34
6245,100886,throwing a book onto a surface,Throwing [something] onto a surface,['a book'],1,Dropping [something],book,1,44
2505,170987,throwing book,Throwing [something],['book'],1,Dropping [something],book,1,26
2601,4819,a box falling like a rock,[Something] falling like a rock,['a box'],1,Dropping [something],box,1,34
852,179872,throwing a box in the air and letting it fall,Throwing [something] in the air and letting it fall,['a box'],1,Dropping [something],box,1,32
4284,83235,a box falling like a rock,[Something] falling like a rock,['a box'],1,Dropping [something],box,1,54
7599,205980,throwing box in the air and letting it fall,Throwing [something] in the air and letting it fall,['box'],1,Dropping [something],box,1,31
4460,162409,throwing box onto a surface,Throwing [something] onto a surface,['box'],1,Dropping [something],box,1,54
6128,126172,throwing box in the air and letting it fall,Throwing [something] in the air and letting it fall,['box'],1,Dropping [something],box,1,49
1240,102129,box falling like a rock,[Something] falling like a rock,['box'],1,Dropping [something],box,1,30
10054,204899,throwing a box,Throwing [something],['a box'],1,Dropping [something],box,1,39
3710,101660,throwing box,Throwing [something],['box'],1,Dropping [something],box,1,42
3453,113794,box falling like a rock,[Something] falling like a rock,['box'],1,Dropping [something],box,1,50
9617,20517,box falling like a rock,[Something] falling like a rock,['box'],1,Dropping [something],box,1,46
5177,109338,throwing knife onto a surface,Throwing [something] onto a surface,['knife'],1,Dropping [something],knife,1,40
8902,215552,knife falling like a rock,[Something] falling like a rock,['knife'],1,Dropping [something],knife,1,55
5375,41903,throwing knife onto a surface,Throwing [something] onto a surface,['knife'],1,Dropping [something],knife,1,52
7301,168645,throwing knife onto a surface,Throwing [something] onto a surface,['knife'],1,Dropping [something],knife,1,49
12943,151091,throwing knife onto a surface,Throwing [something] onto a surface,['knife'],1,Dropping [something],knife,1,51
5258,48141,knife falling like a rock,[Something] falling like a rock,['knife'],1,Dropping [something],knife,1,27
