,id,label,template,placeholders,num_objects,verb_class_name,noun_class_name,start_frame,stop_frame
4323,152679,lifting pencil up completely without letting it drop down,Lifting [something] up completely without letting it drop down,['pencil'],1,Picking [something] up,pencil,1,32
13225,158336,taking color pencil,Taking [one of many similar things on the table],['color pencil'],1,Picking [something] up,pencil,1,64
12523,26562,lifting pencil up completely without letting it drop down,Lifting [something] up completely without letting it drop down,['pencil'],1,Picking [something] up,pencil,1,39
4692,220128,lifting pencil up completely without letting it drop down,Lifting [something] up completely without letting it drop down,['pencil'],1,Picking [something] up,pencil,1,29
4951,109234,moving color pencils up,Moving [something] up,['color pencils'],1,Picking [something] up,pencil,1,30
6053,180077,moving color pencils up,Moving [something] up,['color pencils'],1,Picking [something] up,pencil,1,31
6615,132847,taking pencil,Taking [one of many similar things on the table],['pencil'],1,Picking [something] up,pencil,1,35
11945,4478,moving color pencils up,Moving [something] up,['color pencils'],1,Picking [something] up,pencil,1,27
6678,55246,lifting pencil up completely without letting it drop down,Lifting [something] up completely without letting it drop down,['pencil'],1,Picking [something] up,pencil,1,30
5686,77349,taking pencil out of hand bag,Taking [something] out of [something],"['pencil', 'hand bag']",2,Picking [something] up,pencil,1,63
12266,114523,lifting bottle with book on it,Lifting [something] with [something] on it,"['bottle', 'book']",2,Picking [something] up,bottle,1,46
620,131051,taking bottle from switchboard,Taking [something] from [somewhere],"['bottle', 'switchboard']",2,Picking [something] up,bottle,1,32
3371,6821,taking a bottle out of a box,Taking [something] out of [something],"['a bottle', 'a box']",2,Picking [something] up,bottle,1,59
3420,70973,lifting a bottle with nail polish on it,Lifting [something] with [something] on it,"['a bottle', 'nail polish']",2,Picking [something] up,bottle,1,32
1306,138377,taking bottle from refridgerator,Taking [something] from [somewhere],"['bottle', 'refridgerator']",2,Picking [something] up,bottle,1,32
1441,140470,moving bottle up,Moving [something] up,['bottle'],1,Picking [something] up,bottle,1,56
12494,27929,lifting plastic bottle up completely without letting it drop down,Lifting [something] up completely without letting it drop down,['plastic bottle'],1,Picking [something] up,bottle,1,47
6209,196466,taking a bottle from a desk,Taking [something] from [somewhere],"['a bottle', 'a desk']",2,Picking [something] up,bottle,1,36
13487,38735,moving a bottle up,Moving [something] up,['a bottle'],1,Picking [something] up,bottle,1,61
14357,30588,picking water bottle up,Picking [something] up,['water bottle'],1,Picking [something] up,bottle,1,44
5253,121641,moving pen up,Moving [something] up,['pen'],1,Picking [something] up,pen,1,41
14631,44325,picking a pen up,Picking [something] up,['a pen'],1,Picking [something] up,pen,1,38
12497,92078,lifting pen up completely without letting it drop down,Lifting [something] up completely without letting it drop down,['pen'],1,Picking [something] up,pen,1,30
14105,217678,taking pen,Taking [one of many similar things on the table],['pen'],1,Picking [something] up,pen,1,61
11407,58362,taking a pen,Taking [one of many similar things on the table],['a pen'],1,Picking [something] up,pen,1,54
9258,171584,moving pen up,Moving [something] up,['pen'],1,Picking [something] up,pen,1,38
10938,203343,taking a pen from a cubbie,Taking [something] from [somewhere],"['a pen', 'a cubbie']",2,Picking [something] up,pen,1,65
13892,149435,taking pen,Taking [one of many similar things on the table],['pen'],1,Picking [something] up,pen,1,43
1623,64625,moving pen up,Moving [something] up,['pen'],1,Picking [something] up,pen,1,62
9002,108653,moving a pen up,Moving [something] up,['a pen'],1,Picking [something] up,pen,1,45
9976,21903,taking book,Taking [one of many similar things on the table],['book'],1,Picking [something] up,book,1,28
3819,215910,lifting book with controller on it,Lifting [something] with [something] on it,"['book', 'controller']",2,Picking [something] up,book,1,46
3268,77199,taking a book from a shelf,Taking [something] from [somewhere],"['a book', 'a shelf']",2,Picking [something] up,book,1,46
5237,20427,lifting book with bottle on it,Lifting [something] with [something] on it,"['book', 'bottle']",2,Picking [something] up,book,1,55
14345,218735,taking a book,Taking [one of many similar things on the table],['a book'],1,Picking [something] up,book,1,43
6200,150983,lifting a book up completely without letting it drop down,Lifting [something] up completely without letting it drop down,['a book'],1,Picking [something] up,book,1,71
1170,201511,lifting book with lego brick on it,Lifting [something] with [something] on it,"['book', 'lego brick']",2,Picking [something] up,book,1,51
3991,192436,taking a book from a book case,Taking [something] from [somewhere],"['a book', 'a book case']",2,Picking [something] up,book,1,66
14777,18022,lifting book with notebook on it,Lifting [something] with [something] on it,"['book', 'notebook']",2,Picking [something] up,book,1,50
9421,179312,taking book out of drawer,Taking [something] out of [something],"['book', 'drawer']",2,Picking [something] up,book,1,37
9668,4742,lifting box with can on it,Lifting [something] with [something] on it,"['box', 'can']",2,Picking [something] up,box,1,52
3081,70305,lifting box with tube on it,Lifting [something] with [something] on it,"['box', 'tube']",2,Picking [something] up,box,1,55
5042,89845,lifting box with matches on it,Lifting [something] with [something] on it,"['box', 'matches']",2,Picking [something] up,box,1,29
5984,36865,lifting box with tumbler on it,Lifting [something] with [something] on it,"['box', 'tumbler']",2,Picking [something] up,box,1,37
1869,95972,lifting box with highlighter on it,Lifting [something] with [something] on it,"['box', 'highlighter']",2,Picking [something] up,box,1,41
12083,126744,taking box from floor,Taking [something] from [somewhere],"['box', 'floor']",2,Picking [something] up,box,1,35
9305,123215,lifting a box with a kitchen lighter on it,Lifting [something] with [something] on it,"['a box', 'a kitchen lighter']",2,Picking [something] up,box,1,48
338,26370,lifting box with computer mouse on it,Lifting [something] with [something] on it,"['box', 'computer mouse']",2,Picking [something] up,box,1,49
6236,102228,taking box,Taking [one of many similar things on the table],['box'],1,Picking [something] up,box,1,50
2057,145451,lifting a box up completely without letting it drop down,Lifting [something] up completely without letting it drop down,['a box'],1,Picking [something] up,box,1,29
7172,202476,putting a pencil next to a pencil sharpener,Putting [something] next to [something],"['a pencil', 'a pencil sharpener']",2,Putting [something],pencil,1,49
1035,43383,putting color pencils on a surface,Putting [something] on a surface,['color pencils'],1,Putting [something],pencil,1,27
4309,115270,putting color pencils on a surface,Putting [something] on a surface,['color pencils'],1,Putting [something],pencil,1,30
14716,173702,putting pencil,Putting [something similar to other things that are already on the table],['pencil'],1,Putting [something],pencil,1,29
5446,112998,putting color pencils on a surface,Putting [something] on a surface,['color pencils'],1,Putting [something],pencil,1,47
2594,59014,putting a pencil on a surface,Putting [something] on a surface,['a pencil'],1,Putting [something],pencil,1,31
14386,190899,putting a pencil on a surface,Putting [something] on a surface,['a pencil'],1,Putting [something],pencil,1,46
13754,210804,putting pencils,Putting [something similar to other things that are already on the table],['pencils'],1,Putting [something],pencil,1,50
8619,87090,putting pencil next to music-player,Putting [something] next to [something],"['pencil', 'music-player']",2,Putting [something],pencil,1,36
962,7542,putting pencil on a surface,Putting [something] on a surface,['pencil'],1,Putting [something],pencil,1,35
7995,158992,putting water bottle and mortein mosquito killer packet on the table,Putting [something] and [something] on the table,"['water bottle', 'mortein mosquito killer packet']",2,Putting [something],bottle,1,50
3614,78195,putting bottles,Putting [something similar to other things that are already on the table],['bottles'],1,Putting [something],bottle,1,38
2958,96587,putting bottle,Putting [something similar to other things that are already on the table],['bottle'],1,Putting [something],bottle,1,49
13832,216847,putting bottle on a surface,Putting [something] on a surface,['bottle'],1,Putting [something],bottle,1,67
14286,155438,putting a bottle next to an iron,Putting [something] next to [something],"['a bottle', 'an iron']",2,Putting [something],bottle,1,52
982,12592,"putting bottle, wallet and pen on the table","Putting [something], [something] and [something] on the table","['bottle', 'wallet', 'pen']",3,Putting [something],bottle,1,41
14382,5705,putting bottle on a surface,Putting [something] on a surface,['bottle'],1,Putting [something],bottle,1,22
12426,42797,putting bottle behind scissors,Putting [something] behind [something],"['bottle', 'scissors']",2,Putting [something],bottle,1,36
10154,84567,putting bottle on a surface,Putting [something] on a surface,['bottle'],1,Putting [something],bottle,1,38
6695,93561,putting water bottle and ball on the table,Putting [something] and [something] on the table,"['water bottle', 'ball']",2,Putting [something],bottle,1,60
2953,148213,putting pen on a surface,Putting [something] on a surface,['pen'],1,Putting [something],pen,1,36
9390,53542,putting pen on a flat surface without letting it roll,Putting [something] on a flat surface without letting it roll,['pen'],1,Putting [something],pen,1,45
2858,38154,"putting a pen, a pencil and a paper clip on the table","Putting [something], [something] and [something] on the table","['a pen', 'a pencil', 'a paper clip']",3,Putting [something],pen,1,50
252,108038,putting pen on a surface,Putting [something] on a surface,['pen'],1,Putting [something],pen,1,42
3430,134654,putting pen on a surface,Putting [something] on a surface,['pen'],1,Putting [something],pen,1,29
13433,36819,putting pen on a surface,Putting [something] on a surface,['pen'],1,Putting [something],pen,1,46
6117,6718,putting pen on a surface,Putting [something] on a surface,['pen'],1,Putting [something],pen,1,38
1455,16679,putting pen on a surface,Putting [something] on a surface,['pen'],1,Putting [something],pen,1,33
9990,207754,putting pen on a surface,Putting [something] on a surface,['pen'],1,Putting [something],pen,1,33
5289,158895,putting a pen and a pencil on the table,Putting [something] and [something] on the table,"['a pen', 'a pencil']",2,Putting [something],pen,1,58
6651,107203,putting a book,Putting [something similar to other things that are already on the table],['a book'],1,Putting [something],book,1,28
8408,115901,putting book onto box,Putting [something] onto [something],"['book', 'box']",2,Putting [something],book,1,45
1714,192270,putting book,Putting [something similar to other things that are already on the table],['book'],1,Putting [something],book,1,32
726,75537,putting book,Putting [something similar to other things that are already on the table],['book'],1,Putting [something],book,1,37
5307,64233,putting a book on a surface,Putting [something] on a surface,['a book'],1,Putting [something],book,1,28
213,140014,putting book,Putting [something similar to other things that are already on the table],['book'],1,Putting [something],book,1,34
9217,67372,putting book and key on the table,Putting [something] and [something] on the table,"['book', 'key']",2,Putting [something],book,1,35
14191,130876,putting book next to book,Putting [something] next to [something],"['book', 'book']",2,Putting [something],book,1,42
7074,42978,putting book and whistle on the table,Putting [something] and [something] on the table,"['book', 'whistle']",2,Putting [something],book,1,42
4690,134980,putting book and cable on the table,Putting [something] and [something] on the table,"['book', 'cable']",2,Putting [something],book,1,51
1380,96064,putting box behind battery,Putting [something] behind [something],"['box', 'battery']",2,Putting [something],box,1,47
13250,1759,"putting box, pen and lip bam on the table","Putting [something], [something] and [something] on the table","['box', 'pen', 'lip bam']",3,Putting [something],box,1,61
4302,79412,putting a box on a surface,Putting [something] on a surface,['a box'],1,Putting [something],box,1,49
3770,141765,putting box and handphone on the table,Putting [something] and [something] on the table,"['box', 'handphone']",2,Putting [something],box,1,56
10333,64141,putting a box onto its side,Putting [something] onto [something],"['a box', 'its side']",2,Putting [something],box,1,52
11165,168379,putting box and bottle on the table,Putting [something] and [something] on the table,"['box', 'bottle']",2,Putting [something],box,1,37
13648,28448,putting box next to yellowbook,Putting [something] next to [something],"['box', 'yellowbook']",2,Putting [something],box,1,51
12709,78361,putting box and pencil on the table,Putting [something] and [something] on the table,"['box', 'pencil']",2,Putting [something],box,1,48
7361,153912,putting box,Putting [something similar to other things that are already on the table],['box'],1,Putting [something],box,1,54
8149,164375,"putting a box that can't roll onto a slanted surface, so it stays where it is","Putting [something] that can't roll onto a slanted surface, so it stays where it is",['a box'],1,Putting [something],box,1,51
6328,40031,throwing pencil onto a surface,Throwing [something] onto a surface,['pencil'],1,Dropping [something],pencil,1,23
9591,195401,throwing a pencil,Throwing [something],['a pencil'],1,Dropping [something],pencil,1,28
1236,131771,throwing color pencils,Throwing [something],['color pencils'],1,Dropping [something],pencil,1,47
624,110639,throwing color pencils,Throwing [something],['color pencils'],1,Dropping [something],pencil,1,27
10639,7349,throwing color pencils,Throwing [something],['color pencils'],1,Dropping [something],pencil,1,27
107,203518,throwing color pencils,Throwing [something],['color pencils'],1,Dropping [something],pencil,1,30
8296,57072,throwing color pencils,Throwing [something],['color pencils'],1,Dropping [something],pencil,1,30
6684,173880,throwing color pencils,Throwing [something],['color pencils'],1,Dropping [something],pencil,1,35
4625,207885,throwing color pencils,Throwing [something],['color pencils'],1,Dropping [something],pencil,1,30
4505,135295,throwing color pencils,Throwing [something],['color pencils'],1,Dropping [something],pencil,1,26
9373,80293,throwing plastic bottle in the air and letting it fall,Throwing [something] in the air and letting it fall,['plastic bottle'],1,Dropping [something],bottle,1,54
14094,206965,bottle falling like a rock,[Something] falling like a rock,['bottle'],1,Dropping [something],bottle,1,35
7953,151542,bottle falling like a rock,[Something] falling like a rock,['bottle'],1,Dropping [something],bottle,1,46
14782,120938,throwing bottle onto a surface,Throwing [something] onto a surface,['bottle'],1,Dropping [something],bottle,1,34
8066,78944,throwing bottle,Throwing [something],['bottle'],1,Dropping [something],bottle,1,38
14430,52645,bottle falling like a rock,[Something] falling like a rock,['bottle'],1,Dropping [something],bottle,1,53
10782,214644,throwing water bottle onto a surface,Throwing [something] onto a surface,['water bottle'],1,Dropping [something],bottle,1,18
11704,56144,bottle falling like a rock,[Something] falling like a rock,['bottle'],1,Dropping [something],bottle,1,49
8594,102046,plastic bottle falling like a rock,[Something] falling like a rock,['plastic bottle'],1,Dropping [something],bottle,1,32
9197,85452,throwing water bottle,Throwing [something],['water bottle'],1,Dropping [something],bottle,1,61
10293,188587,throwing pen in the air and letting it fall,Throwing [something] in the air and letting it fall,['pen'],1,Dropping [something],pen,1,16
10884,78264,throwing pen,Throwing [something],['pen'],1,Dropping [something],pen,1,28
2421,89195,throwing a pen in the air and letting it fall,Throwing [something] in the air and letting it fall,['a pen'],1,Dropping [something],pen,1,49
1134,63788,pen falling like a rock,[Something] falling like a rock,['pen'],1,Dropping [something],pen,1,40
12938,126389,throwing pen onto a surface,Throwing [something] onto a surface,['pen'],1,Dropping [something],pen,1,47
276,85412,pen falling like a rock,[Something] falling like a rock,['pen'],1,Dropping [something],pen,1,64
14538,112993,throwing pen in the air and letting it fall,Throwing [something] in the air and letting it fall,['pen'],1,Dropping [something],pen,1,50
8562,199730,throwing a pen,Throwing [something],['a pen'],1,Dropping [something],pen,1,32
5628,90031,pen falling like a rock,[Something] falling like a rock,['pen'],1,Dropping [something],pen,1,14
5569,104164,throwing a pen onto a surface,Throwing [something] onto a surface,['a pen'],1,Dropping [something],pen,1,54
8474,205307,throwing book,Throwing [something],['book'],1,Dropping [something],book,1,29
12792,8787,throwing book,Throwing [something],['book'],1,Dropping [something],book,1,36
4310,176675,throwing book,Throwing [something],['book'],1,Dropping [something],book,1,27
957,27127,throwing book,Throwing [something],['book'],1,Dropping [something],book,1,35
5174,48429,throwing book,Throwing [something],['book'],1,Dropping [something],book,1,36
12827,64485,a book falling like a rock,[Something] falling like a rock,['a book'],1,Dropping [something],book,1,16
10869,169426,book falling like a rock,[Something] falling like a rock,['book'],1,Dropping [something],book,1,34
6444,109946,throwing book,Throwing [something],['book'],1,Dropping [something],book,1,27
3483,110304,throwing book,Throwing [something],['book'],1,Dropping [something],book,1,25
14198,146025,book falling like a rock,[Something] falling like a rock,['book'],1,Dropping [something],book,1,27
10054,204899,throwing a box,Throwing [something],['a box'],1,Dropping [something],box,1,39
11888,90971,box falling like a rock,[Something] falling like a rock,['box'],1,Dropping [something],box,1,36
11041,100605,throwing box,Throwing [something],['box'],1,Dropping [something],box,1,46
13327,37332,throwing a box in the air and letting it fall,Throwing [something] in the air and letting it fall,['a box'],1,Dropping [something],box,1,38
10521,162045,throwing box,Throwing [something],['box'],1,Dropping [something],box,1,42
7299,172988,box falling like a rock,[Something] falling like a rock,['box'],1,Dropping [something],box,1,48
14320,206183,throwing box,Throwing [something],['box'],1,Dropping [something],box,1,31
14477,127647,box falling like a rock,[Something] falling like a rock,['box'],1,Dropping [something],box,1,35
2263,146288,box falling like a rock,[Something] falling like a rock,['box'],1,Dropping [something],box,1,37
7646,10053,throwing box onto a surface,Throwing [something] onto a surface,['box'],1,Dropping [something],box,1,46
4583,101803,pushing a pencil from left to right,Pushing [something] from left to right,['a pencil'],1,Moving [something] from left to right,pencil,1,48
11519,3100,pushing color pencils from left to right,Pushing [something] from left to right,['color pencils'],1,Moving [something] from left to right,pencil,1,28
181,110542,pushing color pencils from left to right,Pushing [something] from left to right,['color pencils'],1,Moving [something] from left to right,pencil,1,29
10801,164165,pushing pencil from left to right,Pushing [something] from left to right,['pencil'],1,Moving [something] from left to right,pencil,1,41
12671,122936,pushing color pencils from left to right,Pushing [something] from left to right,['color pencils'],1,Moving [something] from left to right,pencil,1,29
3554,44881,pulling color pencils from left to right,Pulling [something] from left to right,['color pencils'],1,Moving [something] from left to right,pencil,1,42
5702,124157,pushing color pencils from left to right,Pushing [something] from left to right,['color pencils'],1,Moving [something] from left to right,pencil,1,24
1347,147696,pushing color pencils from left to right,Pushing [something] from left to right,['color pencils'],1,Moving [something] from left to right,pencil,1,31
3442,38136,pushing color pencils from left to right,Pushing [something] from left to right,['color pencils'],1,Moving [something] from left to right,pencil,1,39
6827,198961,pushing color pencils from left to right,Pushing [something] from left to right,['color pencils'],1,Moving [something] from left to right,pencil,1,31
1127,90911,pushing bottle from left to right,Pushing [something] from left to right,['bottle'],1,Moving [something] from left to right,bottle,1,38
12095,9575,pushing water bottle from left to right,Pushing [something] from left to right,['water bottle'],1,Moving [something] from left to right,bottle,1,33
3733,103287,pushing bottle from left to right,Pushing [something] from left to right,['bottle'],1,Moving [something] from left to right,bottle,1,25
3548,159631,pushing a bottle from left to right,Pushing [something] from left to right,['a bottle'],1,Moving [something] from left to right,bottle,1,36
8996,210346,pushing bottle from left to right,Pushing [something] from left to right,['bottle'],1,Moving [something] from left to right,bottle,1,55
9702,178910,pushing a water bottle from left to right,Pushing [something] from left to right,['a water bottle'],1,Moving [something] from left to right,bottle,1,52
12927,36004,pushing bottle from left to right,Pushing [something] from left to right,['bottle'],1,Moving [something] from left to right,bottle,1,28
11249,18613,pushing bottle from left to right,Pushing [something] from left to right,['bottle'],1,Moving [something] from left to right,bottle,1,36
6685,109703,pushing bottle from left to right,Pushing [something] from left to right,['bottle'],1,Moving [something] from left to right,bottle,1,59
7278,91272,pushing a plastic bottle from left to right,Pushing [something] from left to right,['a plastic bottle'],1,Moving [something] from left to right,bottle,1,47
2935,129373,pulling pen from left to right,Pulling [something] from left to right,['pen'],1,Moving [something] from left to right,pen,1,32
11364,220362,pulling pen from left to right,Pulling [something] from left to right,['pen'],1,Moving [something] from left to right,pen,1,47
13002,212413,pushing pen from left to right,Pushing [something] from left to right,['pen'],1,Moving [something] from left to right,pen,1,44
11057,28563,pushing pen from left to right,Pushing [something] from left to right,['pen'],1,Moving [something] from left to right,pen,1,24
12522,103624,pulling a pen from left to right,Pulling [something] from left to right,['a pen'],1,Moving [something] from left to right,pen,1,69
2416,41956,pushing pen from left to right,Pushing [something] from left to right,['pen'],1,Moving [something] from left to right,pen,1,25
14662,198107,pulling pen from left to right,Pulling [something] from left to right,['pen'],1,Moving [something] from left to right,pen,1,42
6150,3256,pulling pen from left to right,Pulling [something] from left to right,['pen'],1,Moving [something] from left to right,pen,1,37
3811,14758,pushing pen from left to right,Pushing [something] from left to right,['pen'],1,Moving [something] from left to right,pen,1,54
10999,107126,pushing a pen from left to right,Pushing [something] from left to right,['a pen'],1,Moving [something] from left to right,pen,1,46
2937,146894,pushing book from left to right,Pushing [something] from left to right,['book'],1,Moving [something] from left to right,book,1,37
13453,148138,pulling book from left to right,Pulling [something] from left to right,['book'],1,Moving [something] from left to right,book,1,35
11085,22396,pushing a book from left to right,Pushing [something] from left to right,['a book'],1,Moving [something] from left to right,book,1,50
8649,69720,pushing book from left to right,Pushing [something] from left to right,['book'],1,Moving [something] from left to right,book,1,27
4887,20879,pushing book from left to right,Pushing [something] from left to right,['book'],1,Moving [something] from left to right,book,1,50
2137,133769,pushing book from left to right,Pushing [something] from left to right,['book'],1,Moving [something] from left to right,book,1,56
7929,212918,pulling a book from left to right,Pulling [something] from left to right,['a book'],1,Moving [something] from left to right,book,1,53
4797,178136,pushing book from left to right,Pushing [something] from left to right,['book'],1,Moving [something] from left to right,book,1,34
3643,14591,pulling a book from left to right,Pulling [something] from left to right,['a book'],1,Moving [something] from left to right,book,1,54
4345,79266,pushing book from left to right,Pushing [something] from left to right,['book'],1,Moving [something] from left to right,book,1,34
9948,10754,pushing a box from left to right,Pushing [something] from left to right,['a box'],1,Moving [something] from left to right,box,1,39
7912,160631,pushing box from left to right,Pushing [something] from left to right,['box'],1,Moving [something] from left to right,box,1,54
10784,129080,pushing box from left to right,Pushing [something] from left to right,['box'],1,Moving [something] from left to right,box,1,52
4798,32090,pushing box from left to right,Pushing [something] from left to right,['box'],1,Moving [something] from left to right,box,1,39
