,id,label,template,placeholders,num_objects,verb_class_name,noun_class_name,start_frame,stop_frame
6475,206045,taking pen,Taking [one of many similar things on the table],['pen'],1,Picking [something] up,pen,1,55
13212,211176,taking a pen out of a desk organizer,Taking [something] out of [something],"['a pen', 'a desk organizer']",2,Picking [something] up,pen,1,45
14572,12195,taking pen out of box,Taking [something] out of [something],"['pen', 'box']",2,Picking [something] up,pen,1,48
11996,74704,lifting pen up completely without letting it drop down,Lifting [something] up completely without letting it drop down,['pen'],1,Picking [something] up,pen,1,35
9695,138716,picking pen up,Picking [something] up,['pen'],1,Picking [something] up,pen,1,27
3807,97752,moving a pen up,Moving [something] up,['a pen'],1,Picking [something] up,pen,1,47
13397,202581,taking a pen,Taking [one of many similar things on the table],['a pen'],1,Picking [something] up,pen,1,52
3319,137594,taking pens,Taking [one of many similar things on the table],['pens'],1,Picking [something] up,pen,1,34
7893,40015,taking pens,Taking [one of many similar things on the table],['pens'],1,Picking [something] up,pen,1,38
2401,150036,lifting pen up completely without letting it drop down,Lifting [something] up completely without letting it drop down,['pen'],1,Picking [something] up,pen,1,53
12316,70425,taking pen out of cup,Taking [something] out of [something],"['pen', 'cup']",2,Picking [something] up,pen,1,42
12944,62049,taking pen,Taking [one of many similar things on the table],['pen'],1,Picking [something] up,pen,1,58
10950,203357,taking pen from table,Taking [something] from [somewhere],"['pen', 'table']",2,Picking [something] up,pen,1,45
6241,92462,taking pen,Taking [one of many similar things on the table],['pen'],1,Picking [something] up,pen,1,54
12379,69570,moving pen up,Moving [something] up,['pen'],1,Picking [something] up,pen,1,37
3054,72844,picking a pen up,Picking [something] up,['a pen'],1,Picking [something] up,pen,1,39
12885,220805,moving pen up,Moving [something] up,['pen'],1,Picking [something] up,pen,1,17
7648,185117,moving pen up,Moving [something] up,['pen'],1,Picking [something] up,pen,1,40
7036,15274,taking charger from laptop,Taking [something] from [somewhere],"['charger', 'laptop']",2,Picking [something] up,charger,1,53
8602,172223,moving adapter up,Moving [something] up,['adapter'],1,Picking [something] up,charger,1,33
11983,42495,picking charger up,Picking [something] up,['charger'],1,Picking [something] up,charger,1,60
7480,9581,moving adapter up,Moving [something] up,['adapter'],1,Picking [something] up,charger,1,33
4519,145780,moving charger up,Moving [something] up,['charger'],1,Picking [something] up,charger,1,23
457,177313,taking charger from plug,Taking [something] from [somewhere],"['charger', 'plug']",2,Picking [something] up,charger,1,42
8600,54755,moving charger up,Moving [something] up,['charger'],1,Picking [something] up,charger,1,20
12656,64973,moving adapter up,Moving [something] up,['adapter'],1,Picking [something] up,charger,1,33
10122,94193,taking the charger out of the bag,Taking [something] out of [something],"['the charger', 'the bag']",2,Picking [something] up,charger,1,48
6712,123290,picking charger up,Picking [something] up,['charger'],1,Picking [something] up,charger,1,58
1259,62828,moving adapter up,Moving [something] up,['adapter'],1,Picking [something] up,charger,1,33
3801,29468,moving adapter up,Moving [something] up,['adapter'],1,Picking [something] up,charger,1,33
7626,24631,moving adapter up,Moving [something] up,['adapter'],1,Picking [something] up,charger,1,33
10497,190783,taking adapter from socket,Taking [something] from [somewhere],"['adapter', 'socket']",2,Picking [something] up,charger,1,22
8587,159851,taking charger out of cap,Taking [something] out of [something],"['charger', 'cap']",2,Picking [something] up,charger,1,56
10678,29071,moving adapter up,Moving [something] up,['adapter'],1,Picking [something] up,charger,1,33
13086,203992,moving charger up,Moving [something] up,['charger'],1,Picking [something] up,charger,1,27
2333,107789,lifting adapter up completely without letting it drop down,Lifting [something] up completely without letting it drop down,['adapter'],1,Picking [something] up,charger,1,26
12221,63818,taking battery out of small plastic jar,Taking [something] out of [something],"['battery', 'small plastic jar']",2,Picking [something] up,battery,1,35
9363,97933,moving battery up,Moving [something] up,['battery'],1,Picking [something] up,battery,1,45
11015,143970,taking battery,Taking [one of many similar things on the table],['battery'],1,Picking [something] up,battery,1,52
6473,131472,taking batteries out of a box,Taking [something] out of [something],"['batteries', 'a box']",2,Picking [something] up,battery,1,48
1722,52155,taking a battery,Taking [one of many similar things on the table],['a battery'],1,Picking [something] up,battery,1,24
177,121051,taking battery from charger,Taking [something] from [somewhere],"['battery', 'charger']",2,Picking [something] up,battery,1,49
8181,203803,lifting battery up completely without letting it drop down,Lifting [something] up completely without letting it drop down,['battery'],1,Picking [something] up,battery,1,39
11806,80009,taking battery,Taking [one of many similar things on the table],['battery'],1,Picking [something] up,battery,1,36
12365,52693,taking battery out of cup,Taking [something] out of [something],"['battery', 'cup']",2,Picking [something] up,battery,1,44
7569,133686,taking a battery out of tin box,Taking [something] out of [something],"['a battery', 'tin box']",2,Picking [something] up,battery,1,45
471,106163,taking a battery from a table,Taking [something] from [somewhere],"['a battery', 'a table']",2,Picking [something] up,battery,1,32
1474,25410,taking battery from table,Taking [something] from [somewhere],"['battery', 'table']",2,Picking [something] up,battery,1,38
6864,2910,lifting a battery with a thumb drive on it,Lifting [something] with [something] on it,"['a battery', 'a thumb drive']",2,Picking [something] up,battery,1,36
5216,179934,taking a battery out of a pouch,Taking [something] out of [something],"['a battery', 'a pouch']",2,Picking [something] up,battery,1,42
8120,195127,taking battery out of camera cover,Taking [something] out of [something],"['battery', 'camera cover']",2,Picking [something] up,battery,1,53
13676,78199,taking a battery,Taking [one of many similar things on the table],['a battery'],1,Picking [something] up,battery,1,60
9994,88468,picking a battery up,Picking [something] up,['a battery'],1,Picking [something] up,battery,1,40
751,49209,moving battery up,Moving [something] up,['battery'],1,Picking [something] up,battery,1,62
8639,98878,taking mouse from bed,Taking [something] from [somewhere],"['mouse', 'bed']",2,Picking [something] up,mouse,1,49
10578,180935,picking mouse up,Picking [something] up,['mouse'],1,Picking [something] up,mouse,1,63
14804,57070,moving mouse up,Moving [something] up,['mouse'],1,Picking [something] up,mouse,1,31
8783,64644,moving mouse up,Moving [something] up,['mouse'],1,Picking [something] up,mouse,1,50
4592,126452,moving mouse up,Moving [something] up,['mouse'],1,Picking [something] up,mouse,1,27
1008,164714,picking a mouse up,Picking [something] up,['a mouse'],1,Picking [something] up,mouse,1,37
10413,193000,moving mouse up,Moving [something] up,['mouse'],1,Picking [something] up,mouse,1,31
14454,28140,taking mice from table,Taking [something] from [somewhere],"['mice', 'table']",2,Picking [something] up,mouse,1,60
12031,82380,picking mouse up,Picking [something] up,['mouse'],1,Picking [something] up,mouse,1,46
7762,126777,lifting a mouse up completely without letting it drop down,Lifting [something] up completely without letting it drop down,['a mouse'],1,Picking [something] up,mouse,1,41
1544,25955,moving mouse up,Moving [something] up,['mouse'],1,Picking [something] up,mouse,1,31
4478,74668,taking mouse out of box,Taking [something] out of [something],"['mouse', 'box']",2,Picking [something] up,mouse,1,41
9314,97120,taking mouse out of wooden basket,Taking [something] out of [something],"['mouse', 'wooden basket']",2,Picking [something] up,mouse,1,39
12120,168548,taking mouse out of shelf,Taking [something] out of [something],"['mouse', 'shelf']",2,Picking [something] up,mouse,1,28
9917,210906,moving mouse up,Moving [something] up,['mouse'],1,Picking [something] up,mouse,1,61
12503,49437,moving a mouse up,Moving [something] up,['a mouse'],1,Picking [something] up,mouse,1,31
13186,37520,moving mouse up,Moving [something] up,['mouse'],1,Picking [something] up,mouse,1,59
3002,142770,picking mouse up,Picking [something] up,['mouse'],1,Picking [something] up,mouse,1,50
5446,112998,putting color pencils on a surface,Putting [something] on a surface,['color pencils'],1,Putting [something],pencil,1,47
158,142854,putting color pencils on a surface,Putting [something] on a surface,['color pencils'],1,Putting [something],pencil,1,43
2004,77424,putting color pencils on a surface,Putting [something] on a surface,['color pencils'],1,Putting [something],pencil,1,27
10498,208155,putting color pencils on a surface,Putting [something] on a surface,['color pencils'],1,Putting [something],pencil,1,27
1845,126278,putting color pencils on a surface,Putting [something] on a surface,['color pencils'],1,Putting [something],pencil,1,39
12879,169552,putting color pencils on a surface,Putting [something] on a surface,['color pencils'],1,Putting [something],pencil,1,28
4754,183281,putting color pencils on a surface,Putting [something] on a surface,['color pencils'],1,Putting [something],pencil,1,32
8880,78400,putting color pencils on a surface,Putting [something] on a surface,['color pencils'],1,Putting [something],pencil,1,38
10695,96749,putting pencil onto box,Putting [something] onto [something],"['pencil', 'box']",2,Putting [something],pencil,1,29
3812,214992,putting color pencils on a surface,Putting [something] on a surface,['color pencils'],1,Putting [something],pencil,1,30
3832,91597,putting color pencils on a surface,Putting [something] on a surface,['color pencils'],1,Putting [something],pencil,1,27
9531,65406,putting color pencils on a surface,Putting [something] on a surface,['color pencils'],1,Putting [something],pencil,1,22
5466,170858,putting color pencils on a surface,Putting [something] on a surface,['color pencils'],1,Putting [something],pencil,1,43
11845,42615,putting color pencils on a surface,Putting [something] on a surface,['color pencils'],1,Putting [something],pencil,1,32
9865,35331,putting color pencils on a surface,Putting [something] on a surface,['color pencils'],1,Putting [something],pencil,1,43
1301,217394,"putting pencil, sharpener and eraser on the table","Putting [something], [something] and [something] on the table","['pencil', 'sharpener', 'eraser']",3,Putting [something],pencil,1,55
2258,104309,putting color pencils on a surface,Putting [something] on a surface,['color pencils'],1,Putting [something],pencil,1,29
9662,163156,putting color pencils on a surface,Putting [something] on a surface,['color pencils'],1,Putting [something],pencil,1,22
1511,202518,"putting book, sketch pen and eraser on the table","Putting [something], [something] and [something] on the table","['book', 'sketch pen', 'eraser']",3,Putting [something],book,1,59
13475,98509,putting book next to book,Putting [something] next to [something],"['book', 'book']",2,Putting [something],book,1,30
8408,115901,putting book onto box,Putting [something] onto [something],"['book', 'box']",2,Putting [something],book,1,45
7349,89610,putting a book on a surface,Putting [something] on a surface,['a book'],1,Putting [something],book,1,47
13660,62408,putting book on a surface,Putting [something] on a surface,['book'],1,Putting [something],book,1,49
13868,26326,putting book behind bag,Putting [something] behind [something],"['book', 'bag']",2,Putting [something],book,1,46
283,61053,"putting book, remote and bottle on the table","Putting [something], [something] and [something] on the table","['book', 'remote', 'bottle']",3,Putting [something],book,1,48
11549,191625,putting book on a surface,Putting [something] on a surface,['book'],1,Putting [something],book,1,26
748,97693,putting book next to pillow,Putting [something] next to [something],"['book', 'pillow']",2,Putting [something],book,1,40
13026,8996,putting a book and a calculator on the table,Putting [something] and [something] on the table,"['a book', 'a calculator']",2,Putting [something],book,1,59
4796,115471,"putting a book, a remote and a pen on the table","Putting [something], [something] and [something] on the table","['a book', 'a remote', 'a pen']",3,Putting [something],book,1,63
10257,158682,"putting book that can't roll onto a slanted surface, so it stays where it is","Putting [something] that can't roll onto a slanted surface, so it stays where it is",['book'],1,Putting [something],book,1,44
13322,146709,putting a book,Putting [something similar to other things that are already on the table],['a book'],1,Putting [something],book,1,50
12254,123264,"putting book that can't roll onto a slanted surface, so it stays where it is","Putting [something] that can't roll onto a slanted surface, so it stays where it is",['book'],1,Putting [something],book,1,45
6391,63694,putting a book next to the mobile phone,Putting [something] next to [something],"['a book', 'the mobile phone']",2,Putting [something],book,1,48
532,118064,"putting book that can't roll onto a slanted surface, so it stays where it is","Putting [something] that can't roll onto a slanted surface, so it stays where it is",['book'],1,Putting [something],book,1,34
2503,22854,putting book and coin on the table,Putting [something] and [something] on the table,"['book', 'coin']",2,Putting [something],book,1,49
10447,28315,putting a book,Putting [something similar to other things that are already on the table],['a book'],1,Putting [something],book,1,39
2681,18608,putting book,Putting [something similar to other things that are already on the table],['book'],1,Putting [something],book,1,62
10554,66064,putting paper next to wallet,Putting [something] next to [something],"['paper', 'wallet']",2,Putting [something],paper,1,24
11989,114525,putting paper,Putting [something similar to other things that are already on the table],['paper'],1,Putting [something],paper,1,29
9940,72689,"putting paper that can't roll onto a slanted surface, so it stays where it is","Putting [something] that can't roll onto a slanted surface, so it stays where it is",['paper'],1,Putting [something],paper,1,65
1763,17164,putting paper,Putting [something similar to other things that are already on the table],['paper'],1,Putting [something],paper,1,30
4191,35223,"putting paper, trigonal clip and mp3 player on the table","Putting [something], [something] and [something] on the table","['paper', 'trigonal clip', 'mp3 player']",3,Putting [something],paper,1,50
9488,148573,putting papers behind woofer,Putting [something] behind [something],"['papers', 'woofer']",2,Putting [something],paper,1,53
10459,211904,putting paper onto leaf,Putting [something] onto [something],"['paper', 'leaf']",2,Putting [something],paper,1,44
4324,45560,putting a paper,Putting [something similar to other things that are already on the table],['a paper'],1,Putting [something],paper,1,41
12594,118028,putting paper next to music-player,Putting [something] next to [something],"['paper', 'music-player']",2,Putting [something],paper,1,36
10711,124641,putting a paper on a surface,Putting [something] on a surface,['a paper'],1,Putting [something],paper,1,38
10530,3706,putting paper next to phone,Putting [something] next to [something],"['paper', 'phone']",2,Putting [something],paper,1,28
7901,158646,putting paper behind papers,Putting [something] behind [something],"['paper', 'papers']",2,Putting [something],paper,1,34
13366,77904,putting paper onto fridge,Putting [something] onto [something],"['paper', 'fridge']",2,Putting [something],paper,1,42
1322,19975,putting paper and eraser on the table,Putting [something] and [something] on the table,"['paper', 'eraser']",2,Putting [something],paper,1,28
13987,149515,"putting paper, pen and rubber band on the table","Putting [something], [something] and [something] on the table","['paper', 'pen', 'rubber band']",3,Putting [something],paper,1,49
7158,62518,"putting paper, phone and remote on the table","Putting [something], [something] and [something] on the table","['paper', 'phone', 'remote']",3,Putting [something],paper,1,60
5487,98683,putting a paper on a surface,Putting [something] on a surface,['a paper'],1,Putting [something],paper,1,17
8747,58510,putting paper onto envelope,Putting [something] onto [something],"['paper', 'envelope']",2,Putting [something],paper,1,39
6195,65497,"putting paper, brush and shoe polish on the table","Putting [something], [something] and [something] on the table","['paper', 'brush', 'shoe polish']",3,Putting [something],paper,1,49
9776,218113,putting glasses and sunglasses on the table,Putting [something] and [something] on the table,"['glasses', 'sunglasses']",2,Putting [something],glasses,1,50
7511,147570,putting glasses behind a toy castle,Putting [something] behind [something],"['glasses', 'a toy castle']",2,Putting [something],glasses,1,63
8045,119626,putting glasses on a surface,Putting [something] on a surface,['glasses'],1,Putting [something],glasses,1,33
12720,10680,putting some glasses onto a laptop,Putting [something] onto [something],"['some glasses', 'a laptop']",2,Putting [something],glasses,1,52
14290,58136,putting glasses next to a watch,Putting [something] next to [something],"['glasses', 'a watch']",2,Putting [something],glasses,1,60
8106,33256,putting glasses on a surface,Putting [something] on a surface,['glasses'],1,Putting [something],glasses,1,33
12322,41767,putting a glasses on a surface,Putting [something] on a surface,['a glasses'],1,Putting [something],glasses,1,53
9912,155008,putting glasses on a surface,Putting [something] on a surface,['glasses'],1,Putting [something],glasses,1,44
8219,53760,putting glasses behind cooler,Putting [something] behind [something],"['glasses', 'cooler']",2,Putting [something],glasses,1,48
2074,84471,putting glasses on a surface,Putting [something] on a surface,['glasses'],1,Putting [something],glasses,1,33
8499,184773,putting a glasses on a surface,Putting [something] on a surface,['a glasses'],1,Putting [something],glasses,1,33
9333,65949,putting a glasses on a surface,Putting [something] on a surface,['a glasses'],1,Putting [something],glasses,1,43
8150,85001,putting glasses behind pot,Putting [something] behind [something],"['glasses', 'pot']",2,Putting [something],glasses,1,38
10876,56836,putting glasses and a pad of paper on the table,Putting [something] and [something] on the table,"['glasses', 'a pad of paper']",2,Putting [something],glasses,1,62
14568,200991,putting glasses,Putting [something similar to other things that are already on the table],['glasses'],1,Putting [something],glasses,1,68
1779,102904,putting glasses on a surface,Putting [something] on a surface,['glasses'],1,Putting [something],glasses,1,40
4085,4012,putting glasses and notebook on the table,Putting [something] and [something] on the table,"['glasses', 'notebook']",2,Putting [something],glasses,1,45
8082,193122,putting glasses next to scissors,Putting [something] next to [something],"['glasses', 'scissors']",2,Putting [something],glasses,1,50
4016,10592,putting glasses on a surface,Putting [something] on a surface,['glasses'],1,Putting [something],glasses,1,41
11522,114156,throwing keys,Throwing [something],['keys'],1,Dropping [something],key,1,34
1226,177610,throwing keys,Throwing [something],['keys'],1,Dropping [something],key,1,51
10538,52895,throwing key,Throwing [something],['key'],1,Dropping [something],key,1,34
100,209698,throwing key,Throwing [something],['key'],1,Dropping [something],key,1,64
3152,139926,throwing key,Throwing [something],['key'],1,Dropping [something],key,1,46
13562,41066,keys falling like a rock,[Something] falling like a rock,['keys'],1,Dropping [something],key,1,37
14767,79542,throwing keys in the air and letting it fall,Throwing [something] in the air and letting it fall,['keys'],1,Dropping [something],key,1,57
682,62830,throwing key,Throwing [something],['key'],1,Dropping [something],key,1,36
2284,20848,keys falling like a rock,[Something] falling like a rock,['keys'],1,Dropping [something],key,1,46
12836,77124,throwing key onto a surface,Throwing [something] onto a surface,['key'],1,Dropping [something],key,1,42
9936,115491,throwing key,Throwing [something],['key'],1,Dropping [something],key,1,34
2837,188993,throwing keys in the air and letting it fall,Throwing [something] in the air and letting it fall,['keys'],1,Dropping [something],key,1,46
7336,105975,key falling like a rock,[Something] falling like a rock,['key'],1,Dropping [something],key,1,38
9104,32160,keys falling like a rock,[Something] falling like a rock,['keys'],1,Dropping [something],key,1,64
10632,17,throwing keys onto a surface,Throwing [something] onto a surface,['keys'],1,Dropping [something],key,1,62
7946,30669,throwing keys,Throwing [something],['keys'],1,Dropping [something],key,1,72
1644,98231,throwing key,Throwing [something],['key'],1,Dropping [something],key,1,34
10355,131459,throwing keys onto a surface,Throwing [something] onto a surface,['keys'],1,Dropping [something],key,1,62
11648,167284,keys falling like a rock,[Something] falling like a rock,['keys'],1,Dropping [something],key,1,34
13974,28005,a wallet falling like a rock,[Something] falling like a rock,['a wallet'],1,Dropping [something],wallet,1,46
8525,31036,throwing wallet,Throwing [something],['wallet'],1,Dropping [something],wallet,1,30
12749,127586,throwing wallet,Throwing [something],['wallet'],1,Dropping [something],wallet,1,30
14470,66696,throwing wallet,Throwing [something],['wallet'],1,Dropping [something],wallet,1,29
11451,42641,throwing wallet onto a surface,Throwing [something] onto a surface,['wallet'],1,Dropping [something],wallet,1,40
10364,11374,throwing wallet,Throwing [something],['wallet'],1,Dropping [something],wallet,1,30
1645,170152,a wallet falling like a rock,[Something] falling like a rock,['a wallet'],1,Dropping [something],wallet,1,45
13740,171961,throwing a wallet,Throwing [something],['a wallet'],1,Dropping [something],wallet,1,20
14550,199193,wallet falling like a rock,[Something] falling like a rock,['wallet'],1,Dropping [something],wallet,1,29
9941,129618,throwing a wallet,Throwing [something],['a wallet'],1,Dropping [something],wallet,1,45
6799,177046,a wallet falling like a rock,[Something] falling like a rock,['a wallet'],1,Dropping [something],wallet,1,63
7590,9933,throwing wallet,Throwing [something],['wallet'],1,Dropping [something],wallet,1,38
8190,115339,throwing wallet,Throwing [something],['wallet'],1,Dropping [something],wallet,1,30
7865,208073,wallet falling like a rock,[Something] falling like a rock,['wallet'],1,Dropping [something],wallet,1,48
5346,218458,throwing wallet,Throwing [something],['wallet'],1,Dropping [something],wallet,1,64
12080,163909,wallet falling like a rock,[Something] falling like a rock,['wallet'],1,Dropping [something],wallet,1,61
13637,160841,wallet falling like a rock,[Something] falling like a rock,['wallet'],1,Dropping [something],wallet,1,32
10243,203810,wallet falling like a rock,[Something] falling like a rock,['wallet'],1,Dropping [something],wallet,1,56
470,53567,throwing wallet onto a surface,Throwing [something] onto a surface,['wallet'],1,Dropping [something],wallet,1,42
8781,93816,throwing brush in the air and letting it fall,Throwing [something] in the air and letting it fall,['brush'],1,Dropping [something],brush,1,62
10899,25144,throwing brush,Throwing [something],['brush'],1,Dropping [something],brush,1,41
7108,159141,throwing brush,Throwing [something],['brush'],1,Dropping [something],brush,1,31
913,18574,throwing brush onto a surface,Throwing [something] onto a surface,['brush'],1,Dropping [something],brush,1,62
2419,171446,throwing brush,Throwing [something],['brush'],1,Dropping [something],brush,1,62
6409,54174,brush falling like a rock,[Something] falling like a rock,['brush'],1,Dropping [something],brush,1,34
7160,4573,brush falling like a rock,[Something] falling like a rock,['brush'],1,Dropping [something],brush,1,21
2631,5835,brush falling like a rock,[Something] falling like a rock,['brush'],1,Dropping [something],brush,1,40
10997,211840,throwing brush,Throwing [something],['brush'],1,Dropping [something],brush,1,62
9173,215503,throwing brush onto a surface,Throwing [something] onto a surface,['brush'],1,Dropping [something],brush,1,31
7717,24336,throwing brush,Throwing [something],['brush'],1,Dropping [something],brush,1,62
4780,42955,throwing brush,Throwing [something],['brush'],1,Dropping [something],brush,1,45
11531,35839,throwing brush onto a surface,Throwing [something] onto a surface,['brush'],1,Dropping [something],brush,1,48
367,76079,throwing brush,Throwing [something],['brush'],1,Dropping [something],brush,1,50
13196,11166,brush falling like a rock,[Something] falling like a rock,['brush'],1,Dropping [something],brush,1,51
4026,214237,throwing brush onto a surface,Throwing [something] onto a surface,['brush'],1,Dropping [something],brush,1,62
3382,183455,throwing brush onto a surface,Throwing [something] onto a surface,['brush'],1,Dropping [something],brush,1,62
4972,205509,throwing brush in the air and letting it fall,Throwing [something] in the air and letting it fall,['brush'],1,Dropping [something],brush,1,42
3666,45092,brush falling like a rock,[Something] falling like a rock,['brush'],1,Dropping [something],brush,1,33
13821,60218,scissors falling like a rock,[Something] falling like a rock,['scissors'],1,Dropping [something],scissors,1,58
