,id,label,template,placeholders,num_objects,verb_class_name,noun_class_name,start_frame,stop_frame
5322,109912,moving pencil up,Moving [something] up,['pencil'],1,Picking [something] up,pencil,1,48
12007,27890,lifting pencil up completely without letting it drop down,Lifting [something] up completely without letting it drop down,['pencil'],1,Picking [something] up,pencil,1,31
10400,205718,taking pencil out of plate,Taking [something] out of [something],"['pencil', 'plate']",2,Picking [something] up,pencil,1,35
2262,190083,moving color pencils up,Moving [something] up,['color pencils'],1,Picking [something] up,pencil,1,27
9243,121809,moving color pencils up,Moving [something] up,['color pencils'],1,Picking [something] up,pencil,1,26
1595,32664,taking pencil,Taking [one of many similar things on the table],['pencil'],1,Picking [something] up,pencil,1,40
6514,183371,moving color pencils up,Moving [something] up,['color pencils'],1,Picking [something] up,pencil,1,38
12508,60012,moving a pencil up,Moving [something] up,['a pencil'],1,Picking [something] up,pencil,1,37
4270,215874,taking a pencil out of a cup,Taking [something] out of [something],"['a pencil', 'a cup']",2,Picking [something] up,pencil,1,58
6856,24467,lifting color pencils up completely without letting it drop down,Lifting [something] up completely without letting it drop down,['color pencils'],1,Picking [something] up,pencil,1,33
10106,160613,picking plastic bottle up,Picking [something] up,['plastic bottle'],1,Picking [something] up,bottle,1,43
12633,128551,taking bottle out of cup board,Taking [something] out of [something],"['bottle', 'cup board']",2,Picking [something] up,bottle,1,40
9998,24593,taking bottle,Taking [one of many similar things on the table],['bottle'],1,Picking [something] up,bottle,1,40
4147,44734,taking bottle from rack,Taking [something] from [somewhere],"['bottle', 'rack']",2,Picking [something] up,bottle,1,35
5395,96621,taking bottle from ground,Taking [something] from [somewhere],"['bottle', 'ground']",2,Picking [something] up,bottle,1,28
9514,125059,lifting a bottle up completely without letting it drop down,Lifting [something] up completely without letting it drop down,['a bottle'],1,Picking [something] up,bottle,1,69
2076,184570,picking a bottle up,Picking [something] up,['a bottle'],1,Picking [something] up,bottle,1,48
3086,136580,moving bottle up,Moving [something] up,['bottle'],1,Picking [something] up,bottle,1,28
7696,201828,moving bottle up,Moving [something] up,['bottle'],1,Picking [something] up,bottle,1,38
9864,92601,moving plastic bottle up,Moving [something] up,['plastic bottle'],1,Picking [something] up,bottle,1,52
8137,196354,lifting pen up completely without letting it drop down,Lifting [something] up completely without letting it drop down,['pen'],1,Picking [something] up,pen,1,36
13496,46492,taking pen out of glass,Taking [something] out of [something],"['pen', 'glass']",2,Picking [something] up,pen,1,38
2769,62059,taking pen,Taking [one of many similar things on the table],['pen'],1,Picking [something] up,pen,1,37
10348,22877,taking pen out of drawer,Taking [something] out of [something],"['pen', 'drawer']",2,Picking [something] up,pen,1,42
2267,150990,taking a pen,Taking [one of many similar things on the table],['a pen'],1,Picking [something] up,pen,1,62
3106,125913,taking pens,Taking [one of many similar things on the table],['pens'],1,Picking [something] up,pen,1,31
2607,42434,lifting a pen up completely without letting it drop down,Lifting [something] up completely without letting it drop down,['a pen'],1,Picking [something] up,pen,1,44
14379,177671,taking a pen,Taking [one of many similar things on the table],['a pen'],1,Picking [something] up,pen,1,51
11863,47455,picking a pen up,Picking [something] up,['a pen'],1,Picking [something] up,pen,1,34
12497,92078,lifting pen up completely without letting it drop down,Lifting [something] up completely without letting it drop down,['pen'],1,Picking [something] up,pen,1,30
13222,174560,taking a book from the shelf,Taking [something] from [somewhere],"['a book', 'the shelf']",2,Picking [something] up,book,1,68
4909,108147,lifting a book with a mobile phone on it,Lifting [something] with [something] on it,"['a book', 'a mobile phone']",2,Picking [something] up,book,1,58
1951,55197,lifting book with sunglasses on it,Lifting [something] with [something] on it,"['book', 'sunglasses']",2,Picking [something] up,book,1,61
2868,88309,lifting book with mp3 player on it,Lifting [something] with [something] on it,"['book', 'mp3 player']",2,Picking [something] up,book,1,56
5940,40966,lifting book with sticking tape on it,Lifting [something] with [something] on it,"['book', 'sticking tape']",2,Picking [something] up,book,1,39
10738,187759,taking book out of backpack,Taking [something] out of [something],"['book', 'backpack']",2,Picking [something] up,book,1,53
13672,131257,picking book up,Picking [something] up,['book'],1,Picking [something] up,book,1,36
7854,122888,lifting book with candy container on it,Lifting [something] with [something] on it,"['book', 'candy container']",2,Picking [something] up,book,1,39
2710,173969,lifting a book with a pen on it,Lifting [something] with [something] on it,"['a book', 'a pen']",2,Picking [something] up,book,1,50
14702,157804,lifting book with pen on it,Lifting [something] with [something] on it,"['book', 'pen']",2,Picking [something] up,book,1,45
8590,192739,taking key,Taking [one of many similar things on the table],['key'],1,Picking [something] up,key,1,36
13695,29483,moving key up,Moving [something] up,['key'],1,Picking [something] up,key,1,35
11339,47261,moving keys up,Moving [something] up,['keys'],1,Picking [something] up,key,1,50
4135,107875,taking key from chair,Taking [something] from [somewhere],"['key', 'chair']",2,Picking [something] up,key,1,38
11040,69861,lifting keys up completely without letting it drop down,Lifting [something] up completely without letting it drop down,['keys'],1,Picking [something] up,key,1,20
6026,4880,taking key out of wooden box,Taking [something] out of [something],"['key', 'wooden box']",2,Picking [something] up,key,1,50
129,102262,taking keys out of bookbag,Taking [something] out of [something],"['keys', 'bookbag']",2,Picking [something] up,key,1,57
7202,33373,moving keys up,Moving [something] up,['keys'],1,Picking [something] up,key,1,67
2520,80950,moving key up,Moving [something] up,['key'],1,Picking [something] up,key,1,46
8765,193521,taking key out of sand,Taking [something] out of [something],"['key', 'sand']",2,Picking [something] up,key,1,69
8743,87243,moving cup up,Moving [something] up,['cup'],1,Picking [something] up,cup,1,71
13616,216370,taking a cup,Taking [one of many similar things on the table],['a cup'],1,Picking [something] up,cup,1,63
12165,98632,taking cup from bucket,Taking [something] from [somewhere],"['cup', 'bucket']",2,Picking [something] up,cup,1,18
5134,158373,taking a cup out of a shelf,Taking [something] out of [something],"['a cup', 'a shelf']",2,Picking [something] up,cup,1,53
11776,10826,taking cup from towel hanger,Taking [something] from [somewhere],"['cup', 'towel hanger']",2,Picking [something] up,cup,1,42
6756,10793,lifting cup with bottle of cream on it,Lifting [something] with [something] on it,"['cup', 'bottle of cream']",2,Picking [something] up,cup,1,57
351,105723,lifting cup with toast butter on it,Lifting [something] with [something] on it,"['cup', 'toast butter']",2,Picking [something] up,cup,1,56
8129,3165,picking cup up,Picking [something] up,['cup'],1,Picking [something] up,cup,1,52
3395,162810,moving cup up,Moving [something] up,['cup'],1,Picking [something] up,cup,1,36
8913,3850,lifting a cup with a spoon on it,Lifting [something] with [something] on it,"['a cup', 'a spoon']",2,Picking [something] up,cup,1,44
14497,186098,moving glasses up,Moving [something] up,['glasses'],1,Picking [something] up,glasses,1,44
12182,21615,moving glasses up,Moving [something] up,['glasses'],1,Picking [something] up,glasses,1,62
11713,87255,moving glasses up,Moving [something] up,['glasses'],1,Picking [something] up,glasses,1,24
3419,186876,moving glasses up,Moving [something] up,['glasses'],1,Picking [something] up,glasses,1,31
11639,170055,taking glasses from desk,Taking [something] from [somewhere],"['glasses', 'desk']",2,Picking [something] up,glasses,1,36
4630,56107,moving glasses up,Moving [something] up,['glasses'],1,Picking [something] up,glasses,1,31
4086,213965,lifting glasses up completely without letting it drop down,Lifting [something] up completely without letting it drop down,['glasses'],1,Picking [something] up,glasses,1,27
14114,156153,picking glasses up,Picking [something] up,['glasses'],1,Picking [something] up,glasses,1,59
11896,53438,moving glasses up,Moving [something] up,['glasses'],1,Picking [something] up,glasses,1,42
4094,61387,moving glasses up,Moving [something] up,['glasses'],1,Picking [something] up,glasses,1,31
1651,21742,putting color pencils on a surface,Putting [something] on a surface,['color pencils'],1,Putting [something],pencil,1,29
13127,167767,putting a pencil next to a cord,Putting [something] next to [something],"['a pencil', 'a cord']",2,Putting [something],pencil,1,73
2817,159726,putting color pencils on a surface,Putting [something] on a surface,['color pencils'],1,Putting [something],pencil,1,27
13545,124854,putting a pencil on a flat surface without letting it roll,Putting [something] on a flat surface without letting it roll,['a pencil'],1,Putting [something],pencil,1,57
1469,146541,putting color pencils on a surface,Putting [something] on a surface,['color pencils'],1,Putting [something],pencil,1,47
2056,210252,putting color pencils on a surface,Putting [something] on a surface,['color pencils'],1,Putting [something],pencil,1,29
2781,18690,putting pencil next to cellphone,Putting [something] next to [something],"['pencil', 'cellphone']",2,Putting [something],pencil,1,32
7750,217135,putting color pencils on a surface,Putting [something] on a surface,['color pencils'],1,Putting [something],pencil,1,36
6094,74058,putting color pencils on a surface,Putting [something] on a surface,['color pencils'],1,Putting [something],pencil,1,42
1908,159579,putting color pencils on a surface,Putting [something] on a surface,['color pencils'],1,Putting [something],pencil,1,27
1898,50782,putting bottle onto knife,Putting [something] onto [something],"['bottle', 'knife']",2,Putting [something],bottle,1,54
11867,175502,putting bottle on a surface,Putting [something] on a surface,['bottle'],1,Putting [something],bottle,1,34
5449,67127,putting bottle,Putting [something similar to other things that are already on the table],['bottle'],1,Putting [something],bottle,1,49
10523,71541,putting bottle on a flat surface without letting it roll,Putting [something] on a flat surface without letting it roll,['bottle'],1,Putting [something],bottle,1,63
14117,172411,putting bottle on a surface,Putting [something] on a surface,['bottle'],1,Putting [something],bottle,1,60
1809,120690,"putting bottle, cutter and remote on the table","Putting [something], [something] and [something] on the table","['bottle', 'cutter', 'remote']",3,Putting [something],bottle,1,50
3368,4476,putting bottle on a surface,Putting [something] on a surface,['bottle'],1,Putting [something],bottle,1,34
10211,106348,putting bottles,Putting [something similar to other things that are already on the table],['bottles'],1,Putting [something],bottle,1,40
7764,133161,putting bottle next to leaf,Putting [something] next to [something],"['bottle', 'leaf']",2,Putting [something],bottle,1,62
2217,44810,putting bottle on a surface,Putting [something] on a surface,['bottle'],1,Putting [something],bottle,1,34
10819,111475,"putting pen that can't roll onto a slanted surface, so it stays where it is","Putting [something] that can't roll onto a slanted surface, so it stays where it is",['pen'],1,Putting [something],pen,1,55
12907,32685,putting a pen behind a book,Putting [something] behind [something],"['a pen', 'a book']",2,Putting [something],pen,1,33
8433,4312,putting pen behind tape measure,Putting [something] behind [something],"['pen', 'tape measure']",2,Putting [something],pen,1,47
1205,50326,putting pen on a flat surface without letting it roll,Putting [something] on a flat surface without letting it roll,['pen'],1,Putting [something],pen,1,40
10742,135234,putting pen on a surface,Putting [something] on a surface,['pen'],1,Putting [something],pen,1,41
7227,121196,putting pen on a surface,Putting [something] on a surface,['pen'],1,Putting [something],pen,1,36
12237,54398,putting pen next to iphone,Putting [something] next to [something],"['pen', 'iphone']",2,Putting [something],pen,1,32
11144,213075,putting a pen,Putting [something similar to other things that are already on the table],['a pen'],1,Putting [something],pen,1,72
2368,131721,"putting pen, glass and coin on the table","Putting [something], [something] and [something] on the table","['pen', 'glass', 'coin']",3,Putting [something],pen,1,59
6951,151647,putting pen on a surface,Putting [something] on a surface,['pen'],1,Putting [something],pen,1,41
9205,200446,"putting book, cable and cutter on the table","Putting [something], [something] and [something] on the table","['book', 'cable', 'cutter']",3,Putting [something],book,1,46
6242,220075,putting book on a surface,Putting [something] on a surface,['book'],1,Putting [something],book,1,41
12457,186273,putting a book on a surface,Putting [something] on a surface,['a book'],1,Putting [something],book,1,29
12485,14870,putting a book on a surface,Putting [something] on a surface,['a book'],1,Putting [something],book,1,33
12650,21229,putting book and mug on the table,Putting [something] and [something] on the table,"['book', 'mug']",2,Putting [something],book,1,49
12532,112143,putting a book next to money,Putting [something] next to [something],"['a book', 'money']",2,Putting [something],book,1,60
9614,190631,putting book next to portable speaker,Putting [something] next to [something],"['book', 'portable speaker']",2,Putting [something],book,1,46
343,86158,putting a book and pen on the table,Putting [something] and [something] on the table,"['a book', 'pen']",2,Putting [something],book,1,50
2154,129303,"putting book that can't roll onto a slanted surface, so it stays where it is","Putting [something] that can't roll onto a slanted surface, so it stays where it is",['book'],1,Putting [something],book,1,38
5592,81338,putting a book next to a spray bottle,Putting [something] next to [something],"['a book', 'a spray bottle']",2,Putting [something],book,1,39
14030,156201,"putting book, candle and pen on the table","Putting [something], [something] and [something] on the table","['book', 'candle', 'pen']",3,Putting [something],book,1,58
9746,109484,putting wallet next to clay jar,Putting [something] next to [something],"['wallet', 'clay jar']",2,Putting [something],wallet,1,53
6763,13755,putting a wallet next to mosquito bat,Putting [something] next to [something],"['a wallet', 'mosquito bat']",2,Putting [something],wallet,1,49
1888,178534,putting wallet behind doll,Putting [something] behind [something],"['wallet', 'doll']",2,Putting [something],wallet,1,38
7451,4911,"putting wallet, wrist watch and key on the table","Putting [something], [something] and [something] on the table","['wallet', 'wrist watch', 'key']",3,Putting [something],wallet,1,63
5225,160753,putting wallet on a surface,Putting [something] on a surface,['wallet'],1,Putting [something],wallet,1,46
3101,373,putting wallet on a surface,Putting [something] on a surface,['wallet'],1,Putting [something],wallet,1,46
8218,121168,"putting wallet that can't roll onto a slanted surface, so it stays where it is","Putting [something] that can't roll onto a slanted surface, so it stays where it is",['wallet'],1,Putting [something],wallet,1,59
2126,23845,putting wallet on a surface,Putting [something] on a surface,['wallet'],1,Putting [something],wallet,1,42
8800,2608,putting a wallet behind a purse,Putting [something] behind [something],"['a wallet', 'a purse']",2,Putting [something],wallet,1,72
10593,141547,putting wallet on a surface,Putting [something] on a surface,['wallet'],1,Putting [something],wallet,1,34
5435,171697,putting a wallet on a surface,Putting [something] on a surface,['a wallet'],1,Putting [something],wallet,1,31
13879,3752,putting paper onto paper,Putting [something] onto [something],"['paper', 'paper']",2,Putting [something],paper,1,70
12828,81227,putting paper,Putting [something similar to other things that are already on the table],['paper'],1,Putting [something],paper,1,20
9488,148573,putting papers behind woofer,Putting [something] behind [something],"['papers', 'woofer']",2,Putting [something],paper,1,53
1713,194431,putting papers,Putting [something similar to other things that are already on the table],['papers'],1,Putting [something],paper,1,30
8747,58510,putting paper onto envelope,Putting [something] onto [something],"['paper', 'envelope']",2,Putting [something],paper,1,39
9785,108318,putting paper and cell phone on the table,Putting [something] and [something] on the table,"['paper', 'cell phone']",2,Putting [something],paper,1,54
2158,129149,putting paper onto cable,Putting [something] onto [something],"['paper', 'cable']",2,Putting [something],paper,1,42
1763,17164,putting paper,Putting [something similar to other things that are already on the table],['paper'],1,Putting [something],paper,1,30
10459,211904,putting paper onto leaf,Putting [something] onto [something],"['paper', 'leaf']",2,Putting [something],paper,1,44
9471,137179,putting paper,Putting [something similar to other things that are already on the table],['paper'],1,Putting [something],paper,1,46
2032,199472,putting paper onto pencil,Putting [something] onto [something],"['paper', 'pencil']",2,Putting [something],paper,1,29
7747,107985,putting mouse onto box,Putting [something] onto [something],"['mouse', 'box']",2,Putting [something],mouse,1,35
8758,14368,putting mouse onto box,Putting [something] onto [something],"['mouse', 'box']",2,Putting [something],mouse,1,27
7748,78177,putting mouse onto brush,Putting [something] onto [something],"['mouse', 'brush']",2,Putting [something],mouse,1,30
6035,5030,putting mouse next to book,Putting [something] next to [something],"['mouse', 'book']",2,Putting [something],mouse,1,24
9968,102973,putting mouse on a surface,Putting [something] on a surface,['mouse'],1,Putting [something],mouse,1,61
3433,155179,putting mouse on a surface,Putting [something] on a surface,['mouse'],1,Putting [something],mouse,1,35
1707,94869,putting mouse on a surface,Putting [something] on a surface,['mouse'],1,Putting [something],mouse,1,61
12535,170645,putting mouse behind videogame,Putting [something] behind [something],"['mouse', 'videogame']",2,Putting [something],mouse,1,46
5709,195338,putting mouse onto plate,Putting [something] onto [something],"['mouse', 'plate']",2,Putting [something],mouse,1,44
4713,124028,putting mouse on a surface,Putting [something] on a surface,['mouse'],1,Putting [something],mouse,1,35
9322,112030,putting mouse on a surface,Putting [something] on a surface,['mouse'],1,Putting [something],mouse,1,35
10566,184558,throwing color pencils,Throwing [something],['color pencils'],1,Dropping [something],pencil,1,27
1139,213086,throwing color pencils,Throwing [something],['color pencils'],1,Dropping [something],pencil,1,49
13292,70680,throwing a pencil onto a surface,Throwing [something] onto a surface,['a pencil'],1,Dropping [something],pencil,1,33
3331,58470,throwing color pencils,Throwing [something],['color pencils'],1,Dropping [something],pencil,1,29
2150,101495,throwing color pencils,Throwing [something],['color pencils'],1,Dropping [something],pencil,1,39
12878,184624,throwing color pencils,Throwing [something],['color pencils'],1,Dropping [something],pencil,1,28
344,152457,throwing color pencils,Throwing [something],['color pencils'],1,Dropping [something],pencil,1,30
1693,75880,throwing color pencils,Throwing [something],['color pencils'],1,Dropping [something],pencil,1,28
10848,84429,throwing color pencils,Throwing [something],['color pencils'],1,Dropping [something],pencil,1,39
8122,220519,throwing color pencils,Throwing [something],['color pencils'],1,Dropping [something],pencil,1,29
9287,97558,throwing color pencils,Throwing [something],['color pencils'],1,Dropping [something],pencil,1,28
10837,29227,throwing water bottle,Throwing [something],['water bottle'],1,Dropping [something],bottle,1,61
4852,16517,plastic bottle falling like a rock,[Something] falling like a rock,['plastic bottle'],1,Dropping [something],bottle,1,32
14234,106124,throwing bottle in the air and letting it fall,Throwing [something] in the air and letting it fall,['bottle'],1,Dropping [something],bottle,1,30
11155,35288,throwing bottle,Throwing [something],['bottle'],1,Dropping [something],bottle,1,26
14782,120938,throwing bottle onto a surface,Throwing [something] onto a surface,['bottle'],1,Dropping [something],bottle,1,34
10917,194755,throwing a bottle,Throwing [something],['a bottle'],1,Dropping [something],bottle,1,35
2249,87160,throwing bottle,Throwing [something],['bottle'],1,Dropping [something],bottle,1,26
1527,205482,water bottle falling like a rock,[Something] falling like a rock,['water bottle'],1,Dropping [something],bottle,1,37
8571,171969,throwing bottle,Throwing [something],['bottle'],1,Dropping [something],bottle,1,26
1974,218063,bottle falling like a rock,[Something] falling like a rock,['bottle'],1,Dropping [something],bottle,1,34
2194,20524,throwing plastic bottle onto a surface,Throwing [something] onto a surface,['plastic bottle'],1,Dropping [something],bottle,1,35
12924,109873,pen falling like a rock,[Something] falling like a rock,['pen'],1,Dropping [something],pen,1,15
2300,167258,pen falling like a rock,[Something] falling like a rock,['pen'],1,Dropping [something],pen,1,50
14373,172583,throwing pen in the air and letting it fall,Throwing [something] in the air and letting it fall,['pen'],1,Dropping [something],pen,1,44
12963,143893,a pen falling like a rock,[Something] falling like a rock,['a pen'],1,Dropping [something],pen,1,15
3069,123825,throwing pen in the air and letting it fall,Throwing [something] in the air and letting it fall,['pen'],1,Dropping [something],pen,1,21
14466,47193,throwing pen,Throwing [something],['pen'],1,Dropping [something],pen,1,42
689,93127,throwing a pen onto a surface,Throwing [something] onto a surface,['a pen'],1,Dropping [something],pen,1,47
2558,171256,throwing pen,Throwing [something],['pen'],1,Dropping [something],pen,1,49
10238,150408,pen falling like a rock,[Something] falling like a rock,['pen'],1,Dropping [something],pen,1,37
4173,167950,throwing pen in the air and letting it fall,Throwing [something] in the air and letting it fall,['pen'],1,Dropping [something],pen,1,36
10472,63386,throwing pen onto a surface,Throwing [something] onto a surface,['pen'],1,Dropping [something],pen,1,29
14168,116497,throwing a book,Throwing [something],['a book'],1,Dropping [something],book,1,38
1863,67593,throwing book,Throwing [something],['book'],1,Dropping [something],book,1,37
4636,80198,throwing book in the air and letting it fall,Throwing [something] in the air and letting it fall,['book'],1,Dropping [something],book,1,42
3619,105932,book falling like a rock,[Something] falling like a rock,['book'],1,Dropping [something],book,1,22
13376,25805,throwing book onto a surface,Throwing [something] onto a surface,['book'],1,Dropping [something],book,1,39
12420,153570,throwing book in the air and letting it fall,Throwing [something] in the air and letting it fall,['book'],1,Dropping [something],book,1,25
130,126620,a book falling like a rock,[Something] falling like a rock,['a book'],1,Dropping [something],book,1,38
8929,204246,throwing book,Throwing [something],['book'],1,Dropping [something],book,1,57
3836,131044,throwing book,Throwing [something],['book'],1,Dropping [something],book,1,29
6661,127564,a book falling like a rock,[Something] falling like a rock,['a book'],1,Dropping [something],book,1,52
3628,169496,throwing book,Throwing [something],['book'],1,Dropping [something],book,1,38
13099,197612,marker falling like a rock,[Something] falling like a rock,['marker'],1,Dropping [something],marker,1,39
12418,42032,marker falling like a rock,[Something] falling like a rock,['marker'],1,Dropping [something],marker,1,34
8478,211038,throwing marker onto a surface,Throwing [something] onto a surface,['marker'],1,Dropping [something],marker,1,36
779,103528,throwing marker onto a surface,Throwing [something] onto a surface,['marker'],1,Dropping [something],marker,1,57
7888,204409,throwing marker onto a surface,Throwing [something] onto a surface,['marker'],1,Dropping [something],marker,1,17
8524,175931,throwing marker,Throwing [something],['marker'],1,Dropping [something],marker,1,26
1473,213867,marker falling like a rock,[Something] falling like a rock,['marker'],1,Dropping [something],marker,1,14
1324,145123,throwing marker,Throwing [something],['marker'],1,Dropping [something],marker,1,30
9699,194711,throwing marker,Throwing [something],['marker'],1,Dropping [something],marker,1,39
8462,82336,throwing marker onto a surface,Throwing [something] onto a surface,['marker'],1,Dropping [something],marker,1,43
1446,163136,throwing marker onto a surface,Throwing [something] onto a surface,['marker'],1,Dropping [something],marker,1,36
10227,160169,throwing adapter,Throwing [something],['adapter'],1,Dropping [something],charger,1,32
9389,217947,throwing adapter,Throwing [something],['adapter'],1,Dropping [something],charger,1,28
9938,70070,adapter falling like a rock,[Something] falling like a rock,['adapter'],1,Dropping [something],charger,1,33
983,142552,throwing charger,Throwing [something],['charger'],1,Dropping [something],charger,1,45
