,id,label,template,placeholders,num_objects,verb_class_name,noun_class_name,start_frame,stop_frame
959,61890,moving pencil up,Moving [something] up,['pencil'],1,Picking [something] up,pencil,1,37
6745,130720,lifting pencil up completely without letting it drop down,Lifting [something] up completely without letting it drop down,['pencil'],1,Picking [something] up,pencil,1,28
5286,30872,lifting pencil up completely without letting it drop down,Lifting [something] up completely without letting it drop down,['pencil'],1,Picking [something] up,pencil,1,26
3540,19213,moving color pencils up,Moving [something] up,['color pencils'],1,Picking [something] up,pencil,1,30
2920,103465,moving pencil up,Moving [something] up,['pencil'],1,Picking [something] up,pencil,1,26
4951,109234,moving color pencils up,Moving [something] up,['color pencils'],1,Picking [something] up,pencil,1,30
7059,32572,moving color pencils up,Moving [something] up,['color pencils'],1,Picking [something] up,pencil,1,23
3644,141067,moving color pencils up,Moving [something] up,['color pencils'],1,Picking [something] up,pencil,1,27
7999,215398,lifting pencil up completely without letting it drop down,Lifting [something] up completely without letting it drop down,['pencil'],1,Picking [something] up,pencil,1,37
13866,91685,picking pencil up,Picking [something] up,['pencil'],1,Picking [something] up,pencil,1,37
8340,193500,picking bottle up,Picking [something] up,['bottle'],1,Picking [something] up,bottle,1,45
3400,132577,taking bottle,Taking [one of many similar things on the table],['bottle'],1,Picking [something] up,bottle,1,16
7579,143310,lifting water bottle up completely without letting it drop down,Lifting [something] up completely without letting it drop down,['water bottle'],1,Picking [something] up,bottle,1,56
14730,35530,moving bottle up,Moving [something] up,['bottle'],1,Picking [something] up,bottle,1,32
2861,144508,moving bottle up,Moving [something] up,['bottle'],1,Picking [something] up,bottle,1,38
5395,96621,taking bottle from ground,Taking [something] from [somewhere],"['bottle', 'ground']",2,Picking [something] up,bottle,1,28
4389,150119,taking bottle,Taking [one of many similar things on the table],['bottle'],1,Picking [something] up,bottle,1,50
11299,135632,taking bottles,Taking [one of many similar things on the table],['bottles'],1,Picking [something] up,bottle,1,43
10419,45607,taking bottles,Taking [one of many similar things on the table],['bottles'],1,Picking [something] up,bottle,1,54
4147,44734,taking bottle from rack,Taking [something] from [somewhere],"['bottle', 'rack']",2,Picking [something] up,bottle,1,35
10938,203343,taking a pen from a cubbie,Taking [something] from [somewhere],"['a pen', 'a cubbie']",2,Picking [something] up,pen,1,65
8021,212564,picking pen up,Picking [something] up,['pen'],1,Picking [something] up,pen,1,25
12297,69424,taking pen from table,Taking [something] from [somewhere],"['pen', 'table']",2,Picking [something] up,pen,1,28
8182,90385,taking pens,Taking [one of many similar things on the table],['pens'],1,Picking [something] up,pen,1,37
10264,186361,taking a pen out of a box,Taking [something] out of [something],"['a pen', 'a box']",2,Picking [something] up,pen,1,40
13337,186132,picking a pen up,Picking [something] up,['a pen'],1,Picking [something] up,pen,1,47
6278,54852,taking pen,Taking [one of many similar things on the table],['pen'],1,Picking [something] up,pen,1,40
9012,111443,taking a pen,Taking [one of many similar things on the table],['a pen'],1,Picking [something] up,pen,1,58
5295,27712,taking pens,Taking [one of many similar things on the table],['pens'],1,Picking [something] up,pen,1,35
12984,45073,taking pens,Taking [one of many similar things on the table],['pens'],1,Picking [something] up,pen,1,37
14345,218735,taking a book,Taking [one of many similar things on the table],['a book'],1,Picking [something] up,book,1,43
3558,59540,moving book up,Moving [something] up,['book'],1,Picking [something] up,book,1,34
7173,85796,moving book up,Moving [something] up,['book'],1,Picking [something] up,book,1,31
6186,169061,lifting book with sock on it,Lifting [something] with [something] on it,"['book', 'sock']",2,Picking [something] up,book,1,62
3268,77199,taking a book from a shelf,Taking [something] from [somewhere],"['a book', 'a shelf']",2,Picking [something] up,book,1,46
14509,114296,taking a book,Taking [one of many similar things on the table],['a book'],1,Picking [something] up,book,1,58
11397,11100,moving a book up,Moving [something] up,['a book'],1,Picking [something] up,book,1,45
14507,143248,lifting a book with a bottle of perfume on it,Lifting [something] with [something] on it,"['a book', 'a bottle of perfume']",2,Picking [something] up,book,1,50
562,149873,moving book up,Moving [something] up,['book'],1,Picking [something] up,book,1,30
2203,202905,lifting a book with a bottle on it,Lifting [something] with [something] on it,"['a book', 'a bottle']",2,Picking [something] up,book,1,63
14677,87865,taking the phone out of the box,Taking [something] out of [something],"['the phone', 'the box']",2,Picking [something] up,phone,1,53
8814,28158,moving phone up,Moving [something] up,['phone'],1,Picking [something] up,phone,1,62
5655,125429,taking a phone from a counter,Taking [something] from [somewhere],"['a phone', 'a counter']",2,Picking [something] up,phone,1,54
7016,1393,lifting mobile up completely without letting it drop down,Lifting [something] up completely without letting it drop down,['mobile'],1,Picking [something] up,phone,1,46
8172,63246,taking mobile,Taking [one of many similar things on the table],['mobile'],1,Picking [something] up,phone,1,27
11240,168828,moving a phone up,Moving [something] up,['a phone'],1,Picking [something] up,phone,1,46
9603,6456,lifting phone with can on it,Lifting [something] with [something] on it,"['phone', 'can']",2,Picking [something] up,phone,1,59
5650,163481,moving a phone up,Moving [something] up,['a phone'],1,Picking [something] up,phone,1,59
4939,141699,moving phone up,Moving [something] up,['phone'],1,Picking [something] up,phone,1,30
5816,57300,taking mobile,Taking [one of many similar things on the table],['mobile'],1,Picking [something] up,phone,1,42
12031,82380,picking mouse up,Picking [something] up,['mouse'],1,Picking [something] up,mouse,1,46
12135,173366,moving mouse up,Moving [something] up,['mouse'],1,Picking [something] up,mouse,1,31
1008,164714,picking a mouse up,Picking [something] up,['a mouse'],1,Picking [something] up,mouse,1,37
13186,37520,moving mouse up,Moving [something] up,['mouse'],1,Picking [something] up,mouse,1,59
13368,104739,picking mouse up,Picking [something] up,['mouse'],1,Picking [something] up,mouse,1,34
8639,98878,taking mouse from bed,Taking [something] from [somewhere],"['mouse', 'bed']",2,Picking [something] up,mouse,1,49
10413,193000,moving mouse up,Moving [something] up,['mouse'],1,Picking [something] up,mouse,1,31
10778,162263,lifting mouse up completely without letting it drop down,Lifting [something] up completely without letting it drop down,['mouse'],1,Picking [something] up,mouse,1,58
12120,168548,taking mouse out of shelf,Taking [something] out of [something],"['mouse', 'shelf']",2,Picking [something] up,mouse,1,28
11807,201343,taking mouse,Taking [one of many similar things on the table],['mouse'],1,Picking [something] up,mouse,1,16
2410,108934,taking brush out of case,Taking [something] out of [something],"['brush', 'case']",2,Picking [something] up,brush,1,30
12058,74145,moving brush up,Moving [something] up,['brush'],1,Picking [something] up,brush,1,39
9075,165267,moving brush up,Moving [something] up,['brush'],1,Picking [something] up,brush,1,38
10002,55698,lifting brush up completely without letting it drop down,Lifting [something] up completely without letting it drop down,['brush'],1,Picking [something] up,brush,1,38
7976,158471,moving brush up,Moving [something] up,['brush'],1,Picking [something] up,brush,1,33
11609,163041,moving a brush up,Moving [something] up,['a brush'],1,Picking [something] up,brush,1,50
10744,165941,moving brush up,Moving [something] up,['brush'],1,Picking [something] up,brush,1,55
14687,21313,taking brushes,Taking [one of many similar things on the table],['brushes'],1,Picking [something] up,brush,1,58
13940,84412,lifting brush up completely without letting it drop down,Lifting [something] up completely without letting it drop down,['brush'],1,Picking [something] up,brush,1,37
8919,142420,moving brush up,Moving [something] up,['brush'],1,Picking [something] up,brush,1,62
12649,178411,putting color pencils on a surface,Putting [something] on a surface,['color pencils'],1,Putting [something],pencil,1,27
14716,173702,putting pencil,Putting [something similar to other things that are already on the table],['pencil'],1,Putting [something],pencil,1,29
12327,57597,putting color pencils on a surface,Putting [something] on a surface,['color pencils'],1,Putting [something],pencil,1,27
3850,199133,putting color pencil on a surface,Putting [something] on a surface,['color pencil'],1,Putting [something],pencil,1,32
12260,41552,putting color pencils on a surface,Putting [something] on a surface,['color pencils'],1,Putting [something],pencil,1,38
11417,12422,putting pencil onto pc harddisk,Putting [something] onto [something],"['pencil', 'pc harddisk']",2,Putting [something],pencil,1,42
4683,163996,putting color pencils on a surface,Putting [something] on a surface,['color pencils'],1,Putting [something],pencil,1,27
390,21627,putting color pencils on a surface,Putting [something] on a surface,['color pencils'],1,Putting [something],pencil,1,47
5594,131674,putting color pencils on a surface,Putting [something] on a surface,['color pencils'],1,Putting [something],pencil,1,38
9542,17701,putting color pencils on a surface,Putting [something] on a surface,['color pencils'],1,Putting [something],pencil,1,42
13232,62403,"putting a plastic bottle that can't roll onto a slanted surface, so it stays where it is","Putting [something] that can't roll onto a slanted surface, so it stays where it is",['a plastic bottle'],1,Putting [something],bottle,1,42
2217,44810,putting bottle on a surface,Putting [something] on a surface,['bottle'],1,Putting [something],bottle,1,34
11512,66127,putting a plastic bottle,Putting [something similar to other things that are already on the table],['a plastic bottle'],1,Putting [something],bottle,1,40
3456,82450,putting bottle and vegetable on the table,Putting [something] and [something] on the table,"['bottle', 'vegetable']",2,Putting [something],bottle,1,37
5152,79119,"putting a bottle, a lunch box and a spoon on the table","Putting [something], [something] and [something] on the table","['a bottle', 'a lunch box', 'a spoon']",3,Putting [something],bottle,1,60
10408,183943,"putting bottle, spidol and comb on the table","Putting [something], [something] and [something] on the table","['bottle', 'spidol', 'comb']",3,Putting [something],bottle,1,46
8223,119797,putting bottle on a flat surface without letting it roll,Putting [something] on a flat surface without letting it roll,['bottle'],1,Putting [something],bottle,1,70
10529,51584,putting bottle behind carton,Putting [something] behind [something],"['bottle', 'carton']",2,Putting [something],bottle,1,61
1070,216819,putting bottle on a flat surface without letting it roll,Putting [something] on a flat surface without letting it roll,['bottle'],1,Putting [something],bottle,1,52
5922,2241,putting a bottle on a surface,Putting [something] on a surface,['a bottle'],1,Putting [something],bottle,1,59
9707,193335,putting pen onto shoe,Putting [something] onto [something],"['pen', 'shoe']",2,Putting [something],pen,1,47
545,175096,"putting pens, padlock and rexona on the table","Putting [something], [something] and [something] on the table","['pens', 'padlock', 'rexona']",3,Putting [something],pen,1,55
4150,133666,putting pen next to mug,Putting [something] next to [something],"['pen', 'mug']",2,Putting [something],pen,1,48
1059,81562,putting pen on a surface,Putting [something] on a surface,['pen'],1,Putting [something],pen,1,33
13814,51445,putting a pen next to sunglasses,Putting [something] next to [something],"['a pen', 'sunglasses']",2,Putting [something],pen,1,46
12942,161762,putting pens,Putting [something similar to other things that are already on the table],['pens'],1,Putting [something],pen,1,34
12198,210192,putting pen,Putting [something similar to other things that are already on the table],['pen'],1,Putting [something],pen,1,22
12973,66976,putting pen on a surface,Putting [something] on a surface,['pen'],1,Putting [something],pen,1,33
13398,67856,putting a pen next to a pen,Putting [something] next to [something],"['a pen', 'a pen']",2,Putting [something],pen,1,56
11032,176818,putting pens,Putting [something similar to other things that are already on the table],['pens'],1,Putting [something],pen,1,43
13638,211145,putting the book on a surface,Putting [something] on a surface,['the book'],1,Putting [something],book,1,57
2763,98155,putting book on a surface,Putting [something] on a surface,['book'],1,Putting [something],book,1,53
2539,29167,putting book,Putting [something similar to other things that are already on the table],['book'],1,Putting [something],book,1,31
7176,201782,putting book on a surface,Putting [something] on a surface,['book'],1,Putting [something],book,1,50
12254,123264,"putting book that can't roll onto a slanted surface, so it stays where it is","Putting [something] that can't roll onto a slanted surface, so it stays where it is",['book'],1,Putting [something],book,1,45
13838,17011,putting book on a surface,Putting [something] on a surface,['book'],1,Putting [something],book,1,35
7541,216027,putting book on a flat surface without letting it roll,Putting [something] on a flat surface without letting it roll,['book'],1,Putting [something],book,1,26
271,106655,"putting a book, a mobile phone and a pen on the table","Putting [something], [something] and [something] on the table","['a book', 'a mobile phone', 'a pen']",3,Putting [something],book,1,56
2321,117775,"putting a book, a pen and a battery on the table","Putting [something], [something] and [something] on the table","['a book', 'a pen', 'a battery']",3,Putting [something],book,1,64
13468,99788,putting book next to box,Putting [something] next to [something],"['book', 'box']",2,Putting [something],book,1,56
4214,214581,putting book,Putting [something similar to other things that are already on the table],['book'],1,Putting [something],book,1,56
6612,116111,putting keys behind bag,Putting [something] behind [something],"['keys', 'bag']",2,Putting [something],key,1,62
5842,164060,"putting key, coolers and battery on the table","Putting [something], [something] and [something] on the table","['key', 'coolers', 'battery']",3,Putting [something],key,1,61
4517,126466,putting key on a surface,Putting [something] on a surface,['key'],1,Putting [something],key,1,32
10720,104641,putting keys and lemon on the table,Putting [something] and [something] on the table,"['keys', 'lemon']",2,Putting [something],key,1,58
918,204627,putting keys next to keys,Putting [something] next to [something],"['keys', 'keys']",2,Putting [something],key,1,31
8900,38719,putting the keys onto a picture,Putting [something] onto [something],"['the keys', 'a picture']",2,Putting [something],key,1,18
2798,189008,putting key behind bottle,Putting [something] behind [something],"['key', 'bottle']",2,Putting [something],key,1,38
1952,36999,putting keys and desk calculator on the table,Putting [something] and [something] on the table,"['keys', 'desk calculator']",2,Putting [something],key,1,48
5894,126374,putting key on a surface,Putting [something] on a surface,['key'],1,Putting [something],key,1,32
7875,130395,putting key on a surface,Putting [something] on a surface,['key'],1,Putting [something],key,1,32
8655,36524,putting a key on a surface,Putting [something] on a surface,['a key'],1,Putting [something],key,1,60
11581,176718,putting knife onto creditcard,Putting [something] onto [something],"['knife', 'creditcard']",2,Putting [something],knife,1,41
5729,20516,putting the knife onto plastic container,Putting [something] onto [something],"['the knife', 'plastic container']",2,Putting [something],knife,1,49
6552,127430,putting a knife,Putting [something similar to other things that are already on the table],['a knife'],1,Putting [something],knife,1,49
9969,52491,putting knife on a surface,Putting [something] on a surface,['knife'],1,Putting [something],knife,1,68
7989,59977,putting knife behind stamp box,Putting [something] behind [something],"['knife', 'stamp box']",2,Putting [something],knife,1,24
13199,114212,putting knife,Putting [something similar to other things that are already on the table],['knife'],1,Putting [something],knife,1,40
12630,74429,putting a knife next to a dish,Putting [something] next to [something],"['a knife', 'a dish']",2,Putting [something],knife,1,35
6658,45760,"putting knife that can't roll onto a slanted surface, so it stays where it is","Putting [something] that can't roll onto a slanted surface, so it stays where it is",['knife'],1,Putting [something],knife,1,48
4679,95043,putting knife onto box,Putting [something] onto [something],"['knife', 'box']",2,Putting [something],knife,1,46
5153,84813,putting a knife,Putting [something similar to other things that are already on the table],['a knife'],1,Putting [something],knife,1,31
7508,1645,putting knife onto book,Putting [something] onto [something],"['knife', 'book']",2,Putting [something],knife,1,44
4978,114905,"putting watch, watch and watch on the table","Putting [something], [something] and [something] on the table","['watch', 'watch', 'watch']",3,Putting [something],watch,1,59
11473,85089,putting a watch behind a box,Putting [something] behind [something],"['a watch', 'a box']",2,Putting [something],watch,1,36
1921,20784,putting a watch,Putting [something similar to other things that are already on the table],['a watch'],1,Putting [something],watch,1,61
13656,1108,putting watch next to tablet,Putting [something] next to [something],"['watch', 'tablet']",2,Putting [something],watch,1,41
11323,108575,putting a watch on a surface,Putting [something] on a surface,['a watch'],1,Putting [something],watch,1,34
5661,119465,putting watch onto wallet,Putting [something] onto [something],"['watch', 'wallet']",2,Putting [something],watch,1,65
7964,85284,putting watch on a surface,Putting [something] on a surface,['watch'],1,Putting [something],watch,1,50
6741,101498,putting a watch on a surface,Putting [something] on a surface,['a watch'],1,Putting [something],watch,1,34
6873,193703,"putting watch, pen and pencil on the table","Putting [something], [something] and [something] on the table","['watch', 'pen', 'pencil']",3,Putting [something],watch,1,62
12015,76792,putting watch onto purse,Putting [something] onto [something],"['watch', 'purse']",2,Putting [something],watch,1,48
9464,106644,putting watch,Putting [something similar to other things that are already on the table],['watch'],1,Putting [something],watch,1,59
5848,191611,throwing pencil in the air and letting it fall,Throwing [something] in the air and letting it fall,['pencil'],1,Dropping [something],pencil,1,48
6748,180601,throwing color pencils,Throwing [something],['color pencils'],1,Dropping [something],pencil,1,32
10218,166682,throwing color pencils,Throwing [something],['color pencils'],1,Dropping [something],pencil,1,28
2989,10067,throwing pencil in the air and letting it fall,Throwing [something] in the air and letting it fall,['pencil'],1,Dropping [something],pencil,1,20
2903,64528,throwing color pencils,Throwing [something],['color pencils'],1,Dropping [something],pencil,1,30
4634,42057,throwing color pencils,Throwing [something],['color pencils'],1,Dropping [something],pencil,1,30
6835,15223,throwing color pencils,Throwing [something],['color pencils'],1,Dropping [something],pencil,1,35
1040,203654,throwing color pencils,Throwing [something],['color pencils'],1,Dropping [something],pencil,1,29
10351,198229,throwing color pencils,Throwing [something],['color pencils'],1,Dropping [something],pencil,1,30
4497,24567,throwing pencil in the air and letting it fall,Throwing [something] in the air and letting it fall,['pencil'],1,Dropping [something],pencil,1,36
166,198926,throwing color pencils,Throwing [something],['color pencils'],1,Dropping [something],pencil,1,28
3927,79669,throwing bottle,Throwing [something],['bottle'],1,Dropping [something],bottle,1,34
8603,194884,throwing bottle in the air and letting it fall,Throwing [something] in the air and letting it fall,['bottle'],1,Dropping [something],bottle,1,41
1448,150084,throwing bottle,Throwing [something],['bottle'],1,Dropping [something],bottle,1,66
2906,179511,throwing plastic bottle onto a surface,Throwing [something] onto a surface,['plastic bottle'],1,Dropping [something],bottle,1,42
14237,194017,bottle falling like a rock,[Something] falling like a rock,['bottle'],1,Dropping [something],bottle,1,27
8571,171969,throwing bottle,Throwing [something],['bottle'],1,Dropping [something],bottle,1,26
10305,129969,water bottle falling like a rock,[Something] falling like a rock,['water bottle'],1,Dropping [something],bottle,1,36
894,147405,bottle falling like a rock,[Something] falling like a rock,['bottle'],1,Dropping [something],bottle,1,42
11289,146960,throwing bottle,Throwing [something],['bottle'],1,Dropping [something],bottle,1,49
10963,202776,a bottle falling like a rock,[Something] falling like a rock,['a bottle'],1,Dropping [something],bottle,1,54
661,59630,bottle falling like a rock,[Something] falling like a rock,['bottle'],1,Dropping [something],bottle,1,52
13902,62472,pen falling like a rock,[Something] falling like a rock,['pen'],1,Dropping [something],pen,1,30
12896,14515,throwing pen in the air and letting it fall,Throwing [something] in the air and letting it fall,['pen'],1,Dropping [something],pen,1,40
13338,24711,a pen falling like a rock,[Something] falling like a rock,['a pen'],1,Dropping [something],pen,1,43
14590,205379,a pen falling like a rock,[Something] falling like a rock,['a pen'],1,Dropping [something],pen,1,26
4813,200160,throwing a pen onto a surface,Throwing [something] onto a surface,['a pen'],1,Dropping [something],pen,1,35
3069,123825,throwing pen in the air and letting it fall,Throwing [something] in the air and letting it fall,['pen'],1,Dropping [something],pen,1,21
12619,188944,a pen falling like a rock,[Something] falling like a rock,['a pen'],1,Dropping [something],pen,1,65
1562,159989,pen falling like a rock,[Something] falling like a rock,['pen'],1,Dropping [something],pen,1,35
14763,45752,throwing pen,Throwing [something],['pen'],1,Dropping [something],pen,1,31
5468,176610,throwing pen in the air and letting it fall,Throwing [something] in the air and letting it fall,['pen'],1,Dropping [something],pen,1,29
542,104446,throwing a pen in the air and letting it fall,Throwing [something] in the air and letting it fall,['a pen'],1,Dropping [something],pen,1,51
6030,135054,a book falling like a rock,[Something] falling like a rock,['a book'],1,Dropping [something],book,1,53
2891,18126,throwing book onto a surface,Throwing [something] onto a surface,['book'],1,Dropping [something],book,1,48
6580,97887,book falling like a rock,[Something] falling like a rock,['book'],1,Dropping [something],book,1,40
14021,207188,book falling like a rock,[Something] falling like a rock,['book'],1,Dropping [something],book,1,26
2809,90820,throwing book,Throwing [something],['book'],1,Dropping [something],book,1,32
10368,109698,throwing book,Throwing [something],['book'],1,Dropping [something],book,1,35
8924,87087,throwing book onto a surface,Throwing [something] onto a surface,['book'],1,Dropping [something],book,1,27
1225,174866,a book falling like a rock,[Something] falling like a rock,['a book'],1,Dropping [something],book,1,50
5182,191537,book falling like a rock,[Something] falling like a rock,['book'],1,Dropping [something],book,1,27
3984,16454,book falling like a rock,[Something] falling like a rock,['book'],1,Dropping [something],book,1,24
14168,116497,throwing a book,Throwing [something],['a book'],1,Dropping [something],book,1,38
13936,164973,throwing remote in the air and letting it fall,Throwing [something] in the air and letting it fall,['remote'],1,Dropping [something],remote,1,27
5991,98048,remote falling like a rock,[Something] falling like a rock,['remote'],1,Dropping [something],remote,1,22
12678,214304,throwing a remote onto a surface,Throwing [something] onto a surface,['a remote'],1,Dropping [something],remote,1,39
4595,67852,a remote falling like a rock,[Something] falling like a rock,['a remote'],1,Dropping [something],remote,1,48
5953,176322,remote falling like a rock,[Something] falling like a rock,['remote'],1,Dropping [something],remote,1,43
8763,129449,throwing remote onto a surface,Throwing [something] onto a surface,['remote'],1,Dropping [something],remote,1,31
425,177592,throwing remote,Throwing [something],['remote'],1,Dropping [something],remote,1,31
9710,72234,throwing a remote control onto a surface,Throwing [something] onto a surface,['a remote control'],1,Dropping [something],remote,1,24
11714,193332,throwing remote,Throwing [something],['remote'],1,Dropping [something],remote,1,25
6517,202025,throwing remote,Throwing [something],['remote'],1,Dropping [something],remote,1,26
13630,139211,remote control falling like a rock,[Something] falling like a rock,['remote control'],1,Dropping [something],remote,1,36
13974,28005,a wallet falling like a rock,[Something] falling like a rock,['a wallet'],1,Dropping [something],wallet,1,46
7865,208073,wallet falling like a rock,[Something] falling like a rock,['wallet'],1,Dropping [something],wallet,1,48
