,id,label,template,placeholders,num_objects,verb_class_name,noun_class_name,start_frame,stop_frame
10938,203343,taking a pen from a cubbie,Taking [something] from [somewhere],"['a pen', 'a cubbie']",2,Picking [something] up,pen,1,65
8021,212564,picking pen up,Picking [something] up,['pen'],1,Picking [something] up,pen,1,25
12297,69424,taking pen from table,Taking [something] from [somewhere],"['pen', 'table']",2,Picking [something] up,pen,1,28
8182,90385,taking pens,Taking [one of many similar things on the table],['pens'],1,Picking [something] up,pen,1,37
10264,186361,taking a pen out of a box,Taking [something] out of [something],"['a pen', 'a box']",2,Picking [something] up,pen,1,40
13337,186132,picking a pen up,Picking [something] up,['a pen'],1,Picking [something] up,pen,1,47
6278,54852,taking pen,Taking [one of many similar things on the table],['pen'],1,Picking [something] up,pen,1,40
9012,111443,taking a pen,Taking [one of many similar things on the table],['a pen'],1,Picking [something] up,pen,1,58
5295,27712,taking pens,Taking [one of many similar things on the table],['pens'],1,Picking [something] up,pen,1,35
12984,45073,taking pens,Taking [one of many similar things on the table],['pens'],1,Picking [something] up,pen,1,37
9999,215916,lifting pen up completely without letting it drop down,Lifting [something] up completely without letting it drop down,['pen'],1,Picking [something] up,pen,1,35
13930,132553,taking pen out of jar,Taking [something] out of [something],"['pen', 'jar']",2,Picking [something] up,pen,1,36
11027,57042,lifting pen up completely without letting it drop down,Lifting [something] up completely without letting it drop down,['pen'],1,Picking [something] up,pen,1,51
9947,26141,lifting pen up completely without letting it drop down,Lifting [something] up completely without letting it drop down,['pen'],1,Picking [something] up,pen,1,28
3319,137594,taking pens,Taking [one of many similar things on the table],['pens'],1,Picking [something] up,pen,1,34
8271,217907,taking pen out of pen stand,Taking [something] out of [something],"['pen', 'pen stand']",2,Picking [something] up,pen,1,38
5394,185910,taking pens,Taking [one of many similar things on the table],['pens'],1,Picking [something] up,pen,1,33
4149,103049,taking pens,Taking [one of many similar things on the table],['pens'],1,Picking [something] up,pen,1,43
1778,123045,taking keys from stool,Taking [something] from [somewhere],"['keys', 'stool']",2,Picking [something] up,key,1,67
10107,55780,picking key up,Picking [something] up,['key'],1,Picking [something] up,key,1,60
7680,114825,moving key up,Moving [something] up,['key'],1,Picking [something] up,key,1,19
1971,19109,lifting key up completely without letting it drop down,Lifting [something] up completely without letting it drop down,['key'],1,Picking [something] up,key,1,48
13306,85972,taking keys out of bowl,Taking [something] out of [something],"['keys', 'bowl']",2,Picking [something] up,key,1,58
5707,182309,moving keys up,Moving [something] up,['keys'],1,Picking [something] up,key,1,56
14293,123776,taking keys out of bag,Taking [something] out of [something],"['keys', 'bag']",2,Picking [something] up,key,1,67
4534,130912,taking keys from lock,Taking [something] from [somewhere],"['keys', 'lock']",2,Picking [something] up,key,1,52
2686,63419,taking key out of cup,Taking [something] out of [something],"['key', 'cup']",2,Picking [something] up,key,1,41
11791,206554,moving key up,Moving [something] up,['key'],1,Picking [something] up,key,1,29
9732,40635,taking keys out of jar,Taking [something] out of [something],"['keys', 'jar']",2,Picking [something] up,key,1,41
642,75871,moving key up,Moving [something] up,['key'],1,Picking [something] up,key,1,36
10594,75162,taking key,Taking [one of many similar things on the table],['key'],1,Picking [something] up,key,1,53
5167,30267,moving key up,Moving [something] up,['key'],1,Picking [something] up,key,1,29
8080,191472,taking key from door,Taking [something] from [somewhere],"['key', 'door']",2,Picking [something] up,key,1,54
4135,107875,taking key from chair,Taking [something] from [somewhere],"['key', 'chair']",2,Picking [something] up,key,1,38
9621,68983,moving key up,Moving [something] up,['key'],1,Picking [something] up,key,1,42
7006,104110,taking key,Taking [one of many similar things on the table],['key'],1,Picking [something] up,key,1,33
2283,139850,taking cup from window,Taking [something] from [somewhere],"['cup', 'window']",2,Picking [something] up,cup,1,29
10435,178313,lifting cup with knife on it,Lifting [something] with [something] on it,"['cup', 'knife']",2,Picking [something] up,cup,1,60
8426,8662,lifting a cup with a glove on it,Lifting [something] with [something] on it,"['a cup', 'a glove']",2,Picking [something] up,cup,1,35
2491,41666,lifting a cup with a spoon on it,Lifting [something] with [something] on it,"['a cup', 'a spoon']",2,Picking [something] up,cup,1,40
13396,76825,taking cup,Taking [one of many similar things on the table],['cup'],1,Picking [something] up,cup,1,68
6708,38559,picking a cup up,Picking [something] up,['a cup'],1,Picking [something] up,cup,1,58
14034,200999,picking a cup up,Picking [something] up,['a cup'],1,Picking [something] up,cup,1,55
5593,186741,moving cup up,Moving [something] up,['cup'],1,Picking [something] up,cup,1,43
3698,31153,moving cup up,Moving [something] up,['cup'],1,Picking [something] up,cup,1,50
12701,196953,lifting cup with napkin on it,Lifting [something] with [something] on it,"['cup', 'napkin']",2,Picking [something] up,cup,1,46
10201,32311,taking cup from bucket,Taking [something] from [somewhere],"['cup', 'bucket']",2,Picking [something] up,cup,1,36
903,38324,moving cup up,Moving [something] up,['cup'],1,Picking [something] up,cup,1,43
11147,206222,taking cup out of vessel,Taking [something] out of [something],"['cup', 'vessel']",2,Picking [something] up,cup,1,40
6386,142492,taking a cup from a right side to the left,Taking [something] from [somewhere],"['a cup', 'a right side to the left']",2,Picking [something] up,cup,1,64
8702,71810,taking cup from rack,Taking [something] from [somewhere],"['cup', 'rack']",2,Picking [something] up,cup,1,32
5134,158373,taking a cup out of a shelf,Taking [something] out of [something],"['a cup', 'a shelf']",2,Picking [something] up,cup,1,53
10108,12688,lifting a cup with a spoon on it,Lifting [something] with [something] on it,"['a cup', 'a spoon']",2,Picking [something] up,cup,1,43
7919,17675,lifting a cup with salt shaker on it,Lifting [something] with [something] on it,"['a cup', 'salt shaker']",2,Picking [something] up,cup,1,48
3350,50585,taking glasses out of cooler,Taking [something] out of [something],"['glasses', 'cooler']",2,Picking [something] up,glasses,1,54
13153,170270,moving glasses up,Moving [something] up,['glasses'],1,Picking [something] up,glasses,1,34
3419,186876,moving glasses up,Moving [something] up,['glasses'],1,Picking [something] up,glasses,1,31
11261,44858,moving glasses up,Moving [something] up,['glasses'],1,Picking [something] up,glasses,1,39
12182,21615,moving glasses up,Moving [something] up,['glasses'],1,Picking [something] up,glasses,1,62
12595,94558,taking glasses out of cup,Taking [something] out of [something],"['glasses', 'cup']",2,Picking [something] up,glasses,1,55
11639,170055,taking glasses from desk,Taking [something] from [somewhere],"['glasses', 'desk']",2,Picking [something] up,glasses,1,36
14481,16999,picking glasses up,Picking [something] up,['glasses'],1,Picking [something] up,glasses,1,62
10528,139140,taking glasses out of box,Taking [something] out of [something],"['glasses', 'box']",2,Picking [something] up,glasses,1,28
11966,167303,moving glasses up,Moving [something] up,['glasses'],1,Picking [something] up,glasses,1,31
13221,43077,moving glasses up,Moving [something] up,['glasses'],1,Picking [something] up,glasses,1,68
10036,216091,taking glasses out of draw,Taking [something] out of [something],"['glasses', 'draw']",2,Picking [something] up,glasses,1,60
12804,44879,moving glasses up,Moving [something] up,['glasses'],1,Picking [something] up,glasses,1,31
14391,37956,lifting glasses with paper on it,Lifting [something] with [something] on it,"['glasses', 'paper']",2,Picking [something] up,glasses,1,62
13831,10902,moving glasses up,Moving [something] up,['glasses'],1,Picking [something] up,glasses,1,47
12548,38793,moving glasses up,Moving [something] up,['glasses'],1,Picking [something] up,glasses,1,31
4086,213965,lifting glasses up completely without letting it drop down,Lifting [something] up completely without letting it drop down,['glasses'],1,Picking [something] up,glasses,1,27
7699,99880,moving glasses up,Moving [something] up,['glasses'],1,Picking [something] up,glasses,1,64
4535,64251,putting box behind box,Putting [something] behind [something],"['box', 'box']",2,Putting [something],box,1,51
6823,171649,putting box next to purse,Putting [something] next to [something],"['box', 'purse']",2,Putting [something],box,1,35
1607,932,"putting box, cigarette and lighters on the table","Putting [something], [something] and [something] on the table","['box', 'cigarette', 'lighters']",3,Putting [something],box,1,63
13533,152106,putting box onto prayer book,Putting [something] onto [something],"['box', 'prayer book']",2,Putting [something],box,1,45
5809,63213,putting box onto box,Putting [something] onto [something],"['box', 'box']",2,Putting [something],box,1,63
342,35608,putting box and cable on the table,Putting [something] and [something] on the table,"['box', 'cable']",2,Putting [something],box,1,35
1601,128080,putting box behind music-player,Putting [something] behind [something],"['box', 'music-player']",2,Putting [something],box,1,37
11165,168379,putting box and bottle on the table,Putting [something] and [something] on the table,"['box', 'bottle']",2,Putting [something],box,1,37
4148,85833,putting a box on a surface,Putting [something] on a surface,['a box'],1,Putting [something],box,1,68
9592,109583,"putting box that can't roll onto a slanted surface, so it stays where it is","Putting [something] that can't roll onto a slanted surface, so it stays where it is",['box'],1,Putting [something],box,1,47
5282,52985,"putting a box, a stapler and a hole punch on the table","Putting [something], [something] and [something] on the table","['a box', 'a stapler', 'a hole punch']",3,Putting [something],box,1,69
8027,163965,putting box next to wire,Putting [something] next to [something],"['box', 'wire']",2,Putting [something],box,1,31
8417,205750,"putting a box, a softtoy and a book on the table","Putting [something], [something] and [something] on the table","['a box', 'a softtoy', 'a book']",3,Putting [something],box,1,70
7959,163962,putting box on a surface,Putting [something] on a surface,['box'],1,Putting [something],box,1,39
4792,165943,putting box behind push up bar,Putting [something] behind [something],"['box', 'push up bar']",2,Putting [something],box,1,36
12778,136193,putting box onto speaker,Putting [something] onto [something],"['box', 'speaker']",2,Putting [something],box,1,41
3704,184099,putting a box and a watch on the table,Putting [something] and [something] on the table,"['a box', 'a watch']",2,Putting [something],box,1,51
3318,7916,putting box onto box,Putting [something] onto [something],"['box', 'box']",2,Putting [something],box,1,34
10803,151056,putting mouse onto laptop,Putting [something] onto [something],"['mouse', 'laptop']",2,Putting [something],mouse,1,42
12236,57251,putting mouse onto cable,Putting [something] onto [something],"['mouse', 'cable']",2,Putting [something],mouse,1,40
10060,28681,putting mouse on a surface,Putting [something] on a surface,['mouse'],1,Putting [something],mouse,1,35
10274,66872,putting mouse next to laptop,Putting [something] next to [something],"['mouse', 'laptop']",2,Putting [something],mouse,1,68
13522,106796,putting mouse on a surface,Putting [something] on a surface,['mouse'],1,Putting [something],mouse,1,36
12733,190323,putting mouse onto laptop,Putting [something] onto [something],"['mouse', 'laptop']",2,Putting [something],mouse,1,50
10756,193352,putting mouse next to game control,Putting [something] next to [something],"['mouse', 'game control']",2,Putting [something],mouse,1,49
8034,69183,"putting mouse, lamp and mini botlle on the table","Putting [something], [something] and [something] on the table","['mouse', 'lamp', 'mini botlle']",3,Putting [something],mouse,1,57
8758,14368,putting mouse onto box,Putting [something] onto [something],"['mouse', 'box']",2,Putting [something],mouse,1,27
7396,217370,putting mouse on a surface,Putting [something] on a surface,['mouse'],1,Putting [something],mouse,1,62
7747,107985,putting mouse onto box,Putting [something] onto [something],"['mouse', 'box']",2,Putting [something],mouse,1,35
5062,123107,putting mouse on a surface,Putting [something] on a surface,['mouse'],1,Putting [something],mouse,1,35
12024,1863,"putting mouse, bottle and head phone on the table","Putting [something], [something] and [something] on the table","['mouse', 'bottle', 'head phone']",3,Putting [something],mouse,1,43
4425,193981,putting mouse next to keyboard,Putting [something] next to [something],"['mouse', 'keyboard']",2,Putting [something],mouse,1,48
14789,17367,putting mouse next to keyboard,Putting [something] next to [something],"['mouse', 'keyboard']",2,Putting [something],mouse,1,56
9395,199522,putting mouse on a surface,Putting [something] on a surface,['mouse'],1,Putting [something],mouse,1,35
1707,94869,putting mouse on a surface,Putting [something] on a surface,['mouse'],1,Putting [something],mouse,1,61
447,84637,putting mouse and hammer on the table,Putting [something] and [something] on the table,"['mouse', 'hammer']",2,Putting [something],mouse,1,40
6676,118090,putting mouse behind cell phone box,Putting [something] behind [something],"['mouse', 'cell phone box']",2,Putting [something],mouse,1,63
11644,98041,putting brush behind box,Putting [something] behind [something],"['brush', 'box']",2,Putting [something],brush,1,46
5430,64148,putting brush next to makeup,Putting [something] next to [something],"['brush', 'makeup']",2,Putting [something],brush,1,33
6202,42755,putting brush on a surface,Putting [something] on a surface,['brush'],1,Putting [something],brush,1,60
12186,66926,putting a brush behind a book,Putting [something] behind [something],"['a brush', 'a book']",2,Putting [something],brush,1,49
8782,45890,putting brush on a surface,Putting [something] on a surface,['brush'],1,Putting [something],brush,1,61
8840,155303,putting brush on a surface,Putting [something] on a surface,['brush'],1,Putting [something],brush,1,60
10015,214938,putting brush and glass on the table,Putting [something] and [something] on the table,"['brush', 'glass']",2,Putting [something],brush,1,49
13122,200783,"putting brush, remote and bag on the table","Putting [something], [something] and [something] on the table","['brush', 'remote', 'bag']",3,Putting [something],brush,1,51
7649,179009,"putting brush that can't roll onto a slanted surface, so it stays where it is","Putting [something] that can't roll onto a slanted surface, so it stays where it is",['brush'],1,Putting [something],brush,1,40
13049,187718,putting a brush on a surface,Putting [something] on a surface,['a brush'],1,Putting [something],brush,1,37
6919,134349,putting brush onto bottle,Putting [something] onto [something],"['brush', 'bottle']",2,Putting [something],brush,1,44
11337,16169,putting brush next to glass,Putting [something] next to [something],"['brush', 'glass']",2,Putting [something],brush,1,37
6975,51435,putting brush and paste on the table,Putting [something] and [something] on the table,"['brush', 'paste']",2,Putting [something],brush,1,73
7720,138330,putting brush next to tube,Putting [something] next to [something],"['brush', 'tube']",2,Putting [something],brush,1,48
10546,4130,putting brush onto bowl,Putting [something] onto [something],"['brush', 'bowl']",2,Putting [something],brush,1,34
2602,126195,putting brush next to beverage bottle,Putting [something] next to [something],"['brush', 'beverage bottle']",2,Putting [something],brush,1,45
7462,11837,"putting brush, pliers and radish on the table","Putting [something], [something] and [something] on the table","['brush', 'pliers', 'radish']",3,Putting [something],brush,1,60
1417,88004,putting brush behind oil container,Putting [something] behind [something],"['brush', 'oil container']",2,Putting [something],brush,1,48
6948,112319,putting brush next to sport shoe,Putting [something] next to [something],"['brush', 'sport shoe']",2,Putting [something],brush,1,39
9079,218691,"putting scissors, box and remote control on the table","Putting [something], [something] and [something] on the table","['scissors', 'box', 'remote control']",3,Putting [something],scissors,1,68
10923,112718,"putting scissors, pen and mouse on the table","Putting [something], [something] and [something] on the table","['scissors', 'pen', 'mouse']",3,Putting [something],scissors,1,53
6839,162133,putting scissors next to pc harddisk,Putting [something] next to [something],"['scissors', 'pc harddisk']",2,Putting [something],scissors,1,36
8640,110210,putting a scissors next to a flower pot,Putting [something] next to [something],"['a scissors', 'a flower pot']",2,Putting [something],scissors,1,48
11657,168171,putting scissors and sunglasses on the table,Putting [something] and [something] on the table,"['scissors', 'sunglasses']",2,Putting [something],scissors,1,72
12937,135766,putting a scissors on a surface,Putting [something] on a surface,['a scissors'],1,Putting [something],scissors,1,34
13155,175048,putting scissors behind book,Putting [something] behind [something],"['scissors', 'book']",2,Putting [something],scissors,1,72
8133,209167,putting scissors behind bottle,Putting [something] behind [something],"['scissors', 'bottle']",2,Putting [something],scissors,1,48
8235,40259,putting scissors on a surface,Putting [something] on a surface,['scissors'],1,Putting [something],scissors,1,33
5945,119425,putting scissors next to tv box,Putting [something] next to [something],"['scissors', 'tv box']",2,Putting [something],scissors,1,40
6174,110063,putting scissors on a surface,Putting [something] on a surface,['scissors'],1,Putting [something],scissors,1,56
4034,5801,putting scissors next to sport shoe,Putting [something] next to [something],"['scissors', 'sport shoe']",2,Putting [something],scissors,1,36
12926,33418,putting scissors and cd on the table,Putting [something] and [something] on the table,"['scissors', 'cd']",2,Putting [something],scissors,1,52
3470,86121,putting scissors on a surface,Putting [something] on a surface,['scissors'],1,Putting [something],scissors,1,34
5859,208529,"putting scissors, mp3 player and highlighter on the table","Putting [something], [something] and [something] on the table","['scissors', 'mp3 player', 'highlighter']",3,Putting [something],scissors,1,53
8343,38841,"putting scissors, a roll of gauze and a medicine packet on the table","Putting [something], [something] and [something] on the table","['scissors', 'a roll of gauze', 'a medicine packet']",3,Putting [something],scissors,1,65
1626,50047,putting a scissors behind a shoe perfume,Putting [something] behind [something],"['a scissors', 'a shoe perfume']",2,Putting [something],scissors,1,30
444,54972,putting scissors on a surface,Putting [something] on a surface,['scissors'],1,Putting [something],scissors,1,45
14775,201629,putting scissors on a surface,Putting [something] on a surface,['scissors'],1,Putting [something],scissors,1,54
5848,191611,throwing pencil in the air and letting it fall,Throwing [something] in the air and letting it fall,['pencil'],1,Dropping [something],pencil,1,48
6748,180601,throwing color pencils,Throwing [something],['color pencils'],1,Dropping [something],pencil,1,32
10218,166682,throwing color pencils,Throwing [something],['color pencils'],1,Dropping [something],pencil,1,28
2989,10067,throwing pencil in the air and letting it fall,Throwing [something] in the air and letting it fall,['pencil'],1,Dropping [something],pencil,1,20
2903,64528,throwing color pencils,Throwing [something],['color pencils'],1,Dropping [something],pencil,1,30
4634,42057,throwing color pencils,Throwing [something],['color pencils'],1,Dropping [something],pencil,1,30
6835,15223,throwing color pencils,Throwing [something],['color pencils'],1,Dropping [something],pencil,1,35
1040,203654,throwing color pencils,Throwing [something],['color pencils'],1,Dropping [something],pencil,1,29
10351,198229,throwing color pencils,Throwing [something],['color pencils'],1,Dropping [something],pencil,1,30
4497,24567,throwing pencil in the air and letting it fall,Throwing [something] in the air and letting it fall,['pencil'],1,Dropping [something],pencil,1,36
166,198926,throwing color pencils,Throwing [something],['color pencils'],1,Dropping [something],pencil,1,28
11678,9309,throwing color pencils,Throwing [something],['color pencils'],1,Dropping [something],pencil,1,26
13096,204553,throwing a pencil in the air and letting it fall,Throwing [something] in the air and letting it fall,['a pencil'],1,Dropping [something],pencil,1,53
2335,120485,throwing color pencils,Throwing [something],['color pencils'],1,Dropping [something],pencil,1,30
1796,198777,throwing color pencils,Throwing [something],['color pencils'],1,Dropping [something],pencil,1,39
11593,58499,throwing color pencils,Throwing [something],['color pencils'],1,Dropping [something],pencil,1,26
12634,165138,throwing color pencils,Throwing [something],['color pencils'],1,Dropping [something],pencil,1,29
2112,61449,throwing color pencils,Throwing [something],['color pencils'],1,Dropping [something],pencil,1,26
9263,85947,throwing color pencils,Throwing [something],['color pencils'],1,Dropping [something],pencil,1,29
6030,135054,a book falling like a rock,[Something] falling like a rock,['a book'],1,Dropping [something],book,1,53
2891,18126,throwing book onto a surface,Throwing [something] onto a surface,['book'],1,Dropping [something],book,1,48
6580,97887,book falling like a rock,[Something] falling like a rock,['book'],1,Dropping [something],book,1,40
14021,207188,book falling like a rock,[Something] falling like a rock,['book'],1,Dropping [something],book,1,26
2809,90820,throwing book,Throwing [something],['book'],1,Dropping [something],book,1,32
10368,109698,throwing book,Throwing [something],['book'],1,Dropping [something],book,1,35
8924,87087,throwing book onto a surface,Throwing [something] onto a surface,['book'],1,Dropping [something],book,1,27
1225,174866,a book falling like a rock,[Something] falling like a rock,['a book'],1,Dropping [something],book,1,50
5182,191537,book falling like a rock,[Something] falling like a rock,['book'],1,Dropping [something],book,1,27
3984,16454,book falling like a rock,[Something] falling like a rock,['book'],1,Dropping [something],book,1,24
14168,116497,throwing a book,Throwing [something],['a book'],1,Dropping [something],book,1,38
14703,194058,book falling like a rock,[Something] falling like a rock,['book'],1,Dropping [something],book,1,34
7249,6327,throwing book,Throwing [something],['book'],1,Dropping [something],book,1,65
9823,190718,a book falling like a rock,[Something] falling like a rock,['a book'],1,Dropping [something],book,1,54
547,91896,throwing book,Throwing [something],['book'],1,Dropping [something],book,1,34
8136,122782,throwing book onto a surface,Throwing [something] onto a surface,['book'],1,Dropping [something],book,1,34
1254,114545,throwing book,Throwing [something],['book'],1,Dropping [something],book,1,47
13593,60352,book falling like a rock,[Something] falling like a rock,['book'],1,Dropping [something],book,1,21
8608,15704,throwing book,Throwing [something],['book'],1,Dropping [something],book,1,35
13974,28005,a wallet falling like a rock,[Something] falling like a rock,['a wallet'],1,Dropping [something],wallet,1,46
7865,208073,wallet falling like a rock,[Something] falling like a rock,['wallet'],1,Dropping [something],wallet,1,48
6596,56298,throwing a wallet onto a surface,Throwing [something] onto a surface,['a wallet'],1,Dropping [something],wallet,1,29
8641,134272,a wallet falling like a rock,[Something] falling like a rock,['a wallet'],1,Dropping [something],wallet,1,39
14199,46264,throwing wallet onto a surface,Throwing [something] onto a surface,['wallet'],1,Dropping [something],wallet,1,49
11020,56004,throwing wallet onto a surface,Throwing [something] onto a surface,['wallet'],1,Dropping [something],wallet,1,41
8575,215550,throwing a wallet onto a surface,Throwing [something] onto a surface,['a wallet'],1,Dropping [something],wallet,1,40
12745,37303,throwing a wallet in the air and letting it fall,Throwing [something] in the air and letting it fall,['a wallet'],1,Dropping [something],wallet,1,25
11451,42641,throwing wallet onto a surface,Throwing [something] onto a surface,['wallet'],1,Dropping [something],wallet,1,40
251,59280,throwing wallet,Throwing [something],['wallet'],1,Dropping [something],wallet,1,40
9387,187661,wallet falling like a rock,[Something] falling like a rock,['wallet'],1,Dropping [something],wallet,1,25
11445,27942,throwing wallet,Throwing [something],['wallet'],1,Dropping [something],wallet,1,30
8525,31036,throwing wallet,Throwing [something],['wallet'],1,Dropping [something],wallet,1,30
12287,2580,wallet falling like a rock,[Something] falling like a rock,['wallet'],1,Dropping [something],wallet,1,40
6799,177046,a wallet falling like a rock,[Something] falling like a rock,['a wallet'],1,Dropping [something],wallet,1,63
13703,33679,a wallet falling like a rock,[Something] falling like a rock,['a wallet'],1,Dropping [something],wallet,1,46
11934,208311,throwing wallet onto a surface,Throwing [something] onto a surface,['wallet'],1,Dropping [something],wallet,1,62
