,id,label,template,placeholders,num_objects,verb_class_name,noun_class_name,start_frame,stop_frame
8585,145166,moving color pencils up,Moving [something] up,['color pencils'],1,Picking [something] up,pencil,1,37
8110,132156,moving color pencils up,Moving [something] up,['color pencils'],1,Picking [something] up,pencil,1,29
10739,112173,moving color pencils up,Moving [something] up,['color pencils'],1,Picking [something] up,pencil,1,27
11439,68577,moving color pencil up,Moving [something] up,['color pencil'],1,Picking [something] up,pencil,1,30
6514,183371,moving color pencils up,Moving [something] up,['color pencils'],1,Picking [something] up,pencil,1,38
3607,144868,lifting pencil up completely without letting it drop down,Lifting [something] up completely without letting it drop down,['pencil'],1,Picking [something] up,pencil,1,29
11408,31760,lifting color pencils up completely without letting it drop down,Lifting [something] up completely without letting it drop down,['color pencils'],1,Picking [something] up,pencil,1,36
14306,182928,taking a pencil,Taking [one of many similar things on the table],['a pencil'],1,Picking [something] up,pencil,1,40
11633,115407,moving color pencils up,Moving [something] up,['color pencils'],1,Picking [something] up,pencil,1,27
6154,23579,moving pencil up,Moving [something] up,['pencil'],1,Picking [something] up,pencil,1,26
12197,33536,taking bottles,Taking [one of many similar things on the table],['bottles'],1,Picking [something] up,bottle,1,40
7840,90643,lifting bottle with hand on it,Lifting [something] with [something] on it,"['bottle', 'hand']",2,Picking [something] up,bottle,1,56
11179,104011,taking bottle from floor,Taking [something] from [somewhere],"['bottle', 'floor']",2,Picking [something] up,bottle,1,35
620,131051,taking bottle from switchboard,Taking [something] from [somewhere],"['bottle', 'switchboard']",2,Picking [something] up,bottle,1,32
9049,134545,taking bottle out of mini fridge,Taking [something] out of [something],"['bottle', 'mini fridge']",2,Picking [something] up,bottle,1,34
14734,50421,taking bottle out of bowl,Taking [something] out of [something],"['bottle', 'bowl']",2,Picking [something] up,bottle,1,58
12545,144208,moving a bottle up,Moving [something] up,['a bottle'],1,Picking [something] up,bottle,1,47
5804,160450,taking bottles,Taking [one of many similar things on the table],['bottles'],1,Picking [something] up,bottle,1,46
7885,86411,taking bottle from flush tank,Taking [something] from [somewhere],"['bottle', 'flush tank']",2,Picking [something] up,bottle,1,33
5382,107819,picking plastic bottle up,Picking [something] up,['plastic bottle'],1,Picking [something] up,bottle,1,60
4240,125138,taking pen,Taking [one of many similar things on the table],['pen'],1,Picking [something] up,pen,1,37
13930,132553,taking pen out of jar,Taking [something] out of [something],"['pen', 'jar']",2,Picking [something] up,pen,1,36
14650,161664,taking pen out of pencil case,Taking [something] out of [something],"['pen', 'pencil case']",2,Picking [something] up,pen,1,63
13378,196297,taking pen out of cup,Taking [something] out of [something],"['pen', 'cup']",2,Picking [something] up,pen,1,40
4514,56492,moving pen up,Moving [something] up,['pen'],1,Picking [something] up,pen,1,50
14420,69679,taking pen,Taking [one of many similar things on the table],['pen'],1,Picking [something] up,pen,1,53
11176,5682,taking pen out of box,Taking [something] out of [something],"['pen', 'box']",2,Picking [something] up,pen,1,39
11792,50469,taking a pen out of a bowl,Taking [something] out of [something],"['a pen', 'a bowl']",2,Picking [something] up,pen,1,37
8271,217907,taking pen out of pen stand,Taking [something] out of [something],"['pen', 'pen stand']",2,Picking [something] up,pen,1,38
6918,172610,lifting a pen up completely without letting it drop down,Lifting [something] up completely without letting it drop down,['a pen'],1,Picking [something] up,pen,1,42
460,67250,lifting book with remote control on it,Lifting [something] with [something] on it,"['book', 'remote control']",2,Picking [something] up,book,1,61
8689,78100,lifting book with cutter on it,Lifting [something] with [something] on it,"['book', 'cutter']",2,Picking [something] up,book,1,32
13070,84962,taking book,Taking [one of many similar things on the table],['book'],1,Picking [something] up,book,1,52
9563,70362,lifting a book with stapler on it,Lifting [something] with [something] on it,"['a book', 'stapler']",2,Picking [something] up,book,1,62
12903,65455,lifting a book with a box on it,Lifting [something] with [something] on it,"['a book', 'a box']",2,Picking [something] up,book,1,51
4914,55682,lifting a book with a nail polish on it,Lifting [something] with [something] on it,"['a book', 'a nail polish']",2,Picking [something] up,book,1,56
12442,135209,taking book,Taking [one of many similar things on the table],['book'],1,Picking [something] up,book,1,50
9782,130170,taking a book,Taking [one of many similar things on the table],['a book'],1,Picking [something] up,book,1,48
14274,48416,lifting book with pen on it,Lifting [something] with [something] on it,"['book', 'pen']",2,Picking [something] up,book,1,39
10735,72902,taking book from shelf,Taking [something] from [somewhere],"['book', 'shelf']",2,Picking [something] up,book,1,42
1769,85432,lifting box with bat on it,Lifting [something] with [something] on it,"['box', 'bat']",2,Picking [something] up,box,1,53
6149,40357,lifting box with cup on it,Lifting [something] with [something] on it,"['box', 'cup']",2,Picking [something] up,box,1,47
10951,199751,taking a box from a marble surface,Taking [something] from [somewhere],"['a box', 'a marble surface']",2,Picking [something] up,box,1,45
13844,193397,moving box up,Moving [something] up,['box'],1,Picking [something] up,box,1,45
5497,100538,lifting box with pen on it,Lifting [something] with [something] on it,"['box', 'pen']",2,Picking [something] up,box,1,42
6558,33026,lifting box with eyeglasses on it,Lifting [something] with [something] on it,"['box', 'eyeglasses']",2,Picking [something] up,box,1,62
10216,107778,lifting box with keys on it,Lifting [something] with [something] on it,"['box', 'keys']",2,Picking [something] up,box,1,67
12239,163568,lifting a box with a can on it,Lifting [something] with [something] on it,"['a box', 'a can']",2,Picking [something] up,box,1,52
10609,125746,lifting box with pen on it,Lifting [something] with [something] on it,"['box', 'pen']",2,Picking [something] up,box,1,46
11745,186107,lifting box with sandal on it,Lifting [something] with [something] on it,"['box', 'sandal']",2,Picking [something] up,box,1,63
962,7542,putting pencil on a surface,Putting [something] on a surface,['pencil'],1,Putting [something],pencil,1,35
6841,84639,putting color pencils on a surface,Putting [something] on a surface,['color pencils'],1,Putting [something],pencil,1,38
1908,159579,putting color pencils on a surface,Putting [something] on a surface,['color pencils'],1,Putting [something],pencil,1,27
14798,41828,putting pencil behind mug,Putting [something] behind [something],"['pencil', 'mug']",2,Putting [something],pencil,1,55
3150,85192,putting color pencils on a surface,Putting [something] on a surface,['color pencils'],1,Putting [something],pencil,1,42
10244,177921,putting pencil behind mouse,Putting [something] behind [something],"['pencil', 'mouse']",2,Putting [something],pencil,1,33
1035,43383,putting color pencils on a surface,Putting [something] on a surface,['color pencils'],1,Putting [something],pencil,1,27
6404,45716,putting color pencils on a surface,Putting [something] on a surface,['color pencils'],1,Putting [something],pencil,1,28
7479,159870,putting pencil next to sport shoe,Putting [something] next to [something],"['pencil', 'sport shoe']",2,Putting [something],pencil,1,44
14427,170639,putting pencil next to wooden stick,Putting [something] next to [something],"['pencil', 'wooden stick']",2,Putting [something],pencil,1,33
4863,163224,putting a bottle on a surface,Putting [something] on a surface,['a bottle'],1,Putting [something],bottle,1,43
4871,134217,putting bottle next to bowl,Putting [something] next to [something],"['bottle', 'bowl']",2,Putting [something],bottle,1,65
604,208151,putting bottle on a surface,Putting [something] on a surface,['bottle'],1,Putting [something],bottle,1,49
3581,55461,putting a bottle,Putting [something similar to other things that are already on the table],['a bottle'],1,Putting [something],bottle,1,34
6121,152250,putting bottle on a surface,Putting [something] on a surface,['bottle'],1,Putting [something],bottle,1,48
10290,116255,putting bottle on a surface,Putting [something] on a surface,['bottle'],1,Putting [something],bottle,1,52
2035,51169,putting bottle behind bottle,Putting [something] behind [something],"['bottle', 'bottle']",2,Putting [something],bottle,1,25
9752,151815,putting a bottle next to an onion,Putting [something] next to [something],"['a bottle', 'an onion']",2,Putting [something],bottle,1,53
11987,1925,putting a bottle on a surface,Putting [something] on a surface,['a bottle'],1,Putting [something],bottle,1,28
7995,158992,putting water bottle and mortein mosquito killer packet on the table,Putting [something] and [something] on the table,"['water bottle', 'mortein mosquito killer packet']",2,Putting [something],bottle,1,50
6087,214389,putting pen and doll on the table,Putting [something] and [something] on the table,"['pen', 'doll']",2,Putting [something],pen,1,61
8244,114351,putting pen on a surface,Putting [something] on a surface,['pen'],1,Putting [something],pen,1,34
8529,193495,putting pen on a surface,Putting [something] on a surface,['pen'],1,Putting [something],pen,1,35
8257,87885,putting pens,Putting [something similar to other things that are already on the table],['pens'],1,Putting [something],pen,1,36
6360,155373,putting pen on a flat surface without letting it roll,Putting [something] on a flat surface without letting it roll,['pen'],1,Putting [something],pen,1,48
10064,191908,"putting pen that can't roll onto a slanted surface, so it stays where it is","Putting [something] that can't roll onto a slanted surface, so it stays where it is",['pen'],1,Putting [something],pen,1,24
12566,135055,putting pen behind mp3 player,Putting [something] behind [something],"['pen', 'mp3 player']",2,Putting [something],pen,1,32
9970,68602,putting pen onto pencil,Putting [something] onto [something],"['pen', 'pencil']",2,Putting [something],pen,1,48
10806,471,putting a pen next to a pendrive,Putting [something] next to [something],"['a pen', 'a pendrive']",2,Putting [something],pen,1,55
5303,173983,putting pen,Putting [something similar to other things that are already on the table],['pen'],1,Putting [something],pen,1,49
4569,149460,putting book next to book,Putting [something] next to [something],"['book', 'book']",2,Putting [something],book,1,58
271,106655,"putting a book, a mobile phone and a pen on the table","Putting [something], [something] and [something] on the table","['a book', 'a mobile phone', 'a pen']",3,Putting [something],book,1,56
13524,99001,putting book,Putting [something similar to other things that are already on the table],['book'],1,Putting [something],book,1,45
749,80063,putting book and controller on the table,Putting [something] and [something] on the table,"['book', 'controller']",2,Putting [something],book,1,69
7541,216027,putting book on a flat surface without letting it roll,Putting [something] on a flat surface without letting it roll,['book'],1,Putting [something],book,1,26
9130,72019,putting book on a surface,Putting [something] on a surface,['book'],1,Putting [something],book,1,51
8951,88777,putting book,Putting [something similar to other things that are already on the table],['book'],1,Putting [something],book,1,30
726,75537,putting book,Putting [something similar to other things that are already on the table],['book'],1,Putting [something],book,1,37
2724,183830,putting book onto magician hat,Putting [something] onto [something],"['book', 'magician hat']",2,Putting [something],book,1,34
12532,112143,putting a book next to money,Putting [something] next to [something],"['a book', 'money']",2,Putting [something],book,1,60
4148,85833,putting a box on a surface,Putting [something] on a surface,['a box'],1,Putting [something],box,1,68
9835,126886,putting box next to phone,Putting [something] next to [something],"['box', 'phone']",2,Putting [something],box,1,36
7899,98547,putting box behind puff,Putting [something] behind [something],"['box', 'puff']",2,Putting [something],box,1,42
3704,184099,putting a box and a watch on the table,Putting [something] and [something] on the table,"['a box', 'a watch']",2,Putting [something],box,1,51
5236,104250,putting box on a surface,Putting [something] on a surface,['box'],1,Putting [something],box,1,52
12709,78361,putting box and pencil on the table,Putting [something] and [something] on the table,"['box', 'pencil']",2,Putting [something],box,1,48
4970,27917,"putting box, comb and wallet on the table","Putting [something], [something] and [something] on the table","['box', 'comb', 'wallet']",3,Putting [something],box,1,51
10934,130455,putting box on a surface,Putting [something] on a surface,['box'],1,Putting [something],box,1,44
1607,932,"putting box, cigarette and lighters on the table","Putting [something], [something] and [something] on the table","['box', 'cigarette', 'lighters']",3,Putting [something],box,1,63
8027,163965,putting box next to wire,Putting [something] next to [something],"['box', 'wire']",2,Putting [something],box,1,31
8200,1217,throwing color pencils,Throwing [something],['color pencils'],1,Dropping [something],pencil,1,26
624,110639,throwing color pencils,Throwing [something],['color pencils'],1,Dropping [something],pencil,1,27
7326,120772,throwing color pencils,Throwing [something],['color pencils'],1,Dropping [something],pencil,1,47
12219,3992,throwing pencil in the air and letting it fall,Throwing [something] in the air and letting it fall,['pencil'],1,Dropping [something],pencil,1,29
8296,57072,throwing color pencils,Throwing [something],['color pencils'],1,Dropping [something],pencil,1,30
5074,84205,throwing color pencils,Throwing [something],['color pencils'],1,Dropping [something],pencil,1,26
6684,173880,throwing color pencils,Throwing [something],['color pencils'],1,Dropping [something],pencil,1,35
1062,185754,throwing color pencils,Throwing [something],['color pencils'],1,Dropping [something],pencil,1,38
166,198926,throwing color pencils,Throwing [something],['color pencils'],1,Dropping [something],pencil,1,28
344,152457,throwing color pencils,Throwing [something],['color pencils'],1,Dropping [something],pencil,1,30
353,165440,a bottle falling like a rock,[Something] falling like a rock,['a bottle'],1,Dropping [something],bottle,1,42
9272,147849,a bottle falling like a rock,[Something] falling like a rock,['a bottle'],1,Dropping [something],bottle,1,38
6729,137326,throwing bottle onto a surface,Throwing [something] onto a surface,['bottle'],1,Dropping [something],bottle,1,51
14642,62934,throwing bottle,Throwing [something],['bottle'],1,Dropping [something],bottle,1,32
13364,152155,throwing bottle,Throwing [something],['bottle'],1,Dropping [something],bottle,1,60
6808,161887,plastic bottle falling like a rock,[Something] falling like a rock,['plastic bottle'],1,Dropping [something],bottle,1,51
4152,205270,throwing bottle,Throwing [something],['bottle'],1,Dropping [something],bottle,1,26
6308,22708,a water bottle falling like a rock,[Something] falling like a rock,['a water bottle'],1,Dropping [something],bottle,1,27
322,65863,throwing water bottle,Throwing [something],['water bottle'],1,Dropping [something],bottle,1,41
10963,202776,a bottle falling like a rock,[Something] falling like a rock,['a bottle'],1,Dropping [something],bottle,1,54
10692,57722,throwing a pen onto a surface,Throwing [something] onto a surface,['a pen'],1,Dropping [something],pen,1,13
1134,63788,pen falling like a rock,[Something] falling like a rock,['pen'],1,Dropping [something],pen,1,40
14240,141707,throwing a pen onto a surface,Throwing [something] onto a surface,['a pen'],1,Dropping [something],pen,1,39
12938,126389,throwing pen onto a surface,Throwing [something] onto a surface,['pen'],1,Dropping [something],pen,1,47
12500,97435,throwing a pen,Throwing [something],['a pen'],1,Dropping [something],pen,1,28
6296,114723,throwing pen,Throwing [something],['pen'],1,Dropping [something],pen,1,44
8213,23429,throwing pen,Throwing [something],['pen'],1,Dropping [something],pen,1,62
1765,149670,pen falling like a rock,[Something] falling like a rock,['pen'],1,Dropping [something],pen,1,32
542,104446,throwing a pen in the air and letting it fall,Throwing [something] in the air and letting it fall,['a pen'],1,Dropping [something],pen,1,51
689,93127,throwing a pen onto a surface,Throwing [something] onto a surface,['a pen'],1,Dropping [something],pen,1,47
6623,55823,throwing book,Throwing [something],['book'],1,Dropping [something],book,1,35
544,149923,throwing book,Throwing [something],['book'],1,Dropping [something],book,1,25
14725,110660,throwing book,Throwing [something],['book'],1,Dropping [something],book,1,57
9823,190718,a book falling like a rock,[Something] falling like a rock,['a book'],1,Dropping [something],book,1,54
240,98558,throwing book in the air and letting it fall,Throwing [something] in the air and letting it fall,['book'],1,Dropping [something],book,1,48
4310,176675,throwing book,Throwing [something],['book'],1,Dropping [something],book,1,27
12841,199263,throwing book,Throwing [something],['book'],1,Dropping [something],book,1,26
8608,15704,throwing book,Throwing [something],['book'],1,Dropping [something],book,1,35
6362,191202,book falling like a rock,[Something] falling like a rock,['book'],1,Dropping [something],book,1,55
9973,212217,throwing book,Throwing [something],['book'],1,Dropping [something],book,1,34
9623,184278,throwing a box in the air and letting it fall,Throwing [something] in the air and letting it fall,['a box'],1,Dropping [something],box,1,55
3048,106439,box falling like a rock,[Something] falling like a rock,['box'],1,Dropping [something],box,1,47
125,328,throwing box in the air and letting it fall,Throwing [something] in the air and letting it fall,['box'],1,Dropping [something],box,1,41
14368,58696,throwing box,Throwing [something],['box'],1,Dropping [something],box,1,46
4084,201122,box falling like a feather or paper,[Something] falling like a feather or paper,['box'],1,Dropping [something],box,1,36
5076,59663,throwing box onto a surface,Throwing [something] onto a surface,['box'],1,Dropping [something],box,1,41
13310,162441,throwing box in the air and letting it fall,Throwing [something] in the air and letting it fall,['box'],1,Dropping [something],box,1,33
4284,83235,a box falling like a rock,[Something] falling like a rock,['a box'],1,Dropping [something],box,1,54
8412,46804,throwing box,Throwing [something],['box'],1,Dropping [something],box,1,31
6128,126172,throwing box in the air and letting it fall,Throwing [something] in the air and letting it fall,['box'],1,Dropping [something],box,1,49
1072,92883,pushing color pencils from left to right,Pushing [something] from left to right,['color pencils'],1,Moving [something] from left to right,pencil,1,33
4611,219244,pushing color pencils from left to right,Pushing [something] from left to right,['color pencils'],1,Moving [something] from left to right,pencil,1,31
13607,194341,pushing pencil from left to right,Pushing [something] from left to right,['pencil'],1,Moving [something] from left to right,pencil,1,41
11381,214967,pushing color pencils from left to right,Pushing [something] from left to right,['color pencils'],1,Moving [something] from left to right,pencil,1,29
11646,219559,pulling pencil from left to right,Pulling [something] from left to right,['pencil'],1,Moving [something] from left to right,pencil,1,44
5210,155918,pushing color pencils from left to right,Pushing [something] from left to right,['color pencils'],1,Moving [something] from left to right,pencil,1,28
10028,145425,pushing color pencils from left to right,Pushing [something] from left to right,['color pencils'],1,Moving [something] from left to right,pencil,1,29
6425,185055,pushing color pencils from left to right,Pushing [something] from left to right,['color pencils'],1,Moving [something] from left to right,pencil,1,31
10801,164165,pushing pencil from left to right,Pushing [something] from left to right,['pencil'],1,Moving [something] from left to right,pencil,1,41
7157,126297,pushing a pencil from left to right,Pushing [something] from left to right,['a pencil'],1,Moving [something] from left to right,pencil,1,40
10144,212502,pulling a plastic bottle from left to right,Pulling [something] from left to right,['a plastic bottle'],1,Moving [something] from left to right,bottle,1,46
3514,94138,pushing bottle from left to right,Pushing [something] from left to right,['bottle'],1,Moving [something] from left to right,bottle,1,55
12075,103731,pulling plastic bottle from left to right,Pulling [something] from left to right,['plastic bottle'],1,Moving [something] from left to right,bottle,1,36
3765,86997,pushing plastic bottle from left to right,Pushing [something] from left to right,['plastic bottle'],1,Moving [something] from left to right,bottle,1,55
3548,159631,pushing a bottle from left to right,Pushing [something] from left to right,['a bottle'],1,Moving [something] from left to right,bottle,1,36
7012,98192,pushing bottle from left to right,Pushing [something] from left to right,['bottle'],1,Moving [something] from left to right,bottle,1,45
6096,253,pushing bottle from left to right,Pushing [something] from left to right,['bottle'],1,Moving [something] from left to right,bottle,1,36
4777,145010,pulling bottle from left to right,Pulling [something] from left to right,['bottle'],1,Moving [something] from left to right,bottle,1,62
8605,4543,pulling bottle from left to right,Pulling [something] from left to right,['bottle'],1,Moving [something] from left to right,bottle,1,27
4308,154887,pushing a bottle from left to right,Pushing [something] from left to right,['a bottle'],1,Moving [something] from left to right,bottle,1,48
9097,90701,pushing pen from left to right,Pushing [something] from left to right,['pen'],1,Moving [something] from left to right,pen,1,56
2935,129373,pulling pen from left to right,Pulling [something] from left to right,['pen'],1,Moving [something] from left to right,pen,1,32
3576,37752,pushing pen from left to right,Pushing [something] from left to right,['pen'],1,Moving [something] from left to right,pen,1,44
4933,171679,pushing pen from left to right,Pushing [something] from left to right,['pen'],1,Moving [something] from left to right,pen,1,44
105,98051,pulling a pen from left to right,Pulling [something] from left to right,['a pen'],1,Moving [something] from left to right,pen,1,52
6490,53983,pulling pen from left to right,Pulling [something] from left to right,['pen'],1,Moving [something] from left to right,pen,1,36
6150,3256,pulling pen from left to right,Pulling [something] from left to right,['pen'],1,Moving [something] from left to right,pen,1,37
10999,107126,pushing a pen from left to right,Pushing [something] from left to right,['a pen'],1,Moving [something] from left to right,pen,1,46
6500,62466,pulling pen from left to right,Pulling [something] from left to right,['pen'],1,Moving [something] from left to right,pen,1,42
9832,106457,pulling a pen from left to right,Pulling [something] from left to right,['a pen'],1,Moving [something] from left to right,pen,1,58
8347,56109,pushing book from left to right,Pushing [something] from left to right,['book'],1,Moving [something] from left to right,book,1,34
2937,146894,pushing book from left to right,Pushing [something] from left to right,['book'],1,Moving [something] from left to right,book,1,37
3247,120244,pulling a book from left to right,Pulling [something] from left to right,['a book'],1,Moving [something] from left to right,book,1,45
3893,35702,pushing book from left to right,Pushing [something] from left to right,['book'],1,Moving [something] from left to right,book,1,30
19,152137,pushing book from left to right,Pushing [something] from left to right,['book'],1,Moving [something] from left to right,book,1,30
5356,85462,pushing book from left to right,Pushing [something] from left to right,['book'],1,Moving [something] from left to right,book,1,33
5297,42698,pushing book from left to right,Pushing [something] from left to right,['book'],1,Moving [something] from left to right,book,1,32
9400,45449,pushing book from left to right,Pushing [something] from left to right,['book'],1,Moving [something] from left to right,book,1,26
5419,202829,pushing book from left to right,Pushing [something] from left to right,['book'],1,Moving [something] from left to right,book,1,30
8802,30041,pushing book from left to right,Pushing [something] from left to right,['book'],1,Moving [something] from left to right,book,1,51
6235,163492,pushing box from left to right,Pushing [something] from left to right,['box'],1,Moving [something] from left to right,box,1,31
7388,219979,pushing box from left to right,Pushing [something] from left to right,['box'],1,Moving [something] from left to right,box,1,59
5771,213671,pushing box from left to right,Pushing [something] from left to right,['box'],1,Moving [something] from left to right,box,1,52
10457,181298,pulling box from left to right,Pulling [something] from left to right,['box'],1,Moving [something] from left to right,box,1,50
10139,128547,pushing box from left to right,Pushing [something] from left to right,['box'],1,Moving [something] from left to right,box,1,38
