,id,label,template,placeholders,num_objects,verb_class_name,noun_class_name,start_frame,stop_frame
947,61415,lifting pencil up completely without letting it drop down,Lifting [something] up completely without letting it drop down,['pencil'],1,Picking [something] up,pencil,1,40
12845,97214,moving color pencils up,Moving [something] up,['color pencils'],1,Picking [something] up,pencil,1,40
8469,50371,moving color pencils up,Moving [something] up,['color pencils'],1,Picking [something] up,pencil,1,23
11402,164709,moving color pencils up,Moving [something] up,['color pencils'],1,Picking [something] up,pencil,1,26
9876,145586,lifting pencil up completely without letting it drop down,Lifting [something] up completely without letting it drop down,['pencil'],1,Picking [something] up,pencil,1,29
1642,188105,taking pencil,Taking [one of many similar things on the table],['pencil'],1,Picking [something] up,pencil,1,38
10366,59429,lifting pencil up completely without letting it drop down,Lifting [something] up completely without letting it drop down,['pencil'],1,Picking [something] up,pencil,1,27
12163,24548,moving color pencils up,Moving [something] up,['color pencils'],1,Picking [something] up,pencil,1,30
5805,190579,taking a pencil,Taking [one of many similar things on the table],['a pencil'],1,Picking [something] up,pencil,1,57
6653,165053,moving color pencils up,Moving [something] up,['color pencils'],1,Picking [something] up,pencil,1,25
7781,182307,taking pencil from pencil holder,Taking [something] from [somewhere],"['pencil', 'pencil holder']",2,Picking [something] up,pencil,1,41
1823,155927,lifting pencil up completely without letting it drop down,Lifting [something] up completely without letting it drop down,['pencil'],1,Picking [something] up,pencil,1,26
7894,183722,picking pencil up,Picking [something] up,['pencil'],1,Picking [something] up,pencil,1,37
11945,4478,moving color pencils up,Moving [something] up,['color pencils'],1,Picking [something] up,pencil,1,27
5254,57077,moving pencil up,Moving [something] up,['pencil'],1,Picking [something] up,pencil,1,43
4339,7401,lifting pencil up completely without letting it drop down,Lifting [something] up completely without letting it drop down,['pencil'],1,Picking [something] up,pencil,1,24
3184,157222,lifting pencil up completely without letting it drop down,Lifting [something] up completely without letting it drop down,['pencil'],1,Picking [something] up,pencil,1,26
6973,212951,lifting pencil up completely without letting it drop down,Lifting [something] up completely without letting it drop down,['pencil'],1,Picking [something] up,pencil,1,28
385,27673,moving key up,Moving [something] up,['key'],1,Picking [something] up,key,1,45
11385,210511,moving key up,Moving [something] up,['key'],1,Picking [something] up,key,1,29
141,81863,moving keys up,Moving [something] up,['keys'],1,Picking [something] up,key,1,62
2497,41969,taking key out of padlock,Taking [something] out of [something],"['key', 'padlock']",2,Picking [something] up,key,1,42
12205,170233,moving key up,Moving [something] up,['key'],1,Picking [something] up,key,1,29
9747,203441,moving keys up,Moving [something] up,['keys'],1,Picking [something] up,key,1,34
13695,29483,moving key up,Moving [something] up,['key'],1,Picking [something] up,key,1,35
3916,101555,taking keys out of pills container,Taking [something] out of [something],"['keys', 'pills container']",2,Picking [something] up,key,1,59
13958,111853,moving key up,Moving [something] up,['key'],1,Picking [something] up,key,1,43
5454,126524,moving keys up,Moving [something] up,['keys'],1,Picking [something] up,key,1,56
12700,18548,taking key out of cable lock,Taking [something] out of [something],"['key', 'cable lock']",2,Picking [something] up,key,1,43
8588,190156,taking key from table,Taking [something] from [somewhere],"['key', 'table']",2,Picking [something] up,key,1,35
11365,134884,taking key from pocket,Taking [something] from [somewhere],"['key', 'pocket']",2,Picking [something] up,key,1,63
13734,3478,moving keys up,Moving [something] up,['keys'],1,Picking [something] up,key,1,21
7598,21656,moving key up,Moving [something] up,['key'],1,Picking [something] up,key,1,33
11790,113198,taking key out of dish soap container,Taking [something] out of [something],"['key', 'dish soap container']",2,Picking [something] up,key,1,52
10746,18007,moving key up,Moving [something] up,['key'],1,Picking [something] up,key,1,51
5167,30267,moving key up,Moving [something] up,['key'],1,Picking [something] up,key,1,29
14276,23358,taking battery out of mug,Taking [something] out of [something],"['battery', 'mug']",2,Picking [something] up,battery,1,53
13709,157925,taking battery,Taking [one of many similar things on the table],['battery'],1,Picking [something] up,battery,1,65
2650,71422,taking battery out of plate,Taking [something] out of [something],"['battery', 'plate']",2,Picking [something] up,battery,1,30
14113,52494,taking battery,Taking [one of many similar things on the table],['battery'],1,Picking [something] up,battery,1,36
751,49209,moving battery up,Moving [something] up,['battery'],1,Picking [something] up,battery,1,62
133,143207,taking a battery,Taking [one of many similar things on the table],['a battery'],1,Picking [something] up,battery,1,46
615,7828,taking battery out of flat plastic tray,Taking [something] out of [something],"['battery', 'flat plastic tray']",2,Picking [something] up,battery,1,36
10071,96450,taking battery from basket,Taking [something] from [somewhere],"['battery', 'basket']",2,Picking [something] up,battery,1,47
9560,123576,taking a battery out of a box,Taking [something] out of [something],"['a battery', 'a box']",2,Picking [something] up,battery,1,32
11806,80009,taking battery,Taking [one of many similar things on the table],['battery'],1,Picking [something] up,battery,1,36
14197,76465,taking battery from floor,Taking [something] from [somewhere],"['battery', 'floor']",2,Picking [something] up,battery,1,41
5515,205311,lifting battery up completely without letting it drop down,Lifting [something] up completely without letting it drop down,['battery'],1,Picking [something] up,battery,1,39
9974,118660,taking battery,Taking [one of many similar things on the table],['battery'],1,Picking [something] up,battery,1,48
4613,99253,lifting battery with pen drive on it,Lifting [something] with [something] on it,"['battery', 'pen drive']",2,Picking [something] up,battery,1,32
388,158736,taking battery out of ashtray,Taking [something] out of [something],"['battery', 'ashtray']",2,Picking [something] up,battery,1,36
6864,2910,lifting a battery with a thumb drive on it,Lifting [something] with [something] on it,"['a battery', 'a thumb drive']",2,Picking [something] up,battery,1,36
5183,129783,moving battery up,Moving [something] up,['battery'],1,Picking [something] up,battery,1,36
8181,203803,lifting battery up completely without letting it drop down,Lifting [something] up completely without letting it drop down,['battery'],1,Picking [something] up,battery,1,39
14529,56558,taking a watch,Taking [one of many similar things on the table],['a watch'],1,Picking [something] up,watch,1,45
12605,168022,moving watch up,Moving [something] up,['watch'],1,Picking [something] up,watch,1,38
2967,121903,moving watch up,Moving [something] up,['watch'],1,Picking [something] up,watch,1,27
13177,29084,taking watch from desk,Taking [something] from [somewhere],"['watch', 'desk']",2,Picking [something] up,watch,1,44
1694,58569,picking a watch up,Picking [something] up,['a watch'],1,Picking [something] up,watch,1,35
658,143144,picking watch up,Picking [something] up,['watch'],1,Picking [something] up,watch,1,58
1612,116881,taking watch from table,Taking [something] from [somewhere],"['watch', 'table']",2,Picking [something] up,watch,1,29
10128,186963,moving watch up,Moving [something] up,['watch'],1,Picking [something] up,watch,1,62
9159,81106,moving a watch up,Moving [something] up,['a watch'],1,Picking [something] up,watch,1,46
10810,210083,taking watch,Taking [one of many similar things on the table],['watch'],1,Picking [something] up,watch,1,29
13857,9586,picking watch up,Picking [something] up,['watch'],1,Picking [something] up,watch,1,33
5892,205220,moving watch up,Moving [something] up,['watch'],1,Picking [something] up,watch,1,30
9198,194010,moving watch up,Moving [something] up,['watch'],1,Picking [something] up,watch,1,56
3696,26646,moving watch up,Moving [something] up,['watch'],1,Picking [something] up,watch,1,44
1362,90800,taking watch from table.,Taking [something] from [somewhere],"['watch', 'table.']",2,Picking [something] up,watch,1,39
6599,97000,lifting a watch up completely without letting it drop down,Lifting [something] up completely without letting it drop down,['a watch'],1,Picking [something] up,watch,1,36
4384,187435,picking a watch up,Picking [something] up,['a watch'],1,Picking [something] up,watch,1,35
7721,74374,moving a watch up,Moving [something] up,['a watch'],1,Picking [something] up,watch,1,41
962,7542,putting pencil on a surface,Putting [something] on a surface,['pencil'],1,Putting [something],pencil,1,35
6657,124681,putting color pencils on a surface,Putting [something] on a surface,['color pencils'],1,Putting [something],pencil,1,31
1908,159579,putting color pencils on a surface,Putting [something] on a surface,['color pencils'],1,Putting [something],pencil,1,27
8378,194005,putting pencil next to tv box,Putting [something] next to [something],"['pencil', 'tv box']",2,Putting [something],pencil,1,42
3150,85192,putting color pencils on a surface,Putting [something] on a surface,['color pencils'],1,Putting [something],pencil,1,42
10244,177921,putting pencil behind mouse,Putting [something] behind [something],"['pencil', 'mouse']",2,Putting [something],pencil,1,33
1035,43383,putting color pencils on a surface,Putting [something] on a surface,['color pencils'],1,Putting [something],pencil,1,27
6380,87837,putting color pencils on a surface,Putting [something] on a surface,['color pencils'],1,Putting [something],pencil,1,27
7465,155948,putting a pencil on a flat surface without letting it roll,Putting [something] on a flat surface without letting it roll,['a pencil'],1,Putting [something],pencil,1,40
13088,153513,putting pencil behind toy car,Putting [something] behind [something],"['pencil', 'toy car']",2,Putting [something],pencil,1,48
139,48771,putting color pencils on a surface,Putting [something] on a surface,['color pencils'],1,Putting [something],pencil,1,27
4436,147507,putting a pencil next to a mirror,Putting [something] next to [something],"['a pencil', 'a mirror']",2,Putting [something],pencil,1,30
3538,193,putting color pencil on a surface,Putting [something] on a surface,['color pencil'],1,Putting [something],pencil,1,27
10338,114181,putting color pencils on a surface,Putting [something] on a surface,['color pencils'],1,Putting [something],pencil,1,42
372,115465,putting color pencils on a surface,Putting [something] on a surface,['color pencils'],1,Putting [something],pencil,1,27
12213,95604,putting pencil onto container,Putting [something] onto [something],"['pencil', 'container']",2,Putting [something],pencil,1,56
8860,87538,putting color pencils on a surface,Putting [something] on a surface,['color pencils'],1,Putting [something],pencil,1,28
12989,13792,putting color pencils on a surface,Putting [something] on a surface,['color pencils'],1,Putting [something],pencil,1,42
1898,50782,putting bottle onto knife,Putting [something] onto [something],"['bottle', 'knife']",2,Putting [something],bottle,1,54
10141,218655,putting bottle on a surface,Putting [something] on a surface,['bottle'],1,Putting [something],bottle,1,33
2159,77795,putting a bottle on a surface,Putting [something] on a surface,['a bottle'],1,Putting [something],bottle,1,55
576,215304,putting bottle onto wash basin,Putting [something] onto [something],"['bottle', 'wash basin']",2,Putting [something],bottle,1,57
13928,114784,putting bottle behind cup,Putting [something] behind [something],"['bottle', 'cup']",2,Putting [something],bottle,1,44
6822,23659,putting plastic bottle onto table,Putting [something] onto [something],"['plastic bottle', 'table']",2,Putting [something],bottle,1,36
5807,43661,putting bottle onto book,Putting [something] onto [something],"['bottle', 'book']",2,Putting [something],bottle,1,39
7764,133161,putting bottle next to leaf,Putting [something] next to [something],"['bottle', 'leaf']",2,Putting [something],bottle,1,62
10226,58634,putting bottle,Putting [something similar to other things that are already on the table],['bottle'],1,Putting [something],bottle,1,48
8167,92956,putting plastic bottle behind lemon,Putting [something] behind [something],"['plastic bottle', 'lemon']",2,Putting [something],bottle,1,66
13191,184495,putting bottle on a flat surface without letting it roll,Putting [something] on a flat surface without letting it roll,['bottle'],1,Putting [something],bottle,1,55
5551,198331,putting bottle onto table,Putting [something] onto [something],"['bottle', 'table']",2,Putting [something],bottle,1,33
11867,175502,putting bottle on a surface,Putting [something] on a surface,['bottle'],1,Putting [something],bottle,1,34
5152,79119,"putting a bottle, a lunch box and a spoon on the table","Putting [something], [something] and [something] on the table","['a bottle', 'a lunch box', 'a spoon']",3,Putting [something],bottle,1,60
11805,54903,putting a plastic bottle,Putting [something similar to other things that are already on the table],['a plastic bottle'],1,Putting [something],bottle,1,58
3756,112363,putting bottles,Putting [something similar to other things that are already on the table],['bottles'],1,Putting [something],bottle,1,28
8715,167340,putting bottle onto can,Putting [something] onto [something],"['bottle', 'can']",2,Putting [something],bottle,1,28
1074,122729,putting bottle on a surface,Putting [something] on a surface,['bottle'],1,Putting [something],bottle,1,47
7126,215948,putting bottle on a surface,Putting [something] on a surface,['bottle'],1,Putting [something],bottle,1,38
8581,107634,putting phone onto wooden box,Putting [something] onto [something],"['phone', 'wooden box']",2,Putting [something],phone,1,59
2580,72003,putting mobile on a surface,Putting [something] on a surface,['mobile'],1,Putting [something],phone,1,28
127,13397,putting a phone next to a shoe,Putting [something] next to [something],"['a phone', 'a shoe']",2,Putting [something],phone,1,40
13629,181400,putting phone and scissors on the table,Putting [something] and [something] on the table,"['phone', 'scissors']",2,Putting [something],phone,1,72
2773,183608,putting a phone behind a cup,Putting [something] behind [something],"['a phone', 'a cup']",2,Putting [something],phone,1,31
4025,144772,"putting mobile, watch and battery on the table","Putting [something], [something] and [something] on the table","['mobile', 'watch', 'battery']",3,Putting [something],phone,1,65
12661,50274,putting phone next to wrist watch,Putting [something] next to [something],"['phone', 'wrist watch']",2,Putting [something],phone,1,46
3233,42491,putting phone on a surface,Putting [something] on a surface,['phone'],1,Putting [something],phone,1,48
7093,63707,putting mobile on a surface,Putting [something] on a surface,['mobile'],1,Putting [something],phone,1,32
4812,68295,putting mobile on a surface,Putting [something] on a surface,['mobile'],1,Putting [something],phone,1,32
6405,3517,putting mobile and measuring tape on the table,Putting [something] and [something] on the table,"['mobile', 'measuring tape']",2,Putting [something],phone,1,43
5987,218051,putting mobile and notebook on the table,Putting [something] and [something] on the table,"['mobile', 'notebook']",2,Putting [something],phone,1,58
6950,11618,putting mobile next to punching machine,Putting [something] next to [something],"['mobile', 'punching machine']",2,Putting [something],phone,1,41
5411,78196,putting phone behind speaker dock,Putting [something] behind [something],"['phone', 'speaker dock']",2,Putting [something],phone,1,37
7422,121367,putting phone next to box,Putting [something] next to [something],"['phone', 'box']",2,Putting [something],phone,1,44
3848,148502,putting mobile next to remote,Putting [something] next to [something],"['mobile', 'remote']",2,Putting [something],phone,1,36
12144,79528,putting phone onto book,Putting [something] onto [something],"['phone', 'book']",2,Putting [something],phone,1,46
5434,131549,putting phone onto box,Putting [something] onto [something],"['phone', 'box']",2,Putting [something],phone,1,39
6267,100374,putting mobile onto diary,Putting [something] onto [something],"['mobile', 'diary']",2,Putting [something],phone,1,30
3224,137481,putting glasses on a surface,Putting [something] on a surface,['glasses'],1,Putting [something],glasses,1,33
9333,65949,putting a glasses on a surface,Putting [something] on a surface,['a glasses'],1,Putting [something],glasses,1,43
8593,106664,putting glasses on a surface,Putting [something] on a surface,['glasses'],1,Putting [something],glasses,1,33
12483,154691,putting glasses on a surface,Putting [something] on a surface,['glasses'],1,Putting [something],glasses,1,45
13611,195038,"putting glasses, scissors and nail polish on the table","Putting [something], [something] and [something] on the table","['glasses', 'scissors', 'nail polish']",3,Putting [something],glasses,1,47
9031,120911,putting glasses and hairband on the table,Putting [something] and [something] on the table,"['glasses', 'hairband']",2,Putting [something],glasses,1,41
8082,193122,putting glasses next to scissors,Putting [something] next to [something],"['glasses', 'scissors']",2,Putting [something],glasses,1,50
9611,136066,putting glasses on a surface,Putting [something] on a surface,['glasses'],1,Putting [something],glasses,1,33
870,98848,putting glasses onto cooler,Putting [something] onto [something],"['glasses', 'cooler']",2,Putting [something],glasses,1,46
6705,133159,putting glasses onto box,Putting [something] onto [something],"['glasses', 'box']",2,Putting [something],glasses,1,41
11563,164856,putting glasses on a surface,Putting [something] on a surface,['glasses'],1,Putting [something],glasses,1,33
4836,126387,putting glasses behind bottle,Putting [something] behind [something],"['glasses', 'bottle']",2,Putting [something],glasses,1,33
3922,177049,putting glasses on a surface,Putting [something] on a surface,['glasses'],1,Putting [something],glasses,1,33
8112,9175,putting a glasses on a surface,Putting [something] on a surface,['a glasses'],1,Putting [something],glasses,1,41
9644,5772,putting glasses behind toilet paper,Putting [something] behind [something],"['glasses', 'toilet paper']",2,Putting [something],glasses,1,51
8219,53760,putting glasses behind cooler,Putting [something] behind [something],"['glasses', 'cooler']",2,Putting [something],glasses,1,48
14544,34942,"putting glasses, a beer bottle and a wallet on the table","Putting [something], [something] and [something] on the table","['glasses', 'a beer bottle', 'a wallet']",3,Putting [something],glasses,1,69
8045,119626,putting glasses on a surface,Putting [something] on a surface,['glasses'],1,Putting [something],glasses,1,33
1997,146602,putting glasses and phone on the table,Putting [something] and [something] on the table,"['glasses', 'phone']",2,Putting [something],glasses,1,47
8033,103547,throwing color pencils,Throwing [something],['color pencils'],1,Dropping [something],pencil,1,32
624,110639,throwing color pencils,Throwing [something],['color pencils'],1,Dropping [something],pencil,1,27
12461,57931,throwing a color pencil onto a surface,Throwing [something] onto a surface,['a color pencil'],1,Dropping [something],pencil,1,54
10693,210879,throwing color pencil,Throwing [something],['color pencil'],1,Dropping [something],pencil,1,28
10100,53221,throwing color pencils,Throwing [something],['color pencils'],1,Dropping [something],pencil,1,28
5071,156789,throwing color pencils,Throwing [something],['color pencils'],1,Dropping [something],pencil,1,28
6681,101281,throwing color pencils,Throwing [something],['color pencils'],1,Dropping [something],pencil,1,32
1062,185754,throwing color pencils,Throwing [something],['color pencils'],1,Dropping [something],pencil,1,38
166,198926,throwing color pencils,Throwing [something],['color pencils'],1,Dropping [something],pencil,1,28
344,152457,throwing color pencils,Throwing [something],['color pencils'],1,Dropping [something],pencil,1,30
6748,180601,throwing color pencils,Throwing [something],['color pencils'],1,Dropping [something],pencil,1,32
4044,140821,pencil falling like a rock,[Something] falling like a rock,['pencil'],1,Dropping [something],pencil,1,20
1827,184516,pencil falling like a rock,[Something] falling like a rock,['pencil'],1,Dropping [something],pencil,1,31
10639,7349,throwing color pencils,Throwing [something],['color pencils'],1,Dropping [something],pencil,1,27
8122,220519,throwing color pencils,Throwing [something],['color pencils'],1,Dropping [something],pencil,1,29
2335,120485,throwing color pencils,Throwing [something],['color pencils'],1,Dropping [something],pencil,1,30
6317,96675,throwing color pencil,Throwing [something],['color pencil'],1,Dropping [something],pencil,1,28
6835,15223,throwing color pencils,Throwing [something],['color pencils'],1,Dropping [something],pencil,1,35
11154,11160,throwing color pencils,Throwing [something],['color pencils'],1,Dropping [something],pencil,1,26
10692,57722,throwing a pen onto a surface,Throwing [something] onto a surface,['a pen'],1,Dropping [something],pen,1,13
1134,63788,pen falling like a rock,[Something] falling like a rock,['pen'],1,Dropping [something],pen,1,40
10610,18054,throwing pen,Throwing [something],['pen'],1,Dropping [something],pen,1,31
12938,126389,throwing pen onto a surface,Throwing [something] onto a surface,['pen'],1,Dropping [something],pen,1,47
13338,24711,a pen falling like a rock,[Something] falling like a rock,['a pen'],1,Dropping [something],pen,1,43
6296,114723,throwing pen,Throwing [something],['pen'],1,Dropping [something],pen,1,44
8352,85805,throwing pen in the air and letting it fall,Throwing [something] in the air and letting it fall,['pen'],1,Dropping [something],pen,1,23
1765,149670,pen falling like a rock,[Something] falling like a rock,['pen'],1,Dropping [something],pen,1,32
542,104446,throwing a pen in the air and letting it fall,Throwing [something] in the air and letting it fall,['a pen'],1,Dropping [something],pen,1,51
689,93127,throwing a pen onto a surface,Throwing [something] onto a surface,['a pen'],1,Dropping [something],pen,1,47
8562,199730,throwing a pen,Throwing [something],['a pen'],1,Dropping [something],pen,1,32
4512,106373,throwing a pen onto a surface,Throwing [something] onto a surface,['a pen'],1,Dropping [something],pen,1,32
2853,123369,throwing pen,Throwing [something],['pen'],1,Dropping [something],pen,1,41
12924,109873,pen falling like a rock,[Something] falling like a rock,['pen'],1,Dropping [something],pen,1,15
12500,97435,throwing a pen,Throwing [something],['a pen'],1,Dropping [something],pen,1,28
3297,188769,pen falling like a rock,[Something] falling like a rock,['pen'],1,Dropping [something],pen,1,43
7640,29557,throwing a pen in the air and letting it fall,Throwing [something] in the air and letting it fall,['a pen'],1,Dropping [something],pen,1,49
8564,114771,throwing pen,Throwing [something],['pen'],1,Dropping [something],pen,1,38
13171,48258,throwing the pen,Throwing [something],['the pen'],1,Dropping [something],pen,1,42
112,133893,throwing wallet in the air and letting it fall,Throwing [something] in the air and letting it fall,['wallet'],1,Dropping [something],wallet,1,48
3426,208654,throwing wallet,Throwing [something],['wallet'],1,Dropping [something],wallet,1,34
12080,163909,wallet falling like a rock,[Something] falling like a rock,['wallet'],1,Dropping [something],wallet,1,61
14550,199193,wallet falling like a rock,[Something] falling like a rock,['wallet'],1,Dropping [something],wallet,1,29
11934,208311,throwing wallet onto a surface,Throwing [something] onto a surface,['wallet'],1,Dropping [something],wallet,1,62
8525,31036,throwing wallet,Throwing [something],['wallet'],1,Dropping [something],wallet,1,30
4529,134276,throwing wallet,Throwing [something],['wallet'],1,Dropping [something],wallet,1,41
12419,145841,wallet falling like a rock,[Something] falling like a rock,['wallet'],1,Dropping [something],wallet,1,55
9920,154811,throwing a wallet,Throwing [something],['a wallet'],1,Dropping [something],wallet,1,18
7590,9933,throwing wallet,Throwing [something],['wallet'],1,Dropping [something],wallet,1,38
7503,3658,wallet falling like a feather or paper,[Something] falling like a feather or paper,['wallet'],1,Dropping [something],wallet,1,47
10771,21345,throwing wallet in the air and letting it fall,Throwing [something] in the air and letting it fall,['wallet'],1,Dropping [something],wallet,1,62
9941,129618,throwing a wallet,Throwing [something],['a wallet'],1,Dropping [something],wallet,1,45
1645,170152,a wallet falling like a rock,[Something] falling like a rock,['a wallet'],1,Dropping [something],wallet,1,45
8641,134272,a wallet falling like a rock,[Something] falling like a rock,['a wallet'],1,Dropping [something],wallet,1,39
13598,191956,throwing wallet,Throwing [something],['wallet'],1,Dropping [something],wallet,1,39
9615,209158,wallet falling like a rock,[Something] falling like a rock,['wallet'],1,Dropping [something],wallet,1,32
12287,2580,wallet falling like a rock,[Something] falling like a rock,['wallet'],1,Dropping [something],wallet,1,40
2348,218414,throwing wallet onto a surface,Throwing [something] onto a surface,['wallet'],1,Dropping [something],wallet,1,33
