,id,label,template,placeholders,num_objects,verb_class_name,noun_class_name,start_frame,stop_frame
9791,20986,moving color pencils up,Moving [something] up,['color pencils'],1,Picking [something] up,pencil,1,31
14527,20237,taking pencil from cupboard,Taking [something] from [somewhere],"['pencil', 'cupboard']",2,Picking [something] up,pencil,1,59
294,186498,moving color pencils up,Moving [something] up,['color pencils'],1,Picking [something] up,pencil,1,27
10366,59429,lifting pencil up completely without letting it drop down,Lifting [something] up completely without letting it drop down,['pencil'],1,Picking [something] up,pencil,1,27
10194,103057,lifting pencil up completely without letting it drop down,Lifting [something] up completely without letting it drop down,['pencil'],1,Picking [something] up,pencil,1,30
1263,132047,moving pencil up,Moving [something] up,['pencil'],1,Picking [something] up,pencil,1,24
11220,86483,lifting pencil up completely without letting it drop down,Lifting [something] up completely without letting it drop down,['pencil'],1,Picking [something] up,pencil,1,28
8225,18434,moving color pencils up,Moving [something] up,['color pencils'],1,Picking [something] up,pencil,1,27
1,102808,moving color pencils up,Moving [something] up,['color pencils'],1,Picking [something] up,pencil,1,33
9582,68991,lifting pencil up completely without letting it drop down,Lifting [something] up completely without letting it drop down,['pencil'],1,Picking [something] up,pencil,1,29
9888,168216,moving color pencils up,Moving [something] up,['color pencils'],1,Picking [something] up,pencil,1,29
2873,2045,taking pencil out of tray,Taking [something] out of [something],"['pencil', 'tray']",2,Picking [something] up,pencil,1,27
10173,107000,moving color pencils up,Moving [something] up,['color pencils'],1,Picking [something] up,pencil,1,32
6766,151653,lifting pencil up completely without letting it drop down,Lifting [something] up completely without letting it drop down,['pencil'],1,Picking [something] up,pencil,1,36
13820,17984,taking a pencil out of a mug,Taking [something] out of [something],"['a pencil', 'a mug']",2,Picking [something] up,pencil,1,54
10,124959,lifting bottle with spoon on it,Lifting [something] with [something] on it,"['bottle', 'spoon']",2,Picking [something] up,bottle,1,44
12432,53214,taking bottles,Taking [one of many similar things on the table],['bottles'],1,Picking [something] up,bottle,1,43
1130,3474,lifting bottle up completely without letting it drop down,Lifting [something] up completely without letting it drop down,['bottle'],1,Picking [something] up,bottle,1,39
3346,178200,picking water bottle up,Picking [something] up,['water bottle'],1,Picking [something] up,bottle,1,49
6843,91572,lifting plastic bottle up completely without letting it drop down,Lifting [something] up completely without letting it drop down,['plastic bottle'],1,Picking [something] up,bottle,1,57
2208,98464,lifting water bottle up completely without letting it drop down,Lifting [something] up completely without letting it drop down,['water bottle'],1,Picking [something] up,bottle,1,47
4097,71214,taking plastic bottle from table,Taking [something] from [somewhere],"['plastic bottle', 'table']",2,Picking [something] up,bottle,1,39
3742,74151,taking bottles,Taking [one of many similar things on the table],['bottles'],1,Picking [something] up,bottle,1,39
1889,53258,picking water bottle up,Picking [something] up,['water bottle'],1,Picking [something] up,bottle,1,52
10777,62341,taking bottle,Taking [one of many similar things on the table],['bottle'],1,Picking [something] up,bottle,1,50
2928,136540,picking bottle up,Picking [something] up,['bottle'],1,Picking [something] up,bottle,1,47
592,110322,taking bottle from bucket,Taking [something] from [somewhere],"['bottle', 'bucket']",2,Picking [something] up,bottle,1,30
279,203136,picking bottle up,Picking [something] up,['bottle'],1,Picking [something] up,bottle,1,42
12208,81882,moving bottle up,Moving [something] up,['bottle'],1,Picking [something] up,bottle,1,65
14245,67650,taking bottle from floor,Taking [something] from [somewhere],"['bottle', 'floor']",2,Picking [something] up,bottle,1,73
477,103104,taking a pen from a slab,Taking [something] from [somewhere],"['a pen', 'a slab']",2,Picking [something] up,pen,1,59
7887,112321,moving pen up,Moving [something] up,['pen'],1,Picking [something] up,pen,1,45
14323,72016,taking pen out of cup,Taking [something] out of [something],"['pen', 'cup']",2,Picking [something] up,pen,1,51
25,154767,taking pen,Taking [one of many similar things on the table],['pen'],1,Picking [something] up,pen,1,35
218,9790,taking pen,Taking [one of many similar things on the table],['pen'],1,Picking [something] up,pen,1,50
3559,47456,taking pens,Taking [one of many similar things on the table],['pens'],1,Picking [something] up,pen,1,43
3866,99618,lifting pen up completely without letting it drop down,Lifting [something] up completely without letting it drop down,['pen'],1,Picking [something] up,pen,1,56
13066,69703,moving pen up,Moving [something] up,['pen'],1,Picking [something] up,pen,1,41
2047,90810,lifting pen up completely without letting it drop down,Lifting [something] up completely without letting it drop down,['pen'],1,Picking [something] up,pen,1,43
3404,86846,taking pen out of plastic jar,Taking [something] out of [something],"['pen', 'plastic jar']",2,Picking [something] up,pen,1,49
8527,148389,taking a pen out of a pouch,Taking [something] out of [something],"['a pen', 'a pouch']",2,Picking [something] up,pen,1,45
8273,144146,taking pens,Taking [one of many similar things on the table],['pens'],1,Picking [something] up,pen,1,38
10391,172536,taking a pen,Taking [one of many similar things on the table],['a pen'],1,Picking [something] up,pen,1,54
7926,121939,lifting pen up completely without letting it drop down,Lifting [something] up completely without letting it drop down,['pen'],1,Picking [something] up,pen,1,30
14639,195135,taking pen,Taking [one of many similar things on the table],['pen'],1,Picking [something] up,pen,1,43
7163,132137,lifting book with comb on it,Lifting [something] with [something] on it,"['book', 'comb']",2,Picking [something] up,book,1,61
13013,95990,lifting a book with a watch on it,Lifting [something] with [something] on it,"['a book', 'a watch']",2,Picking [something] up,book,1,67
14569,32293,lifting book with rock on it,Lifting [something] with [something] on it,"['book', 'rock']",2,Picking [something] up,book,1,43
2085,52932,taking book,Taking [one of many similar things on the table],['book'],1,Picking [something] up,book,1,33
2968,55137,lifting book with whistle on it,Lifting [something] with [something] on it,"['book', 'whistle']",2,Picking [something] up,book,1,50
874,148744,lifting a book with a pen on it,Lifting [something] with [something] on it,"['a book', 'a pen']",2,Picking [something] up,book,1,50
5952,215749,taking book,Taking [one of many similar things on the table],['book'],1,Picking [something] up,book,1,41
3186,36425,lifting book with cup on it,Lifting [something] with [something] on it,"['book', 'cup']",2,Picking [something] up,book,1,46
1559,195744,lifting a book with a book on it,Lifting [something] with [something] on it,"['a book', 'a book']",2,Picking [something] up,book,1,60
13256,168096,moving book up,Moving [something] up,['book'],1,Picking [something] up,book,1,28
8337,116428,lifting book with pen on it,Lifting [something] with [something] on it,"['book', 'pen']",2,Picking [something] up,book,1,60
8833,149444,lifting book with phone on it,Lifting [something] with [something] on it,"['book', 'phone']",2,Picking [something] up,book,1,61
14214,68391,lifting a book with a toy robot on it,Lifting [something] with [something] on it,"['a book', 'a toy robot']",2,Picking [something] up,book,1,68
7769,82647,lifting book with pen on it,Lifting [something] with [something] on it,"['book', 'pen']",2,Picking [something] up,book,1,52
7854,122888,lifting book with candy container on it,Lifting [something] with [something] on it,"['book', 'candy container']",2,Picking [something] up,book,1,39
14366,167028,lifting box with razor blade on it,Lifting [something] with [something] on it,"['box', 'razor blade']",2,Picking [something] up,box,1,37
4199,25228,lifting a box with a match box on it,Lifting [something] with [something] on it,"['a box', 'a match box']",2,Picking [something] up,box,1,32
5202,73695,lifting box with quarter on it,Lifting [something] with [something] on it,"['box', 'quarter']",2,Picking [something] up,box,1,31
4393,28766,lifting box up completely without letting it drop down,Lifting [something] up completely without letting it drop down,['box'],1,Picking [something] up,box,1,45
2090,154327,lifting box with pen on it,Lifting [something] with [something] on it,"['box', 'pen']",2,Picking [something] up,box,1,47
2511,23914,lifting a box with a powerbank on it,Lifting [something] with [something] on it,"['a box', 'a powerbank']",2,Picking [something] up,box,1,51
5977,2613,moving a box up,Moving [something] up,['a box'],1,Picking [something] up,box,1,30
9693,188063,lifting box with hands on it,Lifting [something] with [something] on it,"['box', 'hands']",2,Picking [something] up,box,1,52
7834,102529,taking box from rack,Taking [something] from [somewhere],"['box', 'rack']",2,Picking [something] up,box,1,32
14330,196654,picking box up,Picking [something] up,['box'],1,Picking [something] up,box,1,34
11745,186107,lifting box with sandal on it,Lifting [something] with [something] on it,"['box', 'sandal']",2,Picking [something] up,box,1,63
6965,160778,taking box from washbasin,Taking [something] from [somewhere],"['box', 'washbasin']",2,Picking [something] up,box,1,33
6085,40965,moving box up,Moving [something] up,['box'],1,Picking [something] up,box,1,47
10432,130500,lifting box with soap on it,Lifting [something] with [something] on it,"['box', 'soap']",2,Picking [something] up,box,1,37
357,154132,lifting a box with an ice pack on it,Lifting [something] with [something] on it,"['a box', 'an ice pack']",2,Picking [something] up,box,1,72
13,104400,putting color pencils on a surface,Putting [something] on a surface,['color pencils'],1,Putting [something],pencil,1,34
12276,83525,putting pencil next to toothbrush,Putting [something] next to [something],"['pencil', 'toothbrush']",2,Putting [something],pencil,1,65
2848,177508,"putting pencil, silver tumler and ball on the table","Putting [something], [something] and [something] on the table","['pencil', 'silver tumler', 'ball']",3,Putting [something],pencil,1,57
7465,155948,putting a pencil on a flat surface without letting it roll,Putting [something] on a flat surface without letting it roll,['a pencil'],1,Putting [something],pencil,1,40
924,212667,putting color pencils on a surface,Putting [something] on a surface,['color pencils'],1,Putting [something],pencil,1,29
6094,74058,putting color pencils on a surface,Putting [something] on a surface,['color pencils'],1,Putting [something],pencil,1,42
10316,177936,putting color pencils on a surface,Putting [something] on a surface,['color pencils'],1,Putting [something],pencil,1,27
10745,165141,putting color pencils on a surface,Putting [something] on a surface,['color pencils'],1,Putting [something],pencil,1,30
1537,87594,putting color pencils on a surface,Putting [something] on a surface,['color pencils'],1,Putting [something],pencil,1,27
4754,183281,putting color pencils on a surface,Putting [something] on a surface,['color pencils'],1,Putting [something],pencil,1,32
5446,112998,putting color pencils on a surface,Putting [something] on a surface,['color pencils'],1,Putting [something],pencil,1,47
4683,163996,putting color pencils on a surface,Putting [something] on a surface,['color pencils'],1,Putting [something],pencil,1,27
574,43569,putting color pencils on a surface,Putting [something] on a surface,['color pencils'],1,Putting [something],pencil,1,28
12948,211381,putting pencil on a flat surface without letting it roll,Putting [something] on a flat surface without letting it roll,['pencil'],1,Putting [something],pencil,1,45
7560,199290,putting color pencils on a surface,Putting [something] on a surface,['color pencils'],1,Putting [something],pencil,1,43
1898,50782,putting bottle onto knife,Putting [something] onto [something],"['bottle', 'knife']",2,Putting [something],bottle,1,54
6119,26661,putting plastic bottle onto table,Putting [something] onto [something],"['plastic bottle', 'table']",2,Putting [something],bottle,1,53
5847,4281,putting bottle on a surface,Putting [something] on a surface,['bottle'],1,Putting [something],bottle,1,42
12727,7030,putting bottle behind coconut shell,Putting [something] behind [something],"['bottle', 'coconut shell']",2,Putting [something],bottle,1,40
14117,172411,putting bottle on a surface,Putting [something] on a surface,['bottle'],1,Putting [something],bottle,1,60
3851,161441,putting bottle on a surface,Putting [something] on a surface,['bottle'],1,Putting [something],bottle,1,38
3337,35639,putting a bottle,Putting [something similar to other things that are already on the table],['a bottle'],1,Putting [something],bottle,1,51
14363,3362,putting the bottle next to the bowl,Putting [something] next to [something],"['the bottle', 'the bowl']",2,Putting [something],bottle,1,55
4919,93328,putting bottle onto rice cooker,Putting [something] onto [something],"['bottle', 'rice cooker']",2,Putting [something],bottle,1,34
11207,88156,putting bottle onto note,Putting [something] onto [something],"['bottle', 'note']",2,Putting [something],bottle,1,37
14382,5705,putting bottle on a surface,Putting [something] on a surface,['bottle'],1,Putting [something],bottle,1,22
4271,7313,putting bottle on a flat surface without letting it roll,Putting [something] on a flat surface without letting it roll,['bottle'],1,Putting [something],bottle,1,47
163,103646,putting a bottle on a surface,Putting [something] on a surface,['a bottle'],1,Putting [something],bottle,1,35
2354,184648,putting bottle and comb on the table,Putting [something] and [something] on the table,"['bottle', 'comb']",2,Putting [something],bottle,1,46
10279,135642,putting bottle on a surface,Putting [something] on a surface,['bottle'],1,Putting [something],bottle,1,28
7497,83179,putting pen onto cigarette pack,Putting [something] onto [something],"['pen', 'cigarette pack']",2,Putting [something],pen,1,69
14138,189074,putting pen next to mug,Putting [something] next to [something],"['pen', 'mug']",2,Putting [something],pen,1,57
946,198924,putting pen on a surface,Putting [something] on a surface,['pen'],1,Putting [something],pen,1,36
12116,207306,putting pen,Putting [something similar to other things that are already on the table],['pen'],1,Putting [something],pen,1,44
13182,49617,putting pen onto book,Putting [something] onto [something],"['pen', 'book']",2,Putting [something],pen,1,49
5957,104853,putting pen on a surface,Putting [something] on a surface,['pen'],1,Putting [something],pen,1,34
11183,141926,putting pen on a surface,Putting [something] on a surface,['pen'],1,Putting [something],pen,1,36
7115,44906,putting pen behind mug,Putting [something] behind [something],"['pen', 'mug']",2,Putting [something],pen,1,59
3360,52609,putting pen onto notebook,Putting [something] onto [something],"['pen', 'notebook']",2,Putting [something],pen,1,41
7650,195214,putting pen on a surface,Putting [something] on a surface,['pen'],1,Putting [something],pen,1,42
1541,217898,putting pen and cup on the table,Putting [something] and [something] on the table,"['pen', 'cup']",2,Putting [something],pen,1,68
11387,135938,putting a pen on a surface,Putting [something] on a surface,['a pen'],1,Putting [something],pen,1,40
4410,197620,putting pen on a surface,Putting [something] on a surface,['pen'],1,Putting [something],pen,1,41
5978,114760,putting pen on a surface,Putting [something] on a surface,['pen'],1,Putting [something],pen,1,31
900,172766,putting pen onto box,Putting [something] onto [something],"['pen', 'box']",2,Putting [something],pen,1,44
5378,167890,putting book,Putting [something similar to other things that are already on the table],['book'],1,Putting [something],book,1,50
5550,217203,"putting a book, a calculator and a remote on the table","Putting [something], [something] and [something] on the table","['a book', 'a calculator', 'a remote']",3,Putting [something],book,1,48
14252,111350,putting a book,Putting [something similar to other things that are already on the table],['a book'],1,Putting [something],book,1,56
13026,8996,putting a book and a calculator on the table,Putting [something] and [something] on the table,"['a book', 'a calculator']",2,Putting [something],book,1,59
5307,64233,putting a book on a surface,Putting [something] on a surface,['a book'],1,Putting [something],book,1,28
7074,42978,putting book and whistle on the table,Putting [something] and [something] on the table,"['book', 'whistle']",2,Putting [something],book,1,42
10415,110199,putting book and mobile phone on the table,Putting [something] and [something] on the table,"['book', 'mobile phone']",2,Putting [something],book,1,68
9205,200446,"putting book, cable and cutter on the table","Putting [something], [something] and [something] on the table","['book', 'cable', 'cutter']",3,Putting [something],book,1,46
13715,131427,putting book next to book,Putting [something] next to [something],"['book', 'book']",2,Putting [something],book,1,45
9098,197888,putting a book onto a book,Putting [something] onto [something],"['a book', 'a book']",2,Putting [something],book,1,51
13473,148722,putting book next to other books,Putting [something] next to [something],"['book', 'other books']",2,Putting [something],book,1,51
12254,123264,"putting book that can't roll onto a slanted surface, so it stays where it is","Putting [something] that can't roll onto a slanted surface, so it stays where it is",['book'],1,Putting [something],book,1,45
11654,77375,putting a book on a surface,Putting [something] on a surface,['a book'],1,Putting [something],book,1,55
12496,119904,putting book and pinset on the table,Putting [something] and [something] on the table,"['book', 'pinset']",2,Putting [something],book,1,37
14104,64267,putting book onto can,Putting [something] onto [something],"['book', 'can']",2,Putting [something],book,1,54
311,85531,putting box on a surface,Putting [something] on a surface,['box'],1,Putting [something],box,1,46
14380,174453,"putting box that can't roll onto a slanted surface, so it stays where it is","Putting [something] that can't roll onto a slanted surface, so it stays where it is",['box'],1,Putting [something],box,1,52
11747,137413,"putting box, hair band and a screw on the table","Putting [something], [something] and [something] on the table","['box', 'hair band', 'a screw']",3,Putting [something],box,1,50
4552,176544,putting a box and a watch on the table,Putting [something] and [something] on the table,"['a box', 'a watch']",2,Putting [something],box,1,49
5503,72723,putting box onto shelf,Putting [something] onto [something],"['box', 'shelf']",2,Putting [something],box,1,50
7361,153912,putting box,Putting [something similar to other things that are already on the table],['box'],1,Putting [something],box,1,54
13424,171041,putting box behind bottle,Putting [something] behind [something],"['box', 'bottle']",2,Putting [something],box,1,42
13628,178990,putting box on a surface,Putting [something] on a surface,['box'],1,Putting [something],box,1,45
2793,210426,"putting box, powder puff and box on the table","Putting [something], [something] and [something] on the table","['box', 'powder puff', 'box']",3,Putting [something],box,1,62
12852,20729,putting box on a surface,Putting [something] on a surface,['box'],1,Putting [something],box,1,49
3318,7916,putting box onto box,Putting [something] onto [something],"['box', 'box']",2,Putting [something],box,1,34
11372,211218,putting box onto table,Putting [something] onto [something],"['box', 'table']",2,Putting [something],box,1,55
10909,9469,putting box and card on the table,Putting [something] and [something] on the table,"['box', 'card']",2,Putting [something],box,1,56
10143,125000,putting box next to mosquito coil,Putting [something] next to [something],"['box', 'mosquito coil']",2,Putting [something],box,1,35
3608,141531,putting box next to newspaper holder,Putting [something] next to [something],"['box', 'newspaper holder']",2,Putting [something],box,1,48
4587,145223,throwing color pencils,Throwing [something],['color pencils'],1,Dropping [something],pencil,1,35
9521,94959,throwing color pencils,Throwing [something],['color pencils'],1,Dropping [something],pencil,1,30
12878,184624,throwing color pencils,Throwing [something],['color pencils'],1,Dropping [something],pencil,1,28
14766,106722,pencil falling like a rock,[Something] falling like a rock,['pencil'],1,Dropping [something],pencil,1,47
12455,197336,throwing a pencil onto a surface,Throwing [something] onto a surface,['a pencil'],1,Dropping [something],pencil,1,37
2950,23951,throwing color pencils,Throwing [something],['color pencils'],1,Dropping [something],pencil,1,28
10215,113366,throwing color pencils,Throwing [something],['color pencils'],1,Dropping [something],pencil,1,32
1535,63691,a pencil falling like a rock,[Something] falling like a rock,['a pencil'],1,Dropping [something],pencil,1,23
9915,35593,throwing color pencils,Throwing [something],['color pencils'],1,Dropping [something],pencil,1,26
7545,164872,throwing color pencils,Throwing [something],['color pencils'],1,Dropping [something],pencil,1,29
79,195331,throwing color pencils,Throwing [something],['color pencils'],1,Dropping [something],pencil,1,39
7681,27409,throwing color pencils,Throwing [something],['color pencils'],1,Dropping [something],pencil,1,26
11932,152884,throwing a pencil onto a surface,Throwing [something] onto a surface,['a pencil'],1,Dropping [something],pencil,1,28
9589,139225,throwing color pencils,Throwing [something],['color pencils'],1,Dropping [something],pencil,1,26
1753,156093,throwing color pencils,Throwing [something],['color pencils'],1,Dropping [something],pencil,1,45
11159,49069,throwing bottle,Throwing [something],['bottle'],1,Dropping [something],bottle,1,30
2194,20524,throwing plastic bottle onto a surface,Throwing [something] onto a surface,['plastic bottle'],1,Dropping [something],bottle,1,35
8571,171969,throwing bottle,Throwing [something],['bottle'],1,Dropping [something],bottle,1,26
14273,196121,bottle falling like a rock,[Something] falling like a rock,['bottle'],1,Dropping [something],bottle,1,37
10685,62065,throwing bottle,Throwing [something],['bottle'],1,Dropping [something],bottle,1,26
2249,87160,throwing bottle,Throwing [something],['bottle'],1,Dropping [something],bottle,1,26
101,66377,a bottle falling like a rock,[Something] falling like a rock,['a bottle'],1,Dropping [something],bottle,1,27
11638,213884,throwing bottle in the air and letting it fall,Throwing [something] in the air and letting it fall,['bottle'],1,Dropping [something],bottle,1,25
7743,173450,throwing bottle,Throwing [something],['bottle'],1,Dropping [something],bottle,1,28
13364,152155,throwing bottle,Throwing [something],['bottle'],1,Dropping [something],bottle,1,60
1122,192815,throwing a bottle in the air and letting it fall,Throwing [something] in the air and letting it fall,['a bottle'],1,Dropping [something],bottle,1,43
322,65863,throwing water bottle,Throwing [something],['water bottle'],1,Dropping [something],bottle,1,41
3535,81667,throwing bottle,Throwing [something],['bottle'],1,Dropping [something],bottle,1,28
10305,129969,water bottle falling like a rock,[Something] falling like a rock,['water bottle'],1,Dropping [something],bottle,1,36
4351,95627,throwing bottle,Throwing [something],['bottle'],1,Dropping [something],bottle,1,29
5731,45803,throwing a pen onto a surface,Throwing [something] onto a surface,['a pen'],1,Dropping [something],pen,1,24
12963,143893,a pen falling like a rock,[Something] falling like a rock,['a pen'],1,Dropping [something],pen,1,15
9728,138216,pen falling like a rock,[Something] falling like a rock,['pen'],1,Dropping [something],pen,1,40
14373,172583,throwing pen in the air and letting it fall,Throwing [something] in the air and letting it fall,['pen'],1,Dropping [something],pen,1,44
14085,110931,throwing pen,Throwing [something],['pen'],1,Dropping [something],pen,1,43
13117,137900,throwing pen,Throwing [something],['pen'],1,Dropping [something],pen,1,41
2540,122535,pen falling like a rock,[Something] falling like a rock,['pen'],1,Dropping [something],pen,1,23
8352,85805,throwing pen in the air and letting it fall,Throwing [something] in the air and letting it fall,['pen'],1,Dropping [something],pen,1,23
8857,7848,throwing pen in the air and letting it fall,Throwing [something] in the air and letting it fall,['pen'],1,Dropping [something],pen,1,32
11565,165027,pen falling like a rock,[Something] falling like a rock,['pen'],1,Dropping [something],pen,1,30
93,130122,throwing pen onto a surface,Throwing [something] onto a surface,['pen'],1,Dropping [something],pen,1,33
10948,219729,throwing pen,Throwing [something],['pen'],1,Dropping [something],pen,1,45
8358,113106,throwing pen in the air and letting it fall,Throwing [something] in the air and letting it fall,['pen'],1,Dropping [something],pen,1,30
12070,178911,throwing a pen,Throwing [something],['a pen'],1,Dropping [something],pen,1,46
2853,123369,throwing pen,Throwing [something],['pen'],1,Dropping [something],pen,1,41
2665,210830,throwing book,Throwing [something],['book'],1,Dropping [something],book,1,32
12723,188116,a book falling like a rock,[Something] falling like a rock,['a book'],1,Dropping [something],book,1,47
8859,46720,book falling like a rock,[Something] falling like a rock,['book'],1,Dropping [something],book,1,32
