,id,label,template,placeholders,num_objects,verb_class_name,noun_class_name,start_frame,stop_frame
12656,64973,moving adapter up,Moving [something] up,['adapter'],1,Picking [something] up,charger,1,33
457,177313,taking charger from plug,Taking [something] from [somewhere],"['charger', 'plug']",2,Picking [something] up,charger,1,42
13086,203992,moving charger up,Moving [something] up,['charger'],1,Picking [something] up,charger,1,27
6597,31896,moving charger up,Moving [something] up,['charger'],1,Picking [something] up,charger,1,50
8587,159851,taking charger out of cap,Taking [something] out of [something],"['charger', 'cap']",2,Picking [something] up,charger,1,56
8600,54755,moving charger up,Moving [something] up,['charger'],1,Picking [something] up,charger,1,20
9483,101362,moving adapter up,Moving [something] up,['adapter'],1,Picking [something] up,charger,1,33
10122,94193,taking the charger out of the bag,Taking [something] out of [something],"['the charger', 'the bag']",2,Picking [something] up,charger,1,48
13662,160811,moving charger up,Moving [something] up,['charger'],1,Picking [something] up,charger,1,27
12201,21890,lifting adapter up completely without letting it drop down,Lifting [something] up completely without letting it drop down,['adapter'],1,Picking [something] up,charger,1,30
13582,164486,taking adapter,Taking [one of many similar things on the table],['adapter'],1,Picking [something] up,charger,1,26
6712,123290,picking charger up,Picking [something] up,['charger'],1,Picking [something] up,charger,1,58
10084,152782,taking charger from bag,Taking [something] from [somewhere],"['charger', 'bag']",2,Picking [something] up,charger,1,45
11983,42495,picking charger up,Picking [something] up,['charger'],1,Picking [something] up,charger,1,60
4519,145780,moving charger up,Moving [something] up,['charger'],1,Picking [something] up,charger,1,23
1000,164593,taking charger out of drawer,Taking [something] out of [something],"['charger', 'drawer']",2,Picking [something] up,charger,1,31
6986,4878,moving charger up,Moving [something] up,['charger'],1,Picking [something] up,charger,1,58
13934,181204,moving charger up,Moving [something] up,['charger'],1,Picking [something] up,charger,1,25
8120,195127,taking battery out of camera cover,Taking [something] out of [something],"['battery', 'camera cover']",2,Picking [something] up,battery,1,53
177,121051,taking battery from charger,Taking [something] from [somewhere],"['battery', 'charger']",2,Picking [something] up,battery,1,49
12365,52693,taking battery out of cup,Taking [something] out of [something],"['battery', 'cup']",2,Picking [something] up,battery,1,44
9363,97933,moving battery up,Moving [something] up,['battery'],1,Picking [something] up,battery,1,45
8181,203803,lifting battery up completely without letting it drop down,Lifting [something] up completely without letting it drop down,['battery'],1,Picking [something] up,battery,1,39
13676,78199,taking a battery,Taking [one of many similar things on the table],['a battery'],1,Picking [something] up,battery,1,60
9565,100970,picking a battery up,Picking [something] up,['a battery'],1,Picking [something] up,battery,1,40
11400,127671,taking battery,Taking [one of many similar things on the table],['battery'],1,Picking [something] up,battery,1,30
12855,144669,moving battery up,Moving [something] up,['battery'],1,Picking [something] up,battery,1,27
4839,108525,moving battery up,Moving [something] up,['battery'],1,Picking [something] up,battery,1,27
1474,25410,taking battery from table,Taking [something] from [somewhere],"['battery', 'table']",2,Picking [something] up,battery,1,38
388,158736,taking battery out of ashtray,Taking [something] out of [something],"['battery', 'ashtray']",2,Picking [something] up,battery,1,36
5216,179934,taking a battery out of a pouch,Taking [something] out of [something],"['a battery', 'a pouch']",2,Picking [something] up,battery,1,42
13822,114326,moving battery up,Moving [something] up,['battery'],1,Picking [something] up,battery,1,46
11015,143970,taking battery,Taking [one of many similar things on the table],['battery'],1,Picking [something] up,battery,1,52
11806,80009,taking battery,Taking [one of many similar things on the table],['battery'],1,Picking [something] up,battery,1,36
5992,189853,lifting battery up completely without letting it drop down,Lifting [something] up completely without letting it drop down,['battery'],1,Picking [something] up,battery,1,32
14197,76465,taking battery from floor,Taking [something] from [somewhere],"['battery', 'floor']",2,Picking [something] up,battery,1,41
11147,206222,taking cup out of vessel,Taking [something] out of [something],"['cup', 'vessel']",2,Picking [something] up,cup,1,40
8042,17594,lifting cup with fork on it,Lifting [something] with [something] on it,"['cup', 'fork']",2,Picking [something] up,cup,1,39
6550,126942,lifting cup up completely without letting it drop down,Lifting [something] up completely without letting it drop down,['cup'],1,Picking [something] up,cup,1,46
8488,159099,taking cup out of cup,Taking [something] out of [something],"['cup', 'cup']",2,Picking [something] up,cup,1,42
13240,66019,lifting cup with book on it,Lifting [something] with [something] on it,"['cup', 'book']",2,Picking [something] up,cup,1,64
8426,8662,lifting a cup with a glove on it,Lifting [something] with [something] on it,"['a cup', 'a glove']",2,Picking [something] up,cup,1,35
13093,205011,picking cup up,Picking [something] up,['cup'],1,Picking [something] up,cup,1,41
13569,169543,picking cup up,Picking [something] up,['cup'],1,Picking [something] up,cup,1,64
5599,206090,taking cup,Taking [one of many similar things on the table],['cup'],1,Picking [something] up,cup,1,45
7266,137782,moving cup up,Moving [something] up,['cup'],1,Picking [something] up,cup,1,56
911,54754,lifting cup with pen on it,Lifting [something] with [something] on it,"['cup', 'pen']",2,Picking [something] up,cup,1,36
2574,87118,taking cup from kitchen ladder unit,Taking [something] from [somewhere],"['cup', 'kitchen ladder unit']",2,Picking [something] up,cup,1,37
10195,194511,lifting cup with spoon on it,Lifting [something] with [something] on it,"['cup', 'spoon']",2,Picking [something] up,cup,1,64
2450,141761,moving cup up,Moving [something] up,['cup'],1,Picking [something] up,cup,1,45
10865,25177,moving cup up,Moving [something] up,['cup'],1,Picking [something] up,cup,1,53
4355,42176,moving cup up,Moving [something] up,['cup'],1,Picking [something] up,cup,1,44
13454,85095,lifting cup with marker on it,Lifting [something] with [something] on it,"['cup', 'marker']",2,Picking [something] up,cup,1,34
3877,120094,moving cup up,Moving [something] up,['cup'],1,Picking [something] up,cup,1,50
6140,179169,lifting scissors up completely without letting it drop down,Lifting [something] up completely without letting it drop down,['scissors'],1,Picking [something] up,scissors,1,58
7304,220526,picking scissors up,Picking [something] up,['scissors'],1,Picking [something] up,scissors,1,40
4058,62453,taking scissors out of drawer,Taking [something] out of [something],"['scissors', 'drawer']",2,Picking [something] up,scissors,1,60
6519,118806,moving scissors up,Moving [something] up,['scissors'],1,Picking [something] up,scissors,1,48
5712,31499,moving scissors up,Moving [something] up,['scissors'],1,Picking [something] up,scissors,1,52
14257,128477,taking scissors out of drawer,Taking [something] out of [something],"['scissors', 'drawer']",2,Picking [something] up,scissors,1,50
10855,45426,moving scissors up,Moving [something] up,['scissors'],1,Picking [something] up,scissors,1,25
12179,163354,taking scissors out of white bowl,Taking [something] out of [something],"['scissors', 'white bowl']",2,Picking [something] up,scissors,1,31
14729,36443,lifting scissors with pen on it,Lifting [something] with [something] on it,"['scissors', 'pen']",2,Picking [something] up,scissors,1,45
10118,196928,taking scissors out of a pocket,Taking [something] out of [something],"['scissors', 'a pocket']",2,Picking [something] up,scissors,1,54
11898,139287,taking scissors out of washbasin,Taking [something] out of [something],"['scissors', 'washbasin']",2,Picking [something] up,scissors,1,34
9516,87878,moving scissors up,Moving [something] up,['scissors'],1,Picking [something] up,scissors,1,62
8818,181063,lifting a scissors with a scale on it,Lifting [something] with [something] on it,"['a scissors', 'a scale']",2,Picking [something] up,scissors,1,56
11733,112821,picking scissors up,Picking [something] up,['scissors'],1,Picking [something] up,scissors,1,67
11557,211813,taking scissors out of cup,Taking [something] out of [something],"['scissors', 'cup']",2,Picking [something] up,scissors,1,41
1022,5221,moving scissors up,Moving [something] up,['scissors'],1,Picking [something] up,scissors,1,49
227,186701,taking scissors,Taking [one of many similar things on the table],['scissors'],1,Picking [something] up,scissors,1,45
5552,108532,taking scissors out of a pocket,Taking [something] out of [something],"['scissors', 'a pocket']",2,Picking [something] up,scissors,1,52
14715,21421,putting bottle on a surface,Putting [something] on a surface,['bottle'],1,Putting [something],bottle,1,44
4464,1284,putting bottles,Putting [something similar to other things that are already on the table],['bottles'],1,Putting [something],bottle,1,29
12041,152346,putting bottle next to sunglasses,Putting [something] next to [something],"['bottle', 'sunglasses']",2,Putting [something],bottle,1,36
12648,45242,putting bottles,Putting [something similar to other things that are already on the table],['bottles'],1,Putting [something],bottle,1,33
6075,96535,putting bottles,Putting [something similar to other things that are already on the table],['bottles'],1,Putting [something],bottle,1,30
12741,110633,putting bottle next to compact disk,Putting [something] next to [something],"['bottle', 'compact disk']",2,Putting [something],bottle,1,35
7079,219804,putting bottles,Putting [something similar to other things that are already on the table],['bottles'],1,Putting [something],bottle,1,31
10523,71541,putting bottle on a flat surface without letting it roll,Putting [something] on a flat surface without letting it roll,['bottle'],1,Putting [something],bottle,1,63
1115,167090,putting bottle on a flat surface without letting it roll,Putting [something] on a flat surface without letting it roll,['bottle'],1,Putting [something],bottle,1,48
10226,58634,putting bottle,Putting [something similar to other things that are already on the table],['bottle'],1,Putting [something],bottle,1,48
6119,26661,putting plastic bottle onto table,Putting [something] onto [something],"['plastic bottle', 'table']",2,Putting [something],bottle,1,53
13928,114784,putting bottle behind cup,Putting [something] behind [something],"['bottle', 'cup']",2,Putting [something],bottle,1,44
6810,166541,putting water bottle and comfort fabric conditioner on the table,Putting [something] and [something] on the table,"['water bottle', 'comfort fabric conditioner']",2,Putting [something],bottle,1,66
11805,54903,putting a plastic bottle,Putting [something similar to other things that are already on the table],['a plastic bottle'],1,Putting [something],bottle,1,58
11695,48791,putting bottle and comb on the table,Putting [something] and [something] on the table,"['bottle', 'comb']",2,Putting [something],bottle,1,31
8043,188255,putting bottle on a surface,Putting [something] on a surface,['bottle'],1,Putting [something],bottle,1,31
13914,36268,putting water bottle next to water bottle,Putting [something] next to [something],"['water bottle', 'water bottle']",2,Putting [something],bottle,1,38
331,98144,putting a bottle on a surface,Putting [something] on a surface,['a bottle'],1,Putting [something],bottle,1,53
8699,82455,"putting box, powder bottle and box on the table","Putting [something], [something] and [something] on the table","['box', 'powder bottle', 'box']",3,Putting [something],box,1,57
12773,108291,putting box next to box,Putting [something] next to [something],"['box', 'box']",2,Putting [something],box,1,44
3770,141765,putting box and handphone on the table,Putting [something] and [something] on the table,"['box', 'handphone']",2,Putting [something],box,1,56
342,35608,putting box and cable on the table,Putting [something] and [something] on the table,"['box', 'cable']",2,Putting [something],box,1,35
13494,78820,"putting box, handphone and pen on the table","Putting [something], [something] and [something] on the table","['box', 'handphone', 'pen']",3,Putting [something],box,1,65
5028,132794,putting a box on a surface,Putting [something] on a surface,['a box'],1,Putting [something],box,1,41
1601,128080,putting box behind music-player,Putting [something] behind [something],"['box', 'music-player']",2,Putting [something],box,1,37
4970,27917,"putting box, comb and wallet on the table","Putting [something], [something] and [something] on the table","['box', 'comb', 'wallet']",3,Putting [something],box,1,51
8027,163965,putting box next to wire,Putting [something] next to [something],"['box', 'wire']",2,Putting [something],box,1,31
9592,109583,"putting box that can't roll onto a slanted surface, so it stays where it is","Putting [something] that can't roll onto a slanted surface, so it stays where it is",['box'],1,Putting [something],box,1,47
13840,19163,putting boxes,Putting [something similar to other things that are already on the table],['boxes'],1,Putting [something],box,1,27
5819,71781,putting box next to box,Putting [something] next to [something],"['box', 'box']",2,Putting [something],box,1,39
9157,90003,putting box behind box,Putting [something] behind [something],"['box', 'box']",2,Putting [something],box,1,51
9836,146258,"putting box, wallet and ruler on the table","Putting [something], [something] and [something] on the table","['box', 'wallet', 'ruler']",3,Putting [something],box,1,51
3608,141531,putting box next to newspaper holder,Putting [something] next to [something],"['box', 'newspaper holder']",2,Putting [something],box,1,48
1607,932,"putting box, cigarette and lighters on the table","Putting [something], [something] and [something] on the table","['box', 'cigarette', 'lighters']",3,Putting [something],box,1,63
4292,197940,putting box behind toy,Putting [something] behind [something],"['box', 'toy']",2,Putting [something],box,1,44
9608,11268,putting a box behind a glove,Putting [something] behind [something],"['a box', 'a glove']",2,Putting [something],box,1,20
8993,175834,putting box onto box,Putting [something] onto [something],"['box', 'box']",2,Putting [something],box,1,27
7989,59977,putting knife behind stamp box,Putting [something] behind [something],"['knife', 'stamp box']",2,Putting [something],knife,1,24
4895,97555,putting knife next to book,Putting [something] next to [something],"['knife', 'book']",2,Putting [something],knife,1,36
8795,32291,putting a knife behind a power bank,Putting [something] behind [something],"['a knife', 'a power bank']",2,Putting [something],knife,1,62
7436,200388,putting knife onto tape,Putting [something] onto [something],"['knife', 'tape']",2,Putting [something],knife,1,57
5555,156927,putting knife,Putting [something similar to other things that are already on the table],['knife'],1,Putting [something],knife,1,19
6372,51504,putting knife next to bottle,Putting [something] next to [something],"['knife', 'bottle']",2,Putting [something],knife,1,52
6577,188990,putting knife and cup on the table,Putting [something] and [something] on the table,"['knife', 'cup']",2,Putting [something],knife,1,50
11622,165194,"putting a knife, fork and a spoon on the table","Putting [something], [something] and [something] on the table","['a knife', 'fork', 'a spoon']",3,Putting [something],knife,1,72
4061,111589,putting knife next to toothbrush,Putting [something] next to [something],"['knife', 'toothbrush']",2,Putting [something],knife,1,42
7145,23216,putting knife behind book,Putting [something] behind [something],"['knife', 'book']",2,Putting [something],knife,1,52
13280,53834,putting knife next to glass cup,Putting [something] next to [something],"['knife', 'glass cup']",2,Putting [something],knife,1,28
9461,156503,putting a knife onto a cup,Putting [something] onto [something],"['a knife', 'a cup']",2,Putting [something],knife,1,49
12501,169382,putting knife onto cup,Putting [something] onto [something],"['knife', 'cup']",2,Putting [something],knife,1,44
7793,88756,putting knife behind dog leash,Putting [something] behind [something],"['knife', 'dog leash']",2,Putting [something],knife,1,45
4597,34983,putting knife on a surface,Putting [something] on a surface,['knife'],1,Putting [something],knife,1,28
11942,158742,"putting a knife, a pair of scissors and duct tape on the table","Putting [something], [something] and [something] on the table","['a knife', 'a pair of scissors', 'duct tape']",3,Putting [something],knife,1,69
5185,102178,putting knife behind cup,Putting [something] behind [something],"['knife', 'cup']",2,Putting [something],knife,1,41
12630,74429,putting a knife next to a dish,Putting [something] next to [something],"['a knife', 'a dish']",2,Putting [something],knife,1,35
2171,61254,putting a knife on a surface,Putting [something] on a surface,['a knife'],1,Putting [something],knife,1,24
7748,78177,putting mouse onto brush,Putting [something] onto [something],"['mouse', 'brush']",2,Putting [something],mouse,1,30
8844,7715,putting mouse on a surface,Putting [something] on a surface,['mouse'],1,Putting [something],mouse,1,62
4884,24446,putting mouse on a surface,Putting [something] on a surface,['mouse'],1,Putting [something],mouse,1,62
8145,124718,putting mouse and cellphone charger on the table,Putting [something] and [something] on the table,"['mouse', 'cellphone charger']",2,Putting [something],mouse,1,52
7396,217370,putting mouse on a surface,Putting [something] on a surface,['mouse'],1,Putting [something],mouse,1,62
14410,203953,putting a mouse onto a mouse pad,Putting [something] onto [something],"['a mouse', 'a mouse pad']",2,Putting [something],mouse,1,62
10803,151056,putting mouse onto laptop,Putting [something] onto [something],"['mouse', 'laptop']",2,Putting [something],mouse,1,42
12535,170645,putting mouse behind videogame,Putting [something] behind [something],"['mouse', 'videogame']",2,Putting [something],mouse,1,46
14789,17367,putting mouse next to keyboard,Putting [something] next to [something],"['mouse', 'keyboard']",2,Putting [something],mouse,1,56
10755,49492,putting mouse on a surface,Putting [something] on a surface,['mouse'],1,Putting [something],mouse,1,54
12236,57251,putting mouse onto cable,Putting [something] onto [something],"['mouse', 'cable']",2,Putting [something],mouse,1,40
10295,76446,putting mouse next to keyboard,Putting [something] next to [something],"['mouse', 'keyboard']",2,Putting [something],mouse,1,44
9510,192966,putting mouse on a surface,Putting [something] on a surface,['mouse'],1,Putting [something],mouse,1,60
12142,757,putting mouse onto diary,Putting [something] onto [something],"['mouse', 'diary']",2,Putting [something],mouse,1,30
11844,57215,putting mouse next to box,Putting [something] next to [something],"['mouse', 'box']",2,Putting [something],mouse,1,39
1853,48823,putting mouse on a surface,Putting [something] on a surface,['mouse'],1,Putting [something],mouse,1,61
447,84637,putting mouse and hammer on the table,Putting [something] and [something] on the table,"['mouse', 'hammer']",2,Putting [something],mouse,1,40
6820,91585,putting mouse on a surface,Putting [something] on a surface,['mouse'],1,Putting [something],mouse,1,35
12307,104389,putting mouse on a surface,Putting [something] on a surface,['mouse'],1,Putting [something],mouse,1,35
13994,83743,throwing a pencil in the air and letting it fall,Throwing [something] in the air and letting it fall,['a pencil'],1,Dropping [something],pencil,1,31
6748,180601,throwing color pencils,Throwing [something],['color pencils'],1,Dropping [something],pencil,1,32
11913,50575,throwing color pencils,Throwing [something],['color pencils'],1,Dropping [something],pencil,1,28
8572,20292,throwing color pencils,Throwing [something],['color pencils'],1,Dropping [something],pencil,1,29
2712,218312,throwing color pencils,Throwing [something],['color pencils'],1,Dropping [something],pencil,1,49
6684,173880,throwing color pencils,Throwing [something],['color pencils'],1,Dropping [something],pencil,1,35
5853,58511,throwing color pencils,Throwing [something],['color pencils'],1,Dropping [something],pencil,1,35
4263,40990,throwing color pencils,Throwing [something],['color pencils'],1,Dropping [something],pencil,1,26
1796,198777,throwing color pencils,Throwing [something],['color pencils'],1,Dropping [something],pencil,1,39
166,198926,throwing color pencils,Throwing [something],['color pencils'],1,Dropping [something],pencil,1,28
3331,58470,throwing color pencils,Throwing [something],['color pencils'],1,Dropping [something],pencil,1,29
11697,78133,throwing color pencils,Throwing [something],['color pencils'],1,Dropping [something],pencil,1,28
2184,195088,throwing color pencils,Throwing [something],['color pencils'],1,Dropping [something],pencil,1,30
6871,68771,throwing color pencils,Throwing [something],['color pencils'],1,Dropping [something],pencil,1,28
624,110639,throwing color pencils,Throwing [something],['color pencils'],1,Dropping [something],pencil,1,27
2173,39534,throwing color pencils,Throwing [something],['color pencils'],1,Dropping [something],pencil,1,35
7978,3383,throwing color pencils,Throwing [something],['color pencils'],1,Dropping [something],pencil,1,29
1040,203654,throwing color pencils,Throwing [something],['color pencils'],1,Dropping [something],pencil,1,29
12350,217879,throwing color pencils,Throwing [something],['color pencils'],1,Dropping [something],pencil,1,36
6030,135054,a book falling like a rock,[Something] falling like a rock,['a book'],1,Dropping [something],book,1,53
2891,18126,throwing book onto a surface,Throwing [something] onto a surface,['book'],1,Dropping [something],book,1,48
6580,97887,book falling like a rock,[Something] falling like a rock,['book'],1,Dropping [something],book,1,40
12827,64485,a book falling like a rock,[Something] falling like a rock,['a book'],1,Dropping [something],book,1,16
2809,90820,throwing book,Throwing [something],['book'],1,Dropping [something],book,1,32
10368,109698,throwing book,Throwing [something],['book'],1,Dropping [something],book,1,35
8929,204246,throwing book,Throwing [something],['book'],1,Dropping [something],book,1,57
1225,174866,a book falling like a rock,[Something] falling like a rock,['a book'],1,Dropping [something],book,1,50
5182,191537,book falling like a rock,[Something] falling like a rock,['book'],1,Dropping [something],book,1,27
3984,16454,book falling like a rock,[Something] falling like a rock,['book'],1,Dropping [something],book,1,24
14168,116497,throwing a book,Throwing [something],['a book'],1,Dropping [something],book,1,38
13376,25805,throwing book onto a surface,Throwing [something] onto a surface,['book'],1,Dropping [something],book,1,39
7307,136896,throwing book,Throwing [something],['book'],1,Dropping [something],book,1,26
9823,190718,a book falling like a rock,[Something] falling like a rock,['a book'],1,Dropping [something],book,1,54
547,91896,throwing book,Throwing [something],['book'],1,Dropping [something],book,1,34
8197,161703,throwing book,Throwing [something],['book'],1,Dropping [something],book,1,33
1254,114545,throwing book,Throwing [something],['book'],1,Dropping [something],book,1,47
9420,51385,throwing book,Throwing [something],['book'],1,Dropping [something],book,1,26
8618,99057,throwing book,Throwing [something],['book'],1,Dropping [something],book,1,27
10048,104634,paper falling like a feather or paper,[Something] falling like a feather or paper,['paper'],1,Dropping [something],paper,1,57
12023,98613,paper falling like a feather or paper,[Something] falling like a feather or paper,['paper'],1,Dropping [something],paper,1,37
13591,80488,paper falling like a feather or paper,[Something] falling like a feather or paper,['paper'],1,Dropping [something],paper,1,52
8553,55256,throwing the paper,Throwing [something],['the paper'],1,Dropping [something],paper,1,49
9218,124169,paper falling like a feather or paper,[Something] falling like a feather or paper,['paper'],1,Dropping [something],paper,1,30
7221,177336,throwing paper,Throwing [something],['paper'],1,Dropping [something],paper,1,36
13535,121455,paper falling like a feather or paper,[Something] falling like a feather or paper,['paper'],1,Dropping [something],paper,1,51
6955,103903,throwing paper,Throwing [something],['paper'],1,Dropping [something],paper,1,38
11560,58295,throwing paper,Throwing [something],['paper'],1,Dropping [something],paper,1,34
12233,186835,paper falling like a feather or paper,[Something] falling like a feather or paper,['paper'],1,Dropping [something],paper,1,34
9529,145368,paper falling like a feather or paper,[Something] falling like a feather or paper,['paper'],1,Dropping [something],paper,1,37
13097,204188,paper falling like a feather or paper,[Something] falling like a feather or paper,['paper'],1,Dropping [something],paper,1,51
10954,54243,throwing paper,Throwing [something],['paper'],1,Dropping [something],paper,1,31
370,219187,paper falling like a feather or paper,[Something] falling like a feather or paper,['paper'],1,Dropping [something],paper,1,35
1244,90444,throwing paper,Throwing [something],['paper'],1,Dropping [something],paper,1,38
13886,76863,paper falling like a feather or paper,[Something] falling like a feather or paper,['paper'],1,Dropping [something],paper,1,33
11897,66503,paper falling like a feather or paper,[Something] falling like a feather or paper,['paper'],1,Dropping [something],paper,1,39
