,id,label,template,placeholders,num_objects,verb_class_name,noun_class_name,start_frame,stop_frame
5632,203833,lifting pencil up completely without letting it drop down,Lifting [something] up completely without letting it drop down,['pencil'],1,Picking [something] up,pencil,1,28
12315,29761,moving color pencils up,Moving [something] up,['color pencils'],1,Picking [something] up,pencil,1,23
5060,60462,lifting color pencils up completely without letting it drop down,Lifting [something] up completely without letting it drop down,['color pencils'],1,Picking [something] up,pencil,1,33
11550,156269,lifting pencil up completely without letting it drop down,Lifting [something] up completely without letting it drop down,['pencil'],1,Picking [something] up,pencil,1,29
6724,206789,moving color pencils up,Moving [something] up,['color pencils'],1,Picking [something] up,pencil,1,38
4631,2361,lifting a pencil up completely without letting it drop down,Lifting [something] up completely without letting it drop down,['a pencil'],1,Picking [something] up,pencil,1,36
685,147576,lifting color pencils up completely without letting it drop down,Lifting [something] up completely without letting it drop down,['color pencils'],1,Picking [something] up,pencil,1,37
2095,101909,moving color pencils up,Moving [something] up,['color pencils'],1,Picking [something] up,pencil,1,38
2332,19677,taking pencil out of white bowl,Taking [something] out of [something],"['pencil', 'white bowl']",2,Picking [something] up,pencil,1,43
12163,24548,moving color pencils up,Moving [something] up,['color pencils'],1,Picking [something] up,pencil,1,30
1164,68489,taking bottle from stand,Taking [something] from [somewhere],"['bottle', 'stand']",2,Picking [something] up,bottle,1,37
10611,220615,moving a bottle up,Moving [something] up,['a bottle'],1,Picking [something] up,bottle,1,41
11299,135632,taking bottles,Taking [one of many similar things on the table],['bottles'],1,Picking [something] up,bottle,1,43
11292,160998,taking bottles,Taking [one of many similar things on the table],['bottles'],1,Picking [something] up,bottle,1,49
10106,160613,picking plastic bottle up,Picking [something] up,['plastic bottle'],1,Picking [something] up,bottle,1,43
13679,176810,moving bottle up,Moving [something] up,['bottle'],1,Picking [something] up,bottle,1,36
14103,201811,taking bottle,Taking [one of many similar things on the table],['bottle'],1,Picking [something] up,bottle,1,47
3573,173232,taking plastic bottle,Taking [one of many similar things on the table],['plastic bottle'],1,Picking [something] up,bottle,1,59
3114,67799,moving water bottle up,Moving [something] up,['water bottle'],1,Picking [something] up,bottle,1,39
3086,136580,moving bottle up,Moving [something] up,['bottle'],1,Picking [something] up,bottle,1,28
7893,40015,taking pens,Taking [one of many similar things on the table],['pens'],1,Picking [something] up,pen,1,38
9370,96328,taking pens,Taking [one of many similar things on the table],['pens'],1,Picking [something] up,pen,1,32
3557,204947,moving pen up,Moving [something] up,['pen'],1,Picking [something] up,pen,1,45
5394,185910,taking pens,Taking [one of many similar things on the table],['pens'],1,Picking [something] up,pen,1,33
1834,122658,taking pen,Taking [one of many similar things on the table],['pen'],1,Picking [something] up,pen,1,57
433,162704,taking pen out of glass,Taking [something] out of [something],"['pen', 'glass']",2,Picking [something] up,pen,1,43
4561,89892,picking a pen up,Picking [something] up,['a pen'],1,Picking [something] up,pen,1,37
6352,49650,taking pen,Taking [one of many similar things on the table],['pen'],1,Picking [something] up,pen,1,46
9695,138716,picking pen up,Picking [something] up,['pen'],1,Picking [something] up,pen,1,27
1696,100227,moving pen up,Moving [something] up,['pen'],1,Picking [something] up,pen,1,30
12846,18698,moving book up,Moving [something] up,['book'],1,Picking [something] up,book,1,55
14780,132392,lifting a book with a bottle of honey on it,Lifting [something] with [something] on it,"['a book', 'a bottle of honey']",2,Picking [something] up,book,1,49
6200,150983,lifting a book up completely without letting it drop down,Lifting [something] up completely without letting it drop down,['a book'],1,Picking [something] up,book,1,71
10340,49825,lifting book with steel ring on it,Lifting [something] with [something] on it,"['book', 'steel ring']",2,Picking [something] up,book,1,42
6743,82072,moving a book up,Moving [something] up,['a book'],1,Picking [something] up,book,1,37
6852,177190,lifting a book with a mouse on it,Lifting [something] with [something] on it,"['a book', 'a mouse']",2,Picking [something] up,book,1,51
2968,55137,lifting book with whistle on it,Lifting [something] with [something] on it,"['book', 'whistle']",2,Picking [something] up,book,1,50
14709,167013,moving a book up,Moving [something] up,['a book'],1,Picking [something] up,book,1,50
2710,173969,lifting a book with a pen on it,Lifting [something] with [something] on it,"['a book', 'a pen']",2,Picking [something] up,book,1,50
8359,83501,lifting book with biscuit on it,Lifting [something] with [something] on it,"['book', 'biscuit']",2,Picking [something] up,book,1,31
11474,35034,picking a box up,Picking [something] up,['a box'],1,Picking [something] up,box,1,48
5984,36865,lifting box with tumbler on it,Lifting [something] with [something] on it,"['box', 'tumbler']",2,Picking [something] up,box,1,37
12174,119360,lifting a box with a watch on it,Lifting [something] with [something] on it,"['a box', 'a watch']",2,Picking [something] up,box,1,51
4199,25228,lifting a box with a match box on it,Lifting [something] with [something] on it,"['a box', 'a match box']",2,Picking [something] up,box,1,32
357,154132,lifting a box with an ice pack on it,Lifting [something] with [something] on it,"['a box', 'an ice pack']",2,Picking [something] up,box,1,72
6181,211758,moving box up,Moving [something] up,['box'],1,Picking [something] up,box,1,61
13045,199600,lifting box with bottle on it,Lifting [something] with [something] on it,"['box', 'bottle']",2,Picking [something] up,box,1,63
13421,24136,lifting box with marker on it,Lifting [something] with [something] on it,"['box', 'marker']",2,Picking [something] up,box,1,38
8294,120794,lifting box with fork on it,Lifting [something] with [something] on it,"['box', 'fork']",2,Picking [something] up,box,1,57
10536,106133,lifting box with head bomb box on it,Lifting [something] with [something] on it,"['box', 'head bomb box']",2,Picking [something] up,box,1,45
8473,211208,moving remote control up,Moving [something] up,['remote control'],1,Picking [something] up,remote,1,60
10762,133999,taking remote,Taking [one of many similar things on the table],['remote'],1,Picking [something] up,remote,1,29
10885,16780,lifting remote control up completely without letting it drop down,Lifting [something] up completely without letting it drop down,['remote control'],1,Picking [something] up,remote,1,65
526,208468,taking a remote control out of a box,Taking [something] out of [something],"['a remote control', 'a box']",2,Picking [something] up,remote,1,38
8119,177453,moving remote up,Moving [something] up,['remote'],1,Picking [something] up,remote,1,33
1576,117760,moving remote up,Moving [something] up,['remote'],1,Picking [something] up,remote,1,22
8606,21788,taking remote out of bag,Taking [something] out of [something],"['remote', 'bag']",2,Picking [something] up,remote,1,51
8582,89048,taking remote,Taking [one of many similar things on the table],['remote'],1,Picking [something] up,remote,1,29
12589,86808,moving remote up,Moving [something] up,['remote'],1,Picking [something] up,remote,1,28
6874,133829,taking remote,Taking [one of many similar things on the table],['remote'],1,Picking [something] up,remote,1,31
8557,119193,picking knife up,Picking [something] up,['knife'],1,Picking [something] up,knife,1,56
6754,38047,moving knife up,Moving [something] up,['knife'],1,Picking [something] up,knife,1,36
13899,204395,taking knife out of mug,Taking [something] out of [something],"['knife', 'mug']",2,Picking [something] up,knife,1,60
208,172917,taking knife out of cub,Taking [something] out of [something],"['knife', 'cub']",2,Picking [something] up,knife,1,47
1291,31872,moving knife up,Moving [something] up,['knife'],1,Picking [something] up,knife,1,17
2482,109718,taking knife,Taking [one of many similar things on the table],['knife'],1,Picking [something] up,knife,1,53
9576,122129,lifting knife up completely without letting it drop down,Lifting [something] up completely without letting it drop down,['knife'],1,Picking [something] up,knife,1,34
10551,33610,lifting a knife up completely without letting it drop down,Lifting [something] up completely without letting it drop down,['a knife'],1,Picking [something] up,knife,1,40
9109,185532,moving knife up,Moving [something] up,['knife'],1,Picking [something] up,knife,1,18
13519,33184,moving knife up,Moving [something] up,['knife'],1,Picking [something] up,knife,1,32
6665,87026,moving brush up,Moving [something] up,['brush'],1,Picking [something] up,brush,1,62
11899,74264,taking brush out of case,Taking [something] out of [something],"['brush', 'case']",2,Picking [something] up,brush,1,32
6461,110917,taking a brush out of a box,Taking [something] out of [something],"['a brush', 'a box']",2,Picking [something] up,brush,1,28
2792,91494,moving brush up,Moving [something] up,['brush'],1,Picking [something] up,brush,1,50
14315,109268,lifting brush with paper on it,Lifting [something] with [something] on it,"['brush', 'paper']",2,Picking [something] up,brush,1,50
12622,83710,lifting brush up completely without letting it drop down,Lifting [something] up completely without letting it drop down,['brush'],1,Picking [something] up,brush,1,33
6178,87839,taking brush out of plastic glass,Taking [something] out of [something],"['brush', 'plastic glass']",2,Picking [something] up,brush,1,51
9054,24266,taking brush out of blue bowl,Taking [something] out of [something],"['brush', 'blue bowl']",2,Picking [something] up,brush,1,39
11518,186775,taking brush from holder,Taking [something] from [somewhere],"['brush', 'holder']",2,Picking [something] up,brush,1,37
5605,161624,taking brush from table,Taking [something] from [somewhere],"['brush', 'table']",2,Picking [something] up,brush,1,29
6219,183686,putting a pencil on a surface,Putting [something] on a surface,['a pencil'],1,Putting [something],pencil,1,32
2396,172680,putting color pencils on a surface,Putting [something] on a surface,['color pencils'],1,Putting [something],pencil,1,30
2384,205128,putting pencil on a surface,Putting [something] on a surface,['pencil'],1,Putting [something],pencil,1,53
3788,63372,"putting pencil, banana and onion on the table","Putting [something], [something] and [something] on the table","['pencil', 'banana', 'onion']",3,Putting [something],pencil,1,55
249,176705,putting color pencils on a surface,Putting [something] on a surface,['color pencils'],1,Putting [something],pencil,1,48
10560,139793,"putting a pencil, a pencil sharpener and an eraser on the table","Putting [something], [something] and [something] on the table","['a pencil', 'a pencil sharpener', 'an eraser']",3,Putting [something],pencil,1,68
9240,11399,putting a pencil and a pen on the table,Putting [something] and [something] on the table,"['a pencil', 'a pen']",2,Putting [something],pencil,1,60
4765,123054,putting pencil,Putting [something similar to other things that are already on the table],['pencil'],1,Putting [something],pencil,1,29
12879,169552,putting color pencils on a surface,Putting [something] on a surface,['color pencils'],1,Putting [something],pencil,1,28
7491,174491,putting color pencils on a surface,Putting [something] on a surface,['color pencils'],1,Putting [something],pencil,1,27
3526,66291,putting a bottle next to a glass,Putting [something] next to [something],"['a bottle', 'a glass']",2,Putting [something],bottle,1,38
1299,59002,putting a bottle on a surface,Putting [something] on a surface,['a bottle'],1,Putting [something],bottle,1,44
7995,158992,putting water bottle and mortein mosquito killer packet on the table,Putting [something] and [something] on the table,"['water bottle', 'mortein mosquito killer packet']",2,Putting [something],bottle,1,50
5627,129807,putting bottle next to bottle,Putting [something] next to [something],"['bottle', 'bottle']",2,Putting [something],bottle,1,51
13229,7493,putting bottle behind shoe,Putting [something] behind [something],"['bottle', 'shoe']",2,Putting [something],bottle,1,47
1023,73022,putting bottle,Putting [something similar to other things that are already on the table],['bottle'],1,Putting [something],bottle,1,31
2394,84941,putting bottle,Putting [something similar to other things that are already on the table],['bottle'],1,Putting [something],bottle,1,37
6822,23659,putting plastic bottle onto table,Putting [something] onto [something],"['plastic bottle', 'table']",2,Putting [something],bottle,1,36
11207,88156,putting bottle onto note,Putting [something] onto [something],"['bottle', 'note']",2,Putting [something],bottle,1,37
8023,105095,putting water bottle next to water bottle,Putting [something] next to [something],"['water bottle', 'water bottle']",2,Putting [something],bottle,1,38
5985,171432,putting pen on a surface,Putting [something] on a surface,['pen'],1,Putting [something],pen,1,37
13907,166000,putting a pen,Putting [something similar to other things that are already on the table],['a pen'],1,Putting [something],pen,1,43
4327,63002,putting pen onto wallet,Putting [something] onto [something],"['pen', 'wallet']",2,Putting [something],pen,1,42
7362,126494,putting pen,Putting [something similar to other things that are already on the table],['pen'],1,Putting [something],pen,1,45
5311,49627,putting pen next to box,Putting [something] next to [something],"['pen', 'box']",2,Putting [something],pen,1,44
774,133871,putting pen on a flat surface without letting it roll,Putting [something] on a flat surface without letting it roll,['pen'],1,Putting [something],pen,1,49
5693,164046,putting pen,Putting [something similar to other things that are already on the table],['pen'],1,Putting [something],pen,1,42
9942,75564,putting pen,Putting [something similar to other things that are already on the table],['pen'],1,Putting [something],pen,1,42
7146,179358,putting pen and camera pouch on the table,Putting [something] and [something] on the table,"['pen', 'camera pouch']",2,Putting [something],pen,1,57
3572,4005,putting pen and pen on the table,Putting [something] and [something] on the table,"['pen', 'pen']",2,Putting [something],pen,1,39
1740,50164,putting a book on a surface,Putting [something] on a surface,['a book'],1,Putting [something],book,1,46
10397,147921,putting book onto bag,Putting [something] onto [something],"['book', 'bag']",2,Putting [something],book,1,51
2593,178279,putting book behind can,Putting [something] behind [something],"['book', 'can']",2,Putting [something],book,1,44
715,123044,putting a book next to a controller,Putting [something] next to [something],"['a book', 'a controller']",2,Putting [something],book,1,43
3830,31306,putting book,Putting [something similar to other things that are already on the table],['book'],1,Putting [something],book,1,46
213,140014,putting book,Putting [something similar to other things that are already on the table],['book'],1,Putting [something],book,1,34
11229,89873,"putting book, glasses and hilighter on the table","Putting [something], [something] and [something] on the table","['book', 'glasses', 'hilighter']",3,Putting [something],book,1,72
2321,117775,"putting a book, a pen and a battery on the table","Putting [something], [something] and [something] on the table","['a book', 'a pen', 'a battery']",3,Putting [something],book,1,64
7349,89610,putting a book on a surface,Putting [something] on a surface,['a book'],1,Putting [something],book,1,47
13322,146709,putting a book,Putting [something similar to other things that are already on the table],['a book'],1,Putting [something],book,1,50
14165,201372,putting a box next to a bucket,Putting [something] next to [something],"['a box', 'a bucket']",2,Putting [something],box,1,62
10799,185007,putting box behind a crown,Putting [something] behind [something],"['box', 'a crown']",2,Putting [something],box,1,35
9914,155539,putting the box,Putting [something similar to other things that are already on the table],['the box'],1,Putting [something],box,1,50
4659,81907,"putting box, calculator and stamp ink on the table","Putting [something], [something] and [something] on the table","['box', 'calculator', 'stamp ink']",3,Putting [something],box,1,49
273,175922,putting box next to sambrani holder,Putting [something] next to [something],"['box', 'sambrani holder']",2,Putting [something],box,1,43
2534,150348,"putting box, book and coin on the table","Putting [something], [something] and [something] on the table","['box', 'book', 'coin']",3,Putting [something],box,1,48
5391,122510,putting box on a surface,Putting [something] on a surface,['box'],1,Putting [something],box,1,36
10333,64141,putting a box onto its side,Putting [something] onto [something],"['a box', 'its side']",2,Putting [something],box,1,52
228,115843,putting box behind box,Putting [something] behind [something],"['box', 'box']",2,Putting [something],box,1,36
342,35608,putting box and cable on the table,Putting [something] and [something] on the table,"['box', 'cable']",2,Putting [something],box,1,35
2385,185924,putting mobile on a surface,Putting [something] on a surface,['mobile'],1,Putting [something],phone,1,32
2323,92124,putting mobile onto table,Putting [something] onto [something],"['mobile', 'table']",2,Putting [something],phone,1,30
2829,29773,putting phone next to phone,Putting [something] next to [something],"['phone', 'phone']",2,Putting [something],phone,1,36
537,84712,putting mobile next to remote,Putting [something] next to [something],"['mobile', 'remote']",2,Putting [something],phone,1,62
5102,41788,putting a mobile on a surface,Putting [something] on a surface,['a mobile'],1,Putting [something],phone,1,37
5438,210829,putting mobile and mirror on the table,Putting [something] and [something] on the table,"['mobile', 'mirror']",2,Putting [something],phone,1,48
4080,184431,putting a phone,Putting [something similar to other things that are already on the table],['a phone'],1,Putting [something],phone,1,42
9657,168808,putting phone next to hard disk,Putting [something] next to [something],"['phone', 'hard disk']",2,Putting [something],phone,1,41
3670,41723,"putting phone, purse and oinment tube on the table","Putting [something], [something] and [something] on the table","['phone', 'purse', 'oinment tube']",3,Putting [something],phone,1,63
4142,174082,putting a mobile next to puncher,Putting [something] next to [something],"['a mobile', 'puncher']",2,Putting [something],phone,1,61
2260,4129,putting mouse onto laptop,Putting [something] onto [something],"['mouse', 'laptop']",2,Putting [something],mouse,1,50
24,84952,putting mouse on a surface,Putting [something] on a surface,['mouse'],1,Putting [something],mouse,1,45
14111,79647,putting mouse on a surface,Putting [something] on a surface,['mouse'],1,Putting [something],mouse,1,39
4911,84763,putting mouse on a surface,Putting [something] on a surface,['mouse'],1,Putting [something],mouse,1,61
13748,142572,putting a mouse on a surface,Putting [something] on a surface,['a mouse'],1,Putting [something],mouse,1,35
11070,200609,putting mouse and radio on the table,Putting [something] and [something] on the table,"['mouse', 'radio']",2,Putting [something],mouse,1,60
2744,162384,putting mouse on a surface,Putting [something] on a surface,['mouse'],1,Putting [something],mouse,1,42
5062,123107,putting mouse on a surface,Putting [something] on a surface,['mouse'],1,Putting [something],mouse,1,35
14410,203953,putting a mouse onto a mouse pad,Putting [something] onto [something],"['a mouse', 'a mouse pad']",2,Putting [something],mouse,1,62
11673,88717,putting mouse on a surface,Putting [something] on a surface,['mouse'],1,Putting [something],mouse,1,60
870,98848,putting glasses onto cooler,Putting [something] onto [something],"['glasses', 'cooler']",2,Putting [something],glasses,1,46
7511,147570,putting glasses behind a toy castle,Putting [something] behind [something],"['glasses', 'a toy castle']",2,Putting [something],glasses,1,63
14290,58136,putting glasses next to a watch,Putting [something] next to [something],"['glasses', 'a watch']",2,Putting [something],glasses,1,60
8045,119626,putting glasses on a surface,Putting [something] on a surface,['glasses'],1,Putting [something],glasses,1,33
6569,80886,putting glasses on a surface,Putting [something] on a surface,['glasses'],1,Putting [something],glasses,1,33
4016,10592,putting glasses on a surface,Putting [something] on a surface,['glasses'],1,Putting [something],glasses,1,41
8082,193122,putting glasses next to scissors,Putting [something] next to [something],"['glasses', 'scissors']",2,Putting [something],glasses,1,50
12483,154691,putting glasses on a surface,Putting [something] on a surface,['glasses'],1,Putting [something],glasses,1,45
8593,106664,putting glasses on a surface,Putting [something] on a surface,['glasses'],1,Putting [something],glasses,1,33
3940,142699,throwing color pencils,Throwing [something],['color pencils'],1,Dropping [something],pencil,1,31
10351,198229,throwing color pencils,Throwing [something],['color pencils'],1,Dropping [something],pencil,1,30
798,139917,throwing color pencils,Throwing [something],['color pencils'],1,Dropping [something],pencil,1,26
6938,33335,throwing pencil,Throwing [something],['pencil'],1,Dropping [something],pencil,1,22
1535,63691,a pencil falling like a rock,[Something] falling like a rock,['a pencil'],1,Dropping [something],pencil,1,23
6446,217128,throwing color pencils,Throwing [something],['color pencils'],1,Dropping [something],pencil,1,49
1796,198777,throwing color pencils,Throwing [something],['color pencils'],1,Dropping [something],pencil,1,39
593,122723,throwing color pencils,Throwing [something],['color pencils'],1,Dropping [something],pencil,1,49
12251,5436,throwing color pencils,Throwing [something],['color pencils'],1,Dropping [something],pencil,1,29
3762,212165,throwing bottle,Throwing [something],['bottle'],1,Dropping [something],bottle,1,53
1974,218063,bottle falling like a rock,[Something] falling like a rock,['bottle'],1,Dropping [something],bottle,1,34
3825,80395,throwing a water bottle,Throwing [something],['a water bottle'],1,Dropping [something],bottle,1,63
14147,165181,plastic bottle falling like a rock,[Something] falling like a rock,['plastic bottle'],1,Dropping [something],bottle,1,29
722,28401,throwing bottle onto a surface,Throwing [something] onto a surface,['bottle'],1,Dropping [something],bottle,1,40
242,4517,throwing plastic bottle,Throwing [something],['plastic bottle'],1,Dropping [something],bottle,1,50
353,165440,a bottle falling like a rock,[Something] falling like a rock,['a bottle'],1,Dropping [something],bottle,1,42
14096,117327,a bottle falling like a rock,[Something] falling like a rock,['a bottle'],1,Dropping [something],bottle,1,31
6308,22708,a water bottle falling like a rock,[Something] falling like a rock,['a water bottle'],1,Dropping [something],bottle,1,27
2558,171256,throwing pen,Throwing [something],['pen'],1,Dropping [something],pen,1,49
7292,69223,throwing pen,Throwing [something],['pen'],1,Dropping [something],pen,1,25
8666,100285,throwing pen onto a surface,Throwing [something] onto a surface,['pen'],1,Dropping [something],pen,1,38
1110,8447,throwing pen,Throwing [something],['pen'],1,Dropping [something],pen,1,33
14504,103428,pen falling like a rock,[Something] falling like a rock,['pen'],1,Dropping [something],pen,1,45
4229,104167,pen falling like a rock,[Something] falling like a rock,['pen'],1,Dropping [something],pen,1,44
5612,73698,throwing a pen onto a surface,Throwing [something] onto a surface,['a pen'],1,Dropping [something],pen,1,50
5628,90031,pen falling like a rock,[Something] falling like a rock,['pen'],1,Dropping [something],pen,1,14
13803,20493,throwing a pen,Throwing [something],['a pen'],1,Dropping [something],pen,1,45
1037,172246,throwing book,Throwing [something],['book'],1,Dropping [something],book,1,35
513,132825,throwing book,Throwing [something],['book'],1,Dropping [something],book,1,28
7903,112064,throwing book,Throwing [something],['book'],1,Dropping [something],book,1,29
621,137484,throwing book,Throwing [something],['book'],1,Dropping [something],book,1,26
10770,61825,throwing book,Throwing [something],['book'],1,Dropping [something],book,1,32
11779,14885,throwing book,Throwing [something],['book'],1,Dropping [something],book,1,32
5575,51485,throwing book,Throwing [something],['book'],1,Dropping [something],book,1,34
7307,136896,throwing book,Throwing [something],['book'],1,Dropping [something],book,1,26
2665,210830,throwing book,Throwing [something],['book'],1,Dropping [something],book,1,32
2565,126871,throwing box in the air and letting it fall,Throwing [something] in the air and letting it fall,['box'],1,Dropping [something],box,1,57
2353,7589,throwing box onto a surface,Throwing [something] onto a surface,['box'],1,Dropping [something],box,1,34
4154,133937,box falling like a rock,[Something] falling like a rock,['box'],1,Dropping [something],box,1,41
852,179872,throwing a box in the air and letting it fall,Throwing [something] in the air and letting it fall,['a box'],1,Dropping [something],box,1,32
6836,72870,box falling like a rock,[Something] falling like a rock,['box'],1,Dropping [something],box,1,33
7299,172988,box falling like a rock,[Something] falling like a rock,['box'],1,Dropping [something],box,1,48
