,id,label,template,placeholders,num_objects,verb_class_name,noun_class_name,start_frame,stop_frame
959,61890,moving pencil up,Moving [something] up,['pencil'],1,Picking [something] up,pencil,1,37
6745,130720,lifting pencil up completely without letting it drop down,Lifting [something] up completely without letting it drop down,['pencil'],1,Picking [something] up,pencil,1,28
5286,30872,lifting pencil up completely without letting it drop down,Lifting [something] up completely without letting it drop down,['pencil'],1,Picking [something] up,pencil,1,26
3540,19213,moving color pencils up,Moving [something] up,['color pencils'],1,Picking [something] up,pencil,1,30
2920,103465,moving pencil up,Moving [something] up,['pencil'],1,Picking [something] up,pencil,1,26
8340,193500,picking bottle up,Picking [something] up,['bottle'],1,Picking [something] up,bottle,1,45
3400,132577,taking bottle,Taking [one of many similar things on the table],['bottle'],1,Picking [something] up,bottle,1,16
7579,143310,lifting water bottle up completely without letting it drop down,Lifting [something] up completely without letting it drop down,['water bottle'],1,Picking [something] up,bottle,1,56
14730,35530,moving bottle up,Moving [something] up,['bottle'],1,Picking [something] up,bottle,1,32
2861,144508,moving bottle up,Moving [something] up,['bottle'],1,Picking [something] up,bottle,1,38
10938,203343,taking a pen from a cubbie,Taking [something] from [somewhere],"['a pen', 'a cubbie']",2,Picking [something] up,pen,1,65
8021,212564,picking pen up,Picking [something] up,['pen'],1,Picking [something] up,pen,1,25
12297,69424,taking pen from table,Taking [something] from [somewhere],"['pen', 'table']",2,Picking [something] up,pen,1,28
8182,90385,taking pens,Taking [one of many similar things on the table],['pens'],1,Picking [something] up,pen,1,37
10264,186361,taking a pen out of a box,Taking [something] out of [something],"['a pen', 'a box']",2,Picking [something] up,pen,1,40
14345,218735,taking a book,Taking [one of many similar things on the table],['a book'],1,Picking [something] up,book,1,43
3558,59540,moving book up,Moving [something] up,['book'],1,Picking [something] up,book,1,34
7173,85796,moving book up,Moving [something] up,['book'],1,Picking [something] up,book,1,31
6186,169061,lifting book with sock on it,Lifting [something] with [something] on it,"['book', 'sock']",2,Picking [something] up,book,1,62
3268,77199,taking a book from a shelf,Taking [something] from [somewhere],"['a book', 'a shelf']",2,Picking [something] up,book,1,46
6275,76724,lifting box with box on it,Lifting [something] with [something] on it,"['box', 'box']",2,Picking [something] up,box,1,47
1114,115497,lifting box with binder clips on it,Lifting [something] with [something] on it,"['box', 'binder clips']",2,Picking [something] up,box,1,47
10536,106133,lifting box with head bomb box on it,Lifting [something] with [something] on it,"['box', 'head bomb box']",2,Picking [something] up,box,1,45
8058,98308,lifting box with phone on it,Lifting [something] with [something] on it,"['box', 'phone']",2,Picking [something] up,box,1,50
3958,157055,lifting box with funnel on it,Lifting [something] with [something] on it,"['box', 'funnel']",2,Picking [something] up,box,1,42
12649,178411,putting color pencils on a surface,Putting [something] on a surface,['color pencils'],1,Putting [something],pencil,1,27
14716,173702,putting pencil,Putting [something similar to other things that are already on the table],['pencil'],1,Putting [something],pencil,1,29
12327,57597,putting color pencils on a surface,Putting [something] on a surface,['color pencils'],1,Putting [something],pencil,1,27
3850,199133,putting color pencil on a surface,Putting [something] on a surface,['color pencil'],1,Putting [something],pencil,1,32
12260,41552,putting color pencils on a surface,Putting [something] on a surface,['color pencils'],1,Putting [something],pencil,1,38
13232,62403,"putting a plastic bottle that can't roll onto a slanted surface, so it stays where it is","Putting [something] that can't roll onto a slanted surface, so it stays where it is",['a plastic bottle'],1,Putting [something],bottle,1,42
2217,44810,putting bottle on a surface,Putting [something] on a surface,['bottle'],1,Putting [something],bottle,1,34
11512,66127,putting a plastic bottle,Putting [something similar to other things that are already on the table],['a plastic bottle'],1,Putting [something],bottle,1,40
3456,82450,putting bottle and vegetable on the table,Putting [something] and [something] on the table,"['bottle', 'vegetable']",2,Putting [something],bottle,1,37
5152,79119,"putting a bottle, a lunch box and a spoon on the table","Putting [something], [something] and [something] on the table","['a bottle', 'a lunch box', 'a spoon']",3,Putting [something],bottle,1,60
9707,193335,putting pen onto shoe,Putting [something] onto [something],"['pen', 'shoe']",2,Putting [something],pen,1,47
545,175096,"putting pens, padlock and rexona on the table","Putting [something], [something] and [something] on the table","['pens', 'padlock', 'rexona']",3,Putting [something],pen,1,55
4150,133666,putting pen next to mug,Putting [something] next to [something],"['pen', 'mug']",2,Putting [something],pen,1,48
1059,81562,putting pen on a surface,Putting [something] on a surface,['pen'],1,Putting [something],pen,1,33
13814,51445,putting a pen next to sunglasses,Putting [something] next to [something],"['a pen', 'sunglasses']",2,Putting [something],pen,1,46
13638,211145,putting the book on a surface,Putting [something] on a surface,['the book'],1,Putting [something],book,1,57
2763,98155,putting book on a surface,Putting [something] on a surface,['book'],1,Putting [something],book,1,53
2539,29167,putting book,Putting [something similar to other things that are already on the table],['book'],1,Putting [something],book,1,31
7176,201782,putting book on a surface,Putting [something] on a surface,['book'],1,Putting [something],book,1,50
12254,123264,"putting book that can't roll onto a slanted surface, so it stays where it is","Putting [something] that can't roll onto a slanted surface, so it stays where it is",['book'],1,Putting [something],book,1,45
4535,64251,putting box behind box,Putting [something] behind [something],"['box', 'box']",2,Putting [something],box,1,51
6823,171649,putting box next to purse,Putting [something] next to [something],"['box', 'purse']",2,Putting [something],box,1,35
1607,932,"putting box, cigarette and lighters on the table","Putting [something], [something] and [something] on the table","['box', 'cigarette', 'lighters']",3,Putting [something],box,1,63
13533,152106,putting box onto prayer book,Putting [something] onto [something],"['box', 'prayer book']",2,Putting [something],box,1,45
5809,63213,putting box onto box,Putting [something] onto [something],"['box', 'box']",2,Putting [something],box,1,63
5848,191611,throwing pencil in the air and letting it fall,Throwing [something] in the air and letting it fall,['pencil'],1,Dropping [something],pencil,1,48
6748,180601,throwing color pencils,Throwing [something],['color pencils'],1,Dropping [something],pencil,1,32
10218,166682,throwing color pencils,Throwing [something],['color pencils'],1,Dropping [something],pencil,1,28
2989,10067,throwing pencil in the air and letting it fall,Throwing [something] in the air and letting it fall,['pencil'],1,Dropping [something],pencil,1,20
2903,64528,throwing color pencils,Throwing [something],['color pencils'],1,Dropping [something],pencil,1,30
3927,79669,throwing bottle,Throwing [something],['bottle'],1,Dropping [something],bottle,1,34
8603,194884,throwing bottle in the air and letting it fall,Throwing [something] in the air and letting it fall,['bottle'],1,Dropping [something],bottle,1,41
1448,150084,throwing bottle,Throwing [something],['bottle'],1,Dropping [something],bottle,1,66
2906,179511,throwing plastic bottle onto a surface,Throwing [something] onto a surface,['plastic bottle'],1,Dropping [something],bottle,1,42
14237,194017,bottle falling like a rock,[Something] falling like a rock,['bottle'],1,Dropping [something],bottle,1,27
13902,62472,pen falling like a rock,[Something] falling like a rock,['pen'],1,Dropping [something],pen,1,30
12896,14515,throwing pen in the air and letting it fall,Throwing [something] in the air and letting it fall,['pen'],1,Dropping [something],pen,1,40
13338,24711,a pen falling like a rock,[Something] falling like a rock,['a pen'],1,Dropping [something],pen,1,43
14590,205379,a pen falling like a rock,[Something] falling like a rock,['a pen'],1,Dropping [something],pen,1,26
4813,200160,throwing a pen onto a surface,Throwing [something] onto a surface,['a pen'],1,Dropping [something],pen,1,35
6030,135054,a book falling like a rock,[Something] falling like a rock,['a book'],1,Dropping [something],book,1,53
2891,18126,throwing book onto a surface,Throwing [something] onto a surface,['book'],1,Dropping [something],book,1,48
6580,97887,book falling like a rock,[Something] falling like a rock,['book'],1,Dropping [something],book,1,40
14021,207188,book falling like a rock,[Something] falling like a rock,['book'],1,Dropping [something],book,1,26
2809,90820,throwing book,Throwing [something],['book'],1,Dropping [something],book,1,32
12373,193171,box falling like a rock,[Something] falling like a rock,['box'],1,Dropping [something],box,1,39
6562,13989,throwing a box in the air and letting it fall,Throwing [something] in the air and letting it fall,['a box'],1,Dropping [something],box,1,45
7778,110942,a box falling like a rock,[Something] falling like a rock,['a box'],1,Dropping [something],box,1,31
11041,100605,throwing box,Throwing [something],['box'],1,Dropping [something],box,1,46
9434,32695,box falling like a rock,[Something] falling like a rock,['box'],1,Dropping [something],box,1,39
777,159429,pushing color pencils from left to right,Pushing [something] from left to right,['color pencils'],1,Moving [something] from left to right,pencil,1,29
2105,1982,pushing color pencils from left to right,Pushing [something] from left to right,['color pencils'],1,Moving [something] from left to right,pencil,1,28
5730,137237,pushing color pencils from left to right,Pushing [something] from left to right,['color pencils'],1,Moving [something] from left to right,pencil,1,38
3949,109716,pushing color pencils from left to right,Pushing [something] from left to right,['color pencils'],1,Moving [something] from left to right,pencil,1,35
2494,33156,pushing color pencils from left to right,Pushing [something] from left to right,['color pencils'],1,Moving [something] from left to right,pencil,1,40
8996,210346,pushing bottle from left to right,Pushing [something] from left to right,['bottle'],1,Moving [something] from left to right,bottle,1,55
6459,36342,pushing plastic bottle from left to right,Pushing [something] from left to right,['plastic bottle'],1,Moving [something] from left to right,bottle,1,48
4819,15716,pushing bottle from left to right,Pushing [something] from left to right,['bottle'],1,Moving [something] from left to right,bottle,1,36
7255,212782,pulling bottle from left to right,Pulling [something] from left to right,['bottle'],1,Moving [something] from left to right,bottle,1,36
11835,215263,pushing bottle from left to right,Pushing [something] from left to right,['bottle'],1,Moving [something] from left to right,bottle,1,36
5739,142338,pushing pen from left to right,Pushing [something] from left to right,['pen'],1,Moving [something] from left to right,pen,1,42
9346,22793,pushing pen from left to right,Pushing [something] from left to right,['pen'],1,Moving [something] from left to right,pen,1,26
5505,90465,pulling pen from left to right,Pulling [something] from left to right,['pen'],1,Moving [something] from left to right,pen,1,37
14557,50424,pushing pen from left to right,Pushing [something] from left to right,['pen'],1,Moving [something] from left to right,pen,1,35
7808,89557,pulling pen from left to right,Pulling [something] from left to right,['pen'],1,Moving [something] from left to right,pen,1,47
5419,202829,pushing book from left to right,Pushing [something] from left to right,['book'],1,Moving [something] from left to right,book,1,30
3893,35702,pushing book from left to right,Pushing [something] from left to right,['book'],1,Moving [something] from left to right,book,1,30
6817,195249,pushing book from left to right,Pushing [something] from left to right,['book'],1,Moving [something] from left to right,book,1,34
12952,118889,pushing book from left to right,Pushing [something] from left to right,['book'],1,Moving [something] from left to right,book,1,54
12502,128153,pushing book from left to right,Pushing [something] from left to right,['book'],1,Moving [something] from left to right,book,1,32
7023,208098,pulling a box from left to right,Pulling [something] from left to right,['a box'],1,Moving [something] from left to right,box,1,45
8885,119708,pushing box from left to right,Pushing [something] from left to right,['box'],1,Moving [something] from left to right,box,1,57
5958,173399,pushing box from left to right,Pushing [something] from left to right,['box'],1,Moving [something] from left to right,box,1,69
14106,77208,pulling box from left to right,Pulling [something] from left to right,['box'],1,Moving [something] from left to right,box,1,45
10457,181298,pulling box from left to right,Pulling [something] from left to right,['box'],1,Moving [something] from left to right,box,1,50
9319,48949,pushing color pencils from right to left,Pushing [something] from right to left,['color pencils'],1,Moving [something] from right to left,pencil,1,27
1594,103679,pushing color pencils from right to left,Pushing [something] from right to left,['color pencils'],1,Moving [something] from right to left,pencil,1,22
9459,213179,pushing pencil from right to left,Pushing [something] from right to left,['pencil'],1,Moving [something] from right to left,pencil,1,60
12170,27739,pushing pencil from right to left,Pushing [something] from right to left,['pencil'],1,Moving [something] from right to left,pencil,1,37
10834,122587,pushing color pencils from right to left,Pushing [something] from right to left,['color pencils'],1,Moving [something] from right to left,pencil,1,26
10811,96179,pushing a bottle from right to left,Pushing [something] from right to left,['a bottle'],1,Moving [something] from right to left,bottle,1,58
12454,73528,pulling a plastic bottle from right to left,Pulling [something] from right to left,['a plastic bottle'],1,Moving [something] from right to left,bottle,1,41
6188,94979,pulling a bottle from right to left,Pulling [something] from right to left,['a bottle'],1,Moving [something] from right to left,bottle,1,52
11103,100860,pulling plastic bottle from right to left,Pulling [something] from right to left,['plastic bottle'],1,Moving [something] from right to left,bottle,1,47
10773,150193,pushing bottle from right to left,Pushing [something] from right to left,['bottle'],1,Moving [something] from right to left,bottle,1,32
13976,134888,pushing pen from right to left,Pushing [something] from right to left,['pen'],1,Moving [something] from right to left,pen,1,52
12645,166896,pushing pen from right to left,Pushing [something] from right to left,['pen'],1,Moving [something] from right to left,pen,1,73
6116,126801,pulling pen from right to left,Pulling [something] from right to left,['pen'],1,Moving [something] from right to left,pen,1,26
12018,108108,pulling a pen from right to left,Pulling [something] from right to left,['a pen'],1,Moving [something] from right to left,pen,1,68
11833,105940,pulling pen from right to left,Pulling [something] from right to left,['pen'],1,Moving [something] from right to left,pen,1,55
6534,155960,pushing book from right to left,Pushing [something] from right to left,['book'],1,Moving [something] from right to left,book,1,28
6887,88832,pushing book from right to left,Pushing [something] from right to left,['book'],1,Moving [something] from right to left,book,1,32
5238,216102,pulling book from right to left,Pulling [something] from right to left,['book'],1,Moving [something] from right to left,book,1,35
6707,140603,pushing a book from right to left,Pushing [something] from right to left,['a book'],1,Moving [something] from right to left,book,1,36
6427,149132,pushing book from right to left,Pushing [something] from right to left,['book'],1,Moving [something] from right to left,book,1,41
3481,92981,pushing a box from right to left,Pushing [something] from right to left,['a box'],1,Moving [something] from right to left,box,1,29
10601,155324,pulling box from right to left,Pulling [something] from right to left,['box'],1,Moving [something] from right to left,box,1,40
2311,36168,pushing box from right to left,Pushing [something] from right to left,['box'],1,Moving [something] from right to left,box,1,35
14155,217858,pushing box from right to left,Pushing [something] from right to left,['box'],1,Moving [something] from right to left,box,1,48
10592,19290,pulling a box from right to left,Pulling [something] from right to left,['a box'],1,Moving [something] from right to left,box,1,51
