,id,label,template,placeholders,num_objects,verb_class_name,noun_class_name,start_frame,stop_frame
6986,4878,moving charger up,Moving [something] up,['charger'],1,Picking [something] up,charger,1,58
6795,168067,taking charger out of drawer,Taking [something] out of [something],"['charger', 'drawer']",2,Picking [something] up,charger,1,46
5350,181052,taking charger out of drawer,Taking [something] out of [something],"['charger', 'drawer']",2,Picking [something] up,charger,1,46
6167,209281,taking a charger from a handbag,Taking [something] from [somewhere],"['a charger', 'a handbag']",2,Picking [something] up,charger,1,47
13582,164486,taking adapter,Taking [one of many similar things on the table],['adapter'],1,Picking [something] up,charger,1,26
14692,61121,moving charger up,Moving [something] up,['charger'],1,Picking [something] up,charger,1,40
7036,15274,taking charger from laptop,Taking [something] from [somewhere],"['charger', 'laptop']",2,Picking [something] up,charger,1,53
319,51700,taking charger out of coffee lid,Taking [something] out of [something],"['charger', 'coffee lid']",2,Picking [something] up,charger,1,48
6730,99074,picking adapter up,Picking [something] up,['adapter'],1,Picking [something] up,charger,1,51
8600,54755,moving charger up,Moving [something] up,['charger'],1,Picking [something] up,charger,1,20
9949,55234,moving adapter up,Moving [something] up,['adapter'],1,Picking [something] up,charger,1,33
7600,212005,moving adapter up,Moving [something] up,['adapter'],1,Picking [something] up,charger,1,33
8390,191858,taking charger from ladder,Taking [something] from [somewhere],"['charger', 'ladder']",2,Picking [something] up,charger,1,53
8587,159851,taking charger out of cap,Taking [something] out of [something],"['charger', 'cap']",2,Picking [something] up,charger,1,56
128,171742,taking charger from switch board,Taking [something] from [somewhere],"['charger', 'switch board']",2,Picking [something] up,charger,1,49
8188,170998,moving adapter up,Moving [something] up,['adapter'],1,Picking [something] up,charger,1,33
14573,220026,moving charger up,Moving [something] up,['charger'],1,Picking [something] up,charger,1,31
14456,108814,moving charger up,Moving [something] up,['charger'],1,Picking [something] up,charger,1,27
9994,88468,picking a battery up,Picking [something] up,['a battery'],1,Picking [something] up,battery,1,40
8120,195127,taking battery out of camera cover,Taking [something] out of [something],"['battery', 'camera cover']",2,Picking [something] up,battery,1,53
5515,205311,lifting battery up completely without letting it drop down,Lifting [something] up completely without letting it drop down,['battery'],1,Picking [something] up,battery,1,39
140,97352,picking a battery up,Picking [something] up,['a battery'],1,Picking [something] up,battery,1,55
14197,76465,taking battery from floor,Taking [something] from [somewhere],"['battery', 'floor']",2,Picking [something] up,battery,1,41
14276,23358,taking battery out of mug,Taking [something] out of [something],"['battery', 'mug']",2,Picking [something] up,battery,1,53
9363,97933,moving battery up,Moving [something] up,['battery'],1,Picking [something] up,battery,1,45
5992,189853,lifting battery up completely without letting it drop down,Lifting [something] up completely without letting it drop down,['battery'],1,Picking [something] up,battery,1,32
6473,131472,taking batteries out of a box,Taking [something] out of [something],"['batteries', 'a box']",2,Picking [something] up,battery,1,48
10071,96450,taking battery from basket,Taking [something] from [somewhere],"['battery', 'basket']",2,Picking [something] up,battery,1,47
133,143207,taking a battery,Taking [one of many similar things on the table],['a battery'],1,Picking [something] up,battery,1,46
7219,199578,moving battery up,Moving [something] up,['battery'],1,Picking [something] up,battery,1,27
3745,112655,taking battery,Taking [one of many similar things on the table],['battery'],1,Picking [something] up,battery,1,50
2627,120478,moving battery up,Moving [something] up,['battery'],1,Picking [something] up,battery,1,30
13676,78199,taking a battery,Taking [one of many similar things on the table],['a battery'],1,Picking [something] up,battery,1,60
5488,136557,taking battery,Taking [one of many similar things on the table],['battery'],1,Picking [something] up,battery,1,43
13822,114326,moving battery up,Moving [something] up,['battery'],1,Picking [something] up,battery,1,46
12855,144669,moving battery up,Moving [something] up,['battery'],1,Picking [something] up,battery,1,27
903,38324,moving cup up,Moving [something] up,['cup'],1,Picking [something] up,cup,1,43
12529,103566,moving cup up,Moving [something] up,['cup'],1,Picking [something] up,cup,1,49
12672,168196,lifting a cup with spoon on it,Lifting [something] with [something] on it,"['a cup', 'spoon']",2,Picking [something] up,cup,1,43
5134,158373,taking a cup out of a shelf,Taking [something] out of [something],"['a cup', 'a shelf']",2,Picking [something] up,cup,1,53
6386,142492,taking a cup from a right side to the left,Taking [something] from [somewhere],"['a cup', 'a right side to the left']",2,Picking [something] up,cup,1,64
8253,26519,moving cup up,Moving [something] up,['cup'],1,Picking [something] up,cup,1,42
13569,169543,picking cup up,Picking [something] up,['cup'],1,Picking [something] up,cup,1,64
13714,90272,lifting cup up completely without letting it drop down,Lifting [something] up completely without letting it drop down,['cup'],1,Picking [something] up,cup,1,49
3601,198696,picking cup up,Picking [something] up,['cup'],1,Picking [something] up,cup,1,53
13241,21924,moving cup up,Moving [something] up,['cup'],1,Picking [something] up,cup,1,64
3877,120094,moving cup up,Moving [something] up,['cup'],1,Picking [something] up,cup,1,50
11497,161981,taking cup from plate,Taking [something] from [somewhere],"['cup', 'plate']",2,Picking [something] up,cup,1,47
14443,60164,taking cup,Taking [one of many similar things on the table],['cup'],1,Picking [something] up,cup,1,59
13631,207221,picking a cup up,Picking [something] up,['a cup'],1,Picking [something] up,cup,1,32
4036,133784,taking cup,Taking [one of many similar things on the table],['cup'],1,Picking [something] up,cup,1,53
10865,25177,moving cup up,Moving [something] up,['cup'],1,Picking [something] up,cup,1,53
568,59880,picking a cup up,Picking [something] up,['a cup'],1,Picking [something] up,cup,1,58
14134,208285,moving cup up,Moving [something] up,['cup'],1,Picking [something] up,cup,1,33
11626,200922,moving scissors up,Moving [something] up,['scissors'],1,Picking [something] up,scissors,1,31
9997,107314,picking scissors up,Picking [something] up,['scissors'],1,Picking [something] up,scissors,1,66
5552,108532,taking scissors out of a pocket,Taking [something] out of [something],"['scissors', 'a pocket']",2,Picking [something] up,scissors,1,52
1679,59058,moving scissors up,Moving [something] up,['scissors'],1,Picking [something] up,scissors,1,62
5131,72633,lifting scissors up completely without letting it drop down,Lifting [something] up completely without letting it drop down,['scissors'],1,Picking [something] up,scissors,1,15
184,199823,moving scissors up,Moving [something] up,['scissors'],1,Picking [something] up,scissors,1,54
3325,24728,lifting scissors up completely without letting it drop down,Lifting [something] up completely without letting it drop down,['scissors'],1,Picking [something] up,scissors,1,37
7304,220526,picking scissors up,Picking [something] up,['scissors'],1,Picking [something] up,scissors,1,40
13180,64319,moving scissors up,Moving [something] up,['scissors'],1,Picking [something] up,scissors,1,42
2132,119362,lifting scissors up completely without letting it drop down,Lifting [something] up completely without letting it drop down,['scissors'],1,Picking [something] up,scissors,1,38
7938,20354,moving the scissors up,Moving [something] up,['the scissors'],1,Picking [something] up,scissors,1,61
4940,119231,moving scissors up,Moving [something] up,['scissors'],1,Picking [something] up,scissors,1,49
315,171055,moving scissors up,Moving [something] up,['scissors'],1,Picking [something] up,scissors,1,27
6519,118806,moving scissors up,Moving [something] up,['scissors'],1,Picking [something] up,scissors,1,48
12179,163354,taking scissors out of white bowl,Taking [something] out of [something],"['scissors', 'white bowl']",2,Picking [something] up,scissors,1,31
14257,128477,taking scissors out of drawer,Taking [something] out of [something],"['scissors', 'drawer']",2,Picking [something] up,scissors,1,50
2322,58258,moving scissors up,Moving [something] up,['scissors'],1,Picking [something] up,scissors,1,36
3364,84562,moving scissors up,Moving [something] up,['scissors'],1,Picking [something] up,scissors,1,49
13,104400,putting color pencils on a surface,Putting [something] on a surface,['color pencils'],1,Putting [something],pencil,1,34
12276,83525,putting pencil next to toothbrush,Putting [something] next to [something],"['pencil', 'toothbrush']",2,Putting [something],pencil,1,65
2848,177508,"putting pencil, silver tumler and ball on the table","Putting [something], [something] and [something] on the table","['pencil', 'silver tumler', 'ball']",3,Putting [something],pencil,1,57
7479,159870,putting pencil next to sport shoe,Putting [something] next to [something],"['pencil', 'sport shoe']",2,Putting [something],pencil,1,44
924,212667,putting color pencils on a surface,Putting [something] on a surface,['color pencils'],1,Putting [something],pencil,1,29
6133,165479,putting pencil,Putting [something similar to other things that are already on the table],['pencil'],1,Putting [something],pencil,1,36
12146,186660,putting color pencils on a surface,Putting [something] on a surface,['color pencils'],1,Putting [something],pencil,1,27
10745,165141,putting color pencils on a surface,Putting [something] on a surface,['color pencils'],1,Putting [something],pencil,1,30
1537,87594,putting color pencils on a surface,Putting [something] on a surface,['color pencils'],1,Putting [something],pencil,1,27
4765,123054,putting pencil,Putting [something similar to other things that are already on the table],['pencil'],1,Putting [something],pencil,1,29
5466,170858,putting color pencils on a surface,Putting [something] on a surface,['color pencils'],1,Putting [something],pencil,1,43
4754,183281,putting color pencils on a surface,Putting [something] on a surface,['color pencils'],1,Putting [something],pencil,1,32
574,43569,putting color pencils on a surface,Putting [something] on a surface,['color pencils'],1,Putting [something],pencil,1,28
12948,211381,putting pencil on a flat surface without letting it roll,Putting [something] on a flat surface without letting it roll,['pencil'],1,Putting [something],pencil,1,45
7586,27272,putting color pencils on a surface,Putting [something] on a surface,['color pencils'],1,Putting [something],pencil,1,30
13259,60193,putting a pencil on a surface,Putting [something] on a surface,['a pencil'],1,Putting [something],pencil,1,71
12143,23193,putting color pencils on a surface,Putting [something] on a surface,['color pencils'],1,Putting [something],pencil,1,34
11259,50169,putting color pencils on a surface,Putting [something] on a surface,['color pencils'],1,Putting [something],pencil,1,28
10888,117047,putting keys onto wooden box,Putting [something] onto [something],"['keys', 'wooden box']",2,Putting [something],key,1,55
769,62262,putting key onto phone,Putting [something] onto [something],"['key', 'phone']",2,Putting [something],key,1,46
2040,9937,putting a key next to a wallet,Putting [something] next to [something],"['a key', 'a wallet']",2,Putting [something],key,1,41
2983,113991,putting key on a surface,Putting [something] on a surface,['key'],1,Putting [something],key,1,34
8895,124202,putting keys behind keyboard,Putting [something] behind [something],"['keys', 'keyboard']",2,Putting [something],key,1,42
3156,177492,putting a key on a surface,Putting [something] on a surface,['a key'],1,Putting [something],key,1,32
2798,189008,putting key behind bottle,Putting [something] behind [something],"['key', 'bottle']",2,Putting [something],key,1,38
6177,124232,putting a key next to a tablet,Putting [something] next to [something],"['a key', 'a tablet']",2,Putting [something],key,1,38
13794,25683,putting keys onto bag,Putting [something] onto [something],"['keys', 'bag']",2,Putting [something],key,1,34
13546,133003,putting keys behind bag,Putting [something] behind [something],"['keys', 'bag']",2,Putting [something],key,1,38
9794,15706,putting keys on a surface,Putting [something] on a surface,['keys'],1,Putting [something],key,1,31
8655,36524,putting a key on a surface,Putting [something] on a surface,['a key'],1,Putting [something],key,1,60
203,79964,putting key on a surface,Putting [something] on a surface,['key'],1,Putting [something],key,1,32
1737,54763,putting key on a surface,Putting [something] on a surface,['key'],1,Putting [something],key,1,32
5588,137845,putting keys next to bottle,Putting [something] next to [something],"['keys', 'bottle']",2,Putting [something],key,1,45
13490,86804,putting key on a surface,Putting [something] on a surface,['key'],1,Putting [something],key,1,68
668,17123,putting key on a surface,Putting [something] on a surface,['key'],1,Putting [something],key,1,32
1525,169698,putting key and plate on the table,Putting [something] and [something] on the table,"['key', 'plate']",2,Putting [something],key,1,54
11412,147712,putting key behind wallet,Putting [something] behind [something],"['key', 'wallet']",2,Putting [something],key,1,45
13693,89893,putting mouse next to laptop,Putting [something] next to [something],"['mouse', 'laptop']",2,Putting [something],mouse,1,47
2951,105570,putting mouse on a surface,Putting [something] on a surface,['mouse'],1,Putting [something],mouse,1,35
5271,156103,putting a mouse behind a box,Putting [something] behind [something],"['a mouse', 'a box']",2,Putting [something],mouse,1,33
5062,123107,putting mouse on a surface,Putting [something] on a surface,['mouse'],1,Putting [something],mouse,1,35
6676,118090,putting mouse behind cell phone box,Putting [something] behind [something],"['mouse', 'cell phone box']",2,Putting [something],mouse,1,63
148,89368,putting mouse behind laptop,Putting [something] behind [something],"['mouse', 'laptop']",2,Putting [something],mouse,1,62
2439,167553,putting mouse onto keyboard,Putting [something] onto [something],"['mouse', 'keyboard']",2,Putting [something],mouse,1,33
14410,203953,putting a mouse onto a mouse pad,Putting [something] onto [something],"['a mouse', 'a mouse pad']",2,Putting [something],mouse,1,62
12142,757,putting mouse onto diary,Putting [something] onto [something],"['mouse', 'diary']",2,Putting [something],mouse,1,30
3637,195302,putting a mouse next to a selfie stick,Putting [something] next to [something],"['a mouse', 'a selfie stick']",2,Putting [something],mouse,1,47
1014,11953,putting mouse next to keyboard,Putting [something] next to [something],"['mouse', 'keyboard']",2,Putting [something],mouse,1,41
8034,69183,"putting mouse, lamp and mini botlle on the table","Putting [something], [something] and [something] on the table","['mouse', 'lamp', 'mini botlle']",3,Putting [something],mouse,1,57
9216,160995,putting mouse onto box,Putting [something] onto [something],"['mouse', 'box']",2,Putting [something],mouse,1,35
11999,14574,putting mouse on a surface,Putting [something] on a surface,['mouse'],1,Putting [something],mouse,1,62
5709,195338,putting mouse onto plate,Putting [something] onto [something],"['mouse', 'plate']",2,Putting [something],mouse,1,44
4349,17927,putting mouse on a surface,Putting [something] on a surface,['mouse'],1,Putting [something],mouse,1,35
4297,165956,putting mouse next to laptop,Putting [something] next to [something],"['mouse', 'laptop']",2,Putting [something],mouse,1,49
14229,29727,putting mouse onto keyboard,Putting [something] onto [something],"['mouse', 'keyboard']",2,Putting [something],mouse,1,66
8844,7715,putting mouse on a surface,Putting [something] on a surface,['mouse'],1,Putting [something],mouse,1,62
6741,101498,putting a watch on a surface,Putting [something] on a surface,['a watch'],1,Putting [something],watch,1,34
11552,130783,putting watch behind remote,Putting [something] behind [something],"['watch', 'remote']",2,Putting [something],watch,1,32
5267,86776,putting watch on a surface,Putting [something] on a surface,['watch'],1,Putting [something],watch,1,39
859,211845,putting a watch on a surface,Putting [something] on a surface,['a watch'],1,Putting [something],watch,1,35
14630,188137,putting watch on a surface,Putting [something] on a surface,['watch'],1,Putting [something],watch,1,51
293,116269,putting watch on a surface,Putting [something] on a surface,['watch'],1,Putting [something],watch,1,32
10286,195329,putting a watch onto a mobile phone,Putting [something] onto [something],"['a watch', 'a mobile phone']",2,Putting [something],watch,1,56
8246,72437,"putting a watch, a book and a water bottle on the table","Putting [something], [something] and [something] on the table","['a watch', 'a book', 'a water bottle']",3,Putting [something],watch,1,69
3182,167158,"putting watch, bottle and battery on the table","Putting [something], [something] and [something] on the table","['watch', 'bottle', 'battery']",3,Putting [something],watch,1,40
10726,103341,putting watch next to adapter,Putting [something] next to [something],"['watch', 'adapter']",2,Putting [something],watch,1,35
6185,150890,putting watch and remote on the table,Putting [something] and [something] on the table,"['watch', 'remote']",2,Putting [something],watch,1,51
7634,176300,putting a watch behind the box,Putting [something] behind [something],"['a watch', 'the box']",2,Putting [something],watch,1,49
5661,119465,putting watch onto wallet,Putting [something] onto [something],"['watch', 'wallet']",2,Putting [something],watch,1,65
11473,85089,putting a watch behind a box,Putting [something] behind [something],"['a watch', 'a box']",2,Putting [something],watch,1,36
11580,93026,"putting watch, trigonal clip and handphone on the table","Putting [something], [something] and [something] on the table","['watch', 'trigonal clip', 'handphone']",3,Putting [something],watch,1,38
4401,198839,putting watch and shaving razor on the table,Putting [something] and [something] on the table,"['watch', 'shaving razor']",2,Putting [something],watch,1,53
5512,51755,putting watches next to lock,Putting [something] next to [something],"['watches', 'lock']",2,Putting [something],watch,1,37
2613,202762,putting a watch onto a box,Putting [something] onto [something],"['a watch', 'a box']",2,Putting [something],watch,1,31
14518,33523,putting watch next to toy,Putting [something] next to [something],"['watch', 'toy']",2,Putting [something],watch,1,43
11155,35288,throwing bottle,Throwing [something],['bottle'],1,Dropping [something],bottle,1,26
2194,20524,throwing plastic bottle onto a surface,Throwing [something] onto a surface,['plastic bottle'],1,Dropping [something],bottle,1,35
13944,120503,throwing the bottle,Throwing [something],['the bottle'],1,Dropping [something],bottle,1,40
12394,34224,throwing bottle in the air and letting it fall,Throwing [something] in the air and letting it fall,['bottle'],1,Dropping [something],bottle,1,36
14224,120754,bottle falling like a rock,[Something] falling like a rock,['bottle'],1,Dropping [something],bottle,1,30
2249,87160,throwing bottle,Throwing [something],['bottle'],1,Dropping [something],bottle,1,26
101,66377,a bottle falling like a rock,[Something] falling like a rock,['a bottle'],1,Dropping [something],bottle,1,27
11592,95504,bottle falling like a rock,[Something] falling like a rock,['bottle'],1,Dropping [something],bottle,1,51
7536,15018,a plastic bottle falling like a rock,[Something] falling like a rock,['a plastic bottle'],1,Dropping [something],bottle,1,47
13284,117335,bottle falling like a rock,[Something] falling like a rock,['bottle'],1,Dropping [something],bottle,1,32
1122,192815,throwing a bottle in the air and letting it fall,Throwing [something] in the air and letting it fall,['a bottle'],1,Dropping [something],bottle,1,43
322,65863,throwing water bottle,Throwing [something],['water bottle'],1,Dropping [something],bottle,1,41
3648,181222,throwing plastic bottle,Throwing [something],['plastic bottle'],1,Dropping [something],bottle,1,57
10240,23827,throwing a bottle,Throwing [something],['a bottle'],1,Dropping [something],bottle,1,42
4568,43105,throwing bottle,Throwing [something],['bottle'],1,Dropping [something],bottle,1,28
6690,118795,bottle falling like a rock,[Something] falling like a rock,['bottle'],1,Dropping [something],bottle,1,34
7860,64317,throwing bottle,Throwing [something],['bottle'],1,Dropping [something],bottle,1,29
4211,191089,throwing water bottle,Throwing [something],['water bottle'],1,Dropping [something],bottle,1,33
13639,81836,a water bottle falling like a rock,[Something] falling like a rock,['a water bottle'],1,Dropping [something],bottle,1,48
5612,73698,throwing a pen onto a surface,Throwing [something] onto a surface,['a pen'],1,Dropping [something],pen,1,50
12112,145059,throwing a pen in the air and letting it fall,Throwing [something] in the air and letting it fall,['a pen'],1,Dropping [something],pen,1,57
14466,47193,throwing pen,Throwing [something],['pen'],1,Dropping [something],pen,1,42
14811,149405,throwing pen in the air and letting it fall,Throwing [something] in the air and letting it fall,['pen'],1,Dropping [something],pen,1,35
14085,110931,throwing pen,Throwing [something],['pen'],1,Dropping [something],pen,1,43
3520,13937,throwing pen onto a surface,Throwing [something] onto a surface,['pen'],1,Dropping [something],pen,1,31
12619,188944,a pen falling like a rock,[Something] falling like a rock,['a pen'],1,Dropping [something],pen,1,65
2540,122535,pen falling like a rock,[Something] falling like a rock,['pen'],1,Dropping [something],pen,1,23
12363,171036,throwing a pen onto a surface,Throwing [something] onto a surface,['a pen'],1,Dropping [something],pen,1,39
9798,94260,throwing pen,Throwing [something],['pen'],1,Dropping [something],pen,1,38
93,130122,throwing pen onto a surface,Throwing [something] onto a surface,['pen'],1,Dropping [something],pen,1,33
10238,150408,pen falling like a rock,[Something] falling like a rock,['pen'],1,Dropping [something],pen,1,37
13684,37641,throwing pen in the air and letting it fall,Throwing [something] in the air and letting it fall,['pen'],1,Dropping [something],pen,1,43
12188,4308,throwing a pen onto a surface,Throwing [something] onto a surface,['a pen'],1,Dropping [something],pen,1,59
2768,219099,pen falling like a rock,[Something] falling like a rock,['pen'],1,Dropping [something],pen,1,35
13937,138877,throwing pen,Throwing [something],['pen'],1,Dropping [something],pen,1,50
8358,113106,throwing pen in the air and letting it fall,Throwing [something] in the air and letting it fall,['pen'],1,Dropping [something],pen,1,30
12939,178929,throwing pen,Throwing [something],['pen'],1,Dropping [something],pen,1,44
11597,43101,a pen falling like a rock,[Something] falling like a rock,['a pen'],1,Dropping [something],pen,1,42
7778,110942,a box falling like a rock,[Something] falling like a rock,['a box'],1,Dropping [something],box,1,31
10704,69169,box falling like a rock,[Something] falling like a rock,['box'],1,Dropping [something],box,1,34
8051,89107,a box falling like a rock,[Something] falling like a rock,['a box'],1,Dropping [something],box,1,51
13413,176209,throwing box,Throwing [something],['box'],1,Dropping [something],box,1,46
7837,185698,box falling like a rock,[Something] falling like a rock,['box'],1,Dropping [something],box,1,42
5270,44422,a box falling like a rock,[Something] falling like a rock,['a box'],1,Dropping [something],box,1,30
2263,146288,box falling like a rock,[Something] falling like a rock,['box'],1,Dropping [something],box,1,37
452,168725,box falling like a rock,[Something] falling like a rock,['box'],1,Dropping [something],box,1,37
11041,100605,throwing box,Throwing [something],['box'],1,Dropping [something],box,1,46
3180,22658,box falling like a rock,[Something] falling like a rock,['box'],1,Dropping [something],box,1,45
14477,127647,box falling like a rock,[Something] falling like a rock,['box'],1,Dropping [something],box,1,35
125,328,throwing box in the air and letting it fall,Throwing [something] in the air and letting it fall,['box'],1,Dropping [something],box,1,41
7543,155789,throwing a box,Throwing [something],['a box'],1,Dropping [something],box,1,34
14368,58696,throwing box,Throwing [something],['box'],1,Dropping [something],box,1,46
14394,204892,throwing box in the air and letting it fall,Throwing [something] in the air and letting it fall,['box'],1,Dropping [something],box,1,52
10054,204899,throwing a box,Throwing [something],['a box'],1,Dropping [something],box,1,39
9617,20517,box falling like a rock,[Something] falling like a rock,['box'],1,Dropping [something],box,1,46
4778,55051,throwing box in the air and letting it fall,Throwing [something] in the air and letting it fall,['box'],1,Dropping [something],box,1,27
14480,70488,throwing box in the air and letting it fall,Throwing [something] in the air and letting it fall,['box'],1,Dropping [something],box,1,30
11130,186846,brush falling like a rock,[Something] falling like a rock,['brush'],1,Dropping [something],brush,1,50
13691,154650,brush falling like a rock,[Something] falling like a rock,['brush'],1,Dropping [something],brush,1,23
2784,100483,throwing brush onto a surface,Throwing [something] onto a surface,['brush'],1,Dropping [something],brush,1,62
13196,11166,brush falling like a rock,[Something] falling like a rock,['brush'],1,Dropping [something],brush,1,51
