,id,label,template,placeholders,num_objects,verb_class_name,noun_class_name,start_frame,stop_frame
1432,164750,moving color pencils up,Moving [something] up,['color pencils'],1,Picking [something] up,pencil,1,31
3292,177223,taking pencil out of tray,Taking [something] out of [something],"['pencil', 'tray']",2,Picking [something] up,pencil,1,28
3279,14760,moving a pencil up,Moving [something] up,['a pencil'],1,Picking [something] up,pencil,1,40
5266,48322,lifting pencil up completely without letting it drop down,Lifting [something] up completely without letting it drop down,['pencil'],1,Picking [something] up,pencil,1,29
6540,128798,lifting pencil up completely without letting it drop down,Lifting [something] up completely without letting it drop down,['pencil'],1,Picking [something] up,pencil,1,29
7454,117260,taking a pencil,Taking [one of many similar things on the table],['a pencil'],1,Picking [something] up,pencil,1,32
9494,35367,lifting pencil up completely without letting it drop down,Lifting [something] up completely without letting it drop down,['pencil'],1,Picking [something] up,pencil,1,26
11561,94704,moving color pencils up,Moving [something] up,['color pencils'],1,Picking [something] up,pencil,1,31
1790,167842,moving pencil up,Moving [something] up,['pencil'],1,Picking [something] up,pencil,1,48
9791,20986,moving color pencils up,Moving [something] up,['color pencils'],1,Picking [something] up,pencil,1,31
9933,68210,moving color pencils up,Moving [something] up,['color pencils'],1,Picking [something] up,pencil,1,29
4963,27840,moving color pencils up,Moving [something] up,['color pencils'],1,Picking [something] up,pencil,1,29
5469,174004,lifting pencil up completely without letting it drop down,Lifting [something] up completely without letting it drop down,['pencil'],1,Picking [something] up,pencil,1,29
14126,106441,taking a water bottle out of a refrigerator,Taking [something] out of [something],"['a water bottle', 'a refrigerator']",2,Picking [something] up,bottle,1,57
9295,124186,moving bottle up,Moving [something] up,['bottle'],1,Picking [something] up,bottle,1,42
10898,146239,lifting bottle with book on it,Lifting [something] with [something] on it,"['bottle', 'book']",2,Picking [something] up,bottle,1,43
8595,64390,moving water bottle up,Moving [something] up,['water bottle'],1,Picking [something] up,bottle,1,50
2290,183940,taking the bottle out of the glass,Taking [something] out of [something],"['the bottle', 'the glass']",2,Picking [something] up,bottle,1,43
620,131051,taking bottle from switchboard,Taking [something] from [somewhere],"['bottle', 'switchboard']",2,Picking [something] up,bottle,1,32
8371,173854,moving bottle up,Moving [something] up,['bottle'],1,Picking [something] up,bottle,1,38
10911,37392,moving bottle up,Moving [something] up,['bottle'],1,Picking [something] up,bottle,1,48
11409,131735,picking bottle up,Picking [something] up,['bottle'],1,Picking [something] up,bottle,1,33
3897,48518,taking bottle,Taking [one of many similar things on the table],['bottle'],1,Picking [something] up,bottle,1,50
2432,59010,moving bottle up,Moving [something] up,['bottle'],1,Picking [something] up,bottle,1,38
12360,87504,lifting bottle up completely without letting it drop down,Lifting [something] up completely without letting it drop down,['bottle'],1,Picking [something] up,bottle,1,54
5828,139443,taking a water bottle out of the fridge,Taking [something] out of [something],"['a water bottle', 'the fridge']",2,Picking [something] up,bottle,1,65
12484,39234,taking pen out of bowl,Taking [something] out of [something],"['pen', 'bowl']",2,Picking [something] up,pen,1,33
9397,162376,lifting pen up completely without letting it drop down,Lifting [something] up completely without letting it drop down,['pen'],1,Picking [something] up,pen,1,31
5019,118792,taking pens,Taking [one of many similar things on the table],['pens'],1,Picking [something] up,pen,1,39
12316,70425,taking pen out of cup,Taking [something] out of [something],"['pen', 'cup']",2,Picking [something] up,pen,1,42
12462,43967,taking pen from table,Taking [something] from [somewhere],"['pen', 'table']",2,Picking [something] up,pen,1,32
14395,33400,moving pen up,Moving [something] up,['pen'],1,Picking [something] up,pen,1,39
14453,84385,taking pen out of holder,Taking [something] out of [something],"['pen', 'holder']",2,Picking [something] up,pen,1,58
12379,69570,moving pen up,Moving [something] up,['pen'],1,Picking [something] up,pen,1,37
11996,74704,lifting pen up completely without letting it drop down,Lifting [something] up completely without letting it drop down,['pen'],1,Picking [something] up,pen,1,35
6475,206045,taking pen,Taking [one of many similar things on the table],['pen'],1,Picking [something] up,pen,1,55
9913,119137,lifting pen up completely without letting it drop down,Lifting [something] up completely without letting it drop down,['pen'],1,Picking [something] up,pen,1,34
12885,220805,moving pen up,Moving [something] up,['pen'],1,Picking [something] up,pen,1,17
8614,147141,taking a pen out of the box,Taking [something] out of [something],"['a pen', 'the box']",2,Picking [something] up,pen,1,47
1338,166654,moving book up,Moving [something] up,['book'],1,Picking [something] up,book,1,27
104,69154,lifting book with bowl on it,Lifting [something] with [something] on it,"['book', 'bowl']",2,Picking [something] up,book,1,43
11016,29542,lifting book with wallet on it,Lifting [something] with [something] on it,"['book', 'wallet']",2,Picking [something] up,book,1,31
6743,82072,moving a book up,Moving [something] up,['a book'],1,Picking [something] up,book,1,37
6164,213883,moving a book up,Moving [something] up,['a book'],1,Picking [something] up,book,1,46
156,201911,lifting book with pencil on it,Lifting [something] with [something] on it,"['book', 'pencil']",2,Picking [something] up,book,1,64
575,115962,picking book up,Picking [something] up,['book'],1,Picking [something] up,book,1,39
10017,73413,lifting book with key on it,Lifting [something] with [something] on it,"['book', 'key']",2,Picking [something] up,book,1,28
3768,120239,lifting a book with a pen on it,Lifting [something] with [something] on it,"['a book', 'a pen']",2,Picking [something] up,book,1,33
14777,18022,lifting book with notebook on it,Lifting [something] with [something] on it,"['book', 'notebook']",2,Picking [something] up,book,1,50
3970,194886,moving book up,Moving [something] up,['book'],1,Picking [something] up,book,1,54
13632,64988,lifting a book with a box on it,Lifting [something] with [something] on it,"['a book', 'a box']",2,Picking [something] up,book,1,37
3046,193301,lifting book up completely without letting it drop down,Lifting [something] up completely without letting it drop down,['book'],1,Picking [something] up,book,1,48
7313,158864,lifting wallet with nail clipper on it,Lifting [something] with [something] on it,"['wallet', 'nail clipper']",2,Picking [something] up,wallet,1,40
487,170126,moving a wallet up,Moving [something] up,['a wallet'],1,Picking [something] up,wallet,1,27
2616,138574,lifting wallet with alluminum on it,Lifting [something] with [something] on it,"['wallet', 'alluminum']",2,Picking [something] up,wallet,1,34
9378,156845,moving wallet up,Moving [something] up,['wallet'],1,Picking [something] up,wallet,1,43
1370,133395,taking the wallet out of the bag,Taking [something] out of [something],"['the wallet', 'the bag']",2,Picking [something] up,wallet,1,45
5829,49201,lifting a wallet with keys on it,Lifting [something] with [something] on it,"['a wallet', 'keys']",2,Picking [something] up,wallet,1,63
2012,16490,taking a wallet from a rug,Taking [something] from [somewhere],"['a wallet', 'a rug']",2,Picking [something] up,wallet,1,45
10621,6467,lifting wallet with soda cap on it,Lifting [something] with [something] on it,"['wallet', 'soda cap']",2,Picking [something] up,wallet,1,41
7968,48419,taking wallet from pocket,Taking [something] from [somewhere],"['wallet', 'pocket']",2,Picking [something] up,wallet,1,61
5836,137838,moving wallet up,Moving [something] up,['wallet'],1,Picking [something] up,wallet,1,62
6544,92235,taking wallet from teapoy,Taking [something] from [somewhere],"['wallet', 'teapoy']",2,Picking [something] up,wallet,1,51
11448,36960,moving wallet up,Moving [something] up,['wallet'],1,Picking [something] up,wallet,1,55
13059,95301,lifting wallet with mobile on it,Lifting [something] with [something] on it,"['wallet', 'mobile']",2,Picking [something] up,wallet,1,67
1694,58569,picking a watch up,Picking [something] up,['a watch'],1,Picking [something] up,watch,1,35
1612,116881,taking watch from table,Taking [something] from [somewhere],"['watch', 'table']",2,Picking [something] up,watch,1,29
1158,141482,picking a watch up,Picking [something] up,['a watch'],1,Picking [something] up,watch,1,50
6070,31135,taking watch,Taking [one of many similar things on the table],['watch'],1,Picking [something] up,watch,1,34
4750,24717,moving watch up,Moving [something] up,['watch'],1,Picking [something] up,watch,1,47
2967,121903,moving watch up,Moving [something] up,['watch'],1,Picking [something] up,watch,1,27
12268,181634,taking watch,Taking [one of many similar things on the table],['watch'],1,Picking [something] up,watch,1,47
9198,194010,moving watch up,Moving [something] up,['watch'],1,Picking [something] up,watch,1,56
7721,74374,moving a watch up,Moving [something] up,['a watch'],1,Picking [something] up,watch,1,41
4384,187435,picking a watch up,Picking [something] up,['a watch'],1,Picking [something] up,watch,1,35
3166,44948,taking watch,Taking [one of many similar things on the table],['watch'],1,Picking [something] up,watch,1,50
7164,204064,lifting a watch up completely without letting it drop down,Lifting [something] up completely without letting it drop down,['a watch'],1,Picking [something] up,watch,1,39
1602,36747,taking watch from table,Taking [something] from [somewhere],"['watch', 'table']",2,Picking [something] up,watch,1,36
1923,25706,putting pencil next to mouse,Putting [something] next to [something],"['pencil', 'mouse']",2,Putting [something],pencil,1,40
10244,177921,putting pencil behind mouse,Putting [something] behind [something],"['pencil', 'mouse']",2,Putting [something],pencil,1,33
14614,23889,putting pencil next to mug,Putting [something] next to [something],"['pencil', 'mug']",2,Putting [something],pencil,1,53
1537,87594,putting color pencils on a surface,Putting [something] on a surface,['color pencils'],1,Putting [something],pencil,1,27
1789,8797,putting color pencils on a surface,Putting [something] on a surface,['color pencils'],1,Putting [something],pencil,1,32
3788,63372,"putting pencil, banana and onion on the table","Putting [something], [something] and [something] on the table","['pencil', 'banana', 'onion']",3,Putting [something],pencil,1,55
405,173781,putting color pencils on a surface,Putting [something] on a surface,['color pencils'],1,Putting [something],pencil,1,27
2004,77424,putting color pencils on a surface,Putting [something] on a surface,['color pencils'],1,Putting [something],pencil,1,27
1078,13623,putting color pencils on a surface,Putting [something] on a surface,['color pencils'],1,Putting [something],pencil,1,48
7969,9948,"putting pencil, pens and screwdriver on the table","Putting [something], [something] and [something] on the table","['pencil', 'pens', 'screwdriver']",3,Putting [something],pencil,1,53
14277,48706,"putting a pencil, a pen and scissors on the table","Putting [something], [something] and [something] on the table","['a pencil', 'a pen', 'scissors']",3,Putting [something],pencil,1,69
6652,144331,putting color pencils on a surface,Putting [something] on a surface,['color pencils'],1,Putting [something],pencil,1,22
13208,188355,putting a pencil onto a magazine,Putting [something] onto [something],"['a pencil', 'a magazine']",2,Putting [something],pencil,1,48
2121,220347,putting bottles,Putting [something similar to other things that are already on the table],['bottles'],1,Putting [something],bottle,1,39
1299,59002,putting a bottle on a surface,Putting [something] on a surface,['a bottle'],1,Putting [something],bottle,1,44
767,85354,putting bottles,Putting [something similar to other things that are already on the table],['bottles'],1,Putting [something],bottle,1,28
5877,32199,putting a water bottle on a flat surface without letting it roll,Putting [something] on a flat surface without letting it roll,['a water bottle'],1,Putting [something],bottle,1,51
308,96192,putting the bottle next to the fan,Putting [something] next to [something],"['the bottle', 'the fan']",2,Putting [something],bottle,1,70
843,190627,"putting a bottle that can't roll onto a slanted surface, so it stays where it is","Putting [something] that can't roll onto a slanted surface, so it stays where it is",['a bottle'],1,Putting [something],bottle,1,40
4397,4366,putting bottles,Putting [something similar to other things that are already on the table],['bottles'],1,Putting [something],bottle,1,37
3682,161708,putting a bottle on a surface,Putting [something] on a surface,['a bottle'],1,Putting [something],bottle,1,38
9749,4604,putting bottle on a flat surface without letting it roll,Putting [something] on a flat surface without letting it roll,['bottle'],1,Putting [something],bottle,1,39
14065,52198,putting bottle onto cup,Putting [something] onto [something],"['bottle', 'cup']",2,Putting [something],bottle,1,55
7524,120282,putting bottle next to bottle,Putting [something] next to [something],"['bottle', 'bottle']",2,Putting [something],bottle,1,40
1990,94343,putting bottle on a surface,Putting [something] on a surface,['bottle'],1,Putting [something],bottle,1,49
3934,201952,putting bottle on a surface,Putting [something] on a surface,['bottle'],1,Putting [something],bottle,1,28
10185,128023,putting pen and pencil on the table,Putting [something] and [something] on the table,"['pen', 'pencil']",2,Putting [something],pen,1,45
11798,18709,putting pen on a surface,Putting [something] on a surface,['pen'],1,Putting [something],pen,1,37
1455,16679,putting pen on a surface,Putting [something] on a surface,['pen'],1,Putting [something],pen,1,33
1949,173456,putting pens,Putting [something similar to other things that are already on the table],['pens'],1,Putting [something],pen,1,39
7046,86869,putting a pen next to a mouse,Putting [something] next to [something],"['a pen', 'a mouse']",2,Putting [something],pen,1,52
925,185231,putting pen on a surface,Putting [something] on a surface,['pen'],1,Putting [something],pen,1,45
7609,117801,putting pens,Putting [something similar to other things that are already on the table],['pens'],1,Putting [something],pen,1,33
9325,64882,putting pen on a surface,Putting [something] on a surface,['pen'],1,Putting [something],pen,1,37
10086,84394,putting pen and ruler on the table,Putting [something] and [something] on the table,"['pen', 'ruler']",2,Putting [something],pen,1,50
13898,177818,putting a pen onto a charger,Putting [something] onto [something],"['a pen', 'a charger']",2,Putting [something],pen,1,57
7227,121196,putting pen on a surface,Putting [something] on a surface,['pen'],1,Putting [something],pen,1,36
774,133871,putting pen on a flat surface without letting it roll,Putting [something] on a flat surface without letting it roll,['pen'],1,Putting [something],pen,1,49
13474,50909,putting pen on a surface,Putting [something] on a surface,['pen'],1,Putting [something],pen,1,51
5819,71781,putting box next to box,Putting [something] next to [something],"['box', 'box']",2,Putting [something],box,1,39
12852,20729,putting box on a surface,Putting [something] on a surface,['box'],1,Putting [something],box,1,49
4292,197940,putting box behind toy,Putting [something] behind [something],"['box', 'toy']",2,Putting [something],box,1,44
11459,133312,putting box next to camera,Putting [something] next to [something],"['box', 'camera']",2,Putting [something],box,1,20
9157,90003,putting box behind box,Putting [something] behind [something],"['box', 'box']",2,Putting [something],box,1,51
9608,11268,putting a box behind a glove,Putting [something] behind [something],"['a box', 'a glove']",2,Putting [something],box,1,20
8523,105161,putting box behind lighters,Putting [something] behind [something],"['box', 'lighters']",2,Putting [something],box,1,55
8993,175834,putting box onto box,Putting [something] onto [something],"['box', 'box']",2,Putting [something],box,1,27
2793,210426,"putting box, powder puff and box on the table","Putting [something], [something] and [something] on the table","['box', 'powder puff', 'box']",3,Putting [something],box,1,62
2088,157172,"putting box, doll and cable on the table","Putting [something], [something] and [something] on the table","['box', 'doll', 'cable']",3,Putting [something],box,1,44
8027,163965,putting box next to wire,Putting [something] next to [something],"['box', 'wire']",2,Putting [something],box,1,31
10373,209170,putting a box on a surface,Putting [something] on a surface,['a box'],1,Putting [something],box,1,39
5282,52985,"putting a box, a stapler and a hole punch on the table","Putting [something], [something] and [something] on the table","['a box', 'a stapler', 'a hole punch']",3,Putting [something],box,1,69
12755,19307,putting adapter next to the battery,Putting [something] next to [something],"['adapter', 'the battery']",2,Putting [something],charger,1,50
9329,170909,putting adapter behind hair dryer,Putting [something] behind [something],"['adapter', 'hair dryer']",2,Putting [something],charger,1,33
5207,207185,putting adapter behind pouch,Putting [something] behind [something],"['adapter', 'pouch']",2,Putting [something],charger,1,31
7725,139615,putting adapter on a surface,Putting [something] on a surface,['adapter'],1,Putting [something],charger,1,30
10220,191363,"putting adapter, wallet and sipper on the table","Putting [something], [something] and [something] on the table","['adapter', 'wallet', 'sipper']",3,Putting [something],charger,1,54
3348,36431,putting adapter on a surface,Putting [something] on a surface,['adapter'],1,Putting [something],charger,1,30
11212,174789,putting charger behind bottle,Putting [something] behind [something],"['charger', 'bottle']",2,Putting [something],charger,1,31
2464,66852,"putting charger, pen and comb on the table","Putting [something], [something] and [something] on the table","['charger', 'pen', 'comb']",3,Putting [something],charger,1,49
8492,154695,putting charger,Putting [something similar to other things that are already on the table],['charger'],1,Putting [something],charger,1,29
10254,109223,putting charger,Putting [something similar to other things that are already on the table],['charger'],1,Putting [something],charger,1,28
7741,119687,"putting charger, mp3 player and high lighter on the table","Putting [something], [something] and [something] on the table","['charger', 'mp3 player', 'high lighter']",3,Putting [something],charger,1,52
10839,30998,putting charger next to handphone,Putting [something] next to [something],"['charger', 'handphone']",2,Putting [something],charger,1,20
9442,80756,"putting charger that can't roll onto a slanted surface, so it stays where it is","Putting [something] that can't roll onto a slanted surface, so it stays where it is",['charger'],1,Putting [something],charger,1,30
8995,132297,putting battery on a surface,Putting [something] on a surface,['battery'],1,Putting [something],battery,1,19
10991,85302,putting battery next to wooden box,Putting [something] next to [something],"['battery', 'wooden box']",2,Putting [something],battery,1,56
9257,33620,putting battery onto plate,Putting [something] onto [something],"['battery', 'plate']",2,Putting [something],battery,1,39
9423,219914,putting battery onto small box,Putting [something] onto [something],"['battery', 'small box']",2,Putting [something],battery,1,44
6258,131826,putting a battery behind tin box,Putting [something] behind [something],"['a battery', 'tin box']",2,Putting [something],battery,1,62
14621,87289,putting battery behind mug,Putting [something] behind [something],"['battery', 'mug']",2,Putting [something],battery,1,57
1210,6164,putting battery on a flat surface without letting it roll,Putting [something] on a flat surface without letting it roll,['battery'],1,Putting [something],battery,1,34
4883,28389,putting battery behind lotion,Putting [something] behind [something],"['battery', 'lotion']",2,Putting [something],battery,1,52
12123,144939,putting battery next to keys,Putting [something] next to [something],"['battery', 'keys']",2,Putting [something],battery,1,53
6680,144033,putting battery and battery on the table,Putting [something] and [something] on the table,"['battery', 'battery']",2,Putting [something],battery,1,33
6233,76750,putting battery next to bowl,Putting [something] next to [something],"['battery', 'bowl']",2,Putting [something],battery,1,46
6850,122048,putting battery onto jar,Putting [something] onto [something],"['battery', 'jar']",2,Putting [something],battery,1,40
3947,132610,putting battery,Putting [something similar to other things that are already on the table],['battery'],1,Putting [something],battery,1,35
9902,111429,throwing color pencils,Throwing [something],['color pencils'],1,Dropping [something],pencil,1,26
4399,107799,throwing color pencils,Throwing [something],['color pencils'],1,Dropping [something],pencil,1,40
3955,89909,throwing color pencils,Throwing [something],['color pencils'],1,Dropping [something],pencil,1,26
7632,4552,throwing color pencils,Throwing [something],['color pencils'],1,Dropping [something],pencil,1,26
10849,123770,throwing color pencils,Throwing [something],['color pencils'],1,Dropping [something],pencil,1,29
11697,78133,throwing color pencils,Throwing [something],['color pencils'],1,Dropping [something],pencil,1,28
2903,64528,throwing color pencils,Throwing [something],['color pencils'],1,Dropping [something],pencil,1,30
8997,168018,throwing color pencils,Throwing [something],['color pencils'],1,Dropping [something],pencil,1,29
7000,162145,throwing color pencils,Throwing [something],['color pencils'],1,Dropping [something],pencil,1,28
3940,142699,throwing color pencils,Throwing [something],['color pencils'],1,Dropping [something],pencil,1,31
12367,158162,throwing color pencils,Throwing [something],['color pencils'],1,Dropping [something],pencil,1,28
7225,166147,throwing color pencil,Throwing [something],['color pencil'],1,Dropping [something],pencil,1,26
10100,53221,throwing color pencils,Throwing [something],['color pencils'],1,Dropping [something],pencil,1,28
722,28401,throwing bottle onto a surface,Throwing [something] onto a surface,['bottle'],1,Dropping [something],bottle,1,40
12690,109123,throwing a bottle,Throwing [something],['a bottle'],1,Dropping [something],bottle,1,39
10453,170424,bottle falling like a rock,[Something] falling like a rock,['bottle'],1,Dropping [something],bottle,1,36
6663,183712,a water bottle falling like a rock,[Something] falling like a rock,['a water bottle'],1,Dropping [something],bottle,1,39
3825,80395,throwing a water bottle,Throwing [something],['a water bottle'],1,Dropping [something],bottle,1,63
8603,194884,throwing bottle in the air and letting it fall,Throwing [something] in the air and letting it fall,['bottle'],1,Dropping [something],bottle,1,41
1122,192815,throwing a bottle in the air and letting it fall,Throwing [something] in the air and letting it fall,['a bottle'],1,Dropping [something],bottle,1,43
6690,118795,bottle falling like a rock,[Something] falling like a rock,['bottle'],1,Dropping [something],bottle,1,34
3535,81667,throwing bottle,Throwing [something],['bottle'],1,Dropping [something],bottle,1,28
13959,44700,throwing bottle,Throwing [something],['bottle'],1,Dropping [something],bottle,1,41
3078,37602,throwing a plastic bottle,Throwing [something],['a plastic bottle'],1,Dropping [something],bottle,1,44
7998,5256,bottle falling like a rock,[Something] falling like a rock,['bottle'],1,Dropping [something],bottle,1,54
11910,158066,throwing bottle onto a surface,Throwing [something] onto a surface,['bottle'],1,Dropping [something],bottle,1,41
13513,192209,throwing a pen,Throwing [something],['a pen'],1,Dropping [something],pen,1,27
7811,151156,pen falling like a rock,[Something] falling like a rock,['pen'],1,Dropping [something],pen,1,58
4508,55689,a pen falling like a rock,[Something] falling like a rock,['a pen'],1,Dropping [something],pen,1,37
6484,55505,throwing a pen,Throwing [something],['a pen'],1,Dropping [something],pen,1,50
12963,143893,a pen falling like a rock,[Something] falling like a rock,['a pen'],1,Dropping [something],pen,1,15
14466,47193,throwing pen,Throwing [something],['pen'],1,Dropping [something],pen,1,42
3311,205457,throwing pen onto a surface,Throwing [something] onto a surface,['pen'],1,Dropping [something],pen,1,25
10732,160853,throwing pen,Throwing [something],['pen'],1,Dropping [something],pen,1,62
13644,130709,throwing a pen,Throwing [something],['a pen'],1,Dropping [something],pen,1,29
4437,30431,throwing a pen in the air and letting it fall,Throwing [something] in the air and letting it fall,['a pen'],1,Dropping [something],pen,1,43
9060,176972,pen falling like a rock,[Something] falling like a rock,['pen'],1,Dropping [something],pen,1,22
9573,152846,throwing a pen onto a surface,Throwing [something] onto a surface,['a pen'],1,Dropping [something],pen,1,43
12363,171036,throwing a pen onto a surface,Throwing [something] onto a surface,['a pen'],1,Dropping [something],pen,1,39
9065,175959,throwing remote,Throwing [something],['remote'],1,Dropping [something],remote,1,28
1342,126831,remote falling like a rock,[Something] falling like a rock,['remote'],1,Dropping [something],remote,1,20
1435,84898,remote falling like a rock,[Something] falling like a rock,['remote'],1,Dropping [something],remote,1,51
