,id,label,template,placeholders,num_objects,verb_class_name,noun_class_name,start_frame,stop_frame
5208,212706,lifting pencil up completely without letting it drop down,Lifting [something] up completely without letting it drop down,['pencil'],1,Picking [something] up,pencil,1,28
8455,28362,moving color pencils up,Moving [something] up,['color pencils'],1,Picking [something] up,pencil,1,40
959,61890,moving pencil up,Moving [something] up,['pencil'],1,Picking [something] up,pencil,1,37
12988,210645,moving color pencils up,Moving [something] up,['color pencils'],1,Picking [something] up,pencil,1,26
6944,201262,moving color pencils up,Moving [something] up,['color pencils'],1,Picking [something] up,pencil,1,32
6911,181803,lifting pencil up completely without letting it drop down,Lifting [something] up completely without letting it drop down,['pencil'],1,Picking [something] up,pencil,1,31
5053,14799,lifting pencil up completely without letting it drop down,Lifting [something] up completely without letting it drop down,['pencil'],1,Picking [something] up,pencil,1,32
8351,34637,moving color pencils up,Moving [something] up,['color pencils'],1,Picking [something] up,pencil,1,23
4260,39201,taking pencil out of container,Taking [something] out of [something],"['pencil', 'container']",2,Picking [something] up,pencil,1,46
4700,70632,moving color pencils up,Moving [something] up,['color pencils'],1,Picking [something] up,pencil,1,36
8286,106585,lifting bottle up completely without letting it drop down,Lifting [something] up completely without letting it drop down,['bottle'],1,Picking [something] up,bottle,1,38
10931,3421,taking bottle out of the cooker,Taking [something] out of [something],"['bottle', 'the cooker']",2,Picking [something] up,bottle,1,56
7310,52732,moving bottle up,Moving [something] up,['bottle'],1,Picking [something] up,bottle,1,45
3073,44256,lifting bottle with sharpener on it,Lifting [something] with [something] on it,"['bottle', 'sharpener']",2,Picking [something] up,bottle,1,57
8632,101537,taking bottle out of stand,Taking [something] out of [something],"['bottle', 'stand']",2,Picking [something] up,bottle,1,49
4504,186886,taking bottle from switch board,Taking [something] from [somewhere],"['bottle', 'switch board']",2,Picking [something] up,bottle,1,32
5015,98230,picking water bottle up,Picking [something] up,['water bottle'],1,Picking [something] up,bottle,1,67
7595,100807,taking water bottle,Taking [one of many similar things on the table],['water bottle'],1,Picking [something] up,bottle,1,46
3930,26224,moving a bottle up,Moving [something] up,['a bottle'],1,Picking [something] up,bottle,1,62
11350,100442,moving bottle up,Moving [something] up,['bottle'],1,Picking [something] up,bottle,1,48
3473,135573,moving pen up,Moving [something] up,['pen'],1,Picking [something] up,pen,1,29
13520,140211,taking pen,Taking [one of many similar things on the table],['pen'],1,Picking [something] up,pen,1,45
12370,43081,taking pens,Taking [one of many similar things on the table],['pens'],1,Picking [something] up,pen,1,47
11792,50469,taking a pen out of a bowl,Taking [something] out of [something],"['a pen', 'a bowl']",2,Picking [something] up,pen,1,37
4240,125138,taking pen,Taking [one of many similar things on the table],['pen'],1,Picking [something] up,pen,1,37
14776,146002,taking pen out of mug,Taking [something] out of [something],"['pen', 'mug']",2,Picking [something] up,pen,1,48
7804,152755,lifting pen up completely without letting it drop down,Lifting [something] up completely without letting it drop down,['pen'],1,Picking [something] up,pen,1,53
13652,50123,moving a pen up,Moving [something] up,['a pen'],1,Picking [something] up,pen,1,26
3404,86846,taking pen out of plastic jar,Taking [something] out of [something],"['pen', 'plastic jar']",2,Picking [something] up,pen,1,49
6918,172610,lifting a pen up completely without letting it drop down,Lifting [something] up completely without letting it drop down,['a pen'],1,Picking [something] up,pen,1,42
10019,166616,lifting book with eyeglasses on it,Lifting [something] with [something] on it,"['book', 'eyeglasses']",2,Picking [something] up,book,1,46
1007,145154,lifting book with candy on it,Lifting [something] with [something] on it,"['book', 'candy']",2,Picking [something] up,book,1,31
7367,151258,lifting a book with a battery on it,Lifting [something] with [something] on it,"['a book', 'a battery']",2,Picking [something] up,book,1,67
11374,150308,lifting book up completely without letting it drop down,Lifting [something] up completely without letting it drop down,['book'],1,Picking [something] up,book,1,44
10078,196869,taking a book,Taking [one of many similar things on the table],['a book'],1,Picking [something] up,book,1,62
7833,110105,lifting book with coin on it,Lifting [something] with [something] on it,"['book', 'coin']",2,Picking [something] up,book,1,31
11602,89702,lifting book with mouse on it,Lifting [something] with [something] on it,"['book', 'mouse']",2,Picking [something] up,book,1,60
8661,194776,taking book out of basket,Taking [something] out of [something],"['book', 'basket']",2,Picking [something] up,book,1,49
9465,144715,lifting book with mouse on it,Lifting [something] with [something] on it,"['book', 'mouse']",2,Picking [something] up,book,1,47
8404,102751,lifting book up completely without letting it drop down,Lifting [something] up completely without letting it drop down,['book'],1,Picking [something] up,book,1,30
10603,149440,lifting phone up completely without letting it drop down,Lifting [something] up completely without letting it drop down,['phone'],1,Picking [something] up,phone,1,54
9897,119397,moving mobile up,Moving [something] up,['mobile'],1,Picking [something] up,phone,1,25
5655,125429,taking a phone from a counter,Taking [something] from [somewhere],"['a phone', 'a counter']",2,Picking [something] up,phone,1,54
11138,66730,picking phone up,Picking [something] up,['phone'],1,Picking [something] up,phone,1,56
10569,180695,lifting phone with sand timer on it,Lifting [something] with [something] on it,"['phone', 'sand timer']",2,Picking [something] up,phone,1,57
6892,155845,moving a phone up,Moving [something] up,['a phone'],1,Picking [something] up,phone,1,46
8814,28158,moving phone up,Moving [something] up,['phone'],1,Picking [something] up,phone,1,62
5650,163481,moving a phone up,Moving [something] up,['a phone'],1,Picking [something] up,phone,1,59
4939,141699,moving phone up,Moving [something] up,['phone'],1,Picking [something] up,phone,1,30
5816,57300,taking mobile,Taking [one of many similar things on the table],['mobile'],1,Picking [something] up,phone,1,42
11807,201343,taking mouse,Taking [one of many similar things on the table],['mouse'],1,Picking [something] up,mouse,1,16
12120,168548,taking mouse out of shelf,Taking [something] out of [something],"['mouse', 'shelf']",2,Picking [something] up,mouse,1,28
1008,164714,picking a mouse up,Picking [something] up,['a mouse'],1,Picking [something] up,mouse,1,37
13112,93281,taking mouse from table,Taking [something] from [somewhere],"['mouse', 'table']",2,Picking [something] up,mouse,1,26
13296,6774,taking mouse from table,Taking [something] from [somewhere],"['mouse', 'table']",2,Picking [something] up,mouse,1,48
12601,173005,moving mouse up,Moving [something] up,['mouse'],1,Picking [something] up,mouse,1,34
9917,210906,moving mouse up,Moving [something] up,['mouse'],1,Picking [something] up,mouse,1,61
10578,180935,picking mouse up,Picking [something] up,['mouse'],1,Picking [something] up,mouse,1,63
12031,82380,picking mouse up,Picking [something] up,['mouse'],1,Picking [something] up,mouse,1,46
8709,155857,lifting mouse with cloth on it,Lifting [something] with [something] on it,"['mouse', 'cloth']",2,Picking [something] up,mouse,1,37
12094,205229,lifting brush up completely without letting it drop down,Lifting [something] up completely without letting it drop down,['brush'],1,Picking [something] up,brush,1,43
14687,21313,taking brushes,Taking [one of many similar things on the table],['brushes'],1,Picking [something] up,brush,1,58
8919,142420,moving brush up,Moving [something] up,['brush'],1,Picking [something] up,brush,1,62
6461,110917,taking a brush out of a box,Taking [something] out of [something],"['a brush', 'a box']",2,Picking [something] up,brush,1,28
11635,51439,taking brush out of stand,Taking [something] out of [something],"['brush', 'stand']",2,Picking [something] up,brush,1,52
13418,123,picking brush up,Picking [something] up,['brush'],1,Picking [something] up,brush,1,50
11562,37782,moving brush up,Moving [something] up,['brush'],1,Picking [something] up,brush,1,26
10504,42044,taking brush from floor,Taking [something] from [somewhere],"['brush', 'floor']",2,Picking [something] up,brush,1,35
9792,216085,lifting brush up completely without letting it drop down,Lifting [something] up completely without letting it drop down,['brush'],1,Picking [something] up,brush,1,30
7094,59978,moving brush up,Moving [something] up,['brush'],1,Picking [something] up,brush,1,61
12668,72640,putting color pencils on a surface,Putting [something] on a surface,['color pencils'],1,Putting [something],pencil,1,28
14716,173702,putting pencil,Putting [something similar to other things that are already on the table],['pencil'],1,Putting [something],pencil,1,29
12333,124168,putting pencil on a surface,Putting [something] on a surface,['pencil'],1,Putting [something],pencil,1,37
3850,199133,putting color pencil on a surface,Putting [something] on a surface,['color pencil'],1,Putting [something],pencil,1,32
12276,83525,putting pencil next to toothbrush,Putting [something] next to [something],"['pencil', 'toothbrush']",2,Putting [something],pencil,1,65
11426,125322,putting pencil next to pencil,Putting [something] next to [something],"['pencil', 'pencil']",2,Putting [something],pencil,1,42
4754,183281,putting color pencils on a surface,Putting [something] on a surface,['color pencils'],1,Putting [something],pencil,1,32
390,21627,putting color pencils on a surface,Putting [something] on a surface,['color pencils'],1,Putting [something],pencil,1,47
5755,83342,"putting a pencil, a pencil and a pen cap on the table","Putting [something], [something] and [something] on the table","['a pencil', 'a pencil', 'a pen cap']",3,Putting [something],pencil,1,62
9548,8022,putting color pencils on a surface,Putting [something] on a surface,['color pencils'],1,Putting [something],pencil,1,22
14715,21421,putting bottle on a surface,Putting [something] on a surface,['bottle'],1,Putting [something],bottle,1,44
4464,1284,putting bottles,Putting [something similar to other things that are already on the table],['bottles'],1,Putting [something],bottle,1,29
12041,152346,putting bottle next to sunglasses,Putting [something] next to [something],"['bottle', 'sunglasses']",2,Putting [something],bottle,1,36
12648,45242,putting bottles,Putting [something similar to other things that are already on the table],['bottles'],1,Putting [something],bottle,1,33
6075,96535,putting bottles,Putting [something similar to other things that are already on the table],['bottles'],1,Putting [something],bottle,1,30
12741,110633,putting bottle next to compact disk,Putting [something] next to [something],"['bottle', 'compact disk']",2,Putting [something],bottle,1,35
7079,219804,putting bottles,Putting [something similar to other things that are already on the table],['bottles'],1,Putting [something],bottle,1,31
10523,71541,putting bottle on a flat surface without letting it roll,Putting [something] on a flat surface without letting it roll,['bottle'],1,Putting [something],bottle,1,63
1115,167090,putting bottle on a flat surface without letting it roll,Putting [something] on a flat surface without letting it roll,['bottle'],1,Putting [something],bottle,1,48
10226,58634,putting bottle,Putting [something similar to other things that are already on the table],['bottle'],1,Putting [something],bottle,1,48
9707,193335,putting pen onto shoe,Putting [something] onto [something],"['pen', 'shoe']",2,Putting [something],pen,1,47
545,175096,"putting pens, padlock and rexona on the table","Putting [something], [something] and [something] on the table","['pens', 'padlock', 'rexona']",3,Putting [something],pen,1,55
4150,133666,putting pen next to mug,Putting [something] next to [something],"['pen', 'mug']",2,Putting [something],pen,1,48
1059,81562,putting pen on a surface,Putting [something] on a surface,['pen'],1,Putting [something],pen,1,33
13814,51445,putting a pen next to sunglasses,Putting [something] next to [something],"['a pen', 'sunglasses']",2,Putting [something],pen,1,46
12942,161762,putting pens,Putting [something similar to other things that are already on the table],['pens'],1,Putting [something],pen,1,34
12198,210192,putting pen,Putting [something similar to other things that are already on the table],['pen'],1,Putting [something],pen,1,22
12973,66976,putting pen on a surface,Putting [something] on a surface,['pen'],1,Putting [something],pen,1,33
13398,67856,putting a pen next to a pen,Putting [something] next to [something],"['a pen', 'a pen']",2,Putting [something],pen,1,56
11032,176818,putting pens,Putting [something similar to other things that are already on the table],['pens'],1,Putting [something],pen,1,43
3140,164034,putting book,Putting [something similar to other things that are already on the table],['book'],1,Putting [something],book,1,30
13660,62408,putting book on a surface,Putting [something] on a surface,['book'],1,Putting [something],book,1,49
13456,202831,"putting book that can't roll onto a slanted surface, so it stays where it is","Putting [something] that can't roll onto a slanted surface, so it stays where it is",['book'],1,Putting [something],book,1,39
2593,178279,putting book behind can,Putting [something] behind [something],"['book', 'can']",2,Putting [something],book,1,44
11549,191625,putting book on a surface,Putting [something] on a surface,['book'],1,Putting [something],book,1,26
726,75537,putting book,Putting [something similar to other things that are already on the table],['book'],1,Putting [something],book,1,37
10397,147921,putting book onto bag,Putting [something] onto [something],"['book', 'bag']",2,Putting [something],book,1,51
6536,157341,putting a book,Putting [something similar to other things that are already on the table],['a book'],1,Putting [something],book,1,40
13710,117867,putting a book,Putting [something similar to other things that are already on the table],['a book'],1,Putting [something],book,1,56
8397,220086,putting book and cable on the table,Putting [something] and [something] on the table,"['book', 'cable']",2,Putting [something],book,1,41
13664,182388,putting book and lighter on the table,Putting [something] and [something] on the table,"['book', 'lighter']",2,Putting [something],book,1,48
8895,124202,putting keys behind keyboard,Putting [something] behind [something],"['keys', 'keyboard']",2,Putting [something],key,1,42
918,204627,putting keys next to keys,Putting [something] next to [something],"['keys', 'keys']",2,Putting [something],key,1,31
4160,145715,putting key,Putting [something similar to other things that are already on the table],['key'],1,Putting [something],key,1,31
3429,205009,putting keys next to keyboard,Putting [something] next to [something],"['keys', 'keyboard']",2,Putting [something],key,1,34
3345,188504,putting key on a surface,Putting [something] on a surface,['key'],1,Putting [something],key,1,32
6177,124232,putting a key next to a tablet,Putting [something] next to [something],"['a key', 'a tablet']",2,Putting [something],key,1,38
5024,101193,putting key,Putting [something similar to other things that are already on the table],['key'],1,Putting [something],key,1,46
8677,95129,putting a key and a bangle on the table,Putting [something] and [something] on the table,"['a key', 'a bangle']",2,Putting [something],key,1,44
12158,73532,putting keys on a surface,Putting [something] on a surface,['keys'],1,Putting [something],key,1,62
11804,84196,putting key,Putting [something similar to other things that are already on the table],['key'],1,Putting [something],key,1,28
1952,36999,putting keys and desk calculator on the table,Putting [something] and [something] on the table,"['keys', 'desk calculator']",2,Putting [something],key,1,48
7989,59977,putting knife behind stamp box,Putting [something] behind [something],"['knife', 'stamp box']",2,Putting [something],knife,1,24
4895,97555,putting knife next to book,Putting [something] next to [something],"['knife', 'book']",2,Putting [something],knife,1,36
8795,32291,putting a knife behind a power bank,Putting [something] behind [something],"['a knife', 'a power bank']",2,Putting [something],knife,1,62
7436,200388,putting knife onto tape,Putting [something] onto [something],"['knife', 'tape']",2,Putting [something],knife,1,57
5555,156927,putting knife,Putting [something similar to other things that are already on the table],['knife'],1,Putting [something],knife,1,19
6372,51504,putting knife next to bottle,Putting [something] next to [something],"['knife', 'bottle']",2,Putting [something],knife,1,52
6577,188990,putting knife and cup on the table,Putting [something] and [something] on the table,"['knife', 'cup']",2,Putting [something],knife,1,50
11622,165194,"putting a knife, fork and a spoon on the table","Putting [something], [something] and [something] on the table","['a knife', 'fork', 'a spoon']",3,Putting [something],knife,1,72
4061,111589,putting knife next to toothbrush,Putting [something] next to [something],"['knife', 'toothbrush']",2,Putting [something],knife,1,42
7145,23216,putting knife behind book,Putting [something] behind [something],"['knife', 'book']",2,Putting [something],knife,1,52
13280,53834,putting knife next to glass cup,Putting [something] next to [something],"['knife', 'glass cup']",2,Putting [something],knife,1,28
13532,220554,putting watch and pen on the table,Putting [something] and [something] on the table,"['watch', 'pen']",2,Putting [something],watch,1,61
5703,49184,putting watch,Putting [something similar to other things that are already on the table],['watch'],1,Putting [something],watch,1,37
13656,1108,putting watch next to tablet,Putting [something] next to [something],"['watch', 'tablet']",2,Putting [something],watch,1,41
11552,130783,putting watch behind remote,Putting [something] behind [something],"['watch', 'remote']",2,Putting [something],watch,1,32
5796,128270,putting watch behind wooden box,Putting [something] behind [something],"['watch', 'wooden box']",2,Putting [something],watch,1,57
12854,141392,putting watch behind speaker box,Putting [something] behind [something],"['watch', 'speaker box']",2,Putting [something],watch,1,54
11190,67781,putting watch on a surface,Putting [something] on a surface,['watch'],1,Putting [something],watch,1,22
7634,176300,putting a watch behind the box,Putting [something] behind [something],"['a watch', 'the box']",2,Putting [something],watch,1,49
11026,120779,putting watch on a surface,Putting [something] on a surface,['watch'],1,Putting [something],watch,1,30
6261,212381,putting a watch next to the box,Putting [something] next to [something],"['a watch', 'the box']",2,Putting [something],watch,1,41
479,58067,putting watch on a surface,Putting [something] on a surface,['watch'],1,Putting [something],watch,1,44
13994,83743,throwing a pencil in the air and letting it fall,Throwing [something] in the air and letting it fall,['a pencil'],1,Dropping [something],pencil,1,31
6748,180601,throwing color pencils,Throwing [something],['color pencils'],1,Dropping [something],pencil,1,32
11913,50575,throwing color pencils,Throwing [something],['color pencils'],1,Dropping [something],pencil,1,28
8572,20292,throwing color pencils,Throwing [something],['color pencils'],1,Dropping [something],pencil,1,29
2712,218312,throwing color pencils,Throwing [something],['color pencils'],1,Dropping [something],pencil,1,49
6684,173880,throwing color pencils,Throwing [something],['color pencils'],1,Dropping [something],pencil,1,35
5853,58511,throwing color pencils,Throwing [something],['color pencils'],1,Dropping [something],pencil,1,35
4263,40990,throwing color pencils,Throwing [something],['color pencils'],1,Dropping [something],pencil,1,26
1796,198777,throwing color pencils,Throwing [something],['color pencils'],1,Dropping [something],pencil,1,39
166,198926,throwing color pencils,Throwing [something],['color pencils'],1,Dropping [something],pencil,1,28
3331,58470,throwing color pencils,Throwing [something],['color pencils'],1,Dropping [something],pencil,1,29
3825,80395,throwing a water bottle,Throwing [something],['a water bottle'],1,Dropping [something],bottle,1,63
3927,79669,throwing bottle,Throwing [something],['bottle'],1,Dropping [something],bottle,1,34
14066,170289,throwing bottle in the air and letting it fall,Throwing [something] in the air and letting it fall,['bottle'],1,Dropping [something],bottle,1,57
6594,189546,a bottle falling like a rock,[Something] falling like a rock,['a bottle'],1,Dropping [something],bottle,1,42
14094,206965,bottle falling like a rock,[Something] falling like a rock,['bottle'],1,Dropping [something],bottle,1,35
661,59630,bottle falling like a rock,[Something] falling like a rock,['bottle'],1,Dropping [something],bottle,1,52
7870,107344,throwing a bottle,Throwing [something],['a bottle'],1,Dropping [something],bottle,1,54
2906,179511,throwing plastic bottle onto a surface,Throwing [something] onto a surface,['plastic bottle'],1,Dropping [something],bottle,1,42
9715,164247,throwing bottle,Throwing [something],['bottle'],1,Dropping [something],bottle,1,29
894,147405,bottle falling like a rock,[Something] falling like a rock,['bottle'],1,Dropping [something],bottle,1,42
11193,215944,throwing bottle,Throwing [something],['bottle'],1,Dropping [something],bottle,1,26
6672,95529,throwing pen in the air and letting it fall,Throwing [something] in the air and letting it fall,['pen'],1,Dropping [something],pen,1,26
8562,199730,throwing a pen,Throwing [something],['a pen'],1,Dropping [something],pen,1,32
12724,27246,pen falling like a rock,[Something] falling like a rock,['pen'],1,Dropping [something],pen,1,32
3651,110600,throwing pen,Throwing [something],['pen'],1,Dropping [something],pen,1,39
3415,42226,pen falling like a rock,[Something] falling like a rock,['pen'],1,Dropping [something],pen,1,35
5636,186841,a pen falling like a rock,[Something] falling like a rock,['a pen'],1,Dropping [something],pen,1,24
8564,114771,throwing pen,Throwing [something],['pen'],1,Dropping [something],pen,1,38
1562,159989,pen falling like a rock,[Something] falling like a rock,['pen'],1,Dropping [something],pen,1,35
12797,185883,throwing pen,Throwing [something],['pen'],1,Dropping [something],pen,1,36
5468,176610,throwing pen in the air and letting it fall,Throwing [something] in the air and letting it fall,['pen'],1,Dropping [something],pen,1,29
542,104446,throwing a pen in the air and letting it fall,Throwing [something] in the air and letting it fall,['a pen'],1,Dropping [something],pen,1,51
6030,135054,a book falling like a rock,[Something] falling like a rock,['a book'],1,Dropping [something],book,1,53
2891,18126,throwing book onto a surface,Throwing [something] onto a surface,['book'],1,Dropping [something],book,1,48
6580,97887,book falling like a rock,[Something] falling like a rock,['book'],1,Dropping [something],book,1,40
12827,64485,a book falling like a rock,[Something] falling like a rock,['a book'],1,Dropping [something],book,1,16
2809,90820,throwing book,Throwing [something],['book'],1,Dropping [something],book,1,32
10368,109698,throwing book,Throwing [something],['book'],1,Dropping [something],book,1,35
8929,204246,throwing book,Throwing [something],['book'],1,Dropping [something],book,1,57
1225,174866,a book falling like a rock,[Something] falling like a rock,['a book'],1,Dropping [something],book,1,50
5182,191537,book falling like a rock,[Something] falling like a rock,['book'],1,Dropping [something],book,1,27
3984,16454,book falling like a rock,[Something] falling like a rock,['book'],1,Dropping [something],book,1,24
14168,116497,throwing a book,Throwing [something],['a book'],1,Dropping [something],book,1,38
10490,159105,throwing remote,Throwing [something],['remote'],1,Dropping [something],remote,1,26
13440,73228,throwing remote control,Throwing [something],['remote control'],1,Dropping [something],remote,1,42
11128,125206,throwing remote control onto a surface,Throwing [something] onto a surface,['remote control'],1,Dropping [something],remote,1,43
425,177592,throwing remote,Throwing [something],['remote'],1,Dropping [something],remote,1,31
9065,175959,throwing remote,Throwing [something],['remote'],1,Dropping [something],remote,1,28
13383,214111,remote falling like a rock,[Something] falling like a rock,['remote'],1,Dropping [something],remote,1,50
5359,79736,throwing remote,Throwing [something],['remote'],1,Dropping [something],remote,1,26
5991,98048,remote falling like a rock,[Something] falling like a rock,['remote'],1,Dropping [something],remote,1,22
12693,20700,remote falling like a rock,[Something] falling like a rock,['remote'],1,Dropping [something],remote,1,43
9567,78632,throwing remote,Throwing [something],['remote'],1,Dropping [something],remote,1,28
11714,193332,throwing remote,Throwing [something],['remote'],1,Dropping [something],remote,1,25
14196,76273,throwing wallet,Throwing [something],['wallet'],1,Dropping [something],wallet,1,53
7183,135334,throwing wallet,Throwing [something],['wallet'],1,Dropping [something],wallet,1,30
12467,106267,throwing wallet,Throwing [something],['wallet'],1,Dropping [something],wallet,1,31
5346,218458,throwing wallet,Throwing [something],['wallet'],1,Dropping [something],wallet,1,64
