,id,label,template,placeholders,num_objects,verb_class_name,noun_class_name,start_frame,stop_frame
4663,6979,moving color pencils up,Moving [something] up,['color pencils'],1,Picking [something] up,pencil,1,25
12267,164115,moving color pencils up,Moving [something] up,['color pencils'],1,Picking [something] up,pencil,1,27
2636,52841,moving pencil up,Moving [something] up,['pencil'],1,Picking [something] up,pencil,1,24
13895,75325,taking a pencil,Taking [one of many similar things on the table],['a pencil'],1,Picking [something] up,pencil,1,53
4320,3343,moving color pencils up,Moving [something] up,['color pencils'],1,Picking [something] up,pencil,1,38
848,213245,lifting pencil up completely without letting it drop down,Lifting [something] up completely without letting it drop down,['pencil'],1,Picking [something] up,pencil,1,27
7081,139419,moving color pencils up,Moving [something] up,['color pencils'],1,Picking [something] up,pencil,1,30
9491,115856,lifting pencil up completely without letting it drop down,Lifting [something] up completely without letting it drop down,['pencil'],1,Picking [something] up,pencil,1,31
1790,167842,moving pencil up,Moving [something] up,['pencil'],1,Picking [something] up,pencil,1,48
6560,178805,lifting a pencil with a penny on it,Lifting [something] with [something] on it,"['a pencil', 'a penny']",2,Picking [something] up,pencil,1,38
10156,56123,moving pencil up,Moving [something] up,['pencil'],1,Picking [something] up,pencil,1,44
2134,47669,lifting pencil up completely without letting it drop down,Lifting [something] up completely without letting it drop down,['pencil'],1,Picking [something] up,pencil,1,31
4251,170172,lifting color pencils up completely without letting it drop down,Lifting [something] up completely without letting it drop down,['color pencils'],1,Picking [something] up,pencil,1,36
6143,31191,lifting pencil up completely without letting it drop down,Lifting [something] up completely without letting it drop down,['pencil'],1,Picking [something] up,pencil,1,28
2805,121385,lifting pencil up completely without letting it drop down,Lifting [something] up completely without letting it drop down,['pencil'],1,Picking [something] up,pencil,1,31
3973,34018,picking pencil up,Picking [something] up,['pencil'],1,Picking [something] up,pencil,1,57
7040,116493,moving color pencils up,Moving [something] up,['color pencils'],1,Picking [something] up,pencil,1,26
3380,21346,taking a pencil out of can,Taking [something] out of [something],"['a pencil', 'can']",2,Picking [something] up,pencil,1,67
4325,29502,taking bottles,Taking [one of many similar things on the table],['bottles'],1,Picking [something] up,bottle,1,45
13487,38735,moving a bottle up,Moving [something] up,['a bottle'],1,Picking [something] up,bottle,1,61
9864,92601,moving plastic bottle up,Moving [something] up,['plastic bottle'],1,Picking [something] up,bottle,1,52
1112,49245,taking bottles,Taking [one of many similar things on the table],['bottles'],1,Picking [something] up,bottle,1,41
5585,102348,moving bottle up,Moving [something] up,['bottle'],1,Picking [something] up,bottle,1,44
6477,25257,taking bottle out of rice cooker,Taking [something] out of [something],"['bottle', 'rice cooker']",2,Picking [something] up,bottle,1,28
6113,89940,picking bottle up,Picking [something] up,['bottle'],1,Picking [something] up,bottle,1,33
4793,10891,taking bottle from rack,Taking [something] from [somewhere],"['bottle', 'rack']",2,Picking [something] up,bottle,1,44
12003,129237,picking bottle up,Picking [something] up,['bottle'],1,Picking [something] up,bottle,1,45
6124,50925,taking bottles,Taking [one of many similar things on the table],['bottles'],1,Picking [something] up,bottle,1,46
10931,3421,taking bottle out of the cooker,Taking [something] out of [something],"['bottle', 'the cooker']",2,Picking [something] up,bottle,1,56
639,189382,picking bottle up,Picking [something] up,['bottle'],1,Picking [something] up,bottle,1,23
14532,30303,taking a bottle,Taking [one of many similar things on the table],['a bottle'],1,Picking [something] up,bottle,1,52
2290,183940,taking the bottle out of the glass,Taking [something] out of [something],"['the bottle', 'the glass']",2,Picking [something] up,bottle,1,43
7277,145393,taking bottles,Taking [one of many similar things on the table],['bottles'],1,Picking [something] up,bottle,1,42
9018,52095,moving bottle up,Moving [something] up,['bottle'],1,Picking [something] up,bottle,1,40
2488,148391,taking bottle from table,Taking [something] from [somewhere],"['bottle', 'table']",2,Picking [something] up,bottle,1,33
1491,190050,picking bottle up,Picking [something] up,['bottle'],1,Picking [something] up,bottle,1,50
11137,64419,lifting wallet with glass cleaner on it,Lifting [something] with [something] on it,"['wallet', 'glass cleaner']",2,Picking [something] up,wallet,1,62
536,11182,taking wallet from floor,Taking [something] from [somewhere],"['wallet', 'floor']",2,Picking [something] up,wallet,1,59
666,216115,picking wallet up,Picking [something] up,['wallet'],1,Picking [something] up,wallet,1,40
5112,205841,lifting wallet with nail clipper on it,Lifting [something] with [something] on it,"['wallet', 'nail clipper']",2,Picking [something] up,wallet,1,40
13359,203223,taking wallet from floor,Taking [something] from [somewhere],"['wallet', 'floor']",2,Picking [something] up,wallet,1,41
13104,48558,lifting wallet up completely without letting it drop down,Lifting [something] up completely without letting it drop down,['wallet'],1,Picking [something] up,wallet,1,63
4859,43391,lifting wallet with garlic on it,Lifting [something] with [something] on it,"['wallet', 'garlic']",2,Picking [something] up,wallet,1,55
2400,65629,moving wallet up,Moving [something] up,['wallet'],1,Picking [something] up,wallet,1,50
14762,5107,taking wallet,Taking [one of many similar things on the table],['wallet'],1,Picking [something] up,wallet,1,34
13674,92970,lifting a wallet with a coin on it,Lifting [something] with [something] on it,"['a wallet', 'a coin']",2,Picking [something] up,wallet,1,52
11448,36960,moving wallet up,Moving [something] up,['wallet'],1,Picking [something] up,wallet,1,55
13175,138179,taking wallet,Taking [one of many similar things on the table],['wallet'],1,Picking [something] up,wallet,1,32
14365,168603,lifting wallet with eraser on it,Lifting [something] with [something] on it,"['wallet', 'eraser']",2,Picking [something] up,wallet,1,51
13261,67588,lifting wallet with sunglasses on it,Lifting [something] with [something] on it,"['wallet', 'sunglasses']",2,Picking [something] up,wallet,1,46
2151,109597,moving wallet up,Moving [something] up,['wallet'],1,Picking [something] up,wallet,1,45
14302,65130,moving a wallet up,Moving [something] up,['a wallet'],1,Picking [something] up,wallet,1,41
515,88246,taking a wallet from the chair,Taking [something] from [somewhere],"['a wallet', 'the chair']",2,Picking [something] up,wallet,1,43
1402,57658,moving wallet up,Moving [something] up,['wallet'],1,Picking [something] up,wallet,1,27
12679,570,moving charger up,Moving [something] up,['charger'],1,Picking [something] up,charger,1,65
6351,73405,moving charger up,Moving [something] up,['charger'],1,Picking [something] up,charger,1,39
14456,108814,moving charger up,Moving [something] up,['charger'],1,Picking [something] up,charger,1,27
5350,181052,taking charger out of drawer,Taking [something] out of [something],"['charger', 'drawer']",2,Picking [something] up,charger,1,46
9483,101362,moving adapter up,Moving [something] up,['adapter'],1,Picking [something] up,charger,1,33
6730,99074,picking adapter up,Picking [something] up,['adapter'],1,Picking [something] up,charger,1,51
2174,134323,taking a charger out of a backpack,Taking [something] out of [something],"['a charger', 'a backpack']",2,Picking [something] up,charger,1,42
7480,9581,moving adapter up,Moving [something] up,['adapter'],1,Picking [something] up,charger,1,33
5221,128401,moving charger up,Moving [something] up,['charger'],1,Picking [something] up,charger,1,29
8587,159851,taking charger out of cap,Taking [something] out of [something],"['charger', 'cap']",2,Picking [something] up,charger,1,56
6986,4878,moving charger up,Moving [something] up,['charger'],1,Picking [something] up,charger,1,58
8188,170998,moving adapter up,Moving [something] up,['adapter'],1,Picking [something] up,charger,1,33
12201,21890,lifting adapter up completely without letting it drop down,Lifting [something] up completely without letting it drop down,['adapter'],1,Picking [something] up,charger,1,30
1259,62828,moving adapter up,Moving [something] up,['adapter'],1,Picking [something] up,charger,1,33
8602,172223,moving adapter up,Moving [something] up,['adapter'],1,Picking [something] up,charger,1,33
3375,35899,moving charger up,Moving [something] up,['charger'],1,Picking [something] up,charger,1,23
13737,125726,moving charger up,Moving [something] up,['charger'],1,Picking [something] up,charger,1,24
13934,181204,moving charger up,Moving [something] up,['charger'],1,Picking [something] up,charger,1,25
7558,53526,putting a pencil,Putting [something similar to other things that are already on the table],['a pencil'],1,Putting [something],pencil,1,45
12260,41552,putting color pencils on a surface,Putting [something] on a surface,['color pencils'],1,Putting [something],pencil,1,38
9165,157674,putting pencil,Putting [something similar to other things that are already on the table],['pencil'],1,Putting [something],pencil,1,41
480,67418,putting color pencils on a surface,Putting [something] on a surface,['color pencils'],1,Putting [something],pencil,1,38
11494,168633,putting color pencils on a surface,Putting [something] on a surface,['color pencils'],1,Putting [something],pencil,1,42
8555,135862,putting color pencils on a surface,Putting [something] on a surface,['color pencils'],1,Putting [something],pencil,1,27
7479,159870,putting pencil next to sport shoe,Putting [something] next to [something],"['pencil', 'sport shoe']",2,Putting [something],pencil,1,44
6652,144331,putting color pencils on a surface,Putting [something] on a surface,['color pencils'],1,Putting [something],pencil,1,22
3150,85192,putting color pencils on a surface,Putting [something] on a surface,['color pencils'],1,Putting [something],pencil,1,42
9903,17280,"putting a pencil, a marker and a pen on the table","Putting [something], [something] and [something] on the table","['a pencil', 'a marker', 'a pen']",3,Putting [something],pencil,1,63
909,173532,putting pencil on a surface,Putting [something] on a surface,['pencil'],1,Putting [something],pencil,1,61
8986,184737,putting color pencils on a surface,Putting [something] on a surface,['color pencils'],1,Putting [something],pencil,1,27
7969,9948,"putting pencil, pens and screwdriver on the table","Putting [something], [something] and [something] on the table","['pencil', 'pens', 'screwdriver']",3,Putting [something],pencil,1,53
3832,91597,putting color pencils on a surface,Putting [something] on a surface,['color pencils'],1,Putting [something],pencil,1,27
8597,99218,putting color pencil,Putting [something similar to other things that are already on the table],['color pencil'],1,Putting [something],pencil,1,62
12333,124168,putting pencil on a surface,Putting [something] on a surface,['pencil'],1,Putting [something],pencil,1,37
2634,10650,putting pencil and sharpener on the table,Putting [something] and [something] on the table,"['pencil', 'sharpener']",2,Putting [something],pencil,1,47
13555,188567,putting a pencil behind a dumbbell,Putting [something] behind [something],"['a pencil', 'a dumbbell']",2,Putting [something],pencil,1,50
2763,98155,putting book on a surface,Putting [something] on a surface,['book'],1,Putting [something],book,1,53
3990,87322,putting book,Putting [something similar to other things that are already on the table],['book'],1,Putting [something],book,1,52
14104,64267,putting book onto can,Putting [something] onto [something],"['book', 'can']",2,Putting [something],book,1,54
10541,212034,putting book next to basket,Putting [something] next to [something],"['book', 'basket']",2,Putting [something],book,1,64
14172,19853,"putting book, lighter and charger on the table","Putting [something], [something] and [something] on the table","['book', 'lighter', 'charger']",3,Putting [something],book,1,44
6421,136637,putting book behind pillow,Putting [something] behind [something],"['book', 'pillow']",2,Putting [something],book,1,45
12532,112143,putting a book next to money,Putting [something] next to [something],"['a book', 'money']",2,Putting [something],book,1,60
3403,64289,putting a book onto a radiator,Putting [something] onto [something],"['a book', 'a radiator']",2,Putting [something],book,1,34
5584,149221,putting book next to pen stand,Putting [something] next to [something],"['book', 'pen stand']",2,Putting [something],book,1,35
8202,26258,putting book on a surface,Putting [something] on a surface,['book'],1,Putting [something],book,1,41
8908,44300,putting book and money purse on the table,Putting [something] and [something] on the table,"['book', 'money purse']",2,Putting [something],book,1,59
6462,15121,putting a book next to a hat,Putting [something] next to [something],"['a book', 'a hat']",2,Putting [something],book,1,58
1925,149162,putting a book onto a cushion,Putting [something] onto [something],"['a book', 'a cushion']",2,Putting [something],book,1,38
11481,77773,putting book,Putting [something similar to other things that are already on the table],['book'],1,Putting [something],book,1,53
12803,18529,putting a book and a pen on the table,Putting [something] and [something] on the table,"['a book', 'a pen']",2,Putting [something],book,1,63
14435,22355,putting book on a surface,Putting [something] on a surface,['book'],1,Putting [something],book,1,48
7541,216027,putting book on a flat surface without letting it roll,Putting [something] on a flat surface without letting it roll,['book'],1,Putting [something],book,1,26
220,101902,putting a book onto a head,Putting [something] onto [something],"['a book', 'a head']",2,Putting [something],book,1,29
2822,411,putting book onto water filter,Putting [something] onto [something],"['book', 'water filter']",2,Putting [something],book,1,64
2534,150348,"putting box, book and coin on the table","Putting [something], [something] and [something] on the table","['box', 'book', 'coin']",3,Putting [something],box,1,48
1038,47413,"putting box, clip and lock on the table","Putting [something], [something] and [something] on the table","['box', 'clip', 'lock']",3,Putting [something],box,1,60
273,175922,putting box next to sambrani holder,Putting [something] next to [something],"['box', 'sambrani holder']",2,Putting [something],box,1,43
4970,27917,"putting box, comb and wallet on the table","Putting [something], [something] and [something] on the table","['box', 'comb', 'wallet']",3,Putting [something],box,1,51
4535,64251,putting box behind box,Putting [something] behind [something],"['box', 'box']",2,Putting [something],box,1,51
6997,35999,putting box and instant noodles on the table,Putting [something] and [something] on the table,"['box', 'instant noodles']",2,Putting [something],box,1,45
4371,160218,putting box behind computer mouse,Putting [something] behind [something],"['box', 'computer mouse']",2,Putting [something],box,1,44
1605,194433,putting box onto box,Putting [something] onto [something],"['box', 'box']",2,Putting [something],box,1,32
14216,23230,"putting box, book and gum on the table","Putting [something], [something] and [something] on the table","['box', 'book', 'gum']",3,Putting [something],box,1,56
14688,182728,putting box,Putting [something similar to other things that are already on the table],['box'],1,Putting [something],box,1,52
8992,98293,putting box behind soap box,Putting [something] behind [something],"['box', 'soap box']",2,Putting [something],box,1,47
4659,81907,"putting box, calculator and stamp ink on the table","Putting [something], [something] and [something] on the table","['box', 'calculator', 'stamp ink']",3,Putting [something],box,1,49
6081,206340,"putting box that can't roll onto a slanted surface, so it stays where it is","Putting [something] that can't roll onto a slanted surface, so it stays where it is",['box'],1,Putting [something],box,1,48
9087,87801,putting box behind box,Putting [something] behind [something],"['box', 'box']",2,Putting [something],box,1,30
10909,9469,putting box and card on the table,Putting [something] and [something] on the table,"['box', 'card']",2,Putting [something],box,1,56
4552,176544,putting a box and a watch on the table,Putting [something] and [something] on the table,"['a box', 'a watch']",2,Putting [something],box,1,49
342,35608,putting box and cable on the table,Putting [something] and [something] on the table,"['box', 'cable']",2,Putting [something],box,1,35
13250,1759,"putting box, pen and lip bam on the table","Putting [something], [something] and [something] on the table","['box', 'pen', 'lip bam']",3,Putting [something],box,1,61
5576,195937,"putting box that can't roll onto a slanted surface, so it stays where it is","Putting [something] that can't roll onto a slanted surface, so it stays where it is",['box'],1,Putting [something],box,1,52
13957,188301,"putting glasses, marker and gift card on the table","Putting [something], [something] and [something] on the table","['glasses', 'marker', 'gift card']",3,Putting [something],glasses,1,58
4085,4012,putting glasses and notebook on the table,Putting [something] and [something] on the table,"['glasses', 'notebook']",2,Putting [something],glasses,1,45
7259,36340,putting glasses and a phone on the table,Putting [something] and [something] on the table,"['glasses', 'a phone']",2,Putting [something],glasses,1,70
2934,196475,putting glasses onto cd,Putting [something] onto [something],"['glasses', 'cd']",2,Putting [something],glasses,1,39
6761,58283,putting glasses on a surface,Putting [something] on a surface,['glasses'],1,Putting [something],glasses,1,33
2074,84471,putting glasses on a surface,Putting [something] on a surface,['glasses'],1,Putting [something],glasses,1,33
14544,34942,"putting glasses, a beer bottle and a wallet on the table","Putting [something], [something] and [something] on the table","['glasses', 'a beer bottle', 'a wallet']",3,Putting [something],glasses,1,69
14290,58136,putting glasses next to a watch,Putting [something] next to [something],"['glasses', 'a watch']",2,Putting [something],glasses,1,60
7511,147570,putting glasses behind a toy castle,Putting [something] behind [something],"['glasses', 'a toy castle']",2,Putting [something],glasses,1,63
12720,10680,putting some glasses onto a laptop,Putting [something] onto [something],"['some glasses', 'a laptop']",2,Putting [something],glasses,1,52
8106,33256,putting glasses on a surface,Putting [something] on a surface,['glasses'],1,Putting [something],glasses,1,33
4269,121515,putting glasses next to lock,Putting [something] next to [something],"['glasses', 'lock']",2,Putting [something],glasses,1,44
12483,154691,putting glasses on a surface,Putting [something] on a surface,['glasses'],1,Putting [something],glasses,1,45
9333,65949,putting a glasses on a surface,Putting [something] on a surface,['a glasses'],1,Putting [something],glasses,1,43
10876,56836,putting glasses and a pad of paper on the table,Putting [something] and [something] on the table,"['glasses', 'a pad of paper']",2,Putting [something],glasses,1,62
4303,219240,putting a glasses on a surface,Putting [something] on a surface,['a glasses'],1,Putting [something],glasses,1,29
13267,207785,putting glasses on a surface,Putting [something] on a surface,['glasses'],1,Putting [something],glasses,1,38
8219,53760,putting glasses behind cooler,Putting [something] behind [something],"['glasses', 'cooler']",2,Putting [something],glasses,1,48
8082,193122,putting glasses next to scissors,Putting [something] next to [something],"['glasses', 'scissors']",2,Putting [something],glasses,1,50
12461,57931,throwing a color pencil onto a surface,Throwing [something] onto a surface,['a color pencil'],1,Dropping [something],pencil,1,54
12251,5436,throwing color pencils,Throwing [something],['color pencils'],1,Dropping [something],pencil,1,29
7863,152353,throwing color pencils,Throwing [something],['color pencils'],1,Dropping [something],pencil,1,47
11315,167189,throwing color pencils,Throwing [something],['color pencils'],1,Dropping [something],pencil,1,29
10849,123770,throwing color pencils,Throwing [something],['color pencils'],1,Dropping [something],pencil,1,29
5021,96167,throwing color pencils,Throwing [something],['color pencils'],1,Dropping [something],pencil,1,36
11697,78133,throwing color pencils,Throwing [something],['color pencils'],1,Dropping [something],pencil,1,28
10566,184558,throwing color pencils,Throwing [something],['color pencils'],1,Dropping [something],pencil,1,27
1693,75880,throwing color pencils,Throwing [something],['color pencils'],1,Dropping [something],pencil,1,28
5071,156789,throwing color pencils,Throwing [something],['color pencils'],1,Dropping [something],pencil,1,28
5685,161739,throwing color pencils,Throwing [something],['color pencils'],1,Dropping [something],pencil,1,28
9915,35593,throwing color pencils,Throwing [something],['color pencils'],1,Dropping [something],pencil,1,26
8033,103547,throwing color pencils,Throwing [something],['color pencils'],1,Dropping [something],pencil,1,32
7000,162145,throwing color pencils,Throwing [something],['color pencils'],1,Dropping [something],pencil,1,28
3313,193892,throwing color pencils,Throwing [something],['color pencils'],1,Dropping [something],pencil,1,28
12455,197336,throwing a pencil onto a surface,Throwing [something] onto a surface,['a pencil'],1,Dropping [something],pencil,1,37
10693,210879,throwing color pencil,Throwing [something],['color pencil'],1,Dropping [something],pencil,1,28
2335,120485,throwing color pencils,Throwing [something],['color pencils'],1,Dropping [something],pencil,1,30
11154,11160,throwing color pencils,Throwing [something],['color pencils'],1,Dropping [something],pencil,1,26
14097,160772,keys falling like a rock,[Something] falling like a rock,['keys'],1,Dropping [something],key,1,51
13589,5207,keys falling like a rock,[Something] falling like a rock,['keys'],1,Dropping [something],key,1,40
680,174224,keys falling like a rock,[Something] falling like a rock,['keys'],1,Dropping [something],key,1,23
466,8380,key falling like a rock,[Something] falling like a rock,['key'],1,Dropping [something],key,1,19
12836,77124,throwing key onto a surface,Throwing [something] onto a surface,['key'],1,Dropping [something],key,1,42
10914,21619,throwing keys in the air and letting it fall,Throwing [something] in the air and letting it fall,['keys'],1,Dropping [something],key,1,42
6395,81690,throwing key onto a surface,Throwing [something] onto a surface,['key'],1,Dropping [something],key,1,55
9108,211784,key falling like a rock,[Something] falling like a rock,['key'],1,Dropping [something],key,1,45
3044,96835,throwing key,Throwing [something],['key'],1,Dropping [something],key,1,34
1554,218472,throwing a key onto a surface,Throwing [something] onto a surface,['a key'],1,Dropping [something],key,1,42
14253,74810,throwing keys onto a surface,Throwing [something] onto a surface,['keys'],1,Dropping [something],key,1,38
3546,196707,throwing key,Throwing [something],['key'],1,Dropping [something],key,1,34
12898,160304,throwing keys onto a surface,Throwing [something] onto a surface,['keys'],1,Dropping [something],key,1,62
7578,171573,throwing key,Throwing [something],['key'],1,Dropping [something],key,1,34
13557,59218,key falling like a rock,[Something] falling like a rock,['key'],1,Dropping [something],key,1,56
10853,141501,throwing keys,Throwing [something],['keys'],1,Dropping [something],key,1,36
6722,175364,throwing key,Throwing [something],['key'],1,Dropping [something],key,1,36
2166,78512,throwing key in the air and letting it fall,Throwing [something] in the air and letting it fall,['key'],1,Dropping [something],key,1,39
8423,45600,throwing key,Throwing [something],['key'],1,Dropping [something],key,1,34
2784,100483,throwing brush onto a surface,Throwing [something] onto a surface,['brush'],1,Dropping [something],brush,1,62
13691,154650,brush falling like a rock,[Something] falling like a rock,['brush'],1,Dropping [something],brush,1,23
5136,215147,throwing brush in the air and letting it fall,Throwing [something] in the air and letting it fall,['brush'],1,Dropping [something],brush,1,62
2181,92336,throwing a brush,Throwing [something],['a brush'],1,Dropping [something],brush,1,26
3103,151600,brush falling like a rock,[Something] falling like a rock,['brush'],1,Dropping [something],brush,1,38
3666,45092,brush falling like a rock,[Something] falling like a rock,['brush'],1,Dropping [something],brush,1,33
1021,170419,throwing brush in the air and letting it fall,Throwing [something] in the air and letting it fall,['brush'],1,Dropping [something],brush,1,57
913,18574,throwing brush onto a surface,Throwing [something] onto a surface,['brush'],1,Dropping [something],brush,1,62
9446,155060,brush falling like a rock,[Something] falling like a rock,['brush'],1,Dropping [something],brush,1,52
11357,178581,throwing brush in the air and letting it fall,Throwing [something] in the air and letting it fall,['brush'],1,Dropping [something],brush,1,62
7108,159141,throwing brush,Throwing [something],['brush'],1,Dropping [something],brush,1,31
4026,214237,throwing brush onto a surface,Throwing [something] onto a surface,['brush'],1,Dropping [something],brush,1,62
3382,183455,throwing brush onto a surface,Throwing [something] onto a surface,['brush'],1,Dropping [something],brush,1,62
