,id,label,template,placeholders,num_objects,verb_class_name,noun_class_name,start_frame,stop_frame
13260,196240,moving book up,Moving [something] up,['book'],1,Picking [something] up,book,1,20
14726,87609,lifting book with tape on it,Lifting [something] with [something] on it,"['book', 'tape']",2,Picking [something] up,book,1,55
2052,158241,lifting book with eraser on it,Lifting [something] with [something] on it,"['book', 'eraser']",2,Picking [something] up,book,1,65
2508,177051,lifting book with train on it,Lifting [something] with [something] on it,"['book', 'train']",2,Picking [something] up,book,1,66
9595,164891,lifting book with cellphone on it,Lifting [something] with [something] on it,"['book', 'cellphone']",2,Picking [something] up,book,1,54
229,108457,moving book up,Moving [something] up,['book'],1,Picking [something] up,book,1,21
12248,56238,taking a book,Taking [one of many similar things on the table],['a book'],1,Picking [something] up,book,1,28
13549,118955,lifting a book with a measuring tape on it,Lifting [something] with [something] on it,"['a book', 'a measuring tape']",2,Picking [something] up,book,1,39
9906,178670,lifting book up completely without letting it drop down,Lifting [something] up completely without letting it drop down,['book'],1,Picking [something] up,book,1,25
10866,4599,taking book,Taking [one of many similar things on the table],['book'],1,Picking [something] up,book,1,33
9782,130170,taking a book,Taking [one of many similar things on the table],['a book'],1,Picking [something] up,book,1,48
10375,220173,moving book up,Moving [something] up,['book'],1,Picking [something] up,book,1,26
12847,194247,taking a book,Taking [one of many similar things on the table],['a book'],1,Picking [something] up,book,1,47
14494,138429,moving book up,Moving [something] up,['book'],1,Picking [something] up,book,1,42
12846,18698,moving book up,Moving [something] up,['book'],1,Picking [something] up,book,1,55
2361,95582,lifting book with camera on it,Lifting [something] with [something] on it,"['book', 'camera']",2,Picking [something] up,book,1,58
13581,63123,taking book from table,Taking [something] from [somewhere],"['book', 'table']",2,Picking [something] up,book,1,51
5754,160661,taking book out of bag,Taking [something] out of [something],"['book', 'bag']",2,Picking [something] up,book,1,55
12850,72779,moving keys up,Moving [something] up,['keys'],1,Picking [something] up,key,1,35
2170,143646,taking key,Taking [one of many similar things on the table],['key'],1,Picking [something] up,key,1,35
12928,76977,moving key up,Moving [something] up,['key'],1,Picking [something] up,key,1,29
10746,18007,moving key up,Moving [something] up,['key'],1,Picking [something] up,key,1,51
10793,139396,taking a key out of the purse,Taking [something] out of [something],"['a key', 'the purse']",2,Picking [something] up,key,1,47
8080,191472,taking key from door,Taking [something] from [somewhere],"['key', 'door']",2,Picking [something] up,key,1,54
8648,189393,taking key from door,Taking [something] from [somewhere],"['key', 'door']",2,Picking [something] up,key,1,38
1778,123045,taking keys from stool,Taking [something] from [somewhere],"['keys', 'stool']",2,Picking [something] up,key,1,67
642,75871,moving key up,Moving [something] up,['key'],1,Picking [something] up,key,1,36
13537,129790,moving key up,Moving [something] up,['key'],1,Picking [something] up,key,1,43
2520,80950,moving key up,Moving [something] up,['key'],1,Picking [something] up,key,1,46
1631,106224,taking keys out of wooden box,Taking [something] out of [something],"['keys', 'wooden box']",2,Picking [something] up,key,1,55
1658,157322,moving key up,Moving [something] up,['key'],1,Picking [something] up,key,1,34
6689,33134,taking key,Taking [one of many similar things on the table],['key'],1,Picking [something] up,key,1,44
11224,212785,moving keys up,Moving [something] up,['keys'],1,Picking [something] up,key,1,46
3384,30733,moving key up,Moving [something] up,['key'],1,Picking [something] up,key,1,29
6331,169214,moving keys up,Moving [something] up,['keys'],1,Picking [something] up,key,1,28
141,81863,moving keys up,Moving [something] up,['keys'],1,Picking [something] up,key,1,62
2855,117060,moving paper up,Moving [something] up,['paper'],1,Picking [something] up,paper,1,59
729,108771,lifting paper up completely without letting it drop down,Lifting [something] up completely without letting it drop down,['paper'],1,Picking [something] up,paper,1,54
4720,75843,lifting paper with coin on it,Lifting [something] with [something] on it,"['paper', 'coin']",2,Picking [something] up,paper,1,37
13750,63853,moving paper up,Moving [something] up,['paper'],1,Picking [something] up,paper,1,40
5191,87085,lifting a paper with a pen on it,Lifting [something] with [something] on it,"['a paper', 'a pen']",2,Picking [something] up,paper,1,66
8090,65856,taking paper out of basket,Taking [something] out of [something],"['paper', 'basket']",2,Picking [something] up,paper,1,53
1572,115607,lifting paper with pen on it,Lifting [something] with [something] on it,"['paper', 'pen']",2,Picking [something] up,paper,1,61
13252,192357,lifting paper with green chalk on it,Lifting [something] with [something] on it,"['paper', 'green chalk']",2,Picking [something] up,paper,1,58
3828,92172,lifting paper with cap on it,Lifting [something] with [something] on it,"['paper', 'cap']",2,Picking [something] up,paper,1,21
3542,44084,taking paper,Taking [one of many similar things on the table],['paper'],1,Picking [something] up,paper,1,30
12220,129103,lifting paper with glasses on it,Lifting [something] with [something] on it,"['paper', 'glasses']",2,Picking [something] up,paper,1,51
2493,9849,picking paper up,Picking [something] up,['paper'],1,Picking [something] up,paper,1,52
13265,164766,lifting paper with pen on it,Lifting [something] with [something] on it,"['paper', 'pen']",2,Picking [something] up,paper,1,26
14576,56039,lifting paper with rule on it,Lifting [something] with [something] on it,"['paper', 'rule']",2,Picking [something] up,paper,1,39
2239,172310,moving paper up,Moving [something] up,['paper'],1,Picking [something] up,paper,1,61
14556,87660,lifting paper with lighter on it,Lifting [something] with [something] on it,"['paper', 'lighter']",2,Picking [something] up,paper,1,56
11615,132275,moving paper up,Moving [something] up,['paper'],1,Picking [something] up,paper,1,29
7053,141569,lifting paper with highlighter on it,Lifting [something] with [something] on it,"['paper', 'highlighter']",2,Picking [something] up,paper,1,40
1259,62828,moving adapter up,Moving [something] up,['adapter'],1,Picking [something] up,charger,1,33
6597,31896,moving charger up,Moving [something] up,['charger'],1,Picking [something] up,charger,1,50
14456,108814,moving charger up,Moving [something] up,['charger'],1,Picking [something] up,charger,1,27
6795,168067,taking charger out of drawer,Taking [something] out of [something],"['charger', 'drawer']",2,Picking [something] up,charger,1,46
5221,128401,moving charger up,Moving [something] up,['charger'],1,Picking [something] up,charger,1,29
7480,9581,moving adapter up,Moving [something] up,['adapter'],1,Picking [something] up,charger,1,33
8602,172223,moving adapter up,Moving [something] up,['adapter'],1,Picking [something] up,charger,1,33
8390,191858,taking charger from ladder,Taking [something] from [somewhere],"['charger', 'ladder']",2,Picking [something] up,charger,1,53
2174,134323,taking a charger out of a backpack,Taking [something] out of [something],"['a charger', 'a backpack']",2,Picking [something] up,charger,1,42
11983,42495,picking charger up,Picking [something] up,['charger'],1,Picking [something] up,charger,1,60
2333,107789,lifting adapter up completely without letting it drop down,Lifting [something] up completely without letting it drop down,['adapter'],1,Picking [something] up,charger,1,26
6986,4878,moving charger up,Moving [something] up,['charger'],1,Picking [something] up,charger,1,58
4519,145780,moving charger up,Moving [something] up,['charger'],1,Picking [something] up,charger,1,23
5961,196798,lifting charger with mp3 player on it,Lifting [something] with [something] on it,"['charger', 'mp3 player']",2,Picking [something] up,charger,1,34
9483,101362,moving adapter up,Moving [something] up,['adapter'],1,Picking [something] up,charger,1,33
7036,15274,taking charger from laptop,Taking [something] from [somewhere],"['charger', 'laptop']",2,Picking [something] up,charger,1,53
6146,194854,moving charger up,Moving [something] up,['charger'],1,Picking [something] up,charger,1,28
6167,209281,taking a charger from a handbag,Taking [something] from [somewhere],"['a charger', 'a handbag']",2,Picking [something] up,charger,1,47
6604,20080,putting bottle and spidol on the table,Putting [something] and [something] on the table,"['bottle', 'spidol']",2,Putting [something],bottle,1,44
335,148589,putting a water bottle and a pig bank on the table,Putting [something] and [something] on the table,"['a water bottle', 'a pig bank']",2,Putting [something],bottle,1,53
2159,77795,putting a bottle on a surface,Putting [something] on a surface,['a bottle'],1,Putting [something],bottle,1,55
4687,122680,putting bottle on a surface,Putting [something] on a surface,['bottle'],1,Putting [something],bottle,1,28
9889,137834,putting bottle next to tube,Putting [something] next to [something],"['bottle', 'tube']",2,Putting [something],bottle,1,53
9887,130263,putting a bottle next to a jar,Putting [something] next to [something],"['a bottle', 'a jar']",2,Putting [something],bottle,1,33
7995,158992,putting water bottle and mortein mosquito killer packet on the table,Putting [something] and [something] on the table,"['water bottle', 'mortein mosquito killer packet']",2,Putting [something],bottle,1,50
10579,152552,"putting bottle, cutex and pack on the table","Putting [something], [something] and [something] on the table","['bottle', 'cutex', 'pack']",3,Putting [something],bottle,1,60
8135,133466,putting a water bottle on a surface,Putting [something] on a surface,['a water bottle'],1,Putting [something],bottle,1,39
12041,152346,putting bottle next to sunglasses,Putting [something] next to [something],"['bottle', 'sunglasses']",2,Putting [something],bottle,1,36
9203,19626,putting a plastic bottle on a surface,Putting [something] on a surface,['a plastic bottle'],1,Putting [something],bottle,1,30
1748,99691,putting water bottle on a surface,Putting [something] on a surface,['water bottle'],1,Putting [something],bottle,1,32
2438,48445,"putting bottle, glass and pan on the table","Putting [something], [something] and [something] on the table","['bottle', 'glass', 'pan']",3,Putting [something],bottle,1,68
5640,172712,putting bottles,Putting [something similar to other things that are already on the table],['bottles'],1,Putting [something],bottle,1,33
7732,184811,putting bottle on a surface,Putting [something] on a surface,['bottle'],1,Putting [something],bottle,1,53
6086,96440,"putting water bottle, toy and container bottle on the table","Putting [something], [something] and [something] on the table","['water bottle', 'toy', 'container bottle']",3,Putting [something],bottle,1,57
521,36617,putting bottle behind jug,Putting [something] behind [something],"['bottle', 'jug']",2,Putting [something],bottle,1,34
4271,7313,putting bottle on a flat surface without letting it roll,Putting [something] on a flat surface without letting it roll,['bottle'],1,Putting [something],bottle,1,47
7966,23243,putting markers,Putting [something similar to other things that are already on the table],['markers'],1,Putting [something],marker,1,37
2102,44755,putting markers,Putting [something similar to other things that are already on the table],['markers'],1,Putting [something],marker,1,35
3062,100298,putting markers,Putting [something similar to other things that are already on the table],['markers'],1,Putting [something],marker,1,34
13538,149099,putting marker next to nail file,Putting [something] next to [something],"['marker', 'nail file']",2,Putting [something],marker,1,41
705,179105,putting marker on a surface,Putting [something] on a surface,['marker'],1,Putting [something],marker,1,36
9026,33306,putting markers,Putting [something similar to other things that are already on the table],['markers'],1,Putting [something],marker,1,37
10992,171365,putting markers,Putting [something similar to other things that are already on the table],['markers'],1,Putting [something],marker,1,30
2577,21782,putting markers,Putting [something similar to other things that are already on the table],['markers'],1,Putting [something],marker,1,33
1613,50562,putting markers,Putting [something similar to other things that are already on the table],['markers'],1,Putting [something],marker,1,35
10994,59107,putting markers,Putting [something similar to other things that are already on the table],['markers'],1,Putting [something],marker,1,32
13689,43923,putting a marker and scissors on the table,Putting [something] and [something] on the table,"['a marker', 'scissors']",2,Putting [something],marker,1,54
1318,164734,putting marker and candy on the table,Putting [something] and [something] on the table,"['marker', 'candy']",2,Putting [something],marker,1,42
9653,197310,putting markers on a surface,Putting [something] on a surface,['markers'],1,Putting [something],marker,1,40
2454,39444,putting marker,Putting [something similar to other things that are already on the table],['marker'],1,Putting [something],marker,1,36
1121,187043,putting marker behind stapler,Putting [something] behind [something],"['marker', 'stapler']",2,Putting [something],marker,1,45
4501,101656,putting markers,Putting [something similar to other things that are already on the table],['markers'],1,Putting [something],marker,1,35
7360,152640,putting markers,Putting [something similar to other things that are already on the table],['markers'],1,Putting [something],marker,1,45
11504,210333,putting marker,Putting [something similar to other things that are already on the table],['marker'],1,Putting [something],marker,1,37
3865,6415,putting markers,Putting [something similar to other things that are already on the table],['markers'],1,Putting [something],marker,1,26
2770,81346,putting battery behind can,Putting [something] behind [something],"['battery', 'can']",2,Putting [something],battery,1,52
2329,188542,putting a battery on a surface,Putting [something] on a surface,['a battery'],1,Putting [something],battery,1,66
12986,23577,putting battery behind keys,Putting [something] behind [something],"['battery', 'keys']",2,Putting [something],battery,1,46
10589,76553,putting battery onto wooden box,Putting [something] onto [something],"['battery', 'wooden box']",2,Putting [something],battery,1,57
6468,137736,putting battery on a surface,Putting [something] on a surface,['battery'],1,Putting [something],battery,1,62
9398,133211,putting battery next to shoe,Putting [something] next to [something],"['battery', 'shoe']",2,Putting [something],battery,1,39
7244,156923,putting battery onto compact disk,Putting [something] onto [something],"['battery', 'compact disk']",2,Putting [something],battery,1,45
7011,69482,putting battery and candy on the table,Putting [something] and [something] on the table,"['battery', 'candy']",2,Putting [something],battery,1,54
3315,115478,putting battery next to portable speaker,Putting [something] next to [something],"['battery', 'portable speaker']",2,Putting [something],battery,1,38
12123,144939,putting battery next to keys,Putting [something] next to [something],"['battery', 'keys']",2,Putting [something],battery,1,53
14390,205521,putting battery onto rubix cube,Putting [something] onto [something],"['battery', 'rubix cube']",2,Putting [something],battery,1,41
2723,213222,putting a battery on a flat surface without letting it roll,Putting [something] on a flat surface without letting it roll,['a battery'],1,Putting [something],battery,1,70
4989,19381,putting battery onto plastic jar,Putting [something] onto [something],"['battery', 'plastic jar']",2,Putting [something],battery,1,47
10860,168106,putting battery on a surface,Putting [something] on a surface,['battery'],1,Putting [something],battery,1,39
6680,144033,putting battery and battery on the table,Putting [something] and [something] on the table,"['battery', 'battery']",2,Putting [something],battery,1,33
7593,75950,"putting a battery that can't roll onto a slanted surface, so it stays where it is","Putting [something] that can't roll onto a slanted surface, so it stays where it is",['a battery'],1,Putting [something],battery,1,54
4340,216579,putting battery behind honey bottle,Putting [something] behind [something],"['battery', 'honey bottle']",2,Putting [something],battery,1,50
12055,92627,putting battery onto book,Putting [something] onto [something],"['battery', 'book']",2,Putting [something],battery,1,30
8075,28969,putting a battery,Putting [something similar to other things that are already on the table],['a battery'],1,Putting [something],battery,1,31
9518,61480,putting watch and earrings on the table,Putting [something] and [something] on the table,"['watch', 'earrings']",2,Putting [something],watch,1,50
3385,11603,putting watch on a surface,Putting [something] on a surface,['watch'],1,Putting [something],watch,1,39
13853,131951,"putting watch, keys and pen on the table","Putting [something], [something] and [something] on the table","['watch', 'keys', 'pen']",3,Putting [something],watch,1,70
7739,68834,putting a watch behind a notebook,Putting [something] behind [something],"['a watch', 'a notebook']",2,Putting [something],watch,1,39
12027,48231,putting a watch on a surface,Putting [something] on a surface,['a watch'],1,Putting [something],watch,1,36
5267,86776,putting watch on a surface,Putting [something] on a surface,['watch'],1,Putting [something],watch,1,39
11552,130783,putting watch behind remote,Putting [something] behind [something],"['watch', 'remote']",2,Putting [something],watch,1,32
5381,42624,putting watch behind keyboard,Putting [something] behind [something],"['watch', 'keyboard']",2,Putting [something],watch,1,35
915,203010,putting watch and flashdisk on the table,Putting [something] and [something] on the table,"['watch', 'flashdisk']",2,Putting [something],watch,1,32
6033,110165,"putting a watch, a key chain and a wallet on the table","Putting [something], [something] and [something] on the table","['a watch', 'a key chain', 'a wallet']",3,Putting [something],watch,1,44
11323,108575,putting a watch on a surface,Putting [something] on a surface,['a watch'],1,Putting [something],watch,1,34
5661,119465,putting watch onto wallet,Putting [something] onto [something],"['watch', 'wallet']",2,Putting [something],watch,1,65
1099,196275,putting watch on a flat surface without letting it roll,Putting [something] on a flat surface without letting it roll,['watch'],1,Putting [something],watch,1,38
10726,103341,putting watch next to adapter,Putting [something] next to [something],"['watch', 'adapter']",2,Putting [something],watch,1,35
11960,145324,"putting watch, lighter and mobile on the table","Putting [something], [something] and [something] on the table","['watch', 'lighter', 'mobile']",3,Putting [something],watch,1,60
10268,95384,putting watch next to shoe,Putting [something] next to [something],"['watch', 'shoe']",2,Putting [something],watch,1,62
4978,114905,"putting watch, watch and watch on the table","Putting [something], [something] and [something] on the table","['watch', 'watch', 'watch']",3,Putting [something],watch,1,59
1921,20784,putting a watch,Putting [something similar to other things that are already on the table],['a watch'],1,Putting [something],watch,1,61
3182,167158,"putting watch, bottle and battery on the table","Putting [something], [something] and [something] on the table","['watch', 'bottle', 'battery']",3,Putting [something],watch,1,40
13703,33679,a wallet falling like a rock,[Something] falling like a rock,['a wallet'],1,Dropping [something],wallet,1,46
14470,66696,throwing wallet,Throwing [something],['wallet'],1,Dropping [something],wallet,1,29
9941,129618,throwing a wallet,Throwing [something],['a wallet'],1,Dropping [something],wallet,1,45
4708,39235,throwing wallet in the air and letting it fall,Throwing [something] in the air and letting it fall,['wallet'],1,Dropping [something],wallet,1,66
5715,40067,wallet falling like a rock,[Something] falling like a rock,['wallet'],1,Dropping [something],wallet,1,40
470,53567,throwing wallet onto a surface,Throwing [something] onto a surface,['wallet'],1,Dropping [something],wallet,1,42
4653,116909,throwing wallet,Throwing [something],['wallet'],1,Dropping [something],wallet,1,34
8945,119953,throwing wallet onto a surface,Throwing [something] onto a surface,['wallet'],1,Dropping [something],wallet,1,62
11451,42641,throwing wallet onto a surface,Throwing [something] onto a surface,['wallet'],1,Dropping [something],wallet,1,40
11020,56004,throwing wallet onto a surface,Throwing [something] onto a surface,['wallet'],1,Dropping [something],wallet,1,41
969,176397,throwing a wallet,Throwing [something],['a wallet'],1,Dropping [something],wallet,1,39
3766,15526,throwing wallet in the air and letting it fall,Throwing [something] in the air and letting it fall,['wallet'],1,Dropping [something],wallet,1,27
12745,37303,throwing a wallet in the air and letting it fall,Throwing [something] in the air and letting it fall,['a wallet'],1,Dropping [something],wallet,1,25
6596,56298,throwing a wallet onto a surface,Throwing [something] onto a surface,['a wallet'],1,Dropping [something],wallet,1,29
6799,177046,a wallet falling like a rock,[Something] falling like a rock,['a wallet'],1,Dropping [something],wallet,1,63
2356,64741,wallet falling like a rock,[Something] falling like a rock,['wallet'],1,Dropping [something],wallet,1,26
3426,208654,throwing wallet,Throwing [something],['wallet'],1,Dropping [something],wallet,1,34
1645,170152,a wallet falling like a rock,[Something] falling like a rock,['a wallet'],1,Dropping [something],wallet,1,45
1458,102527,throwing wallet onto a surface,Throwing [something] onto a surface,['wallet'],1,Dropping [something],wallet,1,33
1188,179438,throwing phone,Throwing [something],['phone'],1,Dropping [something],phone,1,43
8569,186293,throwing phone,Throwing [something],['phone'],1,Dropping [something],phone,1,42
7464,179604,throwing mobile,Throwing [something],['mobile'],1,Dropping [something],phone,1,33
5680,177452,throwing phone onto a surface,Throwing [something] onto a surface,['phone'],1,Dropping [something],phone,1,62
7663,12181,throwing phone onto a surface,Throwing [something] onto a surface,['phone'],1,Dropping [something],phone,1,30
13999,168672,phone falling like a rock,[Something] falling like a rock,['phone'],1,Dropping [something],phone,1,47
13323,52179,a phone falling like a rock,[Something] falling like a rock,['a phone'],1,Dropping [something],phone,1,47
3267,183155,throwing mobile,Throwing [something],['mobile'],1,Dropping [something],phone,1,31
6694,59542,phone falling like a rock,[Something] falling like a rock,['phone'],1,Dropping [something],phone,1,32
6530,90511,throwing mobile,Throwing [something],['mobile'],1,Dropping [something],phone,1,33
1304,122362,throwing mobile,Throwing [something],['mobile'],1,Dropping [something],phone,1,33
4743,40724,throwing mobile,Throwing [something],['mobile'],1,Dropping [something],phone,1,33
1961,89273,throwing a mobile,Throwing [something],['a mobile'],1,Dropping [something],phone,1,39
2904,133061,throwing a mobile,Throwing [something],['a mobile'],1,Dropping [something],phone,1,62
7312,1296,mobile falling like a rock,[Something] falling like a rock,['mobile'],1,Dropping [something],phone,1,41
2863,66277,mobile falling like a rock,[Something] falling like a rock,['mobile'],1,Dropping [something],phone,1,48
12207,95693,phone falling like a rock,[Something] falling like a rock,['phone'],1,Dropping [something],phone,1,27
3553,48142,throwing mobile,Throwing [something],['mobile'],1,Dropping [something],phone,1,28
4063,214939,mobile falling like a rock,[Something] falling like a rock,['mobile'],1,Dropping [something],phone,1,48
9191,99716,throwing brush,Throwing [something],['brush'],1,Dropping [something],brush,1,44
13691,154650,brush falling like a rock,[Something] falling like a rock,['brush'],1,Dropping [something],brush,1,23
913,18574,throwing brush onto a surface,Throwing [something] onto a surface,['brush'],1,Dropping [something],brush,1,62
3382,183455,throwing brush onto a surface,Throwing [something] onto a surface,['brush'],1,Dropping [something],brush,1,62
10997,211840,throwing brush,Throwing [something],['brush'],1,Dropping [something],brush,1,62
4780,42955,throwing brush,Throwing [something],['brush'],1,Dropping [something],brush,1,45
3666,45092,brush falling like a rock,[Something] falling like a rock,['brush'],1,Dropping [something],brush,1,33
1264,134877,brush falling like a rock,[Something] falling like a rock,['brush'],1,Dropping [something],brush,1,20
4026,214237,throwing brush onto a surface,Throwing [something] onto a surface,['brush'],1,Dropping [something],brush,1,62
2631,5835,brush falling like a rock,[Something] falling like a rock,['brush'],1,Dropping [something],brush,1,40
4972,205509,throwing brush in the air and letting it fall,Throwing [something] in the air and letting it fall,['brush'],1,Dropping [something],brush,1,42
10899,25144,throwing brush,Throwing [something],['brush'],1,Dropping [something],brush,1,41
2784,100483,throwing brush onto a surface,Throwing [something] onto a surface,['brush'],1,Dropping [something],brush,1,62
11531,35839,throwing brush onto a surface,Throwing [something] onto a surface,['brush'],1,Dropping [something],brush,1,48
6988,108218,throwing brush,Throwing [something],['brush'],1,Dropping [something],brush,1,62
